[32m INFO[0m fetching abi from https://api.bscscan.com/api?module=contract&action=getabi&address=0x00################################6cf5d&format=json&apikey=6ZUCAR738XJSX6WK3BGN2K8DX4RI9A875M
[32m INFO[0m fetching code from 00287bb3f0df41a41b9c4bc2d94e4fa481d6cf5d
Contract loaded: 0x00################################6cf5d
[32m INFO[0m 

 ================ EVM Fuzzer Start ===================


[32m INFO[0m Deploying contract: 0x00################################6cf5d
[32m INFO[0m Contract 0x00################################6cf5d deployed to: 0x00################################6cf5d -> balacne is 0
[32m INFO[0m Deployed all contracts

[32m INFO[0m fetching pairs for 0x00################################6cf5d
[32m INFO[0m fetching pairs for 0x00################################6cf5d
[32m INFO[0m fetching code from ba4d53db1c3e232da36a68dabc558b3668b4129c
[32m INFO[0m fetching code from bb4cdb9cbd36b01bd1cbaebf2de08d9173bc095c
[32m INFO[0m [Stats #0] run time: 0h-0m-5s, clients: 1, corpus: 0, objectives: 0, executions: 0, exec/sec: 0.000
[32m INFO[0m ============= New Corpus Item =============
[32m INFO[0m Reverted? false 
 Txn:
[Sender] 0x8E################################d79dd
   [1] Router.swapExactETHForTokens{value: 4722.3663 ether}(0, path:(WETH  0x00################################6CF5d), address(this), block.timestamp);

[32m INFO[0m ==========================================
[32m INFO[0m [Testcase #0] run time: 0h-0m-5s, clients: 1, corpus: 17, objectives: 0, executions: 1, exec/sec: 0.000
[32m INFO[0m ============= Coverage Summary =============
[32m INFO[0m 0xbb################################c095c: 11.03% Instruction Covered, 13.16% Branch Covered
[32m INFO[0m 0x00################################6cf5d: 39.10% Instruction Covered, 31.97% Branch Covered
[32m INFO[0m [Stats #0] run time: 0h-0m-5s, clients: 1, corpus: 17, objectives: 0, executions: 1, exec/sec: 0.000
[32m INFO[0m ============= New Corpus Item =============
[32m INFO[0m Reverted? true 
 Txn:
[Sender] 0x8E################################d79dd
   [1] Router.swapExactETHForTokens{value: 4722.3663 ether}(0, path:(WETH  0x00################################6CF5d), address(this), block.timestamp);
   [1] Router.swapExactETHForTokens{value: 7685}(0, path:(WETH  0x00################################6CF5d), address(this), block.timestamp);
   [1] Router.swapExactETHForTokens{value: 1585.1331 ether}(0, path:(WETH  0x00################################6CF5d), address(this), block.timestamp);
   [1] Router.swapExactETHForTokens{value: 4713.2149 ether}(0, path:(WETH  0x00################################6CF5d), address(this), block.timestamp);
[Sender] 0x68################################c9024
   [1] 0x00################################6CF5d.approve{value: 2022.4261 ether}(0x00################################00000, 0)

[32m INFO[0m ==========================================
[32m INFO[0m [Testcase #0] run time: 0h-0m-5s, clients: 1, corpus: 18, objectives: 0, executions: 33, exec/sec: 0.000
[32m INFO[0m [Stats #0] run time: 0h-0m-5s, clients: 1, corpus: 18, objectives: 0, executions: 33, exec/sec: 0.000
[32m INFO[0m ============= New Corpus Item =============
[32m INFO[0m Reverted? false 
 Txn:
[Sender] 0x8E################################d79dd
   [1] Router.swapExactETHForTokens{value: 1182.1971 ether}(0, path:(WETH  0x00################################6CF5d), address(this), block.timestamp);
[Sender] 0x68################################c9024
   [1] 0x00################################6CF5d.approve(0x68################################c9024, 0)
       0x01

[32m INFO[0m ==========================================
[32m INFO[0m [Testcase #0] run time: 0h-0m-5s, clients: 1, corpus: 19, objectives: 0, executions: 34, exec/sec: 0.000
[32m INFO[0m [Stats #0] run time: 0h-0m-5s, clients: 1, corpus: 19, objectives: 0, executions: 34, exec/sec: 0.000
[32m INFO[0m ============= New Corpus Item =============
[32m INFO[0m Reverted? true 
 Txn:
[Sender] 0x8E################################d79dd
   [1] Router.swapExactETHForTokens{value: 4722.3663 ether}(0, path:(WETH  0x00################################6CF5d), address(this), block.timestamp);
   [1] Router.swapExactETHForTokens{value: 2333.9024 ether}(0, path:(WETH  0x00################################6CF5d), address(this), block.timestamp);
[Sender] 0x68################################c9024
   [1] 0x00################################6CF5d.approve(0x00################################00000, 7074290005460327891710457403686212430056768568956107699.8370 ether)
       0x08################################0000000000000000000000000000000000020000000000000000000000000000000000000000000000000000000000000002242455032303a20617070726f766520746f20746865207a65726f2061646472657373000000000000000000000000000000000000000000000000000000000000

[32m INFO[0m ==========================================
[32m INFO[0m [Testcase #0] run time: 0h-0m-5s, clients: 1, corpus: 20, objectives: 0, executions: 35, exec/sec: 0.000
[32m INFO[0m [Stats #0] run time: 0h-0m-5s, clients: 1, corpus: 20, objectives: 0, executions: 35, exec/sec: 0.000
[32m INFO[0m ============= New Corpus Item =============
[32m INFO[0m Reverted? false 
 Txn:
[Sender] 0x8E################################d79dd
   [1] Router.swapExactETHForTokens{value: 2894.2063 ether}(0, path:(WETH  0x00################################6CF5d), address(this), block.timestamp);
[Sender] 0x68################################c9024
   [1] 0x00################################6CF5d.approve(0x68################################c9024, 926228861413959039833477182331830337699283749744004584.6288 ether)
       0x01

[32m INFO[0m ==========================================
[32m INFO[0m [Testcase #0] run time: 0h-0m-5s, clients: 1, corpus: 21, objectives: 0, executions: 38, exec/sec: 0.000
[32m INFO[0m ============= Coverage Summary =============
[32m INFO[0m 0xbb################################c095c: 11.03% Instruction Covered, 13.16% Branch Covered
[32m INFO[0m 0x00################################6cf5d: 40.30% Instruction Covered, 32.65% Branch Covered
[32m INFO[0m [Stats #0] run time: 0h-0m-5s, clients: 1, corpus: 21, objectives: 0, executions: 38, exec/sec: 0.000
[32m INFO[0m ============= New Corpus Item =============
[32m INFO[0m Reverted? false 
 Txn:
[Sender] 0x8E################################d79dd
   [1] Router.swapExactETHForTokens{value: 4722.3663 ether}(0, path:(WETH  0x00################################6CF5d), address(this), block.timestamp);
   [1] Router.swapExactETHForTokens{value: 8146}(0, path:(WETH  0x00################################6CF5d), address(this), block.timestamp);
   [1] Router.swapExactETHForTokens{value: 10.0 ether}(0, path:(WETH  0x00################################6CF5d), address(this), block.timestamp);
   [1] Router.swapExactETHForTokens{value: 10.0 ether}(0, path:(WETH  0x00################################6CF5d), address(this), block.timestamp);
   [1] Router.swapExactETHForTokens{value: 2542.4365 ether}(0, path:(WETH  0x00################################6CF5d), address(this), block.timestamp);
   [1] 0x00################################6CF5d.decimals()
       0x12

[32m INFO[0m ==========================================
[32m INFO[0m [Testcase #0] run time: 0h-0m-5s, clients: 1, corpus: 22, objectives: 0, executions: 65, exec/sec: 0.000
[32m INFO[0m ============= Coverage Summary =============
[32m INFO[0m 0xbb################################c095c: 11.03% Instruction Covered, 13.16% Branch Covered
[32m INFO[0m 0x00################################6cf5d: 40.30% Instruction Covered, 32.65% Branch Covered
[32m INFO[0m [Stats #0] run time: 0h-0m-5s, clients: 1, corpus: 22, objectives: 0, executions: 65, exec/sec: 0.000
[32m INFO[0m ============= New Corpus Item =============
[32m INFO[0m Reverted? true 
 Txn:
[Sender] 0x8E################################d79dd
   [1] Router.swapExactETHForTokens{value: 4722.3663 ether}(0, path:(WETH  0x00################################6CF5d), address(this), block.timestamp);
   [1] Router.swapExactETHForTokens{value: 2333.9024 ether}(0, path:(WETH  0x00################################6CF5d), address(this), block.timestamp);
   [1] Router.swapExactETHForTokens{value: 4099}(0, path:(WETH  0x00################################6CF5d), address(this), block.timestamp);
   [1] 0x00################################6CF5d.decreaseAllowance(0xe1################################c8510, 52370472152847801862862901905898928279045381036118198600647.1125 ether)
       0x08################################0000000000000000000000000000000000020000000000000000000000000000000000000000000000000000000000000002542455032303a2064656372656173656420616c6c6f77616e63652062656c6f77207a65726f000000000000000000000000000000000000000000000000000000

[32m INFO[0m ==========================================
[32m INFO[0m [Testcase #0] run time: 0h-0m-5s, clients: 1, corpus: 23, objectives: 0, executions: 96, exec/sec: 0.000
[32m INFO[0m [Stats #0] run time: 0h-0m-6s, clients: 1, corpus: 23, objectives: 0, executions: 96, exec/sec: 0.000
[32m INFO[0m ============= New Corpus Item =============
[32m INFO[0m Reverted? false 
 Txn:
[Sender] 0x8E################################d79dd
   [1] Router.swapExactETHForTokens{value: 4722.3663 ether}(0, path:(WETH  0x00################################6CF5d), address(this), block.timestamp);
[Sender] 0x68################################c9024
   [1] 0x00################################6CF5d.approve(0x68################################c9024, 55213970774326129459774114225463114568892094119834905.1317 ether)
       0x01
[Sender] 0x8E################################d79dd
   [1] 0x00################################6CF5d.decreaseAllowance(0x35################################31dDb, 0)
       0x01

[32m INFO[0m ==========================================
[32m INFO[0m [Testcase #0] run time: 0h-0m-6s, clients: 1, corpus: 24, objectives: 0, executions: 99, exec/sec: 0.000
[32m INFO[0m [Stats #0] run time: 0h-0m-6s, clients: 1, corpus: 24, objectives: 0, executions: 99, exec/sec: 0.000
[32m INFO[0m ============= New Corpus Item =============
[32m INFO[0m Reverted? false 
 Txn:
[Sender] 0x8E################################d79dd
   [1] Router.swapExactETHForTokens{value: 4722.3663 ether}(0, path:(WETH  0x00################################6CF5d), address(this), block.timestamp);
   [1] Router.swapExactETHForTokens{value: 2333.9024 ether}(0, path:(WETH  0x00################################6CF5d), address(this), block.timestamp);
   [1] Router.swapExactETHForTokens{value: 4099}(0, path:(WETH  0x00################################6CF5d), address(this), block.timestamp);
   [1] 0x00################################6CF5d.decreaseAllowance(0x00################################6CF5d, 0)
       0x01

[32m INFO[0m ==========================================
[32m INFO[0m [Testcase #0] run time: 0h-0m-6s, clients: 1, corpus: 25, objectives: 0, executions: 121, exec/sec: 0.000
[32m INFO[0m ============= Coverage Summary =============
[32m INFO[0m 0xbb################################c095c: 11.03% Instruction Covered, 13.16% Branch Covered
[32m INFO[0m 0x00################################6cf5d: 40.59% Instruction Covered, 32.99% Branch Covered
[32m INFO[0m [Stats #0] run time: 0h-0m-6s, clients: 1, corpus: 25, objectives: 0, executions: 121, exec/sec: 0.000
[32m INFO[0m ============= New Corpus Item =============
[32m INFO[0m Reverted? true 
 Txn:
[Sender] 0x8E################################d79dd
   [1] Router.swapExactETHForTokens{value: 4722.3663 ether}(0, path:(WETH  0x00################################6CF5d), address(this), block.timestamp);
   [1] Router.swapExactETHForTokens{value: 8146}(0, path:(WETH  0x00################################6CF5d), address(this), block.timestamp);
[Sender] 0x68################################c9024
   [1] 0x00################################6CF5d.approve(0x68################################c9024, 209670497985266956218731259314325732206478153459837601144.4304 ether)
       0x01
   [1] 0x00################################6CF5d.excludeAccount(0x00################################00000)
       0x08################################000000000000000000000000000000000002000000000000000000000000000000000000000000000000000000000000000204f776e61626c653a2063616c6c6572206973206e6f7420746865206f776e6572

[32m INFO[0m ==========================================
[32m INFO[0m [Testcase #0] run time: 0h-0m-6s, clients: 1, corpus: 26, objectives: 0, executions: 128, exec/sec: 0.000
[32m INFO[0m ============= Coverage Summary =============
[32m INFO[0m 0x00################################6cf5d: 40.59% Instruction Covered, 32.99% Branch Covered
[32m INFO[0m 0xbb################################c095c: 11.03% Instruction Covered, 13.16% Branch Covered
[32m INFO[0m [Stats #0] run time: 0h-0m-6s, clients: 1, corpus: 26, objectives: 0, executions: 128, exec/sec: 0.000
[32m INFO[0m ============= New Corpus Item =============
[32m INFO[0m Reverted? true 
 Txn:
[Sender] 0x8E################################d79dd
   [1] Router.swapExactETHForTokens{value: 4722.3663 ether}(0, path:(WETH  0x00################################6CF5d), address(this), block.timestamp);
   [1] Router.swapExactETHForTokens{value: 7685}(0, path:(WETH  0x00################################6CF5d), address(this), block.timestamp);
   [1] Router.swapExactETHForTokens{value: 1394.3918 ether}(0, path:(WETH  0x00################################6CF5d), address(this), block.timestamp);
[Sender] 0xe1################################c8510
   [1] 0x00################################6CF5d.includeAccount(0x00################################00000)
       0x08################################000000000000000000000000000000000002000000000000000000000000000000000000000000000000000000000000000204f776e61626c653a2063616c6c6572206973206e6f7420746865206f776e6572

[32m INFO[0m ==========================================
[32m INFO[0m [Testcase #0] run time: 0h-0m-6s, clients: 1, corpus: 27, objectives: 0, executions: 161, exec/sec: 0.000
[32m INFO[0m ============= Coverage Summary =============
[32m INFO[0m 0x00################################6cf5d: 40.59% Instruction Covered, 32.99% Branch Covered
[32m INFO[0m 0xbb################################c095c: 11.03% Instruction Covered, 13.16% Branch Covered
[32m INFO[0m [Stats #0] run time: 0h-0m-6s, clients: 1, corpus: 27, objectives: 0, executions: 161, exec/sec: 0.000
[32m INFO[0m ============= New Corpus Item =============
[32m INFO[0m Reverted? true 
 Txn:
[Sender] 0x8E################################d79dd
   [1] Router.swapExactETHForTokens{value: 4722.3663 ether}(0, path:(WETH  0x00################################6CF5d), address(this), block.timestamp);
   [1] Router.swapExactETHForTokens{value: 2333.9024 ether}(0, path:(WETH  0x00################################6CF5d), address(this), block.timestamp);
[Sender] 0x35################################31dDb
   [1] 0x00################################6CF5d.increaseAllowance(0x00################################00000, 176684719984257149090995240775091671456580805058579184308.7717 ether)
       0x08################################0000000000000000000000000000000000020000000000000000000000000000000000000000000000000000000000000002242455032303a20617070726f766520746f20746865207a65726f2061646472657373000000000000000000000000000000000000000000000000000000000000

[32m INFO[0m ==========================================
[32m INFO[0m [Testcase #0] run time: 0h-0m-6s, clients: 1, corpus: 28, objectives: 0, executions: 192, exec/sec: 0.000
[32m INFO[0m [Stats #0] run time: 0h-0m-6s, clients: 1, corpus: 28, objectives: 0, executions: 192, exec/sec: 165.2
[32m INFO[0m ============= New Corpus Item =============
[32m INFO[0m Reverted? false 
 Txn:
[Sender] 0x8E################################d79dd
   [1] Router.swapExactETHForTokens{value: 4722.3663 ether}(0, path:(WETH  0x00################################6CF5d), address(this), block.timestamp);
   [1] Router.swapExactETHForTokens{value: 7685}(0, path:(WETH  0x00################################6CF5d), address(this), block.timestamp);
   [1] Router.swapExactETHForTokens{value: 1585.1331 ether}(0, path:(WETH  0x00################################6CF5d), address(this), block.timestamp);
[Sender] 0x68################################c9024
   [1] 0x00################################6CF5d.increaseAllowance(0x35################################31dDb, 2713870324579312948346495796394815592416919722517671082465.1311 ether)
       0x01

[32m INFO[0m ==========================================
[32m INFO[0m [Testcase #0] run time: 0h-0m-6s, clients: 1, corpus: 29, objectives: 0, executions: 223, exec/sec: 191.6
[32m INFO[0m ============= Coverage Summary =============
[32m INFO[0m 0xbb################################c095c: 11.03% Instruction Covered, 13.16% Branch Covered
[32m INFO[0m 0x00################################6cf5d: 40.59% Instruction Covered, 32.99% Branch Covered
[32m INFO[0m [Stats #0] run time: 0h-0m-6s, clients: 1, corpus: 29, objectives: 0, executions: 223, exec/sec: 190.0
[32m INFO[0m ============= New Corpus Item =============
[32m INFO[0m Reverted? false 
 Txn:
[Sender] 0x8E################################d79dd
   [1] Router.swapExactETHForTokens{value: 4722.3663 ether}(0, path:(WETH  0x00################################6CF5d), address(this), block.timestamp);
   [1] Router.swapExactETHForTokens{value: 2333.9024 ether}(0, path:(WETH  0x00################################6CF5d), address(this), block.timestamp);
   [1] Router.swapExactETHForTokens{value: 4099}(0, path:(WETH  0x00################################6CF5d), address(this), block.timestamp);
   [1] 0x00################################6CF5d.name()
       0x00################################0000000000000000000000000002000000000000000000000000000000000000000000000000000000000000000114c6974746c65205069672048756e746572000000000000000000000000000000

[32m INFO[0m ==========================================
[32m INFO[0m [Testcase #0] run time: 0h-0m-6s, clients: 1, corpus: 30, objectives: 0, executions: 225, exec/sec: 191.6
[32m INFO[0m ============= Coverage Summary =============
[32m INFO[0m 0x00################################6cf5d: 40.59% Instruction Covered, 32.99% Branch Covered
[32m INFO[0m 0xbb################################c095c: 11.03% Instruction Covered, 13.16% Branch Covered
[32m INFO[0m [Stats #0] run time: 0h-0m-6s, clients: 1, corpus: 30, objectives: 0, executions: 225, exec/sec: 189.9
[32m INFO[0m ============= New Corpus Item =============
[32m INFO[0m Reverted? false 
 Txn:
[Sender] 0x8E################################d79dd
   [1] Router.swapExactETHForTokens{value: 4722.3663 ether}(0, path:(WETH  0x00################################6CF5d), address(this), block.timestamp);
   [1] Router.swapExactETHForTokens{value: 2333.9024 ether}(0, path:(WETH  0x00################################6CF5d), address(this), block.timestamp);
   [1] Router.swapExactETHForTokens{value: 4099}(0, path:(WETH  0x00################################6CF5d), address(this), block.timestamp);
[Sender] 0xe1################################c8510
   [1] 0x00################################6CF5d.payTax(0)

[32m INFO[0m ==========================================
[32m INFO[0m [Testcase #0] run time: 0h-0m-6s, clients: 1, corpus: 31, objectives: 0, executions: 255, exec/sec: 215.1
[32m INFO[0m [Stats #0] run time: 0h-0m-6s, clients: 1, corpus: 31, objectives: 0, executions: 255, exec/sec: 215.0
[32m INFO[0m ============= New Corpus Item =============
[32m INFO[0m Reverted? true 
 Txn:
[Sender] 0x8E################################d79dd
   [1] Router.swapExactETHForTokens{value: 4722.3663 ether}(0, path:(WETH  0x00################################6CF5d), address(this), block.timestamp);
   [1] Router.swapExactETHForTokens{value: 2333.9024 ether}(0, path:(WETH  0x00################################6CF5d), address(this), block.timestamp);
[Sender] 0xe1################################c8510
   [1] 0x00################################6CF5d.payTax(65641040946496430723849676706704090772437459896056781549.5438 ether)
       0x4e################################0000000000000000000000000000000000011

[32m INFO[0m ==========================================
[32m INFO[0m [Testcase #0] run time: 0h-0m-6s, clients: 1, corpus: 32, objectives: 0, executions: 256, exec/sec: 215.8
[32m INFO[0m [Stats #0] run time: 0h-0m-6s, clients: 1, corpus: 32, objectives: 0, executions: 256, exec/sec: 215.4
[32m INFO[0m ============= New Corpus Item =============
[32m INFO[0m Reverted? true 
 Txn:
[Sender] 0x8E################################d79dd
   [1] Router.swapExactETHForTokens{value: 4722.3663 ether}(0, path:(WETH  0x00################################6CF5d), address(this), block.timestamp);
[Sender] 0xe1################################c8510
   [1] 0x00################################6CF5d.payTax(500)
       0x4e################################0000000000000000000000000000000000011

[32m INFO[0m ==========================================
[32m INFO[0m [Testcase #0] run time: 0h-0m-6s, clients: 1, corpus: 33, objectives: 0, executions: 269, exec/sec: 226.2
[32m INFO[0m ============= Coverage Summary =============
[32m INFO[0m 0x00################################6cf5d: 40.94% Instruction Covered, 33.67% Branch Covered
[32m INFO[0m 0xbb################################c095c: 11.03% Instruction Covered, 13.16% Branch Covered
[32m INFO[0m [Stats #0] run time: 0h-0m-6s, clients: 1, corpus: 33, objectives: 0, executions: 286, exec/sec: 239.4
[32m INFO[0m [Stats #0] run time: 0h-0m-6s, clients: 1, corpus: 33, objectives: 0, executions: 286, exec/sec: 239.3
[32m INFO[0m ============= New Corpus Item =============
[32m INFO[0m Reverted? true 
 Txn:
[Sender] 0x8E################################d79dd
   [1] Router.swapExactETHForTokens{value: 4722.3663 ether}(0, path:(WETH  0x00################################6CF5d), address(this), block.timestamp);
[Sender] 0xe1################################c8510
   [1] 0x00################################6CF5d.renounceOwnership()
       0x08################################000000000000000000000000000000000002000000000000000000000000000000000000000000000000000000000000000204f776e61626c653a2063616c6c6572206973206e6f7420746865206f776e6572

[32m INFO[0m ==========================================
[32m INFO[0m [Testcase #0] run time: 0h-0m-6s, clients: 1, corpus: 34, objectives: 0, executions: 287, exec/sec: 240.1
[32m INFO[0m ============= Coverage Summary =============
[32m INFO[0m 0xbb################################c095c: 11.03% Instruction Covered, 13.16% Branch Covered
[32m INFO[0m 0x00################################6cf5d: 40.94% Instruction Covered, 33.67% Branch Covered
[32m INFO[0m [Stats #0] run time: 0h-0m-6s, clients: 1, corpus: 34, objectives: 0, executions: 287, exec/sec: 239.7
[32m INFO[0m ============= New Corpus Item =============
[32m INFO[0m Reverted? true 
 Txn:
[Sender] 0x8E################################d79dd
   [1] Router.swapExactETHForTokens{value: 1182.1971 ether}(0, path:(WETH  0x00################################6CF5d), address(this), block.timestamp);
[Sender] 0x68################################c9024
   [1] 0x00################################6CF5d.approve(0x68################################c9024, 0)
       0x01
[Sender] 0x8E################################d79dd
   [1] 0x00################################6CF5d.setBurnFee(3138550867693340381917894711603833208051.1777 ether)
       0x08################################000000000000000000000000000000000002000000000000000000000000000000000000000000000000000000000000000204f776e61626c653a2063616c6c6572206973206e6f7420746865206f776e6572

[32m INFO[0m ==========================================
[32m INFO[0m [Testcase #0] run time: 0h-0m-6s, clients: 1, corpus: 35, objectives: 0, executions: 319, exec/sec: 266.3
[32m INFO[0m ============= Coverage Summary =============
[32m INFO[0m 0x00################################6cf5d: 40.94% Instruction Covered, 33.67% Branch Covered
[32m INFO[0m 0xbb################################c095c: 11.03% Instruction Covered, 13.16% Branch Covered
[32m INFO[0m [Stats #0] run time: 0h-0m-6s, clients: 1, corpus: 35, objectives: 0, executions: 319, exec/sec: 265.6
[32m INFO[0m ============= New Corpus Item =============
[32m INFO[0m Reverted? true 
 Txn:
[Sender] 0x8E################################d79dd
   [1] Router.swapExactETHForTokens{value: 4722.3663 ether}(0, path:(WETH  0x00################################6CF5d), address(this), block.timestamp);
   [1] Router.swapExactETHForTokens{value: 8146}(0, path:(WETH  0x00################################6CF5d), address(this), block.timestamp);
   [1] Router.swapExactETHForTokens{value: 2933.8981 ether}(0, path:(WETH  0x00################################6CF5d), address(this), block.timestamp);
[Sender] 0xe1################################c8510
   [1] 0x00################################6CF5d.setTaxFee(115022509847369572450601602764873282595246645017035816159246.6293 ether)
       0x08################################000000000000000000000000000000000002000000000000000000000000000000000000000000000000000000000000000204f776e61626c653a2063616c6c6572206973206e6f7420746865206f776e6572

[32m INFO[0m ==========================================
[32m INFO[0m [Testcase #0] run time: 0h-0m-6s, clients: 1, corpus: 36, objectives: 0, executions: 351, exec/sec: 292.1
[32m INFO[0m ============= Coverage Summary =============
[32m INFO[0m 0xbb################################c095c: 11.03% Instruction Covered, 13.16% Branch Covered
[32m INFO[0m 0x00################################6cf5d: 40.94% Instruction Covered, 33.67% Branch Covered
[32m INFO[0m [Stats #0] run time: 0h-0m-6s, clients: 1, corpus: 36, objectives: 0, executions: 351, exec/sec: 289.9
[32m INFO[0m ============= New Corpus Item =============
[32m INFO[0m Reverted? false 
 Txn:
[Sender] 0x8E################################d79dd
   [1] Router.swapExactETHForTokens{value: 4722.3663 ether}(0, path:(WETH  0x00################################6CF5d), address(this), block.timestamp);
   [1] Router.swapExactETHForTokens{value: 2333.9024 ether}(0, path:(WETH  0x00################################6CF5d), address(this), block.timestamp);
   [1] Router.swapExactETHForTokens{value: 4099}(0, path:(WETH  0x00################################6CF5d), address(this), block.timestamp);
[Sender] 0x68################################c9024
   [1] 0x00################################6CF5d.symbol()
       0x00################################0000000000000000000000000002000000000000000000000000000000000000000000000000000000000000000114c6974746c65205069672048756e746572000000000000000000000000000000

[32m INFO[0m ==========================================
[32m INFO[0m [Testcase #0] run time: 0h-0m-6s, clients: 1, corpus: 37, objectives: 0, executions: 383, exec/sec: 316.2
[32m INFO[0m ============= Coverage Summary =============
[32m INFO[0m 0xbb################################c095c: 11.03% Instruction Covered, 13.16% Branch Covered
[32m INFO[0m 0x00################################6cf5d: 40.94% Instruction Covered, 33.67% Branch Covered
[32m INFO[0m [Stats #0] run time: 0h-0m-6s, clients: 1, corpus: 37, objectives: 0, executions: 383, exec/sec: 314.6
[32m INFO[0m ============= New Corpus Item =============
[32m INFO[0m Reverted? true 
 Txn:
[Sender] 0x8E################################d79dd
   [1] Router.swapExactETHForTokens{value: 4722.3663 ether}(0, path:(WETH  0x00################################6CF5d), address(this), block.timestamp);
   [1] Router.swapExactETHForTokens{value: 7685}(0, path:(WETH  0x00################################6CF5d), address(this), block.timestamp);
   [1] Router.swapExactETHForTokens{value: 1585.1331 ether}(0, path:(WETH  0x00################################6CF5d), address(this), block.timestamp);
[Sender] 0xe1################################c8510
   [1] 0x00################################6CF5d.transfer(0x00################################00000, 226822721201845041629194938924308922231549973223481283876.5251 ether)
       0x08################################0000000000000000000000000000000000020000000000000000000000000000000000000000000000000000000000000002342455032303a207472616e7366657220746f20746865207a65726f20616464726573730000000000000000000000000000000000000000000000000000000000

[32m INFO[0m ==========================================
[32m INFO[0m [Testcase #0] run time: 0h-0m-6s, clients: 1, corpus: 38, objectives: 0, executions: 414, exec/sec: 339.9
[32m INFO[0m [Stats #0] run time: 0h-0m-6s, clients: 1, corpus: 38, objectives: 0, executions: 414, exec/sec: 339.9
[32m INFO[0m ============= New Corpus Item =============
[32m INFO[0m Reverted? true 
 Txn:
[Sender] 0x8E################################d79dd
   [1] Router.swapExactETHForTokens{value: 4722.3663 ether}(0, path:(WETH  0x00################################6CF5d), address(this), block.timestamp);
[Sender] 0xe1################################c8510
   [1] 0x00################################6CF5d.transfer(0x8E################################d79dd, 0)
       0x08################################000000000000000000000000000000000002000000000000000000000000000000000000000000000000000000000000000295472616e7366657220616d6f756e74206d7573742062652067726561746572207468616e207a65726f0000000000000000000000000000000000000000000000

[32m INFO[0m ==========================================
[32m INFO[0m [Testcase #0] run time: 0h-0m-6s, clients: 1, corpus: 39, objectives: 0, executions: 416, exec/sec: 341.4
[32m INFO[0m [Stats #0] run time: 0h-0m-6s, clients: 1, corpus: 39, objectives: 0, executions: 416, exec/sec: 341.2
[32m INFO[0m ============= New Corpus Item =============
[32m INFO[0m Reverted? true 
 Txn:
[Sender] 0x8E################################d79dd
   [1] Router.swapExactETHForTokens{value: 4722.3663 ether}(0, path:(WETH  0x00################################6CF5d), address(this), block.timestamp);
[Sender] 0xe1################################c8510
   [1] 0x00################################6CF5d.transfer(0xe1################################c8510, 212485655117273504915910178527518357852959441014303271329.7557 ether)
       0x08################################000000000000000000000000000000000002000000000000000000000000000000000000000000000000000000000000000285472616e7366657220616d6f756e74206578636565647320746865206d61785478416d6f756e742e000000000000000000000000000000000000000000000000

[32m INFO[0m ==========================================
[32m INFO[0m [Testcase #0] run time: 0h-0m-6s, clients: 1, corpus: 40, objectives: 0, executions: 427, exec/sec: 350.1
[32m INFO[0m ============= Coverage Summary =============
[32m INFO[0m 0x00################################6cf5d: 42.28% Instruction Covered, 34.35% Branch Covered
[32m INFO[0m 0xbb################################c095c: 11.03% Instruction Covered, 13.16% Branch Covered
[32m INFO[0m [Stats #0] run time: 0h-0m-6s, clients: 1, corpus: 40, objectives: 0, executions: 427, exec/sec: 348.9
[32m INFO[0m ============= New Corpus Item =============
[32m INFO[0m Reverted? true 
 Txn:
[Sender] 0x8E################################d79dd
   [1] 0x00################################6CF5d.transferFrom(0x00################################00000, 0x68################################c9024, 345129073824078298758390909946382258972176052782034091.5254 ether)
       0x08################################0000000000000000000000000000000000020000000000000000000000000000000000000000000000000000000000000002542455032303a207472616e736665722066726f6d20746865207a65726f2061646472657373000000000000000000000000000000000000000000000000000000

[32m INFO[0m ==========================================
[32m INFO[0m [Testcase #0] run time: 0h-0m-6s, clients: 1, corpus: 41, objectives: 0, executions: 446, exec/sec: 364.3
[32m INFO[0m ============= Coverage Summary =============
[32m INFO[0m 0xbb################################c095c: 11.03% Instruction Covered, 13.16% Branch Covered
[32m INFO[0m 0x00################################6cf5d: 42.28% Instruction Covered, 34.35% Branch Covered
[32m INFO[0m [Stats #0] run time: 0h-0m-6s, clients: 1, corpus: 41, objectives: 0, executions: 446, exec/sec: 363.5
[32m INFO[0m ============= New Corpus Item =============
[32m INFO[0m Reverted? true 
 Txn:
[Sender] 0x8E################################d79dd
   [1] Router.swapExactETHForTokens{value: 4722.3663 ether}(0, path:(WETH  0x00################################6CF5d), address(this), block.timestamp);
   [1] Router.swapExactETHForTokens{value: 0.7205 ether}(0, path:(WETH  0x00################################6CF5d), address(this), block.timestamp);
[Sender] 0x68################################c9024
   [1] 0x00################################6CF5d.approve(0x00################################6CF5d, 9444.7329 ether)
       0x01
[Sender] 0xe1################################c8510
   [1] 0x00################################6CF5d.transferOwnership(0xe1################################c8510)
       0x08################################000000000000000000000000000000000002000000000000000000000000000000000000000000000000000000000000000204f776e61626c653a2063616c6c6572206973206e6f7420746865206f776e6572

[32m INFO[0m ==========================================
[32m INFO[0m [Testcase #0] run time: 0h-0m-6s, clients: 1, corpus: 42, objectives: 0, executions: 479, exec/sec: 390.3
[32m INFO[0m ============= Coverage Summary =============
[32m INFO[0m 0x00################################6cf5d: 42.28% Instruction Covered, 34.35% Branch Covered
[32m INFO[0m 0xbb################################c095c: 11.03% Instruction Covered, 13.16% Branch Covered
[32m INFO[0m [Stats #0] run time: 0h-0m-7s, clients: 1, corpus: 42, objectives: 0, executions: 479, exec/sec: 239.2
[32m INFO[0m ============= New Corpus Item =============
[32m INFO[0m Reverted? false 
 Txn:
[Sender] 0x8E################################d79dd
   [1] Router.swapExactETHForTokens{value: 4722.3663 ether}(0, path:(WETH  0x00################################6CF5d), address(this), block.timestamp);
   [1] 0x00################################6CF5d.payTax(5311)

[32m INFO[0m ==========================================
[32m INFO[0m [Testcase #0] run time: 0h-0m-7s, clients: 1, corpus: 43, objectives: 0, executions: 991, exec/sec: 492.4
[32m INFO[0m [Stats #0] run time: 0h-0m-7s, clients: 1, corpus: 43, objectives: 0, executions: 991, exec/sec: 491.6
[32m INFO[0m ============= New Corpus Item =============
[32m INFO[0m Reverted? false 
 Txn:
[Sender] 0x8E################################d79dd
   [1] Router.swapExactETHForTokens{value: 4722.3663 ether}(0, path:(WETH  0x00################################6CF5d), address(this), block.timestamp);
   [1] 0x00################################6CF5d.payTax(24039990)

[32m INFO[0m ==========================================
[32m INFO[0m [Testcase #0] run time: 0h-0m-7s, clients: 1, corpus: 44, objectives: 0, executions: 999, exec/sec: 495.2
[32m INFO[0m ============= Coverage Summary =============
[32m INFO[0m 0xbb################################c095c: 11.03% Instruction Covered, 13.16% Branch Covered
[32m INFO[0m 0x00################################6cf5d: 42.28% Instruction Covered, 34.35% Branch Covered
[32m INFO[0m [Stats #0] run time: 0h-0m-7s, clients: 1, corpus: 44, objectives: 0, executions: 2201, exec/sec: 965.3
[32m INFO[0m [Stats #0] run time: 0h-0m-8s, clients: 1, corpus: 44, objectives: 0, executions: 9850, exec/sec: 2.994k
[32m INFO[0m [Stats #0] run time: 0h-0m-9s, clients: 1, corpus: 44, objectives: 0, executions: 17762, exec/sec: 4.136k
[32m INFO[0m [Stats #0] run time: 0h-0m-10s, clients: 1, corpus: 44, objectives: 0, executions: 26696, exec/sec: 5.036k
[32m INFO[0m [Stats #0] run time: 0h-0m-11s, clients: 1, corpus: 44, objectives: 0, executions: 35304, exec/sec: 5.600k
[32m INFO[0m [Stats #0] run time: 0h-0m-12s, clients: 1, corpus: 44, objectives: 0, executions: 43540, exec/sec: 5.957k
[32m INFO[0m [Stats #0] run time: 0h-0m-13s, clients: 1, corpus: 44, objectives: 0, executions: 43540, exec/sec: 5.287k
[32m INFO[0m ============= New Corpus Item =============
[32m INFO[0m Reverted? false 
 Txn:
[Sender] 0x8E################################d79dd
   [1] Router.swapExactETHForTokens{value: 4455.7829 ether}(0, path:(WETH  0x00################################6CF5d), address(this), block.timestamp);
   [1] Router.swapExactETHForTokens{value: 116}(0, path:(WETH  0x00################################6CF5d), address(this), block.timestamp);
   [1] 0x00################################6CF5d.transfer(0xe1################################c8510, 316912650057.5735 ether)
       0x01
   [1] 0x00################################6CF5d.name()
       0x00################################0000000000000000000000000002000000000000000000000000000000000000000000000000000000000000000114c6974746c65205069672048756e746572000000000000000000000000000000

[32m INFO[0m ==========================================
[32m INFO[0m [Testcase #0] run time: 0h-0m-13s, clients: 1, corpus: 45, objectives: 0, executions: 52167, exec/sec: 6.334k
[32m INFO[0m ============= Coverage Summary =============
[32m INFO[0m 0x00################################6cf5d: 42.28% Instruction Covered, 34.35% Branch Covered
[32m INFO[0m 0xbb################################c095c: 11.03% Instruction Covered, 13.16% Branch Covered
[32m INFO[0m [Stats #0] run time: 0h-0m-13s, clients: 1, corpus: 45, objectives: 0, executions: 52848, exec/sec: 6.354k
[32m INFO[0m [Stats #0] run time: 0h-0m-14s, clients: 1, corpus: 45, objectives: 0, executions: 61703, exec/sec: 6.620k
[32m INFO[0m [Stats #0] run time: 0h-0m-15s, clients: 1, corpus: 45, objectives: 0, executions: 70477, exec/sec: 6.828k
[32m INFO[0m [Stats #0] run time: 0h-0m-16s, clients: 1, corpus: 45, objectives: 0, executions: 78478, exec/sec: 6.931k
[32m INFO[0m [Stats #0] run time: 0h-0m-17s, clients: 1, corpus: 45, objectives: 0, executions: 78478, exec/sec: 6.734k
[32m INFO[0m ============= New Corpus Item =============
[32m INFO[0m Reverted? false 
 Txn:
[Sender] 0x8E################################d79dd
   [1] Router.swapExactETHForTokens{value: 4713.8169 ether}(0, path:(WETH  0x00################################6CF5d), address(this), block.timestamp);
   [1] 0x00################################6CF5d.transfer(0x35################################31dDb, 6890)
       0x01
[Sender] 0x68################################c9024
   [1] 0x00################################6CF5d.approve(0x68################################c9024, 926228861413959039833477182331830337699283749744004584.6288 ether)
       0x01

[32m INFO[0m ==========================================
[32m INFO[0m [Testcase #0] run time: 0h-0m-17s, clients: 1, corpus: 46, objectives: 0, executions: 81281, exec/sec: 6.974k
[32m INFO[0m ============= Coverage Summary =============
[32m INFO[0m 0x00################################6cf5d: 42.28% Instruction Covered, 34.35% Branch Covered
[32m INFO[0m 0xbb################################c095c: 11.03% Instruction Covered, 13.16% Branch Covered
[32m INFO[0m [Stats #0] run time: 0h-0m-17s, clients: 1, corpus: 46, objectives: 0, executions: 86577, exec/sec: 7.025k
[32m INFO[0m [Stats #0] run time: 0h-0m-18s, clients: 1, corpus: 46, objectives: 0, executions: 86577, exec/sec: 6.717k
[32m INFO[0m ============= New Corpus Item =============
[32m INFO[0m Reverted? false 
 Txn:
[Sender] 0x8E################################d79dd
   [1] Router.swapExactETHForTokens{value: 4713.8169 ether}(0, path:(WETH  0x00################################6CF5d), address(this), block.timestamp);
   [1] 0x00################################6CF5d.transfer(0x35################################31dDb, 6890)
       0x01
   [1] 0x00################################6CF5d.payTax(5311)
   [1] Router.swapExactETHForTokens{value: 9.9999 ether}(0, path:(WETH  0x00################################6CF5d), address(this), block.timestamp);
   [1] Router.swapExactETHForTokens{value: 10.0 ether}(0, path:(WETH  0x00################################6CF5d), address(this), block.timestamp);
   [1] 0x00################################6CF5d.symbol()
       0x00################################0000000000000000000000000002000000000000000000000000000000000000000000000000000000000000000114c6974746c65205069672048756e746572000000000000000000000000000000

[32m INFO[0m ==========================================
[32m INFO[0m [Testcase #0] run time: 0h-0m-18s, clients: 1, corpus: 47, objectives: 0, executions: 91268, exec/sec: 7.080k
[32m INFO[0m ============= Coverage Summary =============
[32m INFO[0m 0xbb################################c095c: 11.03% Instruction Covered, 13.16% Branch Covered
[32m INFO[0m 0x00################################6cf5d: 42.28% Instruction Covered, 34.35% Branch Covered
[32m INFO[0m [Stats #0] run time: 0h-0m-18s, clients: 1, corpus: 47, objectives: 0, executions: 94551, exec/sec: 7.094k
[32m INFO[0m [Stats #0] run time: 0h-0m-19s, clients: 1, corpus: 47, objectives: 0, executions: 94551, exec/sec: 6.990k
[32m INFO[0m ============= New Corpus Item =============
[32m INFO[0m Reverted? false 
 Txn:
[Sender] 0x8E################################d79dd
   [1] Router.swapExactETHForTokens{value: 4713.8169 ether}(0, path:(WETH  0x00################################6CF5d), address(this), block.timestamp);
   [1] 0x00################################6CF5d.transfer(0x35################################31dDb, 6890)
       0x01
   [1] 0x00################################6CF5d.payTax(5311)
   [1] Router.swapExactETHForTokens{value: 9.9999 ether}(0, path:(WETH  0x00################################6CF5d), address(this), block.timestamp);
   [1] Router.swapExactETHForTokens{value: 10.0 ether}(0, path:(WETH  0x00################################6CF5d), address(this), block.timestamp);
   [1] Router.swapExactETHForTokens{value: 3241.9978 ether}(0, path:(WETH  0x00################################6CF5d), address(this), block.timestamp);
   [1] 0x00################################6CF5d.decreaseAllowance(0x00################################6CF5d, 0)
       0x01

[32m INFO[0m ==========================================
[32m INFO[0m [Testcase #0] run time: 0h-0m-19s, clients: 1, corpus: 48, objectives: 0, executions: 96153, exec/sec: 7.094k
[32m INFO[0m ============= Coverage Summary =============
[32m INFO[0m 0xbb################################c095c: 11.03% Instruction Covered, 13.16% Branch Covered
[32m INFO[0m 0x00################################6cf5d: 42.28% Instruction Covered, 34.35% Branch Covered
[32m INFO[0m [Stats #0] run time: 0h-0m-19s, clients: 1, corpus: 48, objectives: 0, executions: 102044, exec/sec: 7.116k
[32m INFO[0m [Stats #0] run time: 0h-0m-20s, clients: 1, corpus: 48, objectives: 0, executions: 109180, exec/sec: 7.112k
[32m INFO[0m [Stats #0] run time: 0h-0m-21s, clients: 1, corpus: 48, objectives: 0, executions: 116932, exec/sec: 7.151k
[32m INFO[0m [Stats #0] run time: 0h-0m-21s, clients: 1, corpus: 48, objectives: 0, executions: 116932, exec/sec: 7.141k
[32m INFO[0m ============= New Corpus Item =============
[32m INFO[0m Reverted? false 
 Txn:
[Sender] 0x8E################################d79dd
   [1] Router.swapExactETHForTokens{value: 564}(0, path:(WETH  0x00################################6CF5d), address(this), block.timestamp);
   [1] Router.swapExactETHForTokens{value: 1208.2069 ether}(0, path:(WETH  0x00################################6CF5d), address(this), block.timestamp);
   [1] 0x00################################6CF5d.transfer(0x35################################31dDb, 549755813888)
       0x01

[32m INFO[0m ==========================================
[32m INFO[0m [Testcase #0] run time: 0h-0m-21s, clients: 1, corpus: 49, objectives: 0, executions: 117228, exec/sec: 7.158k
[32m INFO[0m ============= Coverage Summary =============
[32m INFO[0m 0x00################################6cf5d: 42.28% Instruction Covered, 34.35% Branch Covered
[32m INFO[0m 0xbb################################c095c: 11.03% Instruction Covered, 13.16% Branch Covered
[32m INFO[0m [Stats #0] run time: 0h-0m-22s, clients: 1, corpus: 49, objectives: 0, executions: 124194, exec/sec: 7.157k
[32m INFO[0m [Stats #0] run time: 0h-0m-23s, clients: 1, corpus: 49, objectives: 0, executions: 130960, exec/sec: 7.136k
[32m INFO[0m [Stats #0] run time: 0h-0m-24s, clients: 1, corpus: 49, objectives: 0, executions: 138670, exec/sec: 7.164k
[32m INFO[0m [Stats #0] run time: 0h-0m-25s, clients: 1, corpus: 49, objectives: 0, executions: 146382, exec/sec: 7.190k
[32m INFO[0m [Stats #0] run time: 0h-0m-26s, clients: 1, corpus: 49, objectives: 0, executions: 153402, exec/sec: 7.182k
[32m INFO[0m [Stats #0] run time: 0h-0m-27s, clients: 1, corpus: 49, objectives: 0, executions: 160767, exec/sec: 7.189k
[32m INFO[0m [Stats #0] run time: 0h-0m-28s, clients: 1, corpus: 49, objectives: 0, executions: 168317, exec/sec: 7.204k
[32m INFO[0m [Stats #0] run time: 0h-0m-29s, clients: 1, corpus: 49, objectives: 0, executions: 175550, exec/sec: 7.203k
[32m INFO[0m [Stats #0] run time: 0h-0m-30s, clients: 1, corpus: 49, objectives: 0, executions: 183069, exec/sec: 7.213k
[32m INFO[0m [Stats #0] run time: 0h-0m-31s, clients: 1, corpus: 49, objectives: 0, executions: 190556, exec/sec: 7.223k
[32m INFO[0m [Stats #0] run time: 0h-0m-32s, clients: 1, corpus: 49, objectives: 0, executions: 190556, exec/sec: 7.070k
[32m INFO[0m ============= New Corpus Item =============
[32m INFO[0m Reverted? false 
 Txn:
[Sender] 0x8E################################d79dd
   [1] Router.swapExactETHForTokens{value: 4722.3664 ether}(0, path:(WETH  0x00################################6CF5d), address(this), block.timestamp);
   [1] 0x00################################6CF5d.transfer(0x68################################c9024, 549755813888)
       0x01
   [1] Router.swapExactETHForTokens{value: 4151.8133 ether}(0, path:(WETH  0x00################################6CF5d), address(this), block.timestamp);
   [1] 0x00################################6CF5d.transfer(0x35################################31dDb, 549755813888)
       0x01

[32m INFO[0m ==========================================
[32m INFO[0m [Testcase #0] run time: 0h-0m-32s, clients: 1, corpus: 50, objectives: 0, executions: 194864, exec/sec: 7.229k
[32m INFO[0m ============= Coverage Summary =============
[32m INFO[0m 0x00################################6cf5d: 42.28% Instruction Covered, 34.35% Branch Covered
[32m INFO[0m 0xbb################################c095c: 11.03% Instruction Covered, 13.16% Branch Covered
[32m INFO[0m [Stats #0] run time: 0h-0m-32s, clients: 1, corpus: 50, objectives: 0, executions: 198012, exec/sec: 7.232k
[32m INFO[0m [Stats #0] run time: 0h-0m-33s, clients: 1, corpus: 50, objectives: 0, executions: 205408, exec/sec: 7.237k
[32m INFO[0m [Stats #0] run time: 0h-0m-34s, clients: 1, corpus: 50, objectives: 0, executions: 212357, exec/sec: 7.225k
[32m INFO[0m [Stats #0] run time: 0h-0m-35s, clients: 1, corpus: 50, objectives: 0, executions: 219822, exec/sec: 7.232k
[32m INFO[0m [Stats #0] run time: 0h-0m-36s, clients: 1, corpus: 50, objectives: 0, executions: 226776, exec/sec: 7.221k
[32m INFO[0m [Stats #0] run time: 0h-0m-37s, clients: 1, corpus: 50, objectives: 0, executions: 233404, exec/sec: 7.202k
[32m INFO[0m [Stats #0] run time: 0h-0m-38s, clients: 1, corpus: 50, objectives: 0, executions: 240994, exec/sec: 7.212k
[32m INFO[0m [Stats #0] run time: 0h-0m-39s, clients: 1, corpus: 50, objectives: 0, executions: 248192, exec/sec: 7.210k
[32m INFO[0m [Stats #0] run time: 0h-0m-40s, clients: 1, corpus: 50, objectives: 0, executions: 255683, exec/sec: 7.217k
[32m INFO[0m [Stats #0] run time: 0h-0m-41s, clients: 1, corpus: 50, objectives: 0, executions: 263309, exec/sec: 7.228k
[32m INFO[0m [Stats #0] run time: 0h-0m-42s, clients: 1, corpus: 50, objectives: 0, executions: 270807, exec/sec: 7.234k
[32m INFO[0m [Stats #0] run time: 0h-0m-43s, clients: 1, corpus: 50, objectives: 0, executions: 278233, exec/sec: 7.239k
[32m INFO[0m [Stats #0] run time: 0h-0m-44s, clients: 1, corpus: 50, objectives: 0, executions: 285784, exec/sec: 7.247k
[32m INFO[0m [Stats #0] run time: 0h-0m-45s, clients: 1, corpus: 50, objectives: 0, executions: 293462, exec/sec: 7.257k
[32m INFO[0m [Stats #0] run time: 0h-0m-46s, clients: 1, corpus: 50, objectives: 0, executions: 300857, exec/sec: 7.261k
[32m INFO[0m [Stats #0] run time: 0h-0m-47s, clients: 1, corpus: 50, objectives: 0, executions: 308091, exec/sec: 7.260k
[32m INFO[0m [Stats #0] run time: 0h-0m-48s, clients: 1, corpus: 50, objectives: 0, executions: 315712, exec/sec: 7.268k
[32m INFO[0m [Stats #0] run time: 0h-0m-49s, clients: 1, corpus: 50, objectives: 0, executions: 322972, exec/sec: 7.266k
[32m INFO[0m [Stats #0] run time: 0h-0m-50s, clients: 1, corpus: 50, objectives: 0, executions: 330395, exec/sec: 7.267k
[32m INFO[0m [Stats #0] run time: 0h-0m-51s, clients: 1, corpus: 50, objectives: 0, executions: 337696, exec/sec: 7.267k
[32m INFO[0m [Stats #0] run time: 0h-0m-52s, clients: 1, corpus: 50, objectives: 0, executions: 344989, exec/sec: 7.267k
[32m INFO[0m [Stats #0] run time: 0h-0m-53s, clients: 1, corpus: 50, objectives: 0, executions: 352573, exec/sec: 7.272k
[32m INFO[0m [Stats #0] run time: 0h-0m-54s, clients: 1, corpus: 50, objectives: 0, executions: 359992, exec/sec: 7.274k
[32m INFO[0m [Stats #0] run time: 0h-0m-55s, clients: 1, corpus: 50, objectives: 0, executions: 367267, exec/sec: 7.274k
[32m INFO[0m [Stats #0] run time: 0h-0m-56s, clients: 1, corpus: 50, objectives: 0, executions: 374854, exec/sec: 7.280k
[32m INFO[0m [Stats #0] run time: 0h-0m-57s, clients: 1, corpus: 50, objectives: 0, executions: 382343, exec/sec: 7.284k
[32m INFO[0m [Stats #0] run time: 0h-0m-58s, clients: 1, corpus: 50, objectives: 0, executions: 389638, exec/sec: 7.283k
[32m INFO[0m [Stats #0] run time: 0h-0m-59s, clients: 1, corpus: 50, objectives: 0, executions: 397224, exec/sec: 7.289k
[32m INFO[0m [Stats #0] run time: 0h-1m-0s, clients: 1, corpus: 50, objectives: 0, executions: 404610, exec/sec: 7.290k
[32m INFO[0m [Stats #0] run time: 0h-1m-1s, clients: 1, corpus: 50, objectives: 0, executions: 412101, exec/sec: 7.293k
[32m INFO[0m [Stats #0] run time: 0h-1m-2s, clients: 1, corpus: 50, objectives: 0, executions: 419522, exec/sec: 7.294k
[32m INFO[0m [Stats #0] run time: 0h-1m-4s, clients: 1, corpus: 50, objectives: 0, executions: 426914, exec/sec: 7.295k
[32m INFO[0m [Stats #0] run time: 0h-1m-5s, clients: 1, corpus: 50, objectives: 0, executions: 434308, exec/sec: 7.297k
[32m INFO[0m [Stats #0] run time: 0h-1m-6s, clients: 1, corpus: 50, objectives: 0, executions: 441853, exec/sec: 7.300k
[32m INFO[0m [Stats #0] run time: 0h-1m-7s, clients: 1, corpus: 50, objectives: 0, executions: 448999, exec/sec: 7.297k
[32m INFO[0m [Stats #0] run time: 0h-1m-8s, clients: 1, corpus: 50, objectives: 0, executions: 456463, exec/sec: 7.300k
[32m INFO[0m [Stats #0] run time: 0h-1m-9s, clients: 1, corpus: 50, objectives: 0, executions: 464111, exec/sec: 7.305k
[32m INFO[0m [Stats #0] run time: 0h-1m-10s, clients: 1, corpus: 50, objectives: 0, executions: 471540, exec/sec: 7.306k
[32m INFO[0m [Stats #0] run time: 0h-1m-11s, clients: 1, corpus: 50, objectives: 0, executions: 478867, exec/sec: 7.307k
[32m INFO[0m [Stats #0] run time: 0h-1m-12s, clients: 1, corpus: 50, objectives: 0, executions: 486413, exec/sec: 7.310k
[32m INFO[0m [Stats #0] run time: 0h-1m-13s, clients: 1, corpus: 50, objectives: 0, executions: 493747, exec/sec: 7.310k
[32m INFO[0m [Stats #0] run time: 0h-1m-14s, clients: 1, corpus: 50, objectives: 0, executions: 501425, exec/sec: 7.315k
[32m INFO[0m [Stats #0] run time: 0h-1m-15s, clients: 1, corpus: 50, objectives: 0, executions: 508870, exec/sec: 7.316k
[32m INFO[0m [Stats #0] run time: 0h-1m-16s, clients: 1, corpus: 50, objectives: 0, executions: 516671, exec/sec: 7.321k
[32m INFO[0m [Stats #0] run time: 0h-1m-17s, clients: 1, corpus: 50, objectives: 0, executions: 524129, exec/sec: 7.323k
[32m INFO[0m [Stats #0] run time: 0h-1m-18s, clients: 1, corpus: 50, objectives: 0, executions: 531425, exec/sec: 7.322k
[32m INFO[0m [Stats #0] run time: 0h-1m-19s, clients: 1, corpus: 50, objectives: 0, executions: 539007, exec/sec: 7.325k
[32m INFO[0m [Stats #0] run time: 0h-1m-20s, clients: 1, corpus: 50, objectives: 0, executions: 546278, exec/sec: 7.324k
[32m INFO[0m [Stats #0] run time: 0h-1m-21s, clients: 1, corpus: 50, objectives: 0, executions: 553789, exec/sec: 7.327k
[32m INFO[0m [Stats #0] run time: 0h-1m-22s, clients: 1, corpus: 50, objectives: 0, executions: 561282, exec/sec: 7.329k
[32m INFO[0m [Stats #0] run time: 0h-1m-23s, clients: 1, corpus: 50, objectives: 0, executions: 568581, exec/sec: 7.328k
[32m INFO[0m [Stats #0] run time: 0h-1m-24s, clients: 1, corpus: 50, objectives: 0, executions: 575974, exec/sec: 7.329k
[32m INFO[0m [Stats #0] run time: 0h-1m-25s, clients: 1, corpus: 50, objectives: 0, executions: 583647, exec/sec: 7.333k
[32m INFO[0m [Stats #0] run time: 0h-1m-26s, clients: 1, corpus: 50, objectives: 0, executions: 591338, exec/sec: 7.337k
[32m INFO[0m [Stats #0] run time: 0h-1m-27s, clients: 1, corpus: 50, objectives: 0, executions: 598727, exec/sec: 7.338k
[32m INFO[0m [Stats #0] run time: 0h-1m-28s, clients: 1, corpus: 50, objectives: 0, executions: 606217, exec/sec: 7.340k
[32m INFO[0m [Stats #0] run time: 0h-1m-29s, clients: 1, corpus: 50, objectives: 0, executions: 613771, exec/sec: 7.342k
[32m INFO[0m [Stats #0] run time: 0h-1m-30s, clients: 1, corpus: 50, objectives: 0, executions: 620904, exec/sec: 7.339k
[32m INFO[0m [Stats #0] run time: 0h-1m-31s, clients: 1, corpus: 50, objectives: 0, executions: 628355, exec/sec: 7.339k
[32m INFO[0m [Stats #0] run time: 0h-1m-31s, clients: 1, corpus: 50, objectives: 0, executions: 628355, exec/sec: 7.323k
[32m INFO[0m ============= New Corpus Item =============
[32m INFO[0m Reverted? false 
 Txn:
[Sender] 0x8E################################d79dd
   [1] Router.swapExactETHForTokens{value: 4722.3664 ether}(0, path:(WETH  0x00################################6CF5d), address(this), block.timestamp);
   [1] 0x00################################6CF5d.transfer(0x68################################c9024, 549755813888)
       0x01
   [1] Router.swapExactETHForTokens{value: 4151.8133 ether}(0, path:(WETH  0x00################################6CF5d), address(this), block.timestamp);
   [1] 0x00################################6CF5d.transfer(0xe1################################c8510, 604462.9095 ether)
       0x01
   [1] Router.swapExactETHForTokens{value: 295.8268 ether}(0, path:(WETH  0x00################################6CF5d), address(this), block.timestamp);
   [1] 0x00################################6CF5d.transfer(0x35################################31dDb, 549755813888)
       0x01

[32m INFO[0m ==========================================
[32m INFO[0m [Testcase #0] run time: 0h-1m-31s, clients: 1, corpus: 51, objectives: 0, executions: 629854, exec/sec: 7.341k
[32m INFO[0m ============= Coverage Summary =============
[32m INFO[0m 0xbb################################c095c: 11.03% Instruction Covered, 13.16% Branch Covered
[32m INFO[0m 0x00################################6cf5d: 42.28% Instruction Covered, 34.35% Branch Covered
[32m INFO[0m [Stats #0] run time: 0h-1m-32s, clients: 1, corpus: 51, objectives: 0, executions: 635518, exec/sec: 7.337k
[32m INFO[0m [Stats #0] run time: 0h-1m-33s, clients: 1, corpus: 51, objectives: 0, executions: 642818, exec/sec: 7.336k
[32m INFO[0m [Stats #0] run time: 0h-1m-34s, clients: 1, corpus: 51, objectives: 0, executions: 649669, exec/sec: 7.330k
[32m INFO[0m [Stats #0] run time: 0h-1m-35s, clients: 1, corpus: 51, objectives: 0, executions: 657005, exec/sec: 7.330k
[32m INFO[0m [Stats #0] run time: 0h-1m-36s, clients: 1, corpus: 51, objectives: 0, executions: 664078, exec/sec: 7.326k
[32m INFO[0m [Stats #0] run time: 0h-1m-36s, clients: 1, corpus: 51, objectives: 0, executions: 664078, exec/sec: 7.263k
[32m INFO[0m ============= New Corpus Item =============
[32m INFO[0m Reverted? false 
 Txn:
[Sender] 0x8E################################d79dd
   [1] Router.swapExactETHForTokens{value: 4722.3664 ether}(0, path:(WETH  0x00################################6CF5d), address(this), block.timestamp);
   [1] 0x00################################6CF5d.transfer(0x68################################c9024, 549755813888)
       0x01
   [1] Router.swapExactETHForTokens{value: 4151.8133 ether}(0, path:(WETH  0x00################################6CF5d), address(this), block.timestamp);
   [1] 0x00################################6CF5d.transfer(0xe1################################c8510, 604462.9095 ether)
       0x01
   [1] Router.swapExactETHForTokens{value: 295.8268 ether}(0, path:(WETH  0x00################################6CF5d), address(this), block.timestamp);
   [1] 0x00################################6CF5d.transfer(0x35################################31dDb, 549756862465)
       0x01
   [1] Router.swapExactETHForTokens{value: 1320.7691 ether}(0, path:(WETH  0x00################################6CF5d), address(this), block.timestamp);
[Sender] 0xe1################################c8510
   [1] 0x00################################6CF5d.increaseAllowance(0xe1################################c8510, 115791205800303832891553771727217348130562886304170090854553.5773 ether)
       0x01

[32m INFO[0m ==========================================
[32m INFO[0m [Testcase #0] run time: 0h-1m-36s, clients: 1, corpus: 52, objectives: 0, executions: 669860, exec/sec: 7.326k
[32m INFO[0m ============= Coverage Summary =============
[32m INFO[0m 0xbb################################c095c: 11.03% Instruction Covered, 13.16% Branch Covered
[32m INFO[0m 0x00################################6cf5d: 42.28% Instruction Covered, 34.35% Branch Covered
[32m INFO[0m [Stats #0] run time: 0h-1m-37s, clients: 1, corpus: 52, objectives: 0, executions: 671216, exec/sec: 7.324k
[32m INFO[0m [Stats #0] run time: 0h-1m-38s, clients: 1, corpus: 52, objectives: 0, executions: 677769, exec/sec: 7.315k
[32m INFO[0m [Stats #0] run time: 0h-1m-39s, clients: 1, corpus: 52, objectives: 0, executions: 684404, exec/sec: 7.308k
Timeout