[32m INFO[0m fetching abi from https://api.bscscan.com/api?module=contract&action=getabi&address=0x02################################ed6a8&format=json&apikey=6ZUCAR738XJSX6WK3BGN2K8DX4RI9A875M
[32m INFO[0m fetching code from 02352bed82f37fd43b2e49e8788678360a1ed6a8
Contract loaded: 0x02################################ed6a8
[32m INFO[0m 

 ================ EVM Fuzzer Start ===================


[32m INFO[0m Deploying contract: 0x02################################ed6a8
[32m INFO[0m Contract 0x02################################ed6a8 deployed to: 0x02################################ed6a8 -> balacne is 0
[32m INFO[0m Deployed all contracts

[32m INFO[0m fetching pairs for 0x02################################ed6a8
[32m INFO[0m fetching pairs for 0x02################################ed6a8
[32m INFO[0m fetching code from 858c9d117cfb2c175d14dfbf92c7c5d9285097cc
[32m INFO[0m fetching code from bb4cdb9cbd36b01bd1cbaebf2de08d9173bc095c
[32m INFO[0m [Stats #0] run time: 0h-0m-16s, clients: 1, corpus: 0, objectives: 0, executions: 0, exec/sec: 0.000
[32m INFO[0m ============= New Corpus Item =============
[32m INFO[0m Reverted? false 
 Txn:
[Sender] 0x35################################31dDb
   [1] Router.swapExactETHForTokens{value: 3116.4275 ether}(0, path:(WETH  0x02################################ED6A8), address(this), block.timestamp);

[32m INFO[0m ==========================================
[32m INFO[0m [Testcase #0] run time: 0h-0m-16s, clients: 1, corpus: 21, objectives: 0, executions: 1, exec/sec: 0.000
[32m INFO[0m [Stats #0] run time: 0h-0m-16s, clients: 1, corpus: 21, objectives: 0, executions: 1, exec/sec: 0.000
[32m INFO[0m ============= New Corpus Item =============
[32m INFO[0m Reverted? false 
 Txn:
[Sender] 0x35################################31dDb
   [1] Router.swapExactETHForTokens{value: 2}(0, path:(WETH  0x02################################ED6A8), address(this), block.timestamp);

[32m INFO[0m ==========================================
[32m INFO[0m [Testcase #0] run time: 0h-0m-16s, clients: 1, corpus: 22, objectives: 0, executions: 7, exec/sec: 0.000
[32m INFO[0m [Stats #0] run time: 0h-0m-16s, clients: 1, corpus: 22, objectives: 0, executions: 7, exec/sec: 0.000
[32m INFO[0m ============= New Corpus Item =============
[32m INFO[0m Reverted? true 
 Txn:
[Sender] 0x35################################31dDb
   [1] Router.swapExactETHForTokens{value: 20548}(0, path:(WETH  0x02################################ED6A8), address(this), block.timestamp);
   [1] Router.swapExactETHForTokens{value: 0}(0, path:(WETH  0x02################################ED6A8), address(this), block.timestamp);

[32m INFO[0m ==========================================
[32m INFO[0m [Testcase #0] run time: 0h-0m-16s, clients: 1, corpus: 23, objectives: 0, executions: 20, exec/sec: 0.000
[32m INFO[0m ============= Coverage Summary =============
[32m INFO[0m 0xbb################################c095c: 11.03% Instruction Covered, 13.16% Branch Covered
[32m INFO[0m 0x02################################ed6a8: 39.56% Instruction Covered, 36.70% Branch Covered
[32m INFO[0m [Stats #0] run time: 0h-0m-17s, clients: 1, corpus: 23, objectives: 0, executions: 20, exec/sec: 18.69
[32m INFO[0m ============= New Corpus Item =============
[32m INFO[0m Reverted? false 
 Txn:
[Sender] 0x35################################31dDb
   [1] Router.swapExactETHForTokens{value: 20548}(0, path:(WETH  0x02################################ED6A8), address(this), block.timestamp);
[Sender] 0x68################################c9024
   [1] 0x02################################ED6A8.approve(0xe1################################c8510, 104950338763512754968.7761 ether)
       0x01

[32m INFO[0m ==========================================
[32m INFO[0m [Testcase #0] run time: 0h-0m-17s, clients: 1, corpus: 24, objectives: 0, executions: 33, exec/sec: 30.82
[32m INFO[0m [Stats #0] run time: 0h-0m-18s, clients: 1, corpus: 24, objectives: 0, executions: 33, exec/sec: 15.80
[32m INFO[0m ============= New Corpus Item =============
[32m INFO[0m Reverted? false 
 Txn:
[Sender] 0x35################################31dDb
   [1] Router.swapExactETHForTokens{value: 1058.5082 ether}(0, path:(WETH  0x02################################ED6A8), address(this), block.timestamp);
[Sender] 0x68################################c9024
   [1] 0x02################################ED6A8.approve(0x8E################################d79dd, 13343)
       0x01

[32m INFO[0m ==========================================
[32m INFO[0m [Testcase #0] run time: 0h-0m-18s, clients: 1, corpus: 25, objectives: 0, executions: 35, exec/sec: 16.75
[32m INFO[0m [Stats #0] run time: 0h-0m-18s, clients: 1, corpus: 25, objectives: 0, executions: 35, exec/sec: 16.74
[32m INFO[0m ============= New Corpus Item =============
[32m INFO[0m Reverted? true 
 Txn:
[Sender] 0x35################################31dDb
   [1] Router.swapExactETHForTokens{value: 4078.1816 ether}(0, path:(WETH  0x02################################ED6A8), address(this), block.timestamp);
[Sender] 0x68################################c9024
   [1] 0x02################################ED6A8.approve(0x00################################00000, 23541.5158 ether)
       0x08################################0000000000000000000000000000000000020000000000000000000000000000000000000000000000000000000000000002245524332303a20617070726f766520746f20746865207a65726f2061646472657373000000000000000000000000000000000000000000000000000000000000

[32m INFO[0m ==========================================
[32m INFO[0m [Testcase #0] run time: 0h-0m-18s, clients: 1, corpus: 26, objectives: 0, executions: 37, exec/sec: 17.69
[32m INFO[0m [Stats #0] run time: 0h-0m-18s, clients: 1, corpus: 26, objectives: 0, executions: 37, exec/sec: 17.66
[32m INFO[0m ============= New Corpus Item =============
[32m INFO[0m Reverted? true 
 Txn:
[Sender] 0x35################################31dDb
   [1] Router.swapExactETHForTokens{value: 20548}(0, path:(WETH  0x02################################ED6A8), address(this), block.timestamp);
   [1] Router.swapExactETHForTokens{value: 3172.8762 ether}(0, path:(WETH  0x02################################ED6A8), address(this), block.timestamp);
[Sender] 0x68################################c9024
   [1] 0x02################################ED6A8.approve{value: 4428.4429 ether}(0xe1################################c8510, 0)

[32m INFO[0m ==========================================
[32m INFO[0m [Testcase #0] run time: 0h-0m-18s, clients: 1, corpus: 27, objectives: 0, executions: 42, exec/sec: 20.03
[32m INFO[0m ============= Coverage Summary =============
[32m INFO[0m 0xbb################################c095c: 11.03% Instruction Covered, 13.16% Branch Covered
[32m INFO[0m 0x02################################ed6a8: 40.74% Instruction Covered, 37.19% Branch Covered
[32m INFO[0m [Stats #0] run time: 0h-0m-18s, clients: 1, corpus: 27, objectives: 0, executions: 64, exec/sec: 30.35
[32m INFO[0m [Stats #0] run time: 0h-0m-18s, clients: 1, corpus: 27, objectives: 0, executions: 64, exec/sec: 30.35
[32m INFO[0m ============= New Corpus Item =============
[32m INFO[0m Reverted? true 
 Txn:
[Sender] 0x35################################31dDb
   [1] Router.swapExactETHForTokens{value: 20548}(0, path:(WETH  0x02################################ED6A8), address(this), block.timestamp);
[Sender] 0x68################################c9024
   [1] 0x02################################ED6A8.approve(0x35################################31dDb, 17046)
       0x01
   [1] 0x02################################ED6A8.decreaseAllowance{value: 1806.1373 ether}(0xe1################################c8510, 29593690747763536770200911942998446292484964844061988840046.5031 ether)

[32m INFO[0m ==========================================
[32m INFO[0m [Testcase #0] run time: 0h-0m-18s, clients: 1, corpus: 28, objectives: 0, executions: 65, exec/sec: 30.81
[32m INFO[0m [Stats #0] run time: 0h-0m-18s, clients: 1, corpus: 28, objectives: 0, executions: 65, exec/sec: 22.00
[32m INFO[0m ============= New Corpus Item =============
[32m INFO[0m Reverted? false 
 Txn:
[Sender] 0x35################################31dDb
   [1] Router.swapExactETHForTokens{value: 20548}(0, path:(WETH  0x02################################ED6A8), address(this), block.timestamp);
[Sender] 0x68################################c9024
   [1] 0x02################################ED6A8.approve(0x68################################c9024, 0)
       0x01
[Sender] 0x35################################31dDb
   [1] 0x02################################ED6A8.decreaseAllowance(0x35################################31dDb, 0)
       0x01

[32m INFO[0m ==========================================
[32m INFO[0m [Testcase #0] run time: 0h-0m-18s, clients: 1, corpus: 29, objectives: 0, executions: 66, exec/sec: 22.33
[32m INFO[0m [Stats #0] run time: 0h-0m-19s, clients: 1, corpus: 29, objectives: 0, executions: 66, exec/sec: 17.60
[32m INFO[0m ============= New Corpus Item =============
[32m INFO[0m Reverted? true 
 Txn:
[Sender] 0x35################################31dDb
   [1] Router.swapExactETHForTokens{value: 20548}(0, path:(WETH  0x02################################ED6A8), address(this), block.timestamp);
[Sender] 0x68################################c9024
   [1] 0x02################################ED6A8.approve(0x35################################31dDb, 17046)
       0x01
[Sender] 0x35################################31dDb
   [1] 0x02################################ED6A8.decreaseAllowance(0xe1################################c8510, 70252846850102548896985172134380884186660294319205434.8039 ether)
       0x08################################0000000000000000000000000000000000020000000000000000000000000000000000000000000000000000000000000002545524332303a2064656372656173656420616c6c6f77616e63652062656c6f77207a65726f000000000000000000000000000000000000000000000000000000

[32m INFO[0m ==========================================
[32m INFO[0m [Testcase #0] run time: 0h-0m-19s, clients: 1, corpus: 30, objectives: 0, executions: 69, exec/sec: 18.39
[32m INFO[0m ============= Coverage Summary =============
[32m INFO[0m 0xbb################################c095c: 11.03% Instruction Covered, 13.16% Branch Covered
[32m INFO[0m 0x02################################ed6a8: 42.31% Instruction Covered, 38.42% Branch Covered
[32m INFO[0m [Stats #0] run time: 0h-0m-22s, clients: 1, corpus: 30, objectives: 0, executions: 96, exec/sec: 16.07
[32m INFO[0m [Stats #0] run time: 0h-0m-22s, clients: 1, corpus: 30, objectives: 0, executions: 96, exec/sec: 16.07
[32m INFO[0m ============= New Corpus Item =============
[32m INFO[0m Reverted? true 
 Txn:
[Sender] 0x35################################31dDb
   [1] Router.swapExactETHForTokens{value: 10.0 ether}(0, path:(WETH  0x02################################ED6A8), address(this), block.timestamp);
[Sender] 0x68################################c9024
   [1] 0x02################################ED6A8.approve(0x68################################c9024, 226149522545697779762210933160565745655254485979137077240.9299 ether)
       0x01
   [1] 0x02################################ED6A8.approve(0x68################################c9024, 14023460003711068137264539514799998939271563555970261096762.6246 ether)
       0x01
   [1] 0x02################################ED6A8.approve(0x02################################ED6A8, 0)
       0x01
[Sender] 0x35################################31dDb
   [1] 0x02################################ED6A8.deliver(374144419156711147060143317175368.5971 ether)
       0x08################################00000000000000000000000000000000000200000000000000000000000000000000000000000000000000000000000000021536166654d6174683a206d756c7469706c69636174696f6e206f766572666c6f7700000000000000000000000000000000000000000000000000000000000000

[32m INFO[0m ==========================================
[32m INFO[0m [Testcase #0] run time: 0h-0m-22s, clients: 1, corpus: 31, objectives: 0, executions: 97, exec/sec: 16.23
[32m INFO[0m [Stats #0] run time: 0h-0m-22s, clients: 1, corpus: 31, objectives: 0, executions: 97, exec/sec: 16.23
[32m INFO[0m ============= New Corpus Item =============
[32m INFO[0m Reverted? false 
 Txn:
[Sender] 0x35################################31dDb
   [1] Router.swapExactETHForTokens{value: 4722.3664 ether}(0, path:(WETH  0x02################################ED6A8), address(this), block.timestamp);
   [1] 0x02################################ED6A8.deliver(0)

[32m INFO[0m ==========================================
[32m INFO[0m [Testcase #0] run time: 0h-0m-22s, clients: 1, corpus: 32, objectives: 0, executions: 99, exec/sec: 16.56
[32m INFO[0m [Stats #0] run time: 0h-0m-22s, clients: 1, corpus: 32, objectives: 0, executions: 99, exec/sec: 16.56
[32m INFO[0m ============= New Corpus Item =============
[32m INFO[0m Reverted? true 
 Txn:
[Sender] 0x35################################31dDb
   [1] Router.swapExactETHForTokens{value: 10.0 ether}(0, path:(WETH  0x02################################ED6A8), address(this), block.timestamp);
[Sender] 0x68################################c9024
   [1] 0x02################################ED6A8.approve(0x68################################c9024, 226149522545697779762210933160565745655254485979137077240.9299 ether)
       0x01
   [1] 0x02################################ED6A8.approve(0x68################################c9024, 14023460003711068137264539514799998939271563555970261096762.6246 ether)
       0x01
   [1] 0x02################################ED6A8.approve(0x02################################ED6A8, 0)
       0x01
[Sender] 0x8E################################d79dd
   [1] 0x02################################ED6A8.deliver{value: 456.2782 ether}(1.0 ether)

[32m INFO[0m ==========================================
[32m INFO[0m [Testcase #0] run time: 0h-0m-22s, clients: 1, corpus: 33, objectives: 0, executions: 104, exec/sec: 17.39
[32m INFO[0m [Stats #0] run time: 0h-0m-22s, clients: 1, corpus: 33, objectives: 0, executions: 104, exec/sec: 17.38
[32m INFO[0m ============= New Corpus Item =============
[32m INFO[0m Reverted? false 
 Txn:
[Sender] 0x35################################31dDb
   [1] Router.swapExactETHForTokens{value: 3116.4275 ether}(0, path:(WETH  0x02################################ED6A8), address(this), block.timestamp);
   [1] 0x02################################ED6A8.deliver(18758)

[32m INFO[0m ==========================================
[32m INFO[0m [Testcase #0] run time: 0h-0m-22s, clients: 1, corpus: 34, objectives: 0, executions: 114, exec/sec: 19.05
[32m INFO[0m ============= Coverage Summary =============
[32m INFO[0m 0x02################################ed6a8: 42.79% Instruction Covered, 38.92% Branch Covered
[32m INFO[0m 0xbb################################c095c: 11.03% Instruction Covered, 13.16% Branch Covered
[32m INFO[0m [Stats #0] run time: 0h-0m-22s, clients: 1, corpus: 34, objectives: 0, executions: 114, exec/sec: 19.03
[32m INFO[0m ============= New Corpus Item =============
[32m INFO[0m Reverted? true 
 Txn:
[Sender] 0x35################################31dDb
   [1] Router.swapExactETHForTokens{value: 20548}(0, path:(WETH  0x02################################ED6A8), address(this), block.timestamp);
[Sender] 0x68################################c9024
   [1] 0x02################################ED6A8.approve(0x35################################31dDb, 17046)
       0x01
   [1] 0x02################################ED6A8.excludeFromFee(0x02################################ED6A8)
       0x08################################000000000000000000000000000000000002000000000000000000000000000000000000000000000000000000000000000204f776e61626c653a2063616c6c6572206973206e6f7420746865206f776e6572

[32m INFO[0m ==========================================
[32m INFO[0m [Testcase #0] run time: 0h-0m-22s, clients: 1, corpus: 35, objectives: 0, executions: 129, exec/sec: 21.53
[32m INFO[0m [Stats #0] run time: 0h-0m-22s, clients: 1, corpus: 35, objectives: 0, executions: 129, exec/sec: 21.53
[32m INFO[0m ============= New Corpus Item =============
[32m INFO[0m Reverted? true 
 Txn:
[Sender] 0x35################################31dDb
   [1] Router.swapExactETHForTokens{value: 20548}(0, path:(WETH  0x02################################ED6A8), address(this), block.timestamp);
[Sender] 0x68################################c9024
   [1] 0x02################################ED6A8.approve(0x35################################31dDb, 17046)
       0x01
   [1] 0x02################################ED6A8.excludeFromFee{value: 3144.8440 ether}(0xe1################################c8510)

[32m INFO[0m ==========================================
[32m INFO[0m [Testcase #0] run time: 0h-0m-22s, clients: 1, corpus: 36, objectives: 0, executions: 131, exec/sec: 21.86
[32m INFO[0m ============= Coverage Summary =============
[32m INFO[0m 0x02################################ed6a8: 42.83% Instruction Covered, 39.16% Branch Covered
[32m INFO[0m 0xbb################################c095c: 11.03% Instruction Covered, 13.16% Branch Covered
[32m INFO[0m [Stats #0] run time: 0h-0m-22s, clients: 1, corpus: 36, objectives: 0, executions: 131, exec/sec: 21.85
[32m INFO[0m ============= New Corpus Item =============
[32m INFO[0m Reverted? true 
 Txn:
[Sender] 0x35################################31dDb
   [1] Router.swapExactETHForTokens{value: 10.0 ether}(0, path:(WETH  0x02################################ED6A8), address(this), block.timestamp);
[Sender] 0x68################################c9024
   [1] 0x02################################ED6A8.approve(0x68################################c9024, 226149522545697779762210933160565745655254485979137077240.9299 ether)
       0x01
   [1] 0x02################################ED6A8.approve(0x68################################c9024, 14023460003711068137264539514799998939271563555970261096762.6246 ether)
       0x01
   [1] 0x02################################ED6A8.approve(0x02################################ED6A8, 0)
       0x01
[Sender] 0x35################################31dDb
   [1] 0x02################################ED6A8.deliver(51349)
[Sender] 0xe1################################c8510
   [1] 0x02################################ED6A8.excludeFromReward(0xe1################################c8510)
       0x08################################000000000000000000000000000000000002000000000000000000000000000000000000000000000000000000000000000204f776e61626c653a2063616c6c6572206973206e6f7420746865206f776e6572

[32m INFO[0m ==========================================
[32m INFO[0m [Testcase #0] run time: 0h-0m-22s, clients: 1, corpus: 37, objectives: 0, executions: 161, exec/sec: 26.85
[32m INFO[0m [Stats #0] run time: 0h-0m-22s, clients: 1, corpus: 37, objectives: 0, executions: 161, exec/sec: 26.85
[32m INFO[0m ============= New Corpus Item =============
[32m INFO[0m Reverted? true 
 Txn:
[Sender] 0xe1################################c8510
   [1] 0x02################################ED6A8.excludeFromReward{value: 147.5739 ether}(0x68################################c9024)

[32m INFO[0m ==========================================
[32m INFO[0m [Testcase #0] run time: 0h-0m-22s, clients: 1, corpus: 38, objectives: 0, executions: 172, exec/sec: 28.68
[32m INFO[0m ============= Coverage Summary =============
[32m INFO[0m 0x02################################ed6a8: 42.86% Instruction Covered, 39.41% Branch Covered
[32m INFO[0m 0xbb################################c095c: 11.03% Instruction Covered, 13.16% Branch Covered
[32m INFO[0m [Stats #0] run time: 0h-0m-22s, clients: 1, corpus: 38, objectives: 0, executions: 172, exec/sec: 28.67
[32m INFO[0m ============= New Corpus Item =============
[32m INFO[0m Reverted? true 
 Txn:
[Sender] 0x35################################31dDb
   [1] Router.swapExactETHForTokens{value: 20548}(0, path:(WETH  0x02################################ED6A8), address(this), block.timestamp);
   [1] 0x02################################ED6A8.includeInFee{value: 2293.6424 ether}(0x68################################c9024)

[32m INFO[0m ==========================================
[32m INFO[0m [Testcase #0] run time: 0h-0m-22s, clients: 1, corpus: 39, objectives: 0, executions: 193, exec/sec: 32.17
[32m INFO[0m [Stats #0] run time: 0h-0m-22s, clients: 1, corpus: 39, objectives: 0, executions: 193, exec/sec: 32.17
[32m INFO[0m ============= New Corpus Item =============
[32m INFO[0m Reverted? true 
 Txn:
[Sender] 0x35################################31dDb
   [1] Router.swapExactETHForTokens{value: 20548}(0, path:(WETH  0x02################################ED6A8), address(this), block.timestamp);
[Sender] 0x68################################c9024
   [1] 0x02################################ED6A8.approve(0x68################################c9024, 0)
       0x01
[Sender] 0x8E################################d79dd
   [1] 0x02################################ED6A8.includeInFee(0x68################################c9024)
       0x08################################000000000000000000000000000000000002000000000000000000000000000000000000000000000000000000000000000204f776e61626c653a2063616c6c6572206973206e6f7420746865206f776e6572

[32m INFO[0m ==========================================
[32m INFO[0m [Testcase #0] run time: 0h-0m-22s, clients: 1, corpus: 40, objectives: 0, executions: 195, exec/sec: 32.50
[32m INFO[0m ============= Coverage Summary =============
[32m INFO[0m 0x02################################ed6a8: 42.90% Instruction Covered, 39.66% Branch Covered
[32m INFO[0m 0xbb################################c095c: 11.03% Instruction Covered, 13.16% Branch Covered
[32m INFO[0m [Stats #0] run time: 0h-0m-22s, clients: 1, corpus: 40, objectives: 0, executions: 195, exec/sec: 32.48
[32m INFO[0m ============= New Corpus Item =============
[32m INFO[0m Reverted? true 
 Txn:
[Sender] 0x35################################31dDb
   [1] Router.swapExactETHForTokens{value: 3116.4275 ether}(0, path:(WETH  0x02################################ED6A8), address(this), block.timestamp);
   [1] 0x02################################ED6A8.deliver(18758)
   [1] 0x02################################ED6A8.includeInReward(0x8E################################d79dd)
       0x08################################000000000000000000000000000000000002000000000000000000000000000000000000000000000000000000000000000204f776e61626c653a2063616c6c6572206973206e6f7420746865206f776e6572

[32m INFO[0m ==========================================
[32m INFO[0m [Testcase #0] run time: 0h-0m-22s, clients: 1, corpus: 41, objectives: 0, executions: 225, exec/sec: 37.47
[32m INFO[0m [Stats #0] run time: 0h-0m-22s, clients: 1, corpus: 41, objectives: 0, executions: 225, exec/sec: 37.47
[32m INFO[0m ============= New Corpus Item =============
[32m INFO[0m Reverted? true 
 Txn:
[Sender] 0x35################################31dDb
   [1] Router.swapExactETHForTokens{value: 20548}(0, path:(WETH  0x02################################ED6A8), address(this), block.timestamp);
[Sender] 0x8E################################d79dd
   [1] 0x02################################ED6A8.includeInReward{value: 9.4511 ether}(0x00################################00000)

[32m INFO[0m ==========================================
[32m INFO[0m [Testcase #0] run time: 0h-0m-22s, clients: 1, corpus: 42, objectives: 0, executions: 226, exec/sec: 37.64
[32m INFO[0m ============= Coverage Summary =============
[32m INFO[0m 0xbb################################c095c: 11.03% Instruction Covered, 13.16% Branch Covered
[32m INFO[0m 0x02################################ed6a8: 42.93% Instruction Covered, 39.90% Branch Covered
[32m INFO[0m [Stats #0] run time: 0h-0m-22s, clients: 1, corpus: 42, objectives: 0, executions: 226, exec/sec: 37.62
[32m INFO[0m ============= New Corpus Item =============
[32m INFO[0m Reverted? true 
 Txn:
[Sender] 0xe1################################c8510
   [1] 0x02################################ED6A8.increaseAllowance(0x00################################00000, 0)
       0x08################################0000000000000000000000000000000000020000000000000000000000000000000000000000000000000000000000000002245524332303a20617070726f766520746f20746865207a65726f2061646472657373000000000000000000000000000000000000000000000000000000000000

[32m INFO[0m ==========================================
[32m INFO[0m [Testcase #0] run time: 0h-0m-22s, clients: 1, corpus: 43, objectives: 0, executions: 257, exec/sec: 42.77
[32m INFO[0m [Stats #0] run time: 0h-0m-22s, clients: 1, corpus: 43, objectives: 0, executions: 257, exec/sec: 42.77
[32m INFO[0m ============= New Corpus Item =============
[32m INFO[0m Reverted? true 
 Txn:
[Sender] 0x35################################31dDb
   [1] Router.swapExactETHForTokens{value: 3116.4275 ether}(0, path:(WETH  0x02################################ED6A8), address(this), block.timestamp);
   [1] Router.swapExactETHForTokens{value: 10.0 ether}(0, path:(WETH  0x02################################ED6A8), address(this), block.timestamp);
   [1] Router.swapExactETHForTokens{value: 10.0 ether}(0, path:(WETH  0x02################################ED6A8), address(this), block.timestamp);
   [1] Router.swapExactETHForTokens{value: 9.1518 ether}(0, path:(WETH  0x02################################ED6A8), address(this), block.timestamp);
[Sender] 0xe1################################c8510
   [1] 0x02################################ED6A8.increaseAllowance{value: 1352.3081 ether}(0x00################################00000, 63932985642843602519776061088500489668013105582662.6512 ether)

[32m INFO[0m ==========================================
[32m INFO[0m [Testcase #0] run time: 0h-0m-22s, clients: 1, corpus: 44, objectives: 0, executions: 260, exec/sec: 43.27
[32m INFO[0m [Stats #0] run time: 0h-0m-24s, clients: 1, corpus: 44, objectives: 0, executions: 260, exec/sec: 29.19
[32m INFO[0m ============= New Corpus Item =============
[32m INFO[0m Reverted? false 
 Txn:
[Sender] 0x35################################31dDb
   [1] Router.swapExactETHForTokens{value: 20548}(0, path:(WETH  0x02################################ED6A8), address(this), block.timestamp);
[Sender] 0xe1################################c8510
   [1] 0x02################################ED6A8.increaseAllowance(0x68################################c9024, 1736487899438665322454424259692801569838133481615260653.8619 ether)
       0x01

[32m INFO[0m ==========================================
[32m INFO[0m [Testcase #0] run time: 0h-0m-24s, clients: 1, corpus: 45, objectives: 0, executions: 266, exec/sec: 29.86
[32m INFO[0m ============= Coverage Summary =============
[32m INFO[0m 0xbb################################c095c: 11.03% Instruction Covered, 13.16% Branch Covered
[32m INFO[0m 0x02################################ed6a8: 43.29% Instruction Covered, 40.15% Branch Covered
[32m INFO[0m [Stats #0] run time: 0h-0m-25s, clients: 1, corpus: 45, objectives: 0, executions: 288, exec/sec: 29.96
[32m INFO[0m [Stats #0] run time: 0h-0m-25s, clients: 1, corpus: 45, objectives: 0, executions: 288, exec/sec: 29.96
[32m INFO[0m ============= New Corpus Item =============
[32m INFO[0m Reverted? true 
 Txn:
[Sender] 0x35################################31dDb
   [1] Router.swapExactETHForTokens{value: 1058.5082 ether}(0, path:(WETH  0x02################################ED6A8), address(this), block.timestamp);
[Sender] 0x68################################c9024
   [1] 0x02################################ED6A8.approve(0x8E################################d79dd, 13343)
       0x01
[Sender] 0xe1################################c8510
   [1] 0x02################################ED6A8.lock(18998)
       0x08################################000000000000000000000000000000000002000000000000000000000000000000000000000000000000000000000000000204f776e61626c653a2063616c6c6572206973206e6f7420746865206f776e6572

[32m INFO[0m ==========================================
[32m INFO[0m [Testcase #0] run time: 0h-0m-25s, clients: 1, corpus: 46, objectives: 0, executions: 289, exec/sec: 30.06
[32m INFO[0m [Stats #0] run time: 0h-0m-25s, clients: 1, corpus: 46, objectives: 0, executions: 289, exec/sec: 30.06
[32m INFO[0m ============= New Corpus Item =============
[32m INFO[0m Reverted? true 
 Txn:
[Sender] 0x35################################31dDb
   [1] Router.swapExactETHForTokens{value: 20548}(0, path:(WETH  0x02################################ED6A8), address(this), block.timestamp);
   [1] Router.swapExactETHForTokens{value: 10.0 ether}(0, path:(WETH  0x02################################ED6A8), address(this), block.timestamp);
   [1] Router.swapExactETHForTokens{value: 117300739}(0, path:(WETH  0x02################################ED6A8), address(this), block.timestamp);
[Sender] 0x8E################################d79dd
   [1] 0x02################################ED6A8.lock{value: 2723}(17183537728067411872749767728315432114822244173127707429098.4023 ether)

[32m INFO[0m ==========================================
[32m INFO[0m [Testcase #0] run time: 0h-0m-25s, clients: 1, corpus: 47, objectives: 0, executions: 296, exec/sec: 30.79
[32m INFO[0m ============= Coverage Summary =============
[32m INFO[0m 0xbb################################c095c: 11.03% Instruction Covered, 13.16% Branch Covered
[32m INFO[0m 0x02################################ed6a8: 43.32% Instruction Covered, 40.39% Branch Covered
[32m INFO[0m [Stats #0] run time: 0h-0m-25s, clients: 1, corpus: 47, objectives: 0, executions: 296, exec/sec: 30.77
[32m INFO[0m ============= New Corpus Item =============
[32m INFO[0m Reverted? true 
 Txn:
[Sender] 0x35################################31dDb
   [1] Router.swapExactETHForTokens{value: 2}(0, path:(WETH  0x02################################ED6A8), address(this), block.timestamp);
   [1] Router.swapExactETHForTokens{value: 10.0 ether}(0, path:(WETH  0x02################################ED6A8), address(this), block.timestamp);
   [1] 0x02################################ED6A8.renounceOwnership{value: 4628.7883 ether}()

[32m INFO[0m ==========================================
[32m INFO[0m [Testcase #0] run time: 0h-0m-25s, clients: 1, corpus: 48, objectives: 0, executions: 321, exec/sec: 33.37
[32m INFO[0m [Stats #0] run time: 0h-0m-25s, clients: 1, corpus: 48, objectives: 0, executions: 321, exec/sec: 33.37
[32m INFO[0m ============= New Corpus Item =============
[32m INFO[0m Reverted? true 
 Txn:
[Sender] 0x35################################31dDb
   [1] Router.swapExactETHForTokens{value: 10.0 ether}(0, path:(WETH  0x02################################ED6A8), address(this), block.timestamp);
   [1] 0x02################################ED6A8.renounceOwnership()
       0x08################################000000000000000000000000000000000002000000000000000000000000000000000000000000000000000000000000000204f776e61626c653a2063616c6c6572206973206e6f7420746865206f776e6572

[32m INFO[0m ==========================================
[32m INFO[0m [Testcase #0] run time: 0h-0m-25s, clients: 1, corpus: 49, objectives: 0, executions: 322, exec/sec: 33.47
[32m INFO[0m ============= Coverage Summary =============
[32m INFO[0m 0xbb################################c095c: 11.03% Instruction Covered, 13.16% Branch Covered
[32m INFO[0m 0x02################################ed6a8: 43.36% Instruction Covered, 40.64% Branch Covered
[32m INFO[0m [Stats #0] run time: 0h-0m-25s, clients: 1, corpus: 49, objectives: 0, executions: 322, exec/sec: 33.45
[32m INFO[0m ============= New Corpus Item =============
[32m INFO[0m Reverted? true 
 Txn:
[Sender] 0x35################################31dDb
   [1] Router.swapExactETHForTokens{value: 4078.1816 ether}(0, path:(WETH  0x02################################ED6A8), address(this), block.timestamp);
[Sender] 0xe1################################c8510
   [1] 0x02################################ED6A8.setLiquidityFeePercent{value: 2069.5723 ether}(0)

[32m INFO[0m ==========================================
[32m INFO[0m [Testcase #0] run time: 0h-0m-25s, clients: 1, corpus: 50, objectives: 0, executions: 353, exec/sec: 36.67
[32m INFO[0m [Stats #0] run time: 0h-0m-25s, clients: 1, corpus: 50, objectives: 0, executions: 353, exec/sec: 36.67
[32m INFO[0m ============= New Corpus Item =============
[32m INFO[0m Reverted? true 
 Txn:
[Sender] 0xe1################################c8510
   [1] 0x02################################ED6A8.setLiquidityFeePercent(1813498373237611606056710676611079513659867741761502101.5337 ether)
       0x08################################000000000000000000000000000000000002000000000000000000000000000000000000000000000000000000000000000204f776e61626c653a2063616c6c6572206973206e6f7420746865206f776e6572

[32m INFO[0m ==========================================
[32m INFO[0m [Testcase #0] run time: 0h-0m-25s, clients: 1, corpus: 51, objectives: 0, executions: 354, exec/sec: 36.77
[32m INFO[0m ============= Coverage Summary =============
[32m INFO[0m 0xbb################################c095c: 11.03% Instruction Covered, 13.16% Branch Covered
[32m INFO[0m 0x02################################ed6a8: 43.39% Instruction Covered, 40.89% Branch Covered
[32m INFO[0m [Stats #0] run time: 0h-0m-25s, clients: 1, corpus: 51, objectives: 0, executions: 354, exec/sec: 36.76
[32m INFO[0m ============= New Corpus Item =============
[32m INFO[0m Reverted? true 
 Txn:
[Sender] 0x35################################31dDb
   [1] Router.swapExactETHForTokens{value: 1058.5082 ether}(0, path:(WETH  0x02################################ED6A8), address(this), block.timestamp);
[Sender] 0x68################################c9024
   [1] 0x02################################ED6A8.approve(0x8E################################d79dd, 13343)
       0x01
   [1] 0x02################################ED6A8.setMaxTxPercent(104902874338973337515698436028193975228121494343649903983180.8245 ether)
       0x08################################000000000000000000000000000000000002000000000000000000000000000000000000000000000000000000000000000204f776e61626c653a2063616c6c6572206973206e6f7420746865206f776e6572

[32m INFO[0m ==========================================
[32m INFO[0m [Testcase #0] run time: 0h-0m-25s, clients: 1, corpus: 52, objectives: 0, executions: 385, exec/sec: 39.98
[32m INFO[0m ============= Coverage Summary =============
[32m INFO[0m 0x02################################ed6a8: 43.39% Instruction Covered, 40.89% Branch Covered
[32m INFO[0m 0xbb################################c095c: 11.03% Instruction Covered, 13.16% Branch Covered
[32m INFO[0m [Stats #0] run time: 0h-0m-25s, clients: 1, corpus: 52, objectives: 0, executions: 385, exec/sec: 39.96
[32m INFO[0m ============= New Corpus Item =============
[32m INFO[0m Reverted? true 
 Txn:
[Sender] 0x35################################31dDb
   [1] Router.swapExactETHForTokens{value: 20548}(0, path:(WETH  0x02################################ED6A8), address(this), block.timestamp);
[Sender] 0xe1################################c8510
   [1] 0x02################################ED6A8.setSwapAndLiquifyEnabled(true)
       0x08################################000000000000000000000000000000000002000000000000000000000000000000000000000000000000000000000000000204f776e61626c653a2063616c6c6572206973206e6f7420746865206f776e6572

[32m INFO[0m ==========================================
[32m INFO[0m [Testcase #0] run time: 0h-0m-25s, clients: 1, corpus: 53, objectives: 0, executions: 417, exec/sec: 43.28
[32m INFO[0m [Stats #0] run time: 0h-0m-25s, clients: 1, corpus: 53, objectives: 0, executions: 417, exec/sec: 43.28
[32m INFO[0m ============= New Corpus Item =============
[32m INFO[0m Reverted? true 
 Txn:
[Sender] 0x35################################31dDb
   [1] Router.swapExactETHForTokens{value: 10.0 ether}(0, path:(WETH  0x02################################ED6A8), address(this), block.timestamp);
[Sender] 0x68################################c9024
   [1] 0x02################################ED6A8.approve(0x68################################c9024, 226149522545697779762210933160565745655254485979137077240.9299 ether)
       0x01
   [1] 0x02################################ED6A8.approve(0x68################################c9024, 14023460003711068137264539514799998939271563555970261096762.6246 ether)
       0x01
   [1] 0x02################################ED6A8.approve(0x02################################ED6A8, 0)
       0x01
[Sender] 0xe1################################c8510
   [1] 0x02################################ED6A8.setSwapAndLiquifyEnabled{value: 4587.1506 ether}(true)

[32m INFO[0m ==========================================
[32m INFO[0m [Testcase #0] run time: 0h-0m-25s, clients: 1, corpus: 54, objectives: 0, executions: 418, exec/sec: 43.39
[32m INFO[0m ============= Coverage Summary =============
[32m INFO[0m 0x02################################ed6a8: 43.43% Instruction Covered, 41.13% Branch Covered
[32m INFO[0m 0xbb################################c095c: 11.03% Instruction Covered, 13.16% Branch Covered
[32m INFO[0m [Stats #0] run time: 0h-0m-25s, clients: 1, corpus: 54, objectives: 0, executions: 418, exec/sec: 43.37
[32m INFO[0m ============= New Corpus Item =============
[32m INFO[0m Reverted? true 
 Txn:
[Sender] 0x35################################31dDb
   [1] Router.swapExactETHForTokens{value: 20548}(0, path:(WETH  0x02################################ED6A8), address(this), block.timestamp);
[Sender] 0x68################################c9024
   [1] 0x02################################ED6A8.approve(0xe1################################c8510, 95780971281817308448866066055358606.8564 ether)
       0x01
[Sender] 0x35################################31dDb
   [1] 0x02################################ED6A8.setTaxFeePercent(0)
       0x08################################000000000000000000000000000000000002000000000000000000000000000000000000000000000000000000000000000204f776e61626c653a2063616c6c6572206973206e6f7420746865206f776e6572

[32m INFO[0m ==========================================
[32m INFO[0m [Testcase #0] run time: 0h-0m-25s, clients: 1, corpus: 55, objectives: 0, executions: 449, exec/sec: 46.59
[32m INFO[0m [Stats #0] run time: 0h-0m-25s, clients: 1, corpus: 55, objectives: 0, executions: 449, exec/sec: 46.59
[32m INFO[0m ============= New Corpus Item =============
[32m INFO[0m Reverted? true 
 Txn:
[Sender] 0x35################################31dDb
   [1] Router.swapExactETHForTokens{value: 20548}(0, path:(WETH  0x02################################ED6A8), address(this), block.timestamp);
[Sender] 0x68################################c9024
   [1] 0x02################################ED6A8.approve(0x35################################31dDb, 17046)
       0x01
[Sender] 0x35################################31dDb
   [1] 0x02################################ED6A8.setTaxFeePercent{value: 4127.1932 ether}(0)

[32m INFO[0m ==========================================
[32m INFO[0m [Testcase #0] run time: 0h-0m-25s, clients: 1, corpus: 56, objectives: 0, executions: 454, exec/sec: 47.10
[32m INFO[0m ============= Coverage Summary =============
[32m INFO[0m 0xbb################################c095c: 11.03% Instruction Covered, 13.16% Branch Covered
[32m INFO[0m 0x02################################ed6a8: 43.46% Instruction Covered, 41.38% Branch Covered
[32m INFO[0m [Stats #0] run time: 0h-0m-25s, clients: 1, corpus: 56, objectives: 0, executions: 454, exec/sec: 47.09
[32m INFO[0m ============= New Corpus Item =============
[32m INFO[0m Reverted? true 
 Txn:
[Sender] 0x35################################31dDb
   [1] Router.swapExactETHForTokens{value: 3116.4275 ether}(0, path:(WETH  0x02################################ED6A8), address(this), block.timestamp);
[Sender] 0xe1################################c8510
   [1] 0x02################################ED6A8.transfer(0x00################################00000, 0)
       0x08################################0000000000000000000000000000000000020000000000000000000000000000000000000000000000000000000000000002345524332303a207472616e7366657220746f20746865207a65726f20616464726573730000000000000000000000000000000000000000000000000000000000

[32m INFO[0m ==========================================
[32m INFO[0m [Testcase #0] run time: 0h-0m-25s, clients: 1, corpus: 57, objectives: 0, executions: 481, exec/sec: 49.88
[32m INFO[0m [Stats #0] run time: 0h-0m-25s, clients: 1, corpus: 57, objectives: 0, executions: 481, exec/sec: 49.88
[32m INFO[0m ============= New Corpus Item =============
[32m INFO[0m Reverted? true 
 Txn:
[Sender] 0x35################################31dDb
   [1] Router.swapExactETHForTokens{value: 4078.1816 ether}(0, path:(WETH  0x02################################ED6A8), address(this), block.timestamp);
[Sender] 0xe1################################c8510
   [1] 0x02################################ED6A8.transfer{value: 2.3059 ether}(0xe1################################c8510, 0)

[32m INFO[0m ==========================================
[32m INFO[0m [Testcase #0] run time: 0h-0m-25s, clients: 1, corpus: 58, objectives: 0, executions: 483, exec/sec: 50.09
[32m INFO[0m [Stats #0] run time: 0h-0m-25s, clients: 1, corpus: 58, objectives: 0, executions: 483, exec/sec: 50.09
[32m INFO[0m ============= New Corpus Item =============
[32m INFO[0m Reverted? true 
 Txn:
[Sender] 0x35################################31dDb
   [1] Router.swapExactETHForTokens{value: 3116.4275 ether}(0, path:(WETH  0x02################################ED6A8), address(this), block.timestamp);
[Sender] 0xe1################################c8510
   [1] 0x02################################ED6A8.transfer(0x8E################################d79dd, 2923003274661805836407369665432.6523 ether)
       0x08################################000000000000000000000000000000000002000000000000000000000000000000000000000000000000000000000000000285472616e7366657220616d6f756e74206578636565647320746865206d61785478416d6f756e742e000000000000000000000000000000000000000000000000

[32m INFO[0m ==========================================
[32m INFO[0m [Testcase #0] run time: 0h-0m-25s, clients: 1, corpus: 59, objectives: 0, executions: 492, exec/sec: 51.02
[32m INFO[0m [Stats #0] run time: 0h-0m-26s, clients: 1, corpus: 59, objectives: 0, executions: 492, exec/sec: 47.67
[32m INFO[0m ============= New Corpus Item =============
[32m INFO[0m Reverted? true 
 Txn:
[Sender] 0x35################################31dDb
   [1] Router.swapExactETHForTokens{value: 20548}(0, path:(WETH  0x02################################ED6A8), address(this), block.timestamp);
[Sender] 0x8E################################d79dd
   [1] 0x02################################ED6A8.transfer(0x02################################ED6A8, 14259)
       0x08################################0000000000000000000000000000000000020000000000000000000000000000000000000000000000000000000000000001e536166654d6174683a207375627472616374696f6e206f766572666c6f770000

[32m INFO[0m ==========================================
[32m INFO[0m [Testcase #0] run time: 0h-0m-26s, clients: 1, corpus: 60, objectives: 0, executions: 502, exec/sec: 48.64
[32m INFO[0m ============= Coverage Summary =============
[32m INFO[0m 0x02################################ed6a8: 44.45% Instruction Covered, 42.86% Branch Covered
[32m INFO[0m 0xbb################################c095c: 11.03% Instruction Covered, 13.16% Branch Covered
[32m INFO[0m [Stats #0] run time: 0h-0m-26s, clients: 1, corpus: 60, objectives: 0, executions: 502, exec/sec: 48.58
[32m INFO[0m ============= New Corpus Item =============
[32m INFO[0m Reverted? true 
 Txn:
[Sender] 0x35################################31dDb
   [1] Router.swapExactETHForTokens{value: 3116.4275 ether}(0, path:(WETH  0x02################################ED6A8), address(this), block.timestamp);
   [1] Router.swapExactETHForTokens{value: 10.0 ether}(0, path:(WETH  0x02################################ED6A8), address(this), block.timestamp);
   [1] Router.swapExactETHForTokens{value: 10.0 ether}(0, path:(WETH  0x02################################ED6A8), address(this), block.timestamp);
   [1] Router.swapExactETHForTokens{value: 9.1518 ether}(0, path:(WETH  0x02################################ED6A8), address(this), block.timestamp);
[Sender] 0x68################################c9024
   [1] 0x02################################ED6A8.approve(0xe1################################c8510, 10855504785040522281630102340855874280345406158219700784645.7078 ether)
       0x01
[Sender] 0x8E################################d79dd
   [1] 0x02################################ED6A8.transferFrom(0x68################################c9024, 0xe1################################c8510, 2854408273125988001869925314.9994 ether)
       0x08################################000000000000000000000000000000000002000000000000000000000000000000000000000000000000000000000000000285472616e7366657220616d6f756e74206578636565647320746865206d61785478416d6f756e742e000000000000000000000000000000000000000000000000

[32m INFO[0m ==========================================
[32m INFO[0m [Testcase #0] run time: 0h-0m-26s, clients: 1, corpus: 61, objectives: 0, executions: 513, exec/sec: 49.64
[32m INFO[0m [Stats #0] run time: 0h-0m-26s, clients: 1, corpus: 61, objectives: 0, executions: 513, exec/sec: 49.64
[32m INFO[0m ============= New Corpus Item =============
[32m INFO[0m Reverted? true 
 Txn:
[Sender] 0x35################################31dDb
   [1] Router.swapExactETHForTokens{value: 20548}(0, path:(WETH  0x02################################ED6A8), address(this), block.timestamp);
[Sender] 0x68################################c9024
   [1] 0x02################################ED6A8.approve(0x68################################c9024, 0)
       0x01
[Sender] 0x8E################################d79dd
   [1] 0x02################################ED6A8.transferFrom(0x00################################00000, 0x00################################00000, 0)
       0x08################################0000000000000000000000000000000000020000000000000000000000000000000000000000000000000000000000000002545524332303a207472616e736665722066726f6d20746865207a65726f2061646472657373000000000000000000000000000000000000000000000000000000

[32m INFO[0m ==========================================
[32m INFO[0m [Testcase #0] run time: 0h-0m-26s, clients: 1, corpus: 62, objectives: 0, executions: 515, exec/sec: 49.83
[32m INFO[0m [Stats #0] run time: 0h-0m-26s, clients: 1, corpus: 62, objectives: 0, executions: 515, exec/sec: 49.83
[32m INFO[0m ============= New Corpus Item =============
[32m INFO[0m Reverted? true 
 Txn:
[Sender] 0x8E################################d79dd
   [1] 0x02################################ED6A8.transferFrom{value: 1099528424682}(0x8E################################d79dd, 0x00################################00000, 120861441320619733520502486433022223166668180023958651.5296 ether)

[32m INFO[0m ==========================================
[32m INFO[0m [Testcase #0] run time: 0h-0m-26s, clients: 1, corpus: 63, objectives: 0, executions: 522, exec/sec: 50.50
[32m INFO[0m ============= Coverage Summary =============
[32m INFO[0m 0xbb################################c095c: 11.03% Instruction Covered, 13.16% Branch Covered
[32m INFO[0m 0x02################################ed6a8: 44.49% Instruction Covered, 43.10% Branch Covered
[32m INFO[0m [Stats #0] run time: 0h-0m-26s, clients: 1, corpus: 63, objectives: 0, executions: 522, exec/sec: 50.48
[32m INFO[0m ============= New Corpus Item =============
[32m INFO[0m Reverted? true 
 Txn:
[Sender] 0x35################################31dDb
   [1] Router.swapExactETHForTokens{value: 10.0 ether}(0, path:(WETH  0x02################################ED6A8), address(this), block.timestamp);
[Sender] 0x68################################c9024
   [1] 0x02################################ED6A8.approve(0x68################################c9024, 226149522545697779762210933160565745655254485979137077240.9299 ether)
       0x01
   [1] 0x02################################ED6A8.approve(0x68################################c9024, 14023460003711068137264539514799998939271563555970261096762.6246 ether)
       0x01
   [1] 0x02################################ED6A8.approve(0x02################################ED6A8, 0)
       0x01
   [1] 0x02################################ED6A8.transferOwnership(0x02################################ED6A8)
       0x08################################000000000000000000000000000000000002000000000000000000000000000000000000000000000000000000000000000204f776e61626c653a2063616c6c6572206973206e6f7420746865206f776e6572

[32m INFO[0m ==========================================
[32m INFO[0m [Testcase #0] run time: 0h-0m-26s, clients: 1, corpus: 64, objectives: 0, executions: 545, exec/sec: 52.70
[32m INFO[0m [Stats #0] run time: 0h-0m-26s, clients: 1, corpus: 64, objectives: 0, executions: 545, exec/sec: 52.70
[32m INFO[0m ============= New Corpus Item =============
[32m INFO[0m Reverted? true 
 Txn:
[Sender] 0x35################################31dDb
   [1] Router.swapExactETHForTokens{value: 10.0 ether}(0, path:(WETH  0x02################################ED6A8), address(this), block.timestamp);
[Sender] 0x68################################c9024
   [1] 0x02################################ED6A8.approve(0x68################################c9024, 226149522545697779762210933160565745655254485979137077240.9299 ether)
       0x01
   [1] 0x02################################ED6A8.transferOwnership{value: 3306.1680 ether}(0x00################################00000)

[32m INFO[0m ==========================================
[32m INFO[0m [Testcase #0] run time: 0h-0m-26s, clients: 1, corpus: 65, objectives: 0, executions: 546, exec/sec: 52.79
[32m INFO[0m ============= Coverage Summary =============
[32m INFO[0m 0xbb################################c095c: 11.03% Instruction Covered, 13.16% Branch Covered
[32m INFO[0m 0x02################################ed6a8: 44.52% Instruction Covered, 43.35% Branch Covered
[32m INFO[0m [Stats #0] run time: 0h-0m-26s, clients: 1, corpus: 65, objectives: 0, executions: 546, exec/sec: 52.77
[32m INFO[0m ============= New Corpus Item =============
[32m INFO[0m Reverted? true 
 Txn:
[Sender] 0x35################################31dDb
   [1] Router.swapExactETHForTokens{value: 20548}(0, path:(WETH  0x02################################ED6A8), address(this), block.timestamp);
   [1] Router.swapExactETHForTokens{value: 10.0 ether}(0, path:(WETH  0x02################################ED6A8), address(this), block.timestamp);
   [1] Router.swapExactETHForTokens{value: 117300739}(0, path:(WETH  0x02################################ED6A8), address(this), block.timestamp);
   [1] 0x02################################ED6A8.deliver(3)
[Sender] 0x8E################################d79dd
   [1] 0x02################################ED6A8.unlock()
       0x08################################00000000000000000000000000000000000200000000000000000000000000000000000000000000000000000000000000023596f7520646f6e27742068617665207065726d697373696f6e20746f20756e6c6f636b0000000000000000000000000000000000000000000000000000000000

[32m INFO[0m ==========================================
[32m INFO[0m [Testcase #0] run time: 0h-0m-26s, clients: 1, corpus: 66, objectives: 0, executions: 577, exec/sec: 55.76
[32m INFO[0m [Stats #0] run time: 0h-0m-26s, clients: 1, corpus: 66, objectives: 0, executions: 577, exec/sec: 55.76
[32m INFO[0m ============= New Corpus Item =============
[32m INFO[0m Reverted? true 
 Txn:
[Sender] 0x8E################################d79dd
   [1] 0x02################################ED6A8.unlock{value: 100663045}()

[32m INFO[0m ==========================================
[32m INFO[0m [Testcase #0] run time: 0h-0m-26s, clients: 1, corpus: 67, objectives: 0, executions: 578, exec/sec: 55.86
[32m INFO[0m ============= Coverage Summary =============
[32m INFO[0m 0xbb################################c095c: 11.03% Instruction Covered, 13.16% Branch Covered
[32m INFO[0m 0x02################################ed6a8: 44.56% Instruction Covered, 43.60% Branch Covered
[32m INFO[0m [Stats #0] run time: 0h-0m-26s, clients: 1, corpus: 67, objectives: 0, executions: 578, exec/sec: 55.84
[32m INFO[0m ============= New Corpus Item =============
[32m INFO[0m Reverted? false 
 Txn:
[Sender] 0x35################################31dDb
   [1] 0x02################################ED6A8.call{value: 4574.7936 ether}()

[32m INFO[0m ==========================================
[32m INFO[0m [Testcase #0] run time: 0h-0m-26s, clients: 1, corpus: 68, objectives: 0, executions: 609, exec/sec: 58.84
[32m INFO[0m ============= Coverage Summary =============
[32m INFO[0m 0xbb################################c095c: 11.03% Instruction Covered, 13.16% Branch Covered
[32m INFO[0m 0x02################################ed6a8: 44.56% Instruction Covered, 43.60% Branch Covered
[32m INFO[0m [Stats #0] run time: 0h-0m-26s, clients: 1, corpus: 68, objectives: 0, executions: 928, exec/sec: 85.92
[32m INFO[0m [Stats #0] run time: 0h-0m-26s, clients: 1, corpus: 68, objectives: 0, executions: 928, exec/sec: 85.87
[32m INFO[0m ============= New Corpus Item =============
[32m INFO[0m Reverted? false 
 Txn:
[Sender] 0x35################################31dDb
   [1] Router.swapExactETHForTokens{value: 2361.1111 ether}(0, path:(WETH  0x02################################ED6A8), address(this), block.timestamp);
   [1] 0x02################################ED6A8.deliver(100663045)

[32m INFO[0m ==========================================
[32m INFO[0m [Testcase #0] run time: 0h-0m-26s, clients: 1, corpus: 69, objectives: 0, executions: 975, exec/sec: 90.21
[32m INFO[0m ============= Coverage Summary =============
[32m INFO[0m 0xbb################################c095c: 11.03% Instruction Covered, 13.16% Branch Covered
[32m INFO[0m 0x02################################ed6a8: 44.56% Instruction Covered, 43.60% Branch Covered
[32m INFO[0m [Stats #0] run time: 0h-0m-28s, clients: 1, corpus: 69, objectives: 0, executions: 1887, exec/sec: 147.7
[32m INFO[0m [Stats #0] run time: 0h-0m-30s, clients: 1, corpus: 69, objectives: 0, executions: 2494, exec/sec: 167.4
[32m INFO[0m [Stats #0] run time: 0h-0m-33s, clients: 1, corpus: 69, objectives: 0, executions: 3645, exec/sec: 214.9
[32m INFO[0m [Stats #0] run time: 0h-0m-33s, clients: 1, corpus: 69, objectives: 0, executions: 3645, exec/sec: 208.3
[32m INFO[0m ============= New Corpus Item =============
[32m INFO[0m Reverted? true 
 Txn:
[Sender] 0x8E################################d79dd
   [1] 0x02################################ED6A8.transferFrom(0x02################################ED6A8, 0xe1################################c8510, 3848)
       0x08################################0000000000000000000000000000000000020000000000000000000000000000000000000000000000000000000000000002845524332303a207472616e7366657220616d6f756e74206578636565647320616c6c6f77616e6365000000000000000000000000000000000000000000000000

[32m INFO[0m ==========================================
[32m INFO[0m [Testcase #0] run time: 0h-0m-33s, clients: 1, corpus: 70, objectives: 0, executions: 4188, exec/sec: 239.3
[32m INFO[0m ============= Coverage Summary =============
[32m INFO[0m 0xbb################################c095c: 11.03% Instruction Covered, 13.16% Branch Covered
[32m INFO[0m 0x02################################ed6a8: 45.58% Instruction Covered, 44.09% Branch Covered
[32m INFO[0m [Stats #0] run time: 0h-0m-34s, clients: 1, corpus: 70, objectives: 0, executions: 6872, exec/sec: 382.5
[32m INFO[0m [Stats #0] run time: 0h-0m-35s, clients: 1, corpus: 70, objectives: 0, executions: 16362, exec/sec: 862.6
[32m INFO[0m [Stats #0] run time: 0h-0m-36s, clients: 1, corpus: 70, objectives: 0, executions: 26014, exec/sec: 1.302k
[32m INFO[0m [Stats #0] run time: 0h-0m-37s, clients: 1, corpus: 70, objectives: 0, executions: 36555, exec/sec: 1.742k
[32m INFO[0m [Stats #0] run time: 0h-0m-38s, clients: 1, corpus: 70, objectives: 0, executions: 47485, exec/sec: 2.159k
[32m INFO[0m [Stats #0] run time: 0h-0m-39s, clients: 1, corpus: 70, objectives: 0, executions: 57872, exec/sec: 2.517k
[32m INFO[0m [Stats #0] run time: 0h-0m-40s, clients: 1, corpus: 70, objectives: 0, executions: 68097, exec/sec: 2.838k
[32m INFO[0m [Stats #0] run time: 0h-0m-41s, clients: 1, corpus: 70, objectives: 0, executions: 78962, exec/sec: 3.158k
[32m INFO[0m [Stats #0] run time: 0h-0m-42s, clients: 1, corpus: 70, objectives: 0, executions: 89894, exec/sec: 3.457k
[32m INFO[0m [Stats #0] run time: 0h-0m-43s, clients: 1, corpus: 70, objectives: 0, executions: 100562, exec/sec: 3.723k
[32m INFO[0m [Stats #0] run time: 0h-0m-44s, clients: 1, corpus: 70, objectives: 0, executions: 110663, exec/sec: 3.951k
[32m INFO[0m [Stats #0] run time: 0h-0m-44s, clients: 1, corpus: 70, objectives: 0, executions: 110663, exec/sec: 3.908k
[32m INFO[0m ============= New Corpus Item =============
[32m INFO[0m Reverted? false 
 Txn:
[Sender] 0x35################################31dDb
   [1] Router.swapExactETHForTokens{value: 2}(0, path:(WETH  0x02################################ED6A8), address(this), block.timestamp);
   [1] 0x02################################ED6A8.deliver(0)

[32m INFO[0m ==========================================
[32m INFO[0m [Testcase #0] run time: 0h-0m-44s, clients: 1, corpus: 71, objectives: 0, executions: 114174, exec/sec: 4.032k
[32m INFO[0m ============= Coverage Summary =============
[32m INFO[0m 0xbb################################c095c: 11.03% Instruction Covered, 13.16% Branch Covered
[32m INFO[0m 0x02################################ed6a8: 45.58% Instruction Covered, 44.09% Branch Covered
[32m INFO[0m [Stats #0] run time: 0h-0m-45s, clients: 1, corpus: 71, objectives: 0, executions: 121530, exec/sec: 4.188k
[32m INFO[0m [Stats #0] run time: 0h-0m-46s, clients: 1, corpus: 71, objectives: 0, executions: 132207, exec/sec: 4.404k
[32m INFO[0m [Stats #0] run time: 0h-0m-46s, clients: 1, corpus: 71, objectives: 0, executions: 132207, exec/sec: 4.397k
[32m INFO[0m ============= New Corpus Item =============
[32m INFO[0m Reverted? false 
 Txn:
[Sender] 0x35################################31dDb
   [1] Router.swapExactETHForTokens{value: 2361.1823 ether}(0, path:(WETH  0x02################################ED6A8), address(this), block.timestamp);
   [1] Router.swapExactETHForTokens{value: 9.2006 ether}(0, path:(WETH  0x02################################ED6A8), address(this), block.timestamp);
   [1] Router.swapExactETHForTokens{value: 10.0 ether}(0, path:(WETH  0x02################################ED6A8), address(this), block.timestamp);
   [1] Router.swapExactETHForTokens{value: 10.0 ether}(0, path:(WETH  0x02################################ED6A8), address(this), block.timestamp);
   [1] Router.swapExactETHForTokens{value: 4722.3664 ether}(0, path:(WETH  0x02################################ED6A8), address(this), block.timestamp);
   [1] 0x02################################ED6A8.transfer(0x35################################31dDb, 18902)
       0x01

[32m INFO[0m ==========================================
[32m INFO[0m [Testcase #0] run time: 0h-0m-46s, clients: 1, corpus: 72, objectives: 0, executions: 132699, exec/sec: 4.414k
[32m INFO[0m ============= Coverage Summary =============
[32m INFO[0m 0xbb################################c095c: 11.03% Instruction Covered, 13.16% Branch Covered
[32m INFO[0m 0x02################################ed6a8: 45.58% Instruction Covered, 44.09% Branch Covered
[32m INFO[0m [Stats #0] run time: 0h-0m-46s, clients: 1, corpus: 72, objectives: 0, executions: 132699, exec/sec: 4.388k
[32m INFO[0m ============= New Corpus Item =============
[32m INFO[0m Reverted? false 
 Txn:
[Sender] 0x35################################31dDb
   [1] Router.swapExactETHForTokens{value: 2361.1823 ether}(0, path:(WETH  0x02################################ED6A8), address(this), block.timestamp);
   [1] Router.swapExactETHForTokens{value: 9.2006 ether}(0, path:(WETH  0x02################################ED6A8), address(this), block.timestamp);
   [1] Router.swapExactETHForTokens{value: 10.0 ether}(0, path:(WETH  0x02################################ED6A8), address(this), block.timestamp);
   [1] Router.swapExactETHForTokens{value: 10.0 ether}(0, path:(WETH  0x02################################ED6A8), address(this), block.timestamp);
   [1] Router.swapExactETHForTokens{value: 4722.3664 ether}(0, path:(WETH  0x02################################ED6A8), address(this), block.timestamp);
   [1] 0x02################################ED6A8.transfer(0xe1################################c8510, 18902)
       0x01

[32m INFO[0m ==========================================
[32m INFO[0m [Testcase #0] run time: 0h-0m-46s, clients: 1, corpus: 73, objectives: 0, executions: 134480, exec/sec: 4.447k
[32m INFO[0m ============= Coverage Summary =============
[32m INFO[0m 0x02################################ed6a8: 45.58% Instruction Covered, 44.09% Branch Covered
[32m INFO[0m 0xbb################################c095c: 11.03% Instruction Covered, 13.16% Branch Covered
[32m INFO[0m [Stats #0] run time: 0h-0m-47s, clients: 1, corpus: 73, objectives: 0, executions: 141640, exec/sec: 4.565k
[32m INFO[0m [Stats #0] run time: 0h-0m-48s, clients: 1, corpus: 73, objectives: 0, executions: 151542, exec/sec: 4.730k
[32m INFO[0m [Stats #0] run time: 0h-0m-49s, clients: 1, corpus: 73, objectives: 0, executions: 161005, exec/sec: 4.872k
[32m INFO[0m [Stats #0] run time: 0h-0m-50s, clients: 1, corpus: 73, objectives: 0, executions: 170974, exec/sec: 5.020k
[32m INFO[0m [Stats #0] run time: 0h-0m-50s, clients: 1, corpus: 73, objectives: 0, executions: 170974, exec/sec: 4.977k
[32m INFO[0m ============= New Corpus Item =============
[32m INFO[0m Reverted? false 
 Txn:
[Sender] 0x35################################31dDb
   [1] Router.swapExactETHForTokens{value: 4722.3664 ether}(0, path:(WETH  0x02################################ED6A8), address(this), block.timestamp);
   [1] 0x02################################ED6A8.transfer(0x68################################c9024, 866060983114)
       0x01
   [1] Router.swapExactETHForTokens{value: 4294967295}(0, path:(WETH  0x02################################ED6A8), address(this), block.timestamp);
   [1] 0x02################################ED6A8.transfer(0xe1################################c8510, 18902)
       0x01

[32m INFO[0m ==========================================
[32m INFO[0m [Testcase #0] run time: 0h-0m-50s, clients: 1, corpus: 74, objectives: 0, executions: 174190, exec/sec: 5.071k
[32m INFO[0m ============= Coverage Summary =============
[32m INFO[0m 0x02################################ed6a8: 45.58% Instruction Covered, 44.09% Branch Covered
[32m INFO[0m 0xbb################################c095c: 11.03% Instruction Covered, 13.16% Branch Covered
[32m INFO[0m [Stats #0] run time: 0h-0m-51s, clients: 1, corpus: 74, objectives: 0, executions: 180304, exec/sec: 5.143k
[32m INFO[0m [Stats #0] run time: 0h-0m-52s, clients: 1, corpus: 74, objectives: 0, executions: 189446, exec/sec: 5.254k
[32m INFO[0m [Stats #0] run time: 0h-0m-53s, clients: 1, corpus: 74, objectives: 0, executions: 198809, exec/sec: 5.364k
[32m INFO[0m [Stats #0] run time: 0h-0m-54s, clients: 1, corpus: 74, objectives: 0, executions: 208076, exec/sec: 5.465k
[32m INFO[0m [Stats #0] run time: 0h-0m-55s, clients: 1, corpus: 74, objectives: 0, executions: 217467, exec/sec: 5.565k
[32m INFO[0m [Stats #0] run time: 0h-0m-56s, clients: 1, corpus: 74, objectives: 0, executions: 226891, exec/sec: 5.661k
[32m INFO[0m [Stats #0] run time: 0h-0m-57s, clients: 1, corpus: 74, objectives: 0, executions: 236343, exec/sec: 5.753k
[32m INFO[0m [Stats #0] run time: 0h-0m-58s, clients: 1, corpus: 74, objectives: 0, executions: 245453, exec/sec: 5.832k
[32m INFO[0m [Stats #0] run time: 0h-0m-59s, clients: 1, corpus: 74, objectives: 0, executions: 254659, exec/sec: 5.910k
[32m INFO[0m [Stats #0] run time: 0h-1m-0s, clients: 1, corpus: 74, objectives: 0, executions: 264121, exec/sec: 5.990k
[32m INFO[0m [Stats #0] run time: 0h-1m-1s, clients: 1, corpus: 74, objectives: 0, executions: 273550, exec/sec: 6.064k
[32m INFO[0m [Stats #0] run time: 0h-1m-2s, clients: 1, corpus: 74, objectives: 0, executions: 283009, exec/sec: 6.137k
[32m INFO[0m [Stats #0] run time: 0h-1m-3s, clients: 1, corpus: 74, objectives: 0, executions: 292440, exec/sec: 6.206k
[32m INFO[0m [Stats #0] run time: 0h-1m-4s, clients: 1, corpus: 74, objectives: 0, executions: 301867, exec/sec: 6.272k
[32m INFO[0m [Stats #0] run time: 0h-1m-5s, clients: 1, corpus: 74, objectives: 0, executions: 311326, exec/sec: 6.335k
[32m INFO[0m [Stats #0] run time: 0h-1m-6s, clients: 1, corpus: 74, objectives: 0, executions: 320657, exec/sec: 6.395k
[32m INFO[0m [Stats #0] run time: 0h-1m-7s, clients: 1, corpus: 74, objectives: 0, executions: 329701, exec/sec: 6.447k
[32m INFO[0m [Stats #0] run time: 0h-1m-8s, clients: 1, corpus: 74, objectives: 0, executions: 338846, exec/sec: 6.498k
[32m INFO[0m [Stats #0] run time: 0h-1m-9s, clients: 1, corpus: 74, objectives: 0, executions: 347859, exec/sec: 6.545k
[32m INFO[0m [Stats #0] run time: 0h-1m-10s, clients: 1, corpus: 74, objectives: 0, executions: 357126, exec/sec: 6.595k
[32m INFO[0m [Stats #0] run time: 0h-1m-11s, clients: 1, corpus: 74, objectives: 0, executions: 366559, exec/sec: 6.646k
[32m INFO[0m [Stats #0] run time: 0h-1m-12s, clients: 1, corpus: 74, objectives: 0, executions: 375988, exec/sec: 6.695k
[32m INFO[0m [Stats #0] run time: 0h-1m-13s, clients: 1, corpus: 74, objectives: 0, executions: 385415, exec/sec: 6.741k
[32m INFO[0m [Stats #0] run time: 0h-1m-14s, clients: 1, corpus: 74, objectives: 0, executions: 394839, exec/sec: 6.787k
[32m INFO[0m [Stats #0] run time: 0h-1m-15s, clients: 1, corpus: 74, objectives: 0, executions: 404296, exec/sec: 6.832k
[32m INFO[0m [Stats #0] run time: 0h-1m-16s, clients: 1, corpus: 74, objectives: 0, executions: 413754, exec/sec: 6.874k
[32m INFO[0m [Stats #0] run time: 0h-1m-17s, clients: 1, corpus: 74, objectives: 0, executions: 423182, exec/sec: 6.915k
[32m INFO[0m [Stats #0] run time: 0h-1m-18s, clients: 1, corpus: 74, objectives: 0, executions: 432070, exec/sec: 6.947k
[32m INFO[0m [Stats #0] run time: 0h-1m-19s, clients: 1, corpus: 74, objectives: 0, executions: 441496, exec/sec: 6.986k
[32m INFO[0m [Stats #0] run time: 0h-1m-20s, clients: 1, corpus: 74, objectives: 0, executions: 450919, exec/sec: 7.022k
[32m INFO[0m [Stats #0] run time: 0h-1m-21s, clients: 1, corpus: 74, objectives: 0, executions: 460381, exec/sec: 7.059k
[32m INFO[0m [Stats #0] run time: 0h-1m-22s, clients: 1, corpus: 74, objectives: 0, executions: 469748, exec/sec: 7.094k
[32m INFO[0m [Stats #0] run time: 0h-1m-23s, clients: 1, corpus: 74, objectives: 0, executions: 478413, exec/sec: 7.117k
[32m INFO[0m [Stats #0] run time: 0h-1m-24s, clients: 1, corpus: 74, objectives: 0, executions: 487807, exec/sec: 7.150k
[32m INFO[0m [Stats #0] run time: 0h-1m-25s, clients: 1, corpus: 74, objectives: 0, executions: 496882, exec/sec: 7.178k
[32m INFO[0m [Stats #0] run time: 0h-1m-26s, clients: 1, corpus: 74, objectives: 0, executions: 506122, exec/sec: 7.206k
[32m INFO[0m [Stats #0] run time: 0h-1m-27s, clients: 1, corpus: 74, objectives: 0, executions: 515547, exec/sec: 7.237k
[32m INFO[0m [Stats #0] run time: 0h-1m-28s, clients: 1, corpus: 74, objectives: 0, executions: 524971, exec/sec: 7.267k
[32m INFO[0m [Stats #0] run time: 0h-1m-29s, clients: 1, corpus: 74, objectives: 0, executions: 534404, exec/sec: 7.295k
[32m INFO[0m [Stats #0] run time: 0h-1m-30s, clients: 1, corpus: 74, objectives: 0, executions: 543796, exec/sec: 7.323k
[32m INFO[0m [Stats #0] run time: 0h-1m-30s, clients: 1, corpus: 74, objectives: 0, executions: 543796, exec/sec: 7.306k
[32m INFO[0m ============= New Corpus Item =============
[32m INFO[0m Reverted? false 
 Txn:
[Sender] 0x35################################31dDb
   [1] Router.swapExactETHForTokens{value: 4722.3664 ether}(0, path:(WETH  0x02################################ED6A8), address(this), block.timestamp);
   [1] 0x02################################ED6A8.transfer(0x68################################c9024, 17105)
       0x01
   [1] 0x02################################ED6A8.transfer(0x8E################################d79dd, 18902)
       0x01
   [1] 0x02################################ED6A8.deliver(0)

[32m INFO[0m ==========================================
[32m INFO[0m [Testcase #0] run time: 0h-1m-30s, clients: 1, corpus: 75, objectives: 0, executions: 545412, exec/sec: 7.328k
[32m INFO[0m ============= Coverage Summary =============
[32m INFO[0m 0x02################################ed6a8: 45.58% Instruction Covered, 44.09% Branch Covered
[32m INFO[0m 0xbb################################c095c: 11.03% Instruction Covered, 13.16% Branch Covered
[32m INFO[0m [Stats #0] run time: 0h-1m-31s, clients: 1, corpus: 75, objectives: 0, executions: 545412, exec/sec: 7.275k
[32m INFO[0m ============= New Corpus Item =============
[32m INFO[0m Reverted? false 
 Txn:
[Sender] 0x35################################31dDb
   [1] Router.swapExactETHForTokens{value: 4722.3664 ether}(0, path:(WETH  0x02################################ED6A8), address(this), block.timestamp);
   [1] 0x02################################ED6A8.transfer(0x68################################c9024, 17105)
       0x01
   [1] 0x02################################ED6A8.transfer(0x8E################################d79dd, 18902)
       0x01
   [1] Router.swapExactETHForTokens{value: 10.0 ether}(0, path:(WETH  0x02################################ED6A8), address(this), block.timestamp);
   [1] 0x02################################ED6A8.transfer(0xe1################################c8510, 18902)
       0x01

[32m INFO[0m ==========================================
[32m INFO[0m [Testcase #0] run time: 0h-1m-31s, clients: 1, corpus: 76, objectives: 0, executions: 550270, exec/sec: 7.340k
[32m INFO[0m ============= Coverage Summary =============
[32m INFO[0m 0x02################################ed6a8: 45.58% Instruction Covered, 44.09% Branch Covered
[32m INFO[0m 0xbb################################c095c: 11.03% Instruction Covered, 13.16% Branch Covered
[32m INFO[0m [Stats #0] run time: 0h-1m-31s, clients: 1, corpus: 76, objectives: 0, executions: 552747, exec/sec: 7.343k
[32m INFO[0m [Stats #0] run time: 0h-1m-32s, clients: 1, corpus: 76, objectives: 0, executions: 561088, exec/sec: 7.356k
[32m INFO[0m [Stats #0] run time: 0h-1m-33s, clients: 1, corpus: 76, objectives: 0, executions: 570101, exec/sec: 7.377k
[32m INFO[0m [Stats #0] run time: 0h-1m-34s, clients: 1, corpus: 76, objectives: 0, executions: 579273, exec/sec: 7.400k
[32m INFO[0m [Stats #0] run time: 0h-1m-35s, clients: 1, corpus: 76, objectives: 0, executions: 587550, exec/sec: 7.410k
[32m INFO[0m [Stats #0] run time: 0h-1m-36s, clients: 1, corpus: 76, objectives: 0, executions: 596501, exec/sec: 7.429k
[32m INFO[0m [Stats #0] run time: 0h-1m-37s, clients: 1, corpus: 76, objectives: 0, executions: 605101, exec/sec: 7.443k
[32m INFO[0m [Stats #0] run time: 0h-1m-38s, clients: 1, corpus: 76, objectives: 0, executions: 614186, exec/sec: 7.463k
Timeout