[32m INFO[0m fetching abi from https://api.bscscan.com/api?module=contract&action=getabi&address=0x12################################666a4&format=json&apikey=6ZUCAR738XJSX6WK3BGN2K8DX4RI9A875M
[32m INFO[0m fetching code from 1201d52dd565fd3d18bc7c9bb6518c2f5ae666a4
Contract loaded: 0x12################################666a4
[32m INFO[0m 

 ================ EVM Fuzzer Start ===================


[32m INFO[0m Deploying contract: 0x12################################666a4
[32m INFO[0m Contract 0x12################################666a4 deployed to: 0x12################################666a4 -> balacne is 0
[32m INFO[0m Deployed all contracts

[32m INFO[0m fetching pairs for 0x12################################666a4
[32m INFO[0m fetching pairs for 0x12################################666a4
[32m INFO[0m fetching code from 702f8891e7e8c0a270797e30608df6389c3eb095
[32m INFO[0m fetching code from bb4cdb9cbd36b01bd1cbaebf2de08d9173bc095c
[32m INFO[0m [Stats #0] run time: 0h-0m-19s, clients: 1, corpus: 0, objectives: 0, executions: 0, exec/sec: 0.000
[32m INFO[0m ============= New Corpus Item =============
[32m INFO[0m Reverted? false 
 Txn:
[Sender] 0x8E################################d79dd
   [1] Router.swapExactETHForTokens{value: 3116.4275 ether}(0, path:(WETH  0x12################################666A4), address(this), block.timestamp);

[32m INFO[0m ==========================================
[32m INFO[0m [Testcase #0] run time: 0h-0m-19s, clients: 1, corpus: 21, objectives: 0, executions: 1, exec/sec: 0.000
[32m INFO[0m [Stats #0] run time: 0h-0m-19s, clients: 1, corpus: 21, objectives: 0, executions: 1, exec/sec: 0.000
[32m INFO[0m ============= New Corpus Item =============
[32m INFO[0m Reverted? true 
 Txn:
[Sender] 0x8E################################d79dd
   [1] Router.swapExactETHForTokens{value: 3116.4275 ether}(0, path:(WETH  0x12################################666A4), address(this), block.timestamp);
   [1] Router.swapExactETHForTokens{value: 3916.9970 ether}(0, path:(WETH  0x12################################666A4), address(this), block.timestamp);

[32m INFO[0m ==========================================
[32m INFO[0m [Testcase #0] run time: 0h-0m-19s, clients: 1, corpus: 22, objectives: 0, executions: 2, exec/sec: 0.000
[32m INFO[0m ============= Coverage Summary =============
[32m INFO[0m 0xbb################################c095c: 11.03% Instruction Covered, 13.16% Branch Covered
[32m INFO[0m 0x12################################666a4: 39.56% Instruction Covered, 36.70% Branch Covered
[32m INFO[0m [Stats #0] run time: 0h-0m-20s, clients: 1, corpus: 22, objectives: 0, executions: 2, exec/sec: 1.833
[32m INFO[0m ============= New Corpus Item =============
[32m INFO[0m Reverted? false 
 Txn:
[Sender] 0x8E################################d79dd
   [1] Router.swapExactETHForTokens{value: 3116.4275 ether}(0, path:(WETH  0x12################################666A4), address(this), block.timestamp);
[Sender] 0xe1################################c8510
   [1] 0x12################################666A4.approve(0x12################################666A4, 7061877174525263660867687079.5776 ether)
       0x01

[32m INFO[0m ==========================================
[32m INFO[0m [Testcase #0] run time: 0h-0m-20s, clients: 1, corpus: 23, objectives: 0, executions: 33, exec/sec: 30.23
[32m INFO[0m [Stats #0] run time: 0h-0m-21s, clients: 1, corpus: 23, objectives: 0, executions: 33, exec/sec: 17.16
[32m INFO[0m ============= New Corpus Item =============
[32m INFO[0m Reverted? false 
 Txn:
[Sender] 0x8E################################d79dd
   [1] Router.swapExactETHForTokens{value: 3116.4275 ether}(0, path:(WETH  0x12################################666A4), address(this), block.timestamp);
[Sender] 0xe1################################c8510
   [1] 0x12################################666A4.approve(0x12################################666A4, 7061877174525263660867687079.5776 ether)
       0x01
[Sender] 0x35################################31dDb
   [1] 0x12################################666A4.approve(0x35################################31dDb, 682922393310061064125108242572646899079781722066441387.1851 ether)
       0x01

[32m INFO[0m ==========================================
[32m INFO[0m [Testcase #0] run time: 0h-0m-21s, clients: 1, corpus: 24, objectives: 0, executions: 34, exec/sec: 17.66
[32m INFO[0m [Stats #0] run time: 0h-0m-21s, clients: 1, corpus: 24, objectives: 0, executions: 34, exec/sec: 17.66
[32m INFO[0m ============= New Corpus Item =============
[32m INFO[0m Reverted? true 
 Txn:
[Sender] 0x8E################################d79dd
   [1] Router.swapExactETHForTokens{value: 36.8936 ether}(0, path:(WETH  0x12################################666A4), address(this), block.timestamp);
[Sender] 0xe1################################c8510
   [1] 0x12################################666A4.approve(0x00################################00000, 0)
       0x08################################0000000000000000000000000000000000020000000000000000000000000000000000000000000000000000000000000002245524332303a20617070726f766520746f20746865207a65726f2061646472657373000000000000000000000000000000000000000000000000000000000000

[32m INFO[0m ==========================================
[32m INFO[0m [Testcase #0] run time: 0h-0m-21s, clients: 1, corpus: 25, objectives: 0, executions: 35, exec/sec: 18.17
[32m INFO[0m [Stats #0] run time: 0h-0m-21s, clients: 1, corpus: 25, objectives: 0, executions: 35, exec/sec: 18.15
[32m INFO[0m ============= New Corpus Item =============
[32m INFO[0m Reverted? true 
 Txn:
[Sender] 0x8E################################d79dd
   [1] Router.swapExactETHForTokens{value: 3116.4275 ether}(0, path:(WETH  0x12################################666A4), address(this), block.timestamp);
[Sender] 0xe1################################c8510
   [1] 0x12################################666A4.approve(0x12################################666A4, 7061877174525263660867687079.5776 ether)
       0x01
[Sender] 0x35################################31dDb
   [1] 0x12################################666A4.approve(0x35################################31dDb, 682922393310061064125108242572646899079781722066441387.1851 ether)
       0x01
   [1] 0x12################################666A4.approve(0x8E################################d79dd, 0)
       0x01
[Sender] 0xe1################################c8510
   [1] 0x12################################666A4.approve{value: 4.7446 ether}(0x00################################00000, 0)

[32m INFO[0m ==========================================
[32m INFO[0m [Testcase #0] run time: 0h-0m-21s, clients: 1, corpus: 26, objectives: 0, executions: 39, exec/sec: 20.21
[32m INFO[0m ============= Coverage Summary =============
[32m INFO[0m 0x12################################666a4: 40.74% Instruction Covered, 37.19% Branch Covered
[32m INFO[0m 0xbb################################c095c: 11.03% Instruction Covered, 13.16% Branch Covered
[32m INFO[0m [Stats #0] run time: 0h-0m-21s, clients: 1, corpus: 26, objectives: 0, executions: 39, exec/sec: 20.08
[32m INFO[0m ============= New Corpus Item =============
[32m INFO[0m Reverted? true 
 Txn:
[Sender] 0x8E################################d79dd
   [1] Router.swapExactETHForTokens{value: 36.8936 ether}(0, path:(WETH  0x12################################666A4), address(this), block.timestamp);
   [1] 0x12################################666A4.decreaseAllowance(0x00################################00000, 1920096916160311270081667482346650169019702167271569429175.7452 ether)
       0x08################################0000000000000000000000000000000000020000000000000000000000000000000000000000000000000000000000000002545524332303a2064656372656173656420616c6c6f77616e63652062656c6f77207a65726f000000000000000000000000000000000000000000000000000000

[32m INFO[0m ==========================================
[32m INFO[0m [Testcase #0] run time: 0h-0m-21s, clients: 1, corpus: 27, objectives: 0, executions: 65, exec/sec: 33.46
[32m INFO[0m [Stats #0] run time: 0h-0m-21s, clients: 1, corpus: 27, objectives: 0, executions: 65, exec/sec: 28.44
[32m INFO[0m ============= New Corpus Item =============
[32m INFO[0m Reverted? false 
 Txn:
[Sender] 0x8E################################d79dd
   [1] Router.swapExactETHForTokens{value: 36.8936 ether}(0, path:(WETH  0x12################################666A4), address(this), block.timestamp);
   [1] 0x12################################666A4.decreaseAllowance(0x8E################################d79dd, 0)
       0x01

[32m INFO[0m ==========================================
[32m INFO[0m [Testcase #0] run time: 0h-0m-21s, clients: 1, corpus: 28, objectives: 0, executions: 66, exec/sec: 28.86
[32m INFO[0m [Stats #0] run time: 0h-0m-22s, clients: 1, corpus: 28, objectives: 0, executions: 66, exec/sec: 22.13
[32m INFO[0m ============= New Corpus Item =============
[32m INFO[0m Reverted? true 
 Txn:
[Sender] 0x8E################################d79dd
   [1] Router.swapExactETHForTokens{value: 3116.4275 ether}(0, path:(WETH  0x12################################666A4), address(this), block.timestamp);
[Sender] 0xe1################################c8510
   [1] 0x12################################666A4.approve(0x12################################666A4, 7061877174525263660867687079.5776 ether)
       0x01
[Sender] 0x35################################31dDb
   [1] 0x12################################666A4.approve(0x35################################31dDb, 682922393310061064125108242572646899079781722066441387.1851 ether)
       0x01
[Sender] 0x8E################################d79dd
   [1] 0x12################################666A4.decreaseAllowance{value: 268435666}(0x8E################################d79dd, 3450873585640276448462171487113273703311310245249419.4187 ether)

[32m INFO[0m ==========================================
[32m INFO[0m [Testcase #0] run time: 0h-0m-22s, clients: 1, corpus: 29, objectives: 0, executions: 72, exec/sec: 24.13
[32m INFO[0m ============= Coverage Summary =============
[32m INFO[0m 0x12################################666a4: 42.31% Instruction Covered, 38.42% Branch Covered
[32m INFO[0m 0xbb################################c095c: 11.03% Instruction Covered, 13.16% Branch Covered
[32m INFO[0m [Stats #0] run time: 0h-0m-23s, clients: 1, corpus: 29, objectives: 0, executions: 96, exec/sec: 20.56
[32m INFO[0m [Stats #0] run time: 0h-0m-23s, clients: 1, corpus: 29, objectives: 0, executions: 96, exec/sec: 20.56
[32m INFO[0m ============= New Corpus Item =============
[32m INFO[0m Reverted? true 
 Txn:
[Sender] 0x8E################################d79dd
   [1] Router.swapExactETHForTokens{value: 3116.4275 ether}(0, path:(WETH  0x12################################666A4), address(this), block.timestamp);
   [1] 0x12################################666A4.deliver(104969497386452031315019455232851726764545823229338925774299.1161 ether)
       0x08################################00000000000000000000000000000000000200000000000000000000000000000000000000000000000000000000000000021536166654d6174683a206d756c7469706c69636174696f6e206f766572666c6f7700000000000000000000000000000000000000000000000000000000000000

[32m INFO[0m ==========================================
[32m INFO[0m [Testcase #0] run time: 0h-0m-23s, clients: 1, corpus: 30, objectives: 0, executions: 97, exec/sec: 20.77
[32m INFO[0m [Stats #0] run time: 0h-0m-23s, clients: 1, corpus: 30, objectives: 0, executions: 97, exec/sec: 20.77
[32m INFO[0m ============= New Corpus Item =============
[32m INFO[0m Reverted? false 
 Txn:
[Sender] 0x8E################################d79dd
   [1] Router.swapExactETHForTokens{value: 3116.4275 ether}(0, path:(WETH  0x12################################666A4), address(this), block.timestamp);
[Sender] 0x68################################c9024
   [1] 0x12################################666A4.approve(0x68################################c9024, 178411406106115720147701660.1749 ether)
       0x01
[Sender] 0x8E################################d79dd
   [1] 0x12################################666A4.deliver(0)

[32m INFO[0m ==========================================
[32m INFO[0m [Testcase #0] run time: 0h-0m-23s, clients: 1, corpus: 31, objectives: 0, executions: 102, exec/sec: 21.84
[32m INFO[0m [Stats #0] run time: 0h-0m-23s, clients: 1, corpus: 31, objectives: 0, executions: 102, exec/sec: 21.83
[32m INFO[0m ============= New Corpus Item =============
[32m INFO[0m Reverted? true 
 Txn:
[Sender] 0x8E################################d79dd
   [1] Router.swapExactETHForTokens{value: 3116.4275 ether}(0, path:(WETH  0x12################################666A4), address(this), block.timestamp);
[Sender] 0x68################################c9024
   [1] 0x12################################666A4.approve(0x68################################c9024, 178411406106115720147701660.1749 ether)
       0x01
[Sender] 0x8E################################d79dd
   [1] 0x12################################666A4.deliver{value: 3081.9612 ether}(0)

[32m INFO[0m ==========================================
[32m INFO[0m [Testcase #0] run time: 0h-0m-23s, clients: 1, corpus: 32, objectives: 0, executions: 104, exec/sec: 22.26
[32m INFO[0m [Stats #0] run time: 0h-0m-23s, clients: 1, corpus: 32, objectives: 0, executions: 104, exec/sec: 22.23
[32m INFO[0m ============= New Corpus Item =============
[32m INFO[0m Reverted? false 
 Txn:
[Sender] 0x8E################################d79dd
   [1] Router.swapExactETHForTokens{value: 3116.4275 ether}(0, path:(WETH  0x12################################666A4), address(this), block.timestamp);
   [1] 0x12################################666A4.deliver(14244)

[32m INFO[0m ==========================================
[32m INFO[0m [Testcase #0] run time: 0h-0m-23s, clients: 1, corpus: 33, objectives: 0, executions: 123, exec/sec: 26.29
[32m INFO[0m ============= Coverage Summary =============
[32m INFO[0m 0x12################################666a4: 42.79% Instruction Covered, 38.92% Branch Covered
[32m INFO[0m 0xbb################################c095c: 11.03% Instruction Covered, 13.16% Branch Covered
[32m INFO[0m [Stats #0] run time: 0h-0m-23s, clients: 1, corpus: 33, objectives: 0, executions: 123, exec/sec: 26.26
[32m INFO[0m ============= New Corpus Item =============
[32m INFO[0m Reverted? true 
 Txn:
[Sender] 0xe1################################c8510
   [1] 0x12################################666A4.excludeFromFee(0x35################################31dDb)
       0x08################################000000000000000000000000000000000002000000000000000000000000000000000000000000000000000000000000000204f776e61626c653a2063616c6c6572206973206e6f7420746865206f776e6572

[32m INFO[0m ==========================================
[32m INFO[0m [Testcase #0] run time: 0h-0m-23s, clients: 1, corpus: 34, objectives: 0, executions: 129, exec/sec: 27.54
[32m INFO[0m [Stats #0] run time: 0h-0m-23s, clients: 1, corpus: 34, objectives: 0, executions: 129, exec/sec: 27.54
[32m INFO[0m ============= New Corpus Item =============
[32m INFO[0m Reverted? true 
 Txn:
[Sender] 0x8E################################d79dd
   [1] Router.swapExactETHForTokens{value: 2603.2970 ether}(0, path:(WETH  0x12################################666A4), address(this), block.timestamp);
[Sender] 0xe1################################c8510
   [1] 0x12################################666A4.excludeFromFee{value: 2748.5858 ether}(0x8E################################d79dd)

[32m INFO[0m ==========================================
[32m INFO[0m [Testcase #0] run time: 0h-0m-23s, clients: 1, corpus: 35, objectives: 0, executions: 142, exec/sec: 30.31
[32m INFO[0m ============= Coverage Summary =============
[32m INFO[0m 0x12################################666a4: 42.83% Instruction Covered, 39.16% Branch Covered
[32m INFO[0m 0xbb################################c095c: 11.03% Instruction Covered, 13.16% Branch Covered
[32m INFO[0m [Stats #0] run time: 0h-0m-23s, clients: 1, corpus: 35, objectives: 0, executions: 142, exec/sec: 30.30
[32m INFO[0m ============= New Corpus Item =============
[32m INFO[0m Reverted? true 
 Txn:
[Sender] 0x8E################################d79dd
   [1] Router.swapExactETHForTokens{value: 3116.4275 ether}(0, path:(WETH  0x12################################666A4), address(this), block.timestamp);
   [1] 0x12################################666A4.excludeFromReward(0x8E################################d79dd)
       0x08################################000000000000000000000000000000000002000000000000000000000000000000000000000000000000000000000000000204f776e61626c653a2063616c6c6572206973206e6f7420746865206f776e6572

[32m INFO[0m ==========================================
[32m INFO[0m [Testcase #0] run time: 0h-0m-23s, clients: 1, corpus: 36, objectives: 0, executions: 161, exec/sec: 34.35
[32m INFO[0m [Stats #0] run time: 0h-0m-23s, clients: 1, corpus: 36, objectives: 0, executions: 161, exec/sec: 34.35
[32m INFO[0m ============= New Corpus Item =============
[32m INFO[0m Reverted? true 
 Txn:
[Sender] 0x8E################################d79dd
   [1] Router.swapExactETHForTokens{value: 2603.2970 ether}(0, path:(WETH  0x12################################666A4), address(this), block.timestamp);
[Sender] 0x68################################c9024
   [1] 0x12################################666A4.excludeFromReward{value: 4722.3664 ether}(0x00################################00000)

[32m INFO[0m ==========================================
[32m INFO[0m [Testcase #0] run time: 0h-0m-23s, clients: 1, corpus: 37, objectives: 0, executions: 162, exec/sec: 34.56
[32m INFO[0m ============= Coverage Summary =============
[32m INFO[0m 0x12################################666a4: 42.86% Instruction Covered, 39.41% Branch Covered
[32m INFO[0m 0xbb################################c095c: 11.03% Instruction Covered, 13.16% Branch Covered
[32m INFO[0m [Stats #0] run time: 0h-0m-23s, clients: 1, corpus: 37, objectives: 0, executions: 162, exec/sec: 34.54
[32m INFO[0m ============= New Corpus Item =============
[32m INFO[0m Reverted? true 
 Txn:
[Sender] 0x8E################################d79dd
   [1] Router.swapExactETHForTokens{value: 3116.4275 ether}(0, path:(WETH  0x12################################666A4), address(this), block.timestamp);
[Sender] 0x68################################c9024
   [1] 0x12################################666A4.approve(0x68################################c9024, 178411406106115720147701660.1749 ether)
       0x01
[Sender] 0x35################################31dDb
   [1] 0x12################################666A4.includeInFee(0x8E################################d79dd)
       0x08################################000000000000000000000000000000000002000000000000000000000000000000000000000000000000000000000000000204f776e61626c653a2063616c6c6572206973206e6f7420746865206f776e6572

[32m INFO[0m ==========================================
[32m INFO[0m [Testcase #0] run time: 0h-0m-23s, clients: 1, corpus: 38, objectives: 0, executions: 193, exec/sec: 41.14
[32m INFO[0m [Stats #0] run time: 0h-0m-23s, clients: 1, corpus: 38, objectives: 0, executions: 193, exec/sec: 41.14
[32m INFO[0m ============= New Corpus Item =============
[32m INFO[0m Reverted? true 
 Txn:
[Sender] 0x8E################################d79dd
   [1] Router.swapExactETHForTokens{value: 3116.4275 ether}(0, path:(WETH  0x12################################666A4), address(this), block.timestamp);
[Sender] 0xe1################################c8510
   [1] 0x12################################666A4.approve(0x12################################666A4, 7061877174525263660867687079.5776 ether)
       0x01
[Sender] 0x35################################31dDb
   [1] 0x12################################666A4.approve(0x35################################31dDb, 682922393310061064125108242572646899079781722066441387.1851 ether)
       0x01
   [1] 0x12################################666A4.approve(0x8E################################d79dd, 0)
       0x01
   [1] 0x12################################666A4.includeInFee{value: 36}(0x8E################################d79dd)

[32m INFO[0m ==========================================
[32m INFO[0m [Testcase #0] run time: 0h-0m-23s, clients: 1, corpus: 39, objectives: 0, executions: 194, exec/sec: 41.35
[32m INFO[0m ============= Coverage Summary =============
[32m INFO[0m 0x12################################666a4: 42.90% Instruction Covered, 39.66% Branch Covered
[32m INFO[0m 0xbb################################c095c: 11.03% Instruction Covered, 13.16% Branch Covered
[32m INFO[0m [Stats #0] run time: 0h-0m-23s, clients: 1, corpus: 39, objectives: 0, executions: 194, exec/sec: 41.30
[32m INFO[0m ============= New Corpus Item =============
[32m INFO[0m Reverted? true 
 Txn:
[Sender] 0x8E################################d79dd
   [1] 0x12################################666A4.includeInReward(0x35################################31dDb)
       0x08################################000000000000000000000000000000000002000000000000000000000000000000000000000000000000000000000000000204f776e61626c653a2063616c6c6572206973206e6f7420746865206f776e6572

[32m INFO[0m ==========================================
[32m INFO[0m [Testcase #0] run time: 0h-0m-23s, clients: 1, corpus: 40, objectives: 0, executions: 225, exec/sec: 47.90
[32m INFO[0m [Stats #0] run time: 0h-0m-23s, clients: 1, corpus: 40, objectives: 0, executions: 225, exec/sec: 47.90
[32m INFO[0m ============= New Corpus Item =============
[32m INFO[0m Reverted? true 
 Txn:
[Sender] 0x8E################################d79dd
   [1] Router.swapExactETHForTokens{value: 3116.4275 ether}(0, path:(WETH  0x12################################666A4), address(this), block.timestamp);
[Sender] 0xe1################################c8510
   [1] 0x12################################666A4.approve(0x12################################666A4, 7061877174525263660867687079.5776 ether)
       0x01
[Sender] 0x8E################################d79dd
   [1] 0x12################################666A4.includeInReward{value: 1750.2494 ether}(0x8E################################d79dd)

[32m INFO[0m ==========================================
[32m INFO[0m [Testcase #0] run time: 0h-0m-23s, clients: 1, corpus: 41, objectives: 0, executions: 235, exec/sec: 50.02
[32m INFO[0m ============= Coverage Summary =============
[32m INFO[0m 0x12################################666a4: 42.93% Instruction Covered, 39.90% Branch Covered
[32m INFO[0m 0xbb################################c095c: 11.03% Instruction Covered, 13.16% Branch Covered
[32m INFO[0m [Stats #0] run time: 0h-0m-23s, clients: 1, corpus: 41, objectives: 0, executions: 235, exec/sec: 49.99
[32m INFO[0m ============= New Corpus Item =============
[32m INFO[0m Reverted? true 
 Txn:
[Sender] 0x8E################################d79dd
   [1] Router.swapExactETHForTokens{value: 3116.4275 ether}(0, path:(WETH  0x12################################666A4), address(this), block.timestamp);
[Sender] 0x68################################c9024
   [1] 0x12################################666A4.approve(0x68################################c9024, 178411406106115720147701660.1749 ether)
       0x01
   [1] 0x12################################666A4.increaseAllowance{value: 4496.3470 ether}(0x35################################31dDb, 58299051391339892312467369079360541375207479780998061126.7063 ether)

[32m INFO[0m ==========================================
[32m INFO[0m [Testcase #0] run time: 0h-0m-23s, clients: 1, corpus: 42, objectives: 0, executions: 257, exec/sec: 54.67
[32m INFO[0m [Stats #0] run time: 0h-0m-23s, clients: 1, corpus: 42, objectives: 0, executions: 257, exec/sec: 54.67
[32m INFO[0m ============= New Corpus Item =============
[32m INFO[0m Reverted? true 
 Txn:
[Sender] 0x8E################################d79dd
   [1] Router.swapExactETHForTokens{value: 2603.2970 ether}(0, path:(WETH  0x12################################666A4), address(this), block.timestamp);
[Sender] 0xe1################################c8510
   [1] 0x12################################666A4.approve(0x8E################################d79dd, 2695994666715063979466701508701963067363714442254057.2481 ether)
       0x01
[Sender] 0x8E################################d79dd
   [1] 0x12################################666A4.increaseAllowance(0x00################################00000, 441711793154542749521956214551054327664925469047350118978.7672 ether)
       0x08################################0000000000000000000000000000000000020000000000000000000000000000000000000000000000000000000000000002245524332303a20617070726f766520746f20746865207a65726f2061646472657373000000000000000000000000000000000000000000000000000000000000

[32m INFO[0m ==========================================
[32m INFO[0m [Testcase #0] run time: 0h-0m-23s, clients: 1, corpus: 43, objectives: 0, executions: 258, exec/sec: 54.87
[32m INFO[0m [Stats #0] run time: 0h-0m-24s, clients: 1, corpus: 43, objectives: 0, executions: 258, exec/sec: 48.19
[32m INFO[0m ============= New Corpus Item =============
[32m INFO[0m Reverted? false 
 Txn:
[Sender] 0x8E################################d79dd
   [1] Router.swapExactETHForTokens{value: 2603.2970 ether}(0, path:(WETH  0x12################################666A4), address(this), block.timestamp);
[Sender] 0x68################################c9024
   [1] 0x12################################666A4.increaseAllowance(0xe1################################c8510, 31090492834658537681439256902534212963234455026015.9112 ether)
       0x01

[32m INFO[0m ==========================================
[32m INFO[0m [Testcase #0] run time: 0h-0m-24s, clients: 1, corpus: 44, objectives: 0, executions: 273, exec/sec: 50.98
[32m INFO[0m ============= Coverage Summary =============
[32m INFO[0m 0xbb################################c095c: 11.03% Instruction Covered, 13.16% Branch Covered
[32m INFO[0m 0x12################################666a4: 43.29% Instruction Covered, 40.15% Branch Covered
[32m INFO[0m [Stats #0] run time: 0h-0m-26s, clients: 1, corpus: 44, objectives: 0, executions: 288, exec/sec: 37.25
[32m INFO[0m [Stats #0] run time: 0h-0m-26s, clients: 1, corpus: 44, objectives: 0, executions: 288, exec/sec: 37.24
[32m INFO[0m ============= New Corpus Item =============
[32m INFO[0m Reverted? true 
 Txn:
[Sender] 0x68################################c9024
   [1] 0x12################################666A4.lock(226152881847193046957570058972440387813408942772216919233.2410 ether)
       0x08################################000000000000000000000000000000000002000000000000000000000000000000000000000000000000000000000000000204f776e61626c653a2063616c6c6572206973206e6f7420746865206f776e6572

[32m INFO[0m ==========================================
[32m INFO[0m [Testcase #0] run time: 0h-0m-26s, clients: 1, corpus: 45, objectives: 0, executions: 289, exec/sec: 37.37
[32m INFO[0m [Stats #0] run time: 0h-0m-26s, clients: 1, corpus: 45, objectives: 0, executions: 289, exec/sec: 37.37
[32m INFO[0m ============= New Corpus Item =============
[32m INFO[0m Reverted? true 
 Txn:
[Sender] 0x8E################################d79dd
   [1] Router.swapExactETHForTokens{value: 36.8936 ether}(0, path:(WETH  0x12################################666A4), address(this), block.timestamp);
[Sender] 0x68################################c9024
   [1] 0x12################################666A4.lock{value: 3370.4149 ether}(0)

[32m INFO[0m ==========================================
[32m INFO[0m [Testcase #0] run time: 0h-0m-26s, clients: 1, corpus: 46, objectives: 0, executions: 293, exec/sec: 37.88
[32m INFO[0m ============= Coverage Summary =============
[32m INFO[0m 0xbb################################c095c: 11.03% Instruction Covered, 13.16% Branch Covered
[32m INFO[0m 0x12################################666a4: 43.32% Instruction Covered, 40.39% Branch Covered
[32m INFO[0m [Stats #0] run time: 0h-0m-26s, clients: 1, corpus: 46, objectives: 0, executions: 293, exec/sec: 37.80
[32m INFO[0m ============= New Corpus Item =============
[32m INFO[0m Reverted? true 
 Txn:
[Sender] 0x8E################################d79dd
   [1] Router.swapExactETHForTokens{value: 3116.4275 ether}(0, path:(WETH  0x12################################666A4), address(this), block.timestamp);
[Sender] 0x68################################c9024
   [1] 0x12################################666A4.renounceOwnership()
       0x08################################000000000000000000000000000000000002000000000000000000000000000000000000000000000000000000000000000204f776e61626c653a2063616c6c6572206973206e6f7420746865206f776e6572

[32m INFO[0m ==========================================
[32m INFO[0m [Testcase #0] run time: 0h-0m-26s, clients: 1, corpus: 47, objectives: 0, executions: 321, exec/sec: 41.41
[32m INFO[0m [Stats #0] run time: 0h-0m-26s, clients: 1, corpus: 47, objectives: 0, executions: 321, exec/sec: 41.41
[32m INFO[0m ============= New Corpus Item =============
[32m INFO[0m Reverted? true 
 Txn:
[Sender] 0x8E################################d79dd
   [1] Router.swapExactETHForTokens{value: 36.8936 ether}(0, path:(WETH  0x12################################666A4), address(this), block.timestamp);
   [1] 0x12################################666A4.renounceOwnership{value: 2.3061 ether}()

[32m INFO[0m ==========================================
[32m INFO[0m [Testcase #0] run time: 0h-0m-26s, clients: 1, corpus: 48, objectives: 0, executions: 325, exec/sec: 41.93
[32m INFO[0m ============= Coverage Summary =============
[32m INFO[0m 0x12################################666a4: 43.36% Instruction Covered, 40.64% Branch Covered
[32m INFO[0m 0xbb################################c095c: 11.03% Instruction Covered, 13.16% Branch Covered
[32m INFO[0m [Stats #0] run time: 0h-0m-26s, clients: 1, corpus: 48, objectives: 0, executions: 325, exec/sec: 41.91
[32m INFO[0m ============= New Corpus Item =============
[32m INFO[0m Reverted? true 
 Txn:
[Sender] 0x8E################################d79dd
   [1] Router.swapExactETHForTokens{value: 3116.4275 ether}(0, path:(WETH  0x12################################666A4), address(this), block.timestamp);
[Sender] 0x68################################c9024
   [1] 0x12################################666A4.approve(0x68################################c9024, 178411406106115720147701660.1749 ether)
       0x01
   [1] 0x12################################666A4.setLiquidityFeePercent{value: 1244.7856 ether}(115792089237316195417306239018599458318354709415339296991148.1545 ether)

[32m INFO[0m ==========================================
[32m INFO[0m [Testcase #0] run time: 0h-0m-26s, clients: 1, corpus: 49, objectives: 0, executions: 353, exec/sec: 45.51
[32m INFO[0m [Stats #0] run time: 0h-0m-26s, clients: 1, corpus: 49, objectives: 0, executions: 353, exec/sec: 45.51
[32m INFO[0m ============= New Corpus Item =============
[32m INFO[0m Reverted? true 
 Txn:
[Sender] 0x8E################################d79dd
   [1] Router.swapExactETHForTokens{value: 36.8936 ether}(0, path:(WETH  0x12################################666A4), address(this), block.timestamp);
[Sender] 0x68################################c9024
   [1] 0x12################################666A4.setLiquidityFeePercent(5444517870735015415413.9937 ether)
       0x08################################000000000000000000000000000000000002000000000000000000000000000000000000000000000000000000000000000204f776e61626c653a2063616c6c6572206973206e6f7420746865206f776e6572

[32m INFO[0m ==========================================
[32m INFO[0m [Testcase #0] run time: 0h-0m-26s, clients: 1, corpus: 50, objectives: 0, executions: 354, exec/sec: 45.64
[32m INFO[0m ============= Coverage Summary =============
[32m INFO[0m 0xbb################################c095c: 11.03% Instruction Covered, 13.16% Branch Covered
[32m INFO[0m 0x12################################666a4: 43.39% Instruction Covered, 40.89% Branch Covered
[32m INFO[0m [Stats #0] run time: 0h-0m-26s, clients: 1, corpus: 50, objectives: 0, executions: 354, exec/sec: 45.61
[32m INFO[0m ============= New Corpus Item =============
[32m INFO[0m Reverted? true 
 Txn:
[Sender] 0x8E################################d79dd
   [1] Router.swapExactETHForTokens{value: 3116.4275 ether}(0, path:(WETH  0x12################################666A4), address(this), block.timestamp);
[Sender] 0xe1################################c8510
   [1] 0x12################################666A4.setMaxTxPercent(0)
       0x08################################000000000000000000000000000000000002000000000000000000000000000000000000000000000000000000000000000204f776e61626c653a2063616c6c6572206973206e6f7420746865206f776e6572

[32m INFO[0m ==========================================
[32m INFO[0m [Testcase #0] run time: 0h-0m-26s, clients: 1, corpus: 51, objectives: 0, executions: 385, exec/sec: 49.60
[32m INFO[0m ============= Coverage Summary =============
[32m INFO[0m 0x12################################666a4: 43.39% Instruction Covered, 40.89% Branch Covered
[32m INFO[0m 0xbb################################c095c: 11.03% Instruction Covered, 13.16% Branch Covered
[32m INFO[0m [Stats #0] run time: 0h-0m-26s, clients: 1, corpus: 51, objectives: 0, executions: 385, exec/sec: 49.56
[32m INFO[0m ============= New Corpus Item =============
[32m INFO[0m Reverted? true 
 Txn:
[Sender] 0x8E################################d79dd
   [1] Router.swapExactETHForTokens{value: 36.8936 ether}(0, path:(WETH  0x12################################666A4), address(this), block.timestamp);
[Sender] 0x68################################c9024
   [1] 0x12################################666A4.setSwapAndLiquifyEnabled{value: 2368.3443 ether}(true)

[32m INFO[0m ==========================================
[32m INFO[0m [Testcase #0] run time: 0h-0m-26s, clients: 1, corpus: 52, objectives: 0, executions: 417, exec/sec: 53.68
[32m INFO[0m [Stats #0] run time: 0h-0m-26s, clients: 1, corpus: 52, objectives: 0, executions: 417, exec/sec: 53.68
[32m INFO[0m ============= New Corpus Item =============
[32m INFO[0m Reverted? true 
 Txn:
[Sender] 0x8E################################d79dd
   [1] Router.swapExactETHForTokens{value: 3116.4275 ether}(0, path:(WETH  0x12################################666A4), address(this), block.timestamp);
[Sender] 0xe1################################c8510
   [1] 0x12################################666A4.approve(0x68################################c9024, 0)
       0x01
   [1] 0x12################################666A4.setSwapAndLiquifyEnabled(true)
       0x08################################000000000000000000000000000000000002000000000000000000000000000000000000000000000000000000000000000204f776e61626c653a2063616c6c6572206973206e6f7420746865206f776e6572

[32m INFO[0m ==========================================
[32m INFO[0m [Testcase #0] run time: 0h-0m-26s, clients: 1, corpus: 53, objectives: 0, executions: 418, exec/sec: 53.81
[32m INFO[0m ============= Coverage Summary =============
[32m INFO[0m 0x12################################666a4: 43.43% Instruction Covered, 41.13% Branch Covered
[32m INFO[0m 0xbb################################c095c: 11.03% Instruction Covered, 13.16% Branch Covered
[32m INFO[0m [Stats #0] run time: 0h-0m-26s, clients: 1, corpus: 53, objectives: 0, executions: 418, exec/sec: 53.78
[32m INFO[0m ============= New Corpus Item =============
[32m INFO[0m Reverted? true 
 Txn:
[Sender] 0x8E################################d79dd
   [1] Router.swapExactETHForTokens{value: 3116.4275 ether}(0, path:(WETH  0x12################################666A4), address(this), block.timestamp);
[Sender] 0xe1################################c8510
   [1] 0x12################################666A4.approve(0x12################################666A4, 7061877174525263660867687079.5776 ether)
       0x01
[Sender] 0x35################################31dDb
   [1] 0x12################################666A4.approve(0x35################################31dDb, 682922393310061064125108242572646899079781722066441387.1851 ether)
       0x01
[Sender] 0x8E################################d79dd
   [1] 0x12################################666A4.setTaxFeePercent(883423532390803940985689212686863098614664557422628365.6167 ether)
       0x08################################000000000000000000000000000000000002000000000000000000000000000000000000000000000000000000000000000204f776e61626c653a2063616c6c6572206973206e6f7420746865206f776e6572

[32m INFO[0m ==========================================
[32m INFO[0m [Testcase #0] run time: 0h-0m-26s, clients: 1, corpus: 54, objectives: 0, executions: 449, exec/sec: 57.77
[32m INFO[0m [Stats #0] run time: 0h-0m-26s, clients: 1, corpus: 54, objectives: 0, executions: 449, exec/sec: 57.76
[32m INFO[0m ============= New Corpus Item =============
[32m INFO[0m Reverted? true 
 Txn:
[Sender] 0x8E################################d79dd
   [1] Router.swapExactETHForTokens{value: 36.8936 ether}(0, path:(WETH  0x12################################666A4), address(this), block.timestamp);
   [1] 0x12################################666A4.setTaxFeePercent{value: 73.7869 ether}(56568877628.8486 ether)

[32m INFO[0m ==========================================
[32m INFO[0m [Testcase #0] run time: 0h-0m-26s, clients: 1, corpus: 55, objectives: 0, executions: 452, exec/sec: 58.15
[32m INFO[0m ============= Coverage Summary =============
[32m INFO[0m 0x12################################666a4: 43.46% Instruction Covered, 41.38% Branch Covered
[32m INFO[0m 0xbb################################c095c: 11.03% Instruction Covered, 13.16% Branch Covered
[32m INFO[0m [Stats #0] run time: 0h-0m-26s, clients: 1, corpus: 55, objectives: 0, executions: 452, exec/sec: 58.12
[32m INFO[0m ============= New Corpus Item =============
[32m INFO[0m Reverted? true 
 Txn:
[Sender] 0x8E################################d79dd
   [1] Router.swapExactETHForTokens{value: 36.8936 ether}(0, path:(WETH  0x12################################666A4), address(this), block.timestamp);
[Sender] 0x68################################c9024
   [1] 0x12################################666A4.transfer(0x12################################666A4, 3586900808722831417139006233283500.4030 ether)
       0x08################################000000000000000000000000000000000002000000000000000000000000000000000000000000000000000000000000000285472616e7366657220616d6f756e74206578636565647320746865206d61785478416d6f756e742e000000000000000000000000000000000000000000000000

[32m INFO[0m ==========================================
[32m INFO[0m [Testcase #0] run time: 0h-0m-26s, clients: 1, corpus: 56, objectives: 0, executions: 481, exec/sec: 61.84
[32m INFO[0m [Stats #0] run time: 0h-0m-26s, clients: 1, corpus: 56, objectives: 0, executions: 481, exec/sec: 61.84
[32m INFO[0m ============= New Corpus Item =============
[32m INFO[0m Reverted? true 
 Txn:
[Sender] 0x8E################################d79dd
   [1] Router.swapExactETHForTokens{value: 3116.4275 ether}(0, path:(WETH  0x12################################666A4), address(this), block.timestamp);
[Sender] 0x68################################c9024
   [1] 0x12################################666A4.approve(0x68################################c9024, 178411406106115720147701660.1749 ether)
       0x01
   [1] 0x12################################666A4.transfer(0x00################################00000, 5)
       0x08################################0000000000000000000000000000000000020000000000000000000000000000000000000000000000000000000000000002345524332303a207472616e7366657220746f20746865207a65726f20616464726573730000000000000000000000000000000000000000000000000000000000

[32m INFO[0m ==========================================
[32m INFO[0m [Testcase #0] run time: 0h-0m-26s, clients: 1, corpus: 57, objectives: 0, executions: 483, exec/sec: 62.10
[32m INFO[0m [Stats #0] run time: 0h-0m-27s, clients: 1, corpus: 57, objectives: 0, executions: 483, exec/sec: 57.16
[32m INFO[0m ============= New Corpus Item =============
[32m INFO[0m Reverted? true 
 Txn:
[Sender] 0x8E################################d79dd
   [1] Router.swapExactETHForTokens{value: 3116.4275 ether}(0, path:(WETH  0x12################################666A4), address(this), block.timestamp);
[Sender] 0x68################################c9024
   [1] 0x12################################666A4.transfer(0x12################################666A4, 8796093025608)
       0x08################################0000000000000000000000000000000000020000000000000000000000000000000000000000000000000000000000000001e536166654d6174683a207375627472616374696f6e206f766572666c6f770000

[32m INFO[0m ==========================================
[32m INFO[0m [Testcase #0] run time: 0h-0m-27s, clients: 1, corpus: 58, objectives: 0, executions: 493, exec/sec: 58.34
[32m INFO[0m [Stats #0] run time: 0h-0m-27s, clients: 1, corpus: 58, objectives: 0, executions: 493, exec/sec: 58.32
[32m INFO[0m ============= New Corpus Item =============
[32m INFO[0m Reverted? true 
 Txn:
[Sender] 0x8E################################d79dd
   [1] Router.swapExactETHForTokens{value: 3116.4275 ether}(0, path:(WETH  0x12################################666A4), address(this), block.timestamp);
[Sender] 0xe1################################c8510
   [1] 0x12################################666A4.approve(0xe1################################c8510, 80719170778012241346090093153980463952115071809172564015507.4534 ether)
       0x01
[Sender] 0x68################################c9024
   [1] 0x12################################666A4.transfer{value: 1571.3599 ether}(0x00################################00000, 0)

[32m INFO[0m ==========================================
[32m INFO[0m [Testcase #0] run time: 0h-0m-27s, clients: 1, corpus: 59, objectives: 0, executions: 503, exec/sec: 59.49
[32m INFO[0m ============= Coverage Summary =============
[32m INFO[0m 0xbb################################c095c: 11.03% Instruction Covered, 13.16% Branch Covered
[32m INFO[0m 0x12################################666a4: 44.45% Instruction Covered, 42.86% Branch Covered
[32m INFO[0m [Stats #0] run time: 0h-0m-27s, clients: 1, corpus: 59, objectives: 0, executions: 503, exec/sec: 59.43
[32m INFO[0m ============= New Corpus Item =============
[32m INFO[0m Reverted? true 
 Txn:
[Sender] 0x8E################################d79dd
   [1] Router.swapExactETHForTokens{value: 3116.4275 ether}(0, path:(WETH  0x12################################666A4), address(this), block.timestamp);
   [1] 0x12################################666A4.deliver(14244)
[Sender] 0x35################################31dDb
   [1] 0x12################################666A4.transferFrom{value: 3306.1680 ether}(0x8E################################d79dd, 0x00################################00000, 6582018229284824168619876730229402019930943462.5343 ether)

[32m INFO[0m ==========================================
[32m INFO[0m [Testcase #0] run time: 0h-0m-27s, clients: 1, corpus: 60, objectives: 0, executions: 513, exec/sec: 60.60
[32m INFO[0m [Stats #0] run time: 0h-0m-27s, clients: 1, corpus: 60, objectives: 0, executions: 513, exec/sec: 60.60
[32m INFO[0m ============= New Corpus Item =============
[32m INFO[0m Reverted? true 
 Txn:
[Sender] 0x8E################################d79dd
   [1] Router.swapExactETHForTokens{value: 2603.2970 ether}(0, path:(WETH  0x12################################666A4), address(this), block.timestamp);
[Sender] 0x35################################31dDb
   [1] 0x12################################666A4.transferFrom(0x00################################00000, 0x00################################00000, 0)
       0x08################################0000000000000000000000000000000000020000000000000000000000000000000000000000000000000000000000000002545524332303a207472616e736665722066726f6d20746865207a65726f2061646472657373000000000000000000000000000000000000000000000000000000

[32m INFO[0m ==========================================
[32m INFO[0m [Testcase #0] run time: 0h-0m-27s, clients: 1, corpus: 61, objectives: 0, executions: 514, exec/sec: 60.72
[32m INFO[0m ============= Coverage Summary =============
[32m INFO[0m 0xbb################################c095c: 11.03% Instruction Covered, 13.16% Branch Covered
[32m INFO[0m 0x12################################666a4: 44.49% Instruction Covered, 43.10% Branch Covered
[32m INFO[0m [Stats #0] run time: 0h-0m-27s, clients: 1, corpus: 61, objectives: 0, executions: 514, exec/sec: 60.54
[32m INFO[0m ============= New Corpus Item =============
[32m INFO[0m Reverted? true 
 Txn:
[Sender] 0x8E################################d79dd
   [1] Router.swapExactETHForTokens{value: 3116.4275 ether}(0, path:(WETH  0x12################################666A4), address(this), block.timestamp);
[Sender] 0xe1################################c8510
   [1] 0x12################################666A4.approve(0x12################################666A4, 7061877174525263660867687079.5776 ether)
       0x01
[Sender] 0x35################################31dDb
   [1] 0x12################################666A4.approve(0x35################################31dDb, 682922393310061064125108242572646899079781722066441387.1851 ether)
       0x01
[Sender] 0xe1################################c8510
   [1] 0x12################################666A4.transferOwnership{value: 280920925929473}(0x12################################666A4)

[32m INFO[0m ==========================================
[32m INFO[0m [Testcase #0] run time: 0h-0m-27s, clients: 1, corpus: 62, objectives: 0, executions: 545, exec/sec: 64.19
[32m INFO[0m [Stats #0] run time: 0h-0m-27s, clients: 1, corpus: 62, objectives: 0, executions: 545, exec/sec: 64.19
[32m INFO[0m ============= New Corpus Item =============
[32m INFO[0m Reverted? true 
 Txn:
[Sender] 0x8E################################d79dd
   [1] Router.swapExactETHForTokens{value: 2603.2970 ether}(0, path:(WETH  0x12################################666A4), address(this), block.timestamp);
[Sender] 0xe1################################c8510
   [1] 0x12################################666A4.transferOwnership(0x12################################666A4)
       0x08################################000000000000000000000000000000000002000000000000000000000000000000000000000000000000000000000000000204f776e61626c653a2063616c6c6572206973206e6f7420746865206f776e6572

[32m INFO[0m ==========================================
[32m INFO[0m [Testcase #0] run time: 0h-0m-27s, clients: 1, corpus: 63, objectives: 0, executions: 546, exec/sec: 64.30
[32m INFO[0m ============= Coverage Summary =============
[32m INFO[0m 0x12################################666a4: 44.52% Instruction Covered, 43.35% Branch Covered
[32m INFO[0m 0xbb################################c095c: 11.03% Instruction Covered, 13.16% Branch Covered
[32m INFO[0m [Stats #0] run time: 0h-0m-27s, clients: 1, corpus: 63, objectives: 0, executions: 546, exec/sec: 64.26
[32m INFO[0m ============= New Corpus Item =============
[32m INFO[0m Reverted? true 
 Txn:
[Sender] 0x8E################################d79dd
   [1] Router.swapExactETHForTokens{value: 36.8936 ether}(0, path:(WETH  0x12################################666A4), address(this), block.timestamp);
   [1] 0x12################################666A4.unlock()
       0x08################################00000000000000000000000000000000000200000000000000000000000000000000000000000000000000000000000000023596f7520646f6e27742068617665207065726d697373696f6e20746f20756e6c6f636b0000000000000000000000000000000000000000000000000000000000

[32m INFO[0m ==========================================
[32m INFO[0m [Testcase #0] run time: 0h-0m-27s, clients: 1, corpus: 64, objectives: 0, executions: 577, exec/sec: 67.91
[32m INFO[0m [Stats #0] run time: 0h-0m-27s, clients: 1, corpus: 64, objectives: 0, executions: 577, exec/sec: 67.91
[32m INFO[0m ============= New Corpus Item =============
[32m INFO[0m Reverted? true 
 Txn:
[Sender] 0x8E################################d79dd
   [1] Router.swapExactETHForTokens{value: 3116.4275 ether}(0, path:(WETH  0x12################################666A4), address(this), block.timestamp);
[Sender] 0xe1################################c8510
   [1] 0x12################################666A4.approve(0x12################################666A4, 7061877174525263660867687079.5776 ether)
       0x01
[Sender] 0x35################################31dDb
   [1] 0x12################################666A4.approve(0x35################################31dDb, 682922393310061064125108242572646899079781722066441387.1851 ether)
       0x01
   [1] 0x12################################666A4.unlock{value: 1760.4056 ether}()

[32m INFO[0m ==========================================
[32m INFO[0m [Testcase #0] run time: 0h-0m-27s, clients: 1, corpus: 65, objectives: 0, executions: 578, exec/sec: 68.02
[32m INFO[0m ============= Coverage Summary =============
[32m INFO[0m 0x12################################666a4: 44.56% Instruction Covered, 43.60% Branch Covered
[32m INFO[0m 0xbb################################c095c: 11.03% Instruction Covered, 13.16% Branch Covered
[32m INFO[0m [Stats #0] run time: 0h-0m-27s, clients: 1, corpus: 65, objectives: 0, executions: 578, exec/sec: 67.93
[32m INFO[0m ============= New Corpus Item =============
[32m INFO[0m Reverted? false 
 Txn:
[Sender] 0x68################################c9024
   [1] 0x12################################666A4.call{value: 1859.2507 ether}()

[32m INFO[0m ==========================================
[32m INFO[0m [Testcase #0] run time: 0h-0m-27s, clients: 1, corpus: 66, objectives: 0, executions: 609, exec/sec: 71.57
[32m INFO[0m ============= Coverage Summary =============
[32m INFO[0m 0x12################################666a4: 44.56% Instruction Covered, 43.60% Branch Covered
[32m INFO[0m 0xbb################################c095c: 11.03% Instruction Covered, 13.16% Branch Covered
[32m INFO[0m [Stats #0] run time: 0h-0m-28s, clients: 1, corpus: 66, objectives: 0, executions: 864, exec/sec: 91.83
[32m INFO[0m [Stats #0] run time: 0h-0m-29s, clients: 1, corpus: 66, objectives: 0, executions: 896, exec/sec: 84.13
[32m INFO[0m [Stats #0] run time: 0h-0m-30s, clients: 1, corpus: 66, objectives: 0, executions: 928, exec/sec: 78.58
[32m INFO[0m [Stats #0] run time: 0h-0m-32s, clients: 1, corpus: 66, objectives: 0, executions: 1408, exec/sec: 109.4
[32m INFO[0m [Stats #0] run time: 0h-0m-33s, clients: 1, corpus: 66, objectives: 0, executions: 1855, exec/sec: 126.7
[32m INFO[0m [Stats #0] run time: 0h-0m-35s, clients: 1, corpus: 66, objectives: 0, executions: 1855, exec/sec: 114.8
[32m INFO[0m ============= New Corpus Item =============
[32m INFO[0m Reverted? true 
 Txn:
[Sender] 0x35################################31dDb
   [1] 0x12################################666A4.transferFrom(0x12################################666A4, 0x68################################c9024, 1100275220761)
       0x08################################0000000000000000000000000000000000020000000000000000000000000000000000000000000000000000000000000002845524332303a207472616e7366657220616d6f756e74206578636565647320616c6c6f77616e6365000000000000000000000000000000000000000000000000

[32m INFO[0m ==========================================
[32m INFO[0m [Testcase #0] run time: 0h-0m-35s, clients: 1, corpus: 67, objectives: 0, executions: 1920, exec/sec: 118.8
[32m INFO[0m ============= Coverage Summary =============
[32m INFO[0m 0x12################################666a4: 45.58% Instruction Covered, 44.09% Branch Covered
[32m INFO[0m 0xbb################################c095c: 11.03% Instruction Covered, 13.16% Branch Covered
[32m INFO[0m [Stats #0] run time: 0h-0m-35s, clients: 1, corpus: 67, objectives: 0, executions: 1951, exec/sec: 120.6
[32m INFO[0m [Stats #0] run time: 0h-0m-35s, clients: 1, corpus: 67, objectives: 0, executions: 1951, exec/sec: 120.3
[32m INFO[0m ============= New Corpus Item =============
[32m INFO[0m Reverted? false 
 Txn:
[Sender] 0x8E################################d79dd
   [1] Router.swapExactETHForTokens{value: 36.8936 ether}(0, path:(WETH  0x12################################666A4), address(this), block.timestamp);
   [1] 0x12################################666A4.deliver(0)

[32m INFO[0m ==========================================
[32m INFO[0m [Testcase #0] run time: 0h-0m-35s, clients: 1, corpus: 68, objectives: 0, executions: 2254, exec/sec: 139.0
[32m INFO[0m ============= Coverage Summary =============
[32m INFO[0m 0x12################################666a4: 45.58% Instruction Covered, 44.09% Branch Covered
[32m INFO[0m 0xbb################################c095c: 11.03% Instruction Covered, 13.16% Branch Covered
[32m INFO[0m [Stats #0] run time: 0h-0m-36s, clients: 1, corpus: 68, objectives: 0, executions: 2254, exec/sec: 131.6
[32m INFO[0m ============= New Corpus Item =============
[32m INFO[0m Reverted? false 
 Txn:
[Sender] 0x8E################################d79dd
   [1] Router.swapExactETHForTokens{value: 36.8936 ether}(0, path:(WETH  0x12################################666A4), address(this), block.timestamp);
   [1] 0x12################################666A4.deliver(255)

[32m INFO[0m ==========================================
[32m INFO[0m [Testcase #0] run time: 0h-0m-36s, clients: 1, corpus: 69, objectives: 0, executions: 4310, exec/sec: 251.6
[32m INFO[0m ============= Coverage Summary =============
[32m INFO[0m 0x12################################666a4: 45.58% Instruction Covered, 44.09% Branch Covered
[32m INFO[0m 0xbb################################c095c: 11.03% Instruction Covered, 13.16% Branch Covered
[32m INFO[0m [Stats #0] run time: 0h-0m-36s, clients: 1, corpus: 69, objectives: 0, executions: 4760, exec/sec: 277.2
[32m INFO[0m [Stats #0] run time: 0h-0m-37s, clients: 1, corpus: 69, objectives: 0, executions: 7445, exec/sec: 407.5
[32m INFO[0m [Stats #0] run time: 0h-0m-37s, clients: 1, corpus: 69, objectives: 0, executions: 7445, exec/sec: 405.6
[32m INFO[0m ============= New Corpus Item =============
[32m INFO[0m Reverted? false 
 Txn:
[Sender] 0x8E################################d79dd
   [1] Router.swapExactETHForTokens{value: 8453902}(0, path:(WETH  0x12################################666A4), address(this), block.timestamp);
   [1] 0x12################################666A4.deliver(0)

[32m INFO[0m ==========================================
[32m INFO[0m [Testcase #0] run time: 0h-0m-37s, clients: 1, corpus: 70, objectives: 0, executions: 8703, exec/sec: 474.2
[32m INFO[0m ============= Coverage Summary =============
[32m INFO[0m 0x12################################666a4: 45.58% Instruction Covered, 44.09% Branch Covered
[32m INFO[0m 0xbb################################c095c: 11.03% Instruction Covered, 13.16% Branch Covered
[32m INFO[0m [Stats #0] run time: 0h-0m-38s, clients: 1, corpus: 70, objectives: 0, executions: 14827, exec/sec: 769.4
[32m INFO[0m [Stats #0] run time: 0h-0m-39s, clients: 1, corpus: 70, objectives: 0, executions: 22145, exec/sec: 1.092k
[32m INFO[0m [Stats #0] run time: 0h-0m-40s, clients: 1, corpus: 70, objectives: 0, executions: 31056, exec/sec: 1.452k
[32m INFO[0m [Stats #0] run time: 0h-0m-41s, clients: 1, corpus: 70, objectives: 0, executions: 41475, exec/sec: 1.852k
[32m INFO[0m [Stats #0] run time: 0h-0m-42s, clients: 1, corpus: 70, objectives: 0, executions: 52179, exec/sec: 2.230k
[32m INFO[0m [Stats #0] run time: 0h-0m-43s, clients: 1, corpus: 70, objectives: 0, executions: 63239, exec/sec: 2.592k
[32m INFO[0m [Stats #0] run time: 0h-0m-44s, clients: 1, corpus: 70, objectives: 0, executions: 74321, exec/sec: 2.926k
[32m INFO[0m [Stats #0] run time: 0h-0m-45s, clients: 1, corpus: 70, objectives: 0, executions: 84833, exec/sec: 3.213k
[32m INFO[0m [Stats #0] run time: 0h-0m-46s, clients: 1, corpus: 70, objectives: 0, executions: 95953, exec/sec: 3.501k
[32m INFO[0m [Stats #0] run time: 0h-0m-47s, clients: 1, corpus: 70, objectives: 0, executions: 105831, exec/sec: 3.726k
[32m INFO[0m [Stats #0] run time: 0h-0m-48s, clients: 1, corpus: 70, objectives: 0, executions: 116539, exec/sec: 3.963k
[32m INFO[0m [Stats #0] run time: 0h-0m-49s, clients: 1, corpus: 70, objectives: 0, executions: 127755, exec/sec: 4.202k
[32m INFO[0m [Stats #0] run time: 0h-0m-50s, clients: 1, corpus: 70, objectives: 0, executions: 139096, exec/sec: 4.429k
[32m INFO[0m [Stats #0] run time: 0h-0m-51s, clients: 1, corpus: 70, objectives: 0, executions: 149796, exec/sec: 4.622k
[32m INFO[0m [Stats #0] run time: 0h-0m-52s, clients: 1, corpus: 70, objectives: 0, executions: 159375, exec/sec: 4.770k
[32m INFO[0m [Stats #0] run time: 0h-0m-53s, clients: 1, corpus: 70, objectives: 0, executions: 170525, exec/sec: 4.955k
[32m INFO[0m [Stats #0] run time: 0h-0m-54s, clients: 1, corpus: 70, objectives: 0, executions: 181044, exec/sec: 5.112k
[32m INFO[0m [Stats #0] run time: 0h-0m-55s, clients: 1, corpus: 70, objectives: 0, executions: 190758, exec/sec: 5.239k
[32m INFO[0m [Stats #0] run time: 0h-0m-56s, clients: 1, corpus: 70, objectives: 0, executions: 201177, exec/sec: 5.377k
[32m INFO[0m [Stats #0] run time: 0h-0m-57s, clients: 1, corpus: 70, objectives: 0, executions: 211406, exec/sec: 5.503k
[32m INFO[0m [Stats #0] run time: 0h-0m-58s, clients: 1, corpus: 70, objectives: 0, executions: 222044, exec/sec: 5.632k
[32m INFO[0m [Stats #0] run time: 0h-0m-59s, clients: 1, corpus: 70, objectives: 0, executions: 232660, exec/sec: 5.756k
[32m INFO[0m [Stats #0] run time: 0h-0m-59s, clients: 1, corpus: 70, objectives: 0, executions: 232660, exec/sec: 5.705k
[32m INFO[0m ============= New Corpus Item =============
[32m INFO[0m Reverted? false 
 Txn:
[Sender] 0x8E################################d79dd
   [1] Router.swapExactETHForTokens{value: 30.6918 ether}(0, path:(WETH  0x12################################666A4), address(this), block.timestamp);
   [1] 0x12################################666A4.transfer(0x68################################c9024, 1)
       0x01
[Sender] 0x68################################c9024
   [1] 0x12################################666A4.call{value: 1859.2507 ether}()

[32m INFO[0m ==========================================
[32m INFO[0m [Testcase #0] run time: 0h-0m-59s, clients: 1, corpus: 71, objectives: 0, executions: 236814, exec/sec: 5.806k
[32m INFO[0m ============= Coverage Summary =============
[32m INFO[0m 0xbb################################c095c: 11.03% Instruction Covered, 13.16% Branch Covered
[32m INFO[0m 0x12################################666a4: 45.58% Instruction Covered, 44.09% Branch Covered
[32m INFO[0m [Stats #0] run time: 0h-1m-0s, clients: 1, corpus: 71, objectives: 0, executions: 236814, exec/sec: 5.763k
[32m INFO[0m ============= New Corpus Item =============
[32m INFO[0m Reverted? false 
 Txn:
[Sender] 0x8E################################d79dd
   [1] Router.swapExactETHForTokens{value: 30.6918 ether}(0, path:(WETH  0x12################################666A4), address(this), block.timestamp);
   [1] 0x12################################666A4.transfer(0x68################################c9024, 1)
       0x01
   [1] 0x12################################666A4.deliver(3812)

[32m INFO[0m ==========================================
[32m INFO[0m [Testcase #0] run time: 0h-1m-0s, clients: 1, corpus: 72, objectives: 0, executions: 239177, exec/sec: 5.820k
[32m INFO[0m ============= Coverage Summary =============
[32m INFO[0m 0x12################################666a4: 45.58% Instruction Covered, 44.09% Branch Covered
[32m INFO[0m 0xbb################################c095c: 11.03% Instruction Covered, 13.16% Branch Covered
[32m INFO[0m [Stats #0] run time: 0h-1m-0s, clients: 1, corpus: 72, objectives: 0, executions: 242248, exec/sec: 5.846k
[32m INFO[0m [Stats #0] run time: 0h-1m-1s, clients: 1, corpus: 72, objectives: 0, executions: 251806, exec/sec: 5.934k
[32m INFO[0m [Stats #0] run time: 0h-1m-2s, clients: 1, corpus: 72, objectives: 0, executions: 262133, exec/sec: 6.035k
[32m INFO[0m [Stats #0] run time: 0h-1m-3s, clients: 1, corpus: 72, objectives: 0, executions: 271624, exec/sec: 6.112k
[32m INFO[0m [Stats #0] run time: 0h-1m-4s, clients: 1, corpus: 72, objectives: 0, executions: 281048, exec/sec: 6.185k
[32m INFO[0m [Stats #0] run time: 0h-1m-5s, clients: 1, corpus: 72, objectives: 0, executions: 290756, exec/sec: 6.261k
[32m INFO[0m [Stats #0] run time: 0h-1m-6s, clients: 1, corpus: 72, objectives: 0, executions: 301275, exec/sec: 6.350k
[32m INFO[0m [Stats #0] run time: 0h-1m-7s, clients: 1, corpus: 72, objectives: 0, executions: 310473, exec/sec: 6.408k
[32m INFO[0m [Stats #0] run time: 0h-1m-8s, clients: 1, corpus: 72, objectives: 0, executions: 319801, exec/sec: 6.466k
[32m INFO[0m [Stats #0] run time: 0h-1m-9s, clients: 1, corpus: 72, objectives: 0, executions: 328970, exec/sec: 6.517k
[32m INFO[0m [Stats #0] run time: 0h-1m-10s, clients: 1, corpus: 72, objectives: 0, executions: 338901, exec/sec: 6.583k
[32m INFO[0m [Stats #0] run time: 0h-1m-11s, clients: 1, corpus: 72, objectives: 0, executions: 348485, exec/sec: 6.640k
[32m INFO[0m [Stats #0] run time: 0h-1m-12s, clients: 1, corpus: 72, objectives: 0, executions: 357626, exec/sec: 6.687k
[32m INFO[0m [Stats #0] run time: 0h-1m-13s, clients: 1, corpus: 72, objectives: 0, executions: 368007, exec/sec: 6.754k
[32m INFO[0m [Stats #0] run time: 0h-1m-14s, clients: 1, corpus: 72, objectives: 0, executions: 377974, exec/sec: 6.810k
[32m INFO[0m [Stats #0] run time: 0h-1m-15s, clients: 1, corpus: 72, objectives: 0, executions: 386571, exec/sec: 6.841k
[32m INFO[0m [Stats #0] run time: 0h-1m-16s, clients: 1, corpus: 72, objectives: 0, executions: 396511, exec/sec: 6.895k
[32m INFO[0m [Stats #0] run time: 0h-1m-17s, clients: 1, corpus: 72, objectives: 0, executions: 406677, exec/sec: 6.950k
[32m INFO[0m [Stats #0] run time: 0h-1m-18s, clients: 1, corpus: 72, objectives: 0, executions: 416390, exec/sec: 6.997k
[32m INFO[0m [Stats #0] run time: 0h-1m-19s, clients: 1, corpus: 72, objectives: 0, executions: 425596, exec/sec: 7.032k
[32m INFO[0m [Stats #0] run time: 0h-1m-20s, clients: 1, corpus: 72, objectives: 0, executions: 435311, exec/sec: 7.075k
[32m INFO[0m [Stats #0] run time: 0h-1m-21s, clients: 1, corpus: 72, objectives: 0, executions: 444326, exec/sec: 7.106k
[32m INFO[0m [Stats #0] run time: 0h-1m-22s, clients: 1, corpus: 72, objectives: 0, executions: 454011, exec/sec: 7.146k
[32m INFO[0m [Stats #0] run time: 0h-1m-23s, clients: 1, corpus: 72, objectives: 0, executions: 463337, exec/sec: 7.179k
[32m INFO[0m [Stats #0] run time: 0h-1m-24s, clients: 1, corpus: 72, objectives: 0, executions: 472639, exec/sec: 7.211k
[32m INFO[0m [Stats #0] run time: 0h-1m-25s, clients: 1, corpus: 72, objectives: 0, executions: 483021, exec/sec: 7.258k
[32m INFO[0m [Stats #0] run time: 0h-1m-26s, clients: 1, corpus: 72, objectives: 0, executions: 492448, exec/sec: 7.290k
[32m INFO[0m [Stats #0] run time: 0h-1m-27s, clients: 1, corpus: 72, objectives: 0, executions: 502194, exec/sec: 7.326k
[32m INFO[0m [Stats #0] run time: 0h-1m-28s, clients: 1, corpus: 72, objectives: 0, executions: 511364, exec/sec: 7.352k
[32m INFO[0m [Stats #0] run time: 0h-1m-29s, clients: 1, corpus: 72, objectives: 0, executions: 520857, exec/sec: 7.382k
[32m INFO[0m [Stats #0] run time: 0h-1m-30s, clients: 1, corpus: 72, objectives: 0, executions: 520857, exec/sec: 7.317k
[32m INFO[0m ============= New Corpus Item =============
[32m INFO[0m Reverted? false 
 Txn:
[Sender] 0x8E################################d79dd
   [1] Router.swapExactETHForTokens{value: 3116.4275 ether}(0, path:(WETH  0x12################################666A4), address(this), block.timestamp);
   [1] 0x12################################666A4.transfer(0xe1################################c8510, 6013)
       0x01

[32m INFO[0m ==========================================
[32m INFO[0m [Testcase #0] run time: 0h-1m-30s, clients: 1, corpus: 73, objectives: 0, executions: 527347, exec/sec: 7.408k
[32m INFO[0m ============= Coverage Summary =============
[32m INFO[0m 0x12################################666a4: 45.58% Instruction Covered, 44.09% Branch Covered
[32m INFO[0m 0xbb################################c095c: 11.03% Instruction Covered, 13.16% Branch Covered
[32m INFO[0m [Stats #0] run time: 0h-1m-30s, clients: 1, corpus: 73, objectives: 0, executions: 530954, exec/sec: 7.420k
[32m INFO[0m [Stats #0] run time: 0h-1m-30s, clients: 1, corpus: 73, objectives: 0, executions: 530954, exec/sec: 7.412k
[32m INFO[0m ============= New Corpus Item =============
[32m INFO[0m Reverted? false 
 Txn:
[Sender] 0x8E################################d79dd
   [1] Router.swapExactETHForTokens{value: 30.6918 ether}(0, path:(WETH  0x12################################666A4), address(this), block.timestamp);
   [1] 0x12################################666A4.transfer(0x68################################c9024, 1)
       0x01
   [1] 0x12################################666A4.deliver(3812)
   [1] 0x12################################666A4.transfer(0xe1################################c8510, 6013)
       0x01

[32m INFO[0m ==========================================
[32m INFO[0m [Testcase #0] run time: 0h-1m-30s, clients: 1, corpus: 74, objectives: 0, executions: 531503, exec/sec: 7.420k
[32m INFO[0m ============= Coverage Summary =============
[32m INFO[0m 0x12################################666a4: 45.58% Instruction Covered, 44.09% Branch Covered
[32m INFO[0m 0xbb################################c095c: 11.03% Instruction Covered, 13.16% Branch Covered
[32m INFO[0m [Stats #0] run time: 0h-1m-31s, clients: 1, corpus: 74, objectives: 0, executions: 538308, exec/sec: 7.419k
[32m INFO[0m [Stats #0] run time: 0h-1m-32s, clients: 1, corpus: 74, objectives: 0, executions: 546744, exec/sec: 7.433k
[32m INFO[0m [Stats #0] run time: 0h-1m-33s, clients: 1, corpus: 74, objectives: 0, executions: 555980, exec/sec: 7.456k
[32m INFO[0m [Stats #0] run time: 0h-1m-34s, clients: 1, corpus: 74, objectives: 0, executions: 555980, exec/sec: 7.414k
[32m INFO[0m ============= New Corpus Item =============
[32m INFO[0m Reverted? false 
 Txn:
[Sender] 0x8E################################d79dd
   [1] Router.swapExactETHForTokens{value: 30.6918 ether}(0, path:(WETH  0x12################################666A4), address(this), block.timestamp);
   [1] 0x12################################666A4.transfer(0x68################################c9024, 1)
       0x01
   [1] 0x12################################666A4.deliver(3812)
   [1] 0x12################################666A4.transfer(0xe1################################c8510, 7)
       0x01

[32m INFO[0m ==========================================
[32m INFO[0m [Testcase #0] run time: 0h-1m-34s, clients: 1, corpus: 75, objectives: 0, executions: 559908, exec/sec: 7.453k
[32m INFO[0m ============= Coverage Summary =============
[32m INFO[0m 0x12################################666a4: 45.58% Instruction Covered, 44.09% Branch Covered
[32m INFO[0m 0xbb################################c095c: 11.03% Instruction Covered, 13.16% Branch Covered
[32m INFO[0m [Stats #0] run time: 0h-1m-34s, clients: 1, corpus: 75, objectives: 0, executions: 563068, exec/sec: 7.451k
[32m INFO[0m [Stats #0] run time: 0h-1m-35s, clients: 1, corpus: 75, objectives: 0, executions: 571952, exec/sec: 7.469k
[32m INFO[0m [Stats #0] run time: 0h-1m-36s, clients: 1, corpus: 75, objectives: 0, executions: 581250, exec/sec: 7.492k
[32m INFO[0m [Stats #0] run time: 0h-1m-37s, clients: 1, corpus: 75, objectives: 0, executions: 588859, exec/sec: 7.494k
Timeout