[32m INFO[0m fetching abi from https://api.bscscan.com/api?module=contract&action=getabi&address=0x2f################################cf566&format=json&apikey=6ZUCAR738XJSX6WK3BGN2K8DX4RI9A875M
[32m INFO[0m fetching code from 2fda16db6ae8df453900435a445e515263ecf566
Contract loaded: 0x2f################################cf566
[32m INFO[0m 

 ================ EVM Fuzzer Start ===================


[32m INFO[0m Deploying contract: 0x2f################################cf566
[32m INFO[0m Contract 0x2f################################cf566 deployed to: 0x2f################################cf566 -> balacne is 0
[32m INFO[0m Deployed all contracts

[32m INFO[0m fetching pairs for 0x2f################################cf566
[32m INFO[0m fetching pairs for 0x2f################################cf566
[32m INFO[0m fetching code from 6cb013bc6095a1eedac54ad32a94e5f7b90c25b5
[32m INFO[0m fetching code from bb4cdb9cbd36b01bd1cbaebf2de08d9173bc095c
[32m INFO[0m [Stats #0] run time: 0h-0m-20s, clients: 1, corpus: 0, objectives: 0, executions: 0, exec/sec: 0.000
[32m INFO[0m ============= New Corpus Item =============
[32m INFO[0m Reverted? false 
 Txn:
[Sender] 0x8E################################d79dd
   [1] Router.swapExactETHForTokens{value: 3116.4275 ether}(0, path:(WETH  0x2f################################cF566), address(this), block.timestamp);

[32m INFO[0m ==========================================
[32m INFO[0m [Testcase #0] run time: 0h-0m-20s, clients: 1, corpus: 21, objectives: 0, executions: 1, exec/sec: 0.000
[32m INFO[0m [Stats #0] run time: 0h-0m-20s, clients: 1, corpus: 21, objectives: 0, executions: 1, exec/sec: 0.000
[32m INFO[0m ============= New Corpus Item =============
[32m INFO[0m Reverted? false 
 Txn:
[Sender] 0x8E################################d79dd
   [1] Router.swapExactETHForTokens{value: 3116.4275 ether}(0, path:(WETH  0x2f################################cF566), address(this), block.timestamp);
   [1] Router.swapExactETHForTokens{value: 3916.9970 ether}(0, path:(WETH  0x2f################################cF566), address(this), block.timestamp);

[32m INFO[0m ==========================================
[32m INFO[0m [Testcase #0] run time: 0h-0m-20s, clients: 1, corpus: 22, objectives: 0, executions: 2, exec/sec: 0.000
[32m INFO[0m [Stats #0] run time: 0h-0m-20s, clients: 1, corpus: 22, objectives: 0, executions: 2, exec/sec: 0.000
[32m INFO[0m ============= New Corpus Item =============
[32m INFO[0m Reverted? true 
 Txn:
[Sender] 0x8E################################d79dd
   [1] Router.swapExactETHForTokens{value: 3116.4275 ether}(0, path:(WETH  0x2f################################cF566), address(this), block.timestamp);
   [1] Router.swapExactETHForTokens{value: 4}(0, path:(WETH  0x2f################################cF566), address(this), block.timestamp);

[32m INFO[0m ==========================================
[32m INFO[0m [Testcase #0] run time: 0h-0m-20s, clients: 1, corpus: 23, objectives: 0, executions: 4, exec/sec: 0.000
[32m INFO[0m ============= Coverage Summary =============
[32m INFO[0m 0xbb################################c095c: 11.03% Instruction Covered, 13.16% Branch Covered
[32m INFO[0m 0x2f################################cf566: 40.19% Instruction Covered, 36.49% Branch Covered
[32m INFO[0m [Stats #0] run time: 0h-0m-21s, clients: 1, corpus: 23, objectives: 0, executions: 4, exec/sec: 0.000
[32m INFO[0m ============= New Corpus Item =============
[32m INFO[0m Reverted? true 
 Txn:
[Sender] 0x8E################################d79dd
   [1] Router.swapExactETHForTokens{value: 3116.4275 ether}(0, path:(WETH  0x2f################################cF566), address(this), block.timestamp);
   [1] Router.swapExactETHForTokens{value: 3916.9970 ether}(0, path:(WETH  0x2f################################cF566), address(this), block.timestamp);
   [1] Router.swapExactETHForTokens{value: 1192.4292 ether}(0, path:(WETH  0x2f################################cF566), address(this), block.timestamp);
[Sender] 0xe1################################c8510
   [1] 0x2f################################cF566.approve{value: 0.3602 ether}(0x68################################c9024, 21267647932558655147.5253 ether)

[32m INFO[0m ==========================================
[32m INFO[0m [Testcase #0] run time: 0h-0m-21s, clients: 1, corpus: 24, objectives: 0, executions: 33, exec/sec: 0.000
[32m INFO[0m [Stats #0] run time: 0h-0m-21s, clients: 1, corpus: 24, objectives: 0, executions: 33, exec/sec: 0.000
[32m INFO[0m ============= New Corpus Item =============
[32m INFO[0m Reverted? true 
 Txn:
[Sender] 0x8E################################d79dd
   [1] Router.swapExactETHForTokens{value: 3116.4275 ether}(0, path:(WETH  0x2f################################cF566), address(this), block.timestamp);
   [1] Router.swapExactETHForTokens{value: 3916.9970 ether}(0, path:(WETH  0x2f################################cF566), address(this), block.timestamp);
   [1] Router.swapExactETHForTokens{value: 1192.4292 ether}(0, path:(WETH  0x2f################################cF566), address(this), block.timestamp);
[Sender] 0xe1################################c8510
   [1] 0x2f################################cF566.approve(0x00################################00000, 0)
       0x08################################0000000000000000000000000000000000020000000000000000000000000000000000000000000000000000000000000002245524332303a20617070726f766520746f20746865207a65726f2061646472657373000000000000000000000000000000000000000000000000000000000000

[32m INFO[0m ==========================================
[32m INFO[0m [Testcase #0] run time: 0h-0m-21s, clients: 1, corpus: 25, objectives: 0, executions: 34, exec/sec: 0.000
[32m INFO[0m [Stats #0] run time: 0h-0m-21s, clients: 1, corpus: 25, objectives: 0, executions: 34, exec/sec: 0.000
[32m INFO[0m ============= New Corpus Item =============
[32m INFO[0m Reverted? false 
 Txn:
[Sender] 0x8E################################d79dd
   [1] Router.swapExactETHForTokens{value: 3116.4275 ether}(0, path:(WETH  0x2f################################cF566), address(this), block.timestamp);
   [1] Router.swapExactETHForTokens{value: 3916.9970 ether}(0, path:(WETH  0x2f################################cF566), address(this), block.timestamp);
   [1] Router.swapExactETHForTokens{value: 4226.6379 ether}(0, path:(WETH  0x2f################################cF566), address(this), block.timestamp);
[Sender] 0xe1################################c8510
   [1] 0x2f################################cF566.approve(0x35################################31dDb, 0)
       0x01

[32m INFO[0m ==========================================
[32m INFO[0m [Testcase #0] run time: 0h-0m-21s, clients: 1, corpus: 26, objectives: 0, executions: 35, exec/sec: 0.000
[32m INFO[0m [Stats #0] run time: 0h-0m-21s, clients: 1, corpus: 26, objectives: 0, executions: 35, exec/sec: 0.000
[32m INFO[0m ============= New Corpus Item =============
[32m INFO[0m Reverted? false 
 Txn:
[Sender] 0x8E################################d79dd
   [1] Router.swapExactETHForTokens{value: 10.0 ether}(0, path:(WETH  0x2f################################cF566), address(this), block.timestamp);
   [1] Router.swapExactETHForTokens{value: 3247.2933 ether}(0, path:(WETH  0x2f################################cF566), address(this), block.timestamp);
[Sender] 0xe1################################c8510
   [1] 0x2f################################cF566.approve(0x2f################################cF566, 1606938044258990275541963535730060906376526.1471 ether)
       0x01

[32m INFO[0m ==========================================
[32m INFO[0m [Testcase #0] run time: 0h-0m-21s, clients: 1, corpus: 27, objectives: 0, executions: 36, exec/sec: 0.000
[32m INFO[0m ============= Coverage Summary =============
[32m INFO[0m 0x2f################################cf566: 41.32% Instruction Covered, 36.97% Branch Covered
[32m INFO[0m 0xbb################################c095c: 11.03% Instruction Covered, 13.16% Branch Covered
[32m INFO[0m [Stats #0] run time: 0h-0m-21s, clients: 1, corpus: 27, objectives: 0, executions: 36, exec/sec: 0.000
[32m INFO[0m ============= New Corpus Item =============
[32m INFO[0m Reverted? true 
 Txn:
[Sender] 0x8E################################d79dd
   [1] Router.swapExactETHForTokens{value: 3116.4275 ether}(0, path:(WETH  0x2f################################cF566), address(this), block.timestamp);
   [1] Router.swapExactETHForTokens{value: 3916.9970 ether}(0, path:(WETH  0x2f################################cF566), address(this), block.timestamp);
   [1] Router.swapExactETHForTokens{value: 4226.6379 ether}(0, path:(WETH  0x2f################################cF566), address(this), block.timestamp);
[Sender] 0x68################################c9024
   [1] 0x2f################################cF566.decreaseAllowance{value: 782520516}(0x8E################################d79dd, 0)

[32m INFO[0m ==========================================
[32m INFO[0m [Testcase #0] run time: 0h-0m-21s, clients: 1, corpus: 28, objectives: 0, executions: 65, exec/sec: 0.000
[32m INFO[0m [Stats #0] run time: 0h-0m-21s, clients: 1, corpus: 28, objectives: 0, executions: 65, exec/sec: 0.000
[32m INFO[0m ============= New Corpus Item =============
[32m INFO[0m Reverted? true 
 Txn:
[Sender] 0x8E################################d79dd
   [1] Router.swapExactETHForTokens{value: 3116.4275 ether}(0, path:(WETH  0x2f################################cF566), address(this), block.timestamp);
   [1] Router.swapExactETHForTokens{value: 2272.4504 ether}(0, path:(WETH  0x2f################################cF566), address(this), block.timestamp);
   [1] Router.swapExactETHForTokens{value: 1321.3448 ether}(0, path:(WETH  0x2f################################cF566), address(this), block.timestamp);
   [1] 0x2f################################cF566.decreaseAllowance(0x00################################00000, 0)
       0x08################################0000000000000000000000000000000000020000000000000000000000000000000000000000000000000000000000000002245524332303a20617070726f766520746f20746865207a65726f2061646472657373000000000000000000000000000000000000000000000000000000000000

[32m INFO[0m ==========================================
[32m INFO[0m [Testcase #0] run time: 0h-0m-21s, clients: 1, corpus: 29, objectives: 0, executions: 66, exec/sec: 0.000
[32m INFO[0m [Stats #0] run time: 0h-0m-21s, clients: 1, corpus: 29, objectives: 0, executions: 66, exec/sec: 0.000
[32m INFO[0m ============= New Corpus Item =============
[32m INFO[0m Reverted? true 
 Txn:
[Sender] 0x8E################################d79dd
   [1] Router.swapExactETHForTokens{value: 3116.4275 ether}(0, path:(WETH  0x2f################################cF566), address(this), block.timestamp);
   [1] 0x2f################################cF566.decreaseAllowance(0x68################################c9024, 12259965568607574586775765606463197703.6531 ether)
       0x08################################0000000000000000000000000000000000020000000000000000000000000000000000000000000000000000000000000002545524332303a2064656372656173656420616c6c6f77616e63652062656c6f77207a65726f000000000000000000000000000000000000000000000000000000

[32m INFO[0m ==========================================
[32m INFO[0m [Testcase #0] run time: 0h-0m-21s, clients: 1, corpus: 30, objectives: 0, executions: 68, exec/sec: 0.000
[32m INFO[0m ============= Coverage Summary =============
[32m INFO[0m 0xbb################################c095c: 11.03% Instruction Covered, 13.16% Branch Covered
[32m INFO[0m 0x2f################################cf566: 42.52% Instruction Covered, 38.15% Branch Covered
[32m INFO[0m [Stats #0] run time: 0h-0m-21s, clients: 1, corpus: 30, objectives: 0, executions: 68, exec/sec: 43.24
[32m INFO[0m ============= New Corpus Item =============
[32m INFO[0m Reverted? true 
 Txn:
[Sender] 0x8E################################d79dd
   [1] Router.swapExactETHForTokens{value: 3116.4275 ether}(0, path:(WETH  0x2f################################cF566), address(this), block.timestamp);
   [1] Router.swapExactETHForTokens{value: 3916.9970 ether}(0, path:(WETH  0x2f################################cF566), address(this), block.timestamp);
   [1] Router.swapExactETHForTokens{value: 1192.4292 ether}(0, path:(WETH  0x2f################################cF566), address(this), block.timestamp);
   [1] Router.swapExactETHForTokens{value: 749.2520 ether}(0, path:(WETH  0x2f################################cF566), address(this), block.timestamp);
   [1] 0x2f################################cF566.excludeFromFee(0x8E################################d79dd)
       0x08################################000000000000000000000000000000000002000000000000000000000000000000000000000000000000000000000000000204f776e61626c653a2063616c6c6572206973206e6f7420746865206f776e6572

[32m INFO[0m ==========================================
[32m INFO[0m [Testcase #0] run time: 0h-0m-21s, clients: 1, corpus: 31, objectives: 0, executions: 97, exec/sec: 61.65
[32m INFO[0m [Stats #0] run time: 0h-0m-21s, clients: 1, corpus: 31, objectives: 0, executions: 97, exec/sec: 61.64
[32m INFO[0m ============= New Corpus Item =============
[32m INFO[0m Reverted? true 
 Txn:
[Sender] 0x8E################################d79dd
   [1] Router.swapExactETHForTokens{value: 3116.4275 ether}(0, path:(WETH  0x2f################################cF566), address(this), block.timestamp);
   [1] 0x2f################################cF566.excludeFromFee{value: 3154.8263 ether}(0x35################################31dDb)

[32m INFO[0m ==========================================
[32m INFO[0m [Testcase #0] run time: 0h-0m-21s, clients: 1, corpus: 32, objectives: 0, executions: 103, exec/sec: 65.42
[32m INFO[0m ============= Coverage Summary =============
[32m INFO[0m 0xbb################################c095c: 11.03% Instruction Covered, 13.16% Branch Covered
[32m INFO[0m 0x2f################################cf566: 42.56% Instruction Covered, 38.39% Branch Covered
[32m INFO[0m [Stats #0] run time: 0h-0m-21s, clients: 1, corpus: 32, objectives: 0, executions: 103, exec/sec: 65.27
[32m INFO[0m ============= New Corpus Item =============
[32m INFO[0m Reverted? true 
 Txn:
[Sender] 0x8E################################d79dd
   [1] Router.swapExactETHForTokens{value: 3116.4275 ether}(0, path:(WETH  0x2f################################cF566), address(this), block.timestamp);
   [1] Router.swapExactETHForTokens{value: 3916.9970 ether}(0, path:(WETH  0x2f################################cF566), address(this), block.timestamp);
   [1] Router.swapExactETHForTokens{value: 1192.4292 ether}(0, path:(WETH  0x2f################################cF566), address(this), block.timestamp);
   [1] Router.swapExactETHForTokens{value: 749.2520 ether}(0, path:(WETH  0x2f################################cF566), address(this), block.timestamp);
[Sender] 0xe1################################c8510
   [1] 0x2f################################cF566.excludeFromReward(0xe1################################c8510)
       0x08################################000000000000000000000000000000000002000000000000000000000000000000000000000000000000000000000000000204f776e61626c653a2063616c6c6572206973206e6f7420746865206f776e6572

[32m INFO[0m ==========================================
[32m INFO[0m [Testcase #0] run time: 0h-0m-21s, clients: 1, corpus: 33, objectives: 0, executions: 129, exec/sec: 81.72
[32m INFO[0m [Stats #0] run time: 0h-0m-21s, clients: 1, corpus: 33, objectives: 0, executions: 129, exec/sec: 81.71
[32m INFO[0m ============= New Corpus Item =============
[32m INFO[0m Reverted? true 
 Txn:
[Sender] 0x8E################################d79dd
   [1] Router.swapExactETHForTokens{value: 3116.4275 ether}(0, path:(WETH  0x2f################################cF566), address(this), block.timestamp);
[Sender] 0xe1################################c8510
   [1] 0x2f################################cF566.excludeFromReward{value: 7402945688143}(0x8E################################d79dd)

[32m INFO[0m ==========================================
[32m INFO[0m [Testcase #0] run time: 0h-0m-21s, clients: 1, corpus: 34, objectives: 0, executions: 136, exec/sec: 86.11
[32m INFO[0m ============= Coverage Summary =============
[32m INFO[0m 0x2f################################cf566: 42.59% Instruction Covered, 38.63% Branch Covered
[32m INFO[0m 0xbb################################c095c: 11.03% Instruction Covered, 13.16% Branch Covered
[32m INFO[0m [Stats #0] run time: 0h-0m-21s, clients: 1, corpus: 34, objectives: 0, executions: 136, exec/sec: 85.14
[32m INFO[0m ============= New Corpus Item =============
[32m INFO[0m Reverted? true 
 Txn:
[Sender] 0x8E################################d79dd
   [1] Router.swapExactETHForTokens{value: 3116.4275 ether}(0, path:(WETH  0x2f################################cF566), address(this), block.timestamp);
   [1] Router.swapExactETHForTokens{value: 3916.9970 ether}(0, path:(WETH  0x2f################################cF566), address(this), block.timestamp);
   [1] Router.swapExactETHForTokens{value: 1192.4292 ether}(0, path:(WETH  0x2f################################cF566), address(this), block.timestamp);
   [1] Router.swapExactETHForTokens{value: 4718.6939 ether}(0, path:(WETH  0x2f################################cF566), address(this), block.timestamp);
[Sender] 0x68################################c9024
   [1] 0x2f################################cF566.includeInFee(0x8E################################d79dd)
       0x08################################000000000000000000000000000000000002000000000000000000000000000000000000000000000000000000000000000204f776e61626c653a2063616c6c6572206973206e6f7420746865206f776e6572

[32m INFO[0m ==========================================
[32m INFO[0m [Testcase #0] run time: 0h-0m-21s, clients: 1, corpus: 35, objectives: 0, executions: 161, exec/sec: 100.8
[32m INFO[0m [Stats #0] run time: 0h-0m-21s, clients: 1, corpus: 35, objectives: 0, executions: 161, exec/sec: 100.7
[32m INFO[0m ============= New Corpus Item =============
[32m INFO[0m Reverted? true 
 Txn:
[Sender] 0x8E################################d79dd
   [1] Router.swapExactETHForTokens{value: 10.0 ether}(0, path:(WETH  0x2f################################cF566), address(this), block.timestamp);
   [1] Router.swapExactETHForTokens{value: 3247.2933 ether}(0, path:(WETH  0x2f################################cF566), address(this), block.timestamp);
[Sender] 0xe1################################c8510
   [1] 0x2f################################cF566.approve(0x2f################################cF566, 1606938044258990275541963535730060906376526.1471 ether)
       0x01
[Sender] 0x68################################c9024
   [1] 0x2f################################cF566.includeInFee{value: 0.1801 ether}(0x2f################################cF566)

[32m INFO[0m ==========================================
[32m INFO[0m [Testcase #0] run time: 0h-0m-21s, clients: 1, corpus: 36, objectives: 0, executions: 165, exec/sec: 103.2
[32m INFO[0m ============= Coverage Summary =============
[32m INFO[0m 0xbb################################c095c: 11.03% Instruction Covered, 13.16% Branch Covered
[32m INFO[0m 0x2f################################cf566: 42.63% Instruction Covered, 38.86% Branch Covered
[32m INFO[0m [Stats #0] run time: 0h-0m-21s, clients: 1, corpus: 36, objectives: 0, executions: 165, exec/sec: 103.0
[32m INFO[0m ============= New Corpus Item =============
[32m INFO[0m Reverted? true 
 Txn:
[Sender] 0x8E################################d79dd
   [1] Router.swapExactETHForTokens{value: 10.0 ether}(0, path:(WETH  0x2f################################cF566), address(this), block.timestamp);
   [1] Router.swapExactETHForTokens{value: 3247.2933 ether}(0, path:(WETH  0x2f################################cF566), address(this), block.timestamp);
[Sender] 0x35################################31dDb
   [1] 0x2f################################cF566.includeInReward(0x00################################00000)
       0x08################################000000000000000000000000000000000002000000000000000000000000000000000000000000000000000000000000000204f776e61626c653a2063616c6c6572206973206e6f7420746865206f776e6572

[32m INFO[0m ==========================================
[32m INFO[0m [Testcase #0] run time: 0h-0m-21s, clients: 1, corpus: 37, objectives: 0, executions: 193, exec/sec: 120.4
[32m INFO[0m [Stats #0] run time: 0h-0m-21s, clients: 1, corpus: 37, objectives: 0, executions: 193, exec/sec: 120.4
[32m INFO[0m ============= New Corpus Item =============
[32m INFO[0m Reverted? true 
 Txn:
[Sender] 0x8E################################d79dd
   [1] Router.swapExactETHForTokens{value: 3116.4275 ether}(0, path:(WETH  0x2f################################cF566), address(this), block.timestamp);
   [1] Router.swapExactETHForTokens{value: 3916.9970 ether}(0, path:(WETH  0x2f################################cF566), address(this), block.timestamp);
   [1] Router.swapExactETHForTokens{value: 4226.6379 ether}(0, path:(WETH  0x2f################################cF566), address(this), block.timestamp);
[Sender] 0x35################################31dDb
   [1] 0x2f################################cF566.includeInReward{value: 1244.6169 ether}(0x2f################################cF566)

[32m INFO[0m ==========================================
[32m INFO[0m [Testcase #0] run time: 0h-0m-21s, clients: 1, corpus: 38, objectives: 0, executions: 199, exec/sec: 124.1
[32m INFO[0m ============= Coverage Summary =============
[32m INFO[0m 0x2f################################cf566: 42.66% Instruction Covered, 39.10% Branch Covered
[32m INFO[0m 0xbb################################c095c: 11.03% Instruction Covered, 13.16% Branch Covered
[32m INFO[0m [Stats #0] run time: 0h-0m-21s, clients: 1, corpus: 38, objectives: 0, executions: 199, exec/sec: 123.8
[32m INFO[0m ============= New Corpus Item =============
[32m INFO[0m Reverted? true 
 Txn:
[Sender] 0x8E################################d79dd
   [1] Router.swapExactETHForTokens{value: 3116.4275 ether}(0, path:(WETH  0x2f################################cF566), address(this), block.timestamp);
   [1] Router.swapExactETHForTokens{value: 3916.9970 ether}(0, path:(WETH  0x2f################################cF566), address(this), block.timestamp);
   [1] Router.swapExactETHForTokens{value: 1192.4292 ether}(0, path:(WETH  0x2f################################cF566), address(this), block.timestamp);
   [1] 0x2f################################cF566.increaseAllowance{value: 3392.5185 ether}(0x00################################00000, 0)

[32m INFO[0m ==========================================
[32m INFO[0m [Testcase #0] run time: 0h-0m-21s, clients: 1, corpus: 39, objectives: 0, executions: 225, exec/sec: 139.9
[32m INFO[0m [Stats #0] run time: 0h-0m-21s, clients: 1, corpus: 39, objectives: 0, executions: 225, exec/sec: 139.9
[32m INFO[0m ============= New Corpus Item =============
[32m INFO[0m Reverted? true 
 Txn:
[Sender] 0x8E################################d79dd
   [1] Router.swapExactETHForTokens{value: 3116.4275 ether}(0, path:(WETH  0x2f################################cF566), address(this), block.timestamp);
   [1] 0x2f################################cF566.increaseAllowance(0x00################################00000, 1766833584805050754263400167235375006012147078303412428.6485 ether)
       0x08################################0000000000000000000000000000000000020000000000000000000000000000000000000000000000000000000000000002245524332303a20617070726f766520746f20746865207a65726f2061646472657373000000000000000000000000000000000000000000000000000000000000

[32m INFO[0m ==========================================
[32m INFO[0m [Testcase #0] run time: 0h-0m-21s, clients: 1, corpus: 40, objectives: 0, executions: 226, exec/sec: 140.5
[32m INFO[0m [Stats #0] run time: 0h-0m-21s, clients: 1, corpus: 40, objectives: 0, executions: 226, exec/sec: 140.4
[32m INFO[0m ============= New Corpus Item =============
[32m INFO[0m Reverted? false 
 Txn:
[Sender] 0x8E################################d79dd
   [1] Router.swapExactETHForTokens{value: 3116.4275 ether}(0, path:(WETH  0x2f################################cF566), address(this), block.timestamp);
   [1] Router.swapExactETHForTokens{value: 3916.9970 ether}(0, path:(WETH  0x2f################################cF566), address(this), block.timestamp);
[Sender] 0x68################################c9024
   [1] 0x2f################################cF566.increaseAllowance(0x8E################################d79dd, 8127329867898666864697866704220206189853845416.5391 ether)
       0x01

[32m INFO[0m ==========================================
[32m INFO[0m [Testcase #0] run time: 0h-0m-21s, clients: 1, corpus: 41, objectives: 0, executions: 229, exec/sec: 142.2
[32m INFO[0m ============= Coverage Summary =============
[32m INFO[0m 0x2f################################cf566: 43.01% Instruction Covered, 39.34% Branch Covered
[32m INFO[0m 0xbb################################c095c: 11.03% Instruction Covered, 13.16% Branch Covered
[32m INFO[0m [Stats #0] run time: 0h-0m-22s, clients: 1, corpus: 41, objectives: 0, executions: 256, exec/sec: 143.1
[32m INFO[0m [Stats #0] run time: 0h-0m-22s, clients: 1, corpus: 41, objectives: 0, executions: 256, exec/sec: 143.1
[32m INFO[0m ============= New Corpus Item =============
[32m INFO[0m Reverted? true 
 Txn:
[Sender] 0x8E################################d79dd
   [1] Router.swapExactETHForTokens{value: 3116.4275 ether}(0, path:(WETH  0x2f################################cF566), address(this), block.timestamp);
   [1] Router.swapExactETHForTokens{value: 3916.9970 ether}(0, path:(WETH  0x2f################################cF566), address(this), block.timestamp);
   [1] Router.swapExactETHForTokens{value: 1192.4292 ether}(0, path:(WETH  0x2f################################cF566), address(this), block.timestamp);
[Sender] 0x68################################c9024
   [1] 0x2f################################cF566.lock(43735954624286670439330618660877950675476552978142099560163.8617 ether)
       0x08################################000000000000000000000000000000000002000000000000000000000000000000000000000000000000000000000000000204f776e61626c653a2063616c6c6572206973206e6f7420746865206f776e6572

[32m INFO[0m ==========================================
[32m INFO[0m [Testcase #0] run time: 0h-0m-22s, clients: 1, corpus: 42, objectives: 0, executions: 257, exec/sec: 143.5
[32m INFO[0m [Stats #0] run time: 0h-0m-22s, clients: 1, corpus: 42, objectives: 0, executions: 257, exec/sec: 143.5
[32m INFO[0m ============= New Corpus Item =============
[32m INFO[0m Reverted? true 
 Txn:
[Sender] 0x8E################################d79dd
   [1] Router.swapExactETHForTokens{value: 3116.4275 ether}(0, path:(WETH  0x2f################################cF566), address(this), block.timestamp);
   [1] Router.swapExactETHForTokens{value: 3916.9970 ether}(0, path:(WETH  0x2f################################cF566), address(this), block.timestamp);
   [1] Router.swapExactETHForTokens{value: 4226.6379 ether}(0, path:(WETH  0x2f################################cF566), address(this), block.timestamp);
[Sender] 0x68################################c9024
   [1] 0x2f################################cF566.lock{value: 4496.3470 ether}(17629600039318665503550524360511198099011861701534570669687.7471 ether)

[32m INFO[0m ==========================================
[32m INFO[0m [Testcase #0] run time: 0h-0m-22s, clients: 1, corpus: 43, objectives: 0, executions: 263, exec/sec: 146.8
[32m INFO[0m ============= Coverage Summary =============
[32m INFO[0m 0xbb################################c095c: 11.03% Instruction Covered, 13.16% Branch Covered
[32m INFO[0m 0x2f################################cf566: 43.04% Instruction Covered, 39.57% Branch Covered
[32m INFO[0m [Stats #0] run time: 0h-0m-22s, clients: 1, corpus: 43, objectives: 0, executions: 263, exec/sec: 146.3
[32m INFO[0m ============= New Corpus Item =============
[32m INFO[0m Reverted? true 
 Txn:
[Sender] 0x68################################c9024
   [1] 0x2f################################cF566.maxSwapLimit(0x35################################31dDb, false)
       0x08################################000000000000000000000000000000000002000000000000000000000000000000000000000000000000000000000000000204f776e61626c653a2063616c6c6572206973206e6f7420746865206f776e6572

[32m INFO[0m ==========================================
[32m INFO[0m [Testcase #0] run time: 0h-0m-22s, clients: 1, corpus: 44, objectives: 0, executions: 289, exec/sec: 160.8
[32m INFO[0m [Stats #0] run time: 0h-0m-22s, clients: 1, corpus: 44, objectives: 0, executions: 289, exec/sec: 160.7
[32m INFO[0m ============= New Corpus Item =============
[32m INFO[0m Reverted? true 
 Txn:
[Sender] 0x8E################################d79dd
   [1] Router.swapExactETHForTokens{value: 3116.4275 ether}(0, path:(WETH  0x2f################################cF566), address(this), block.timestamp);
   [1] Router.swapExactETHForTokens{value: 3916.9970 ether}(0, path:(WETH  0x2f################################cF566), address(this), block.timestamp);
   [1] Router.swapExactETHForTokens{value: 4226.6379 ether}(0, path:(WETH  0x2f################################cF566), address(this), block.timestamp);
[Sender] 0x68################################c9024
   [1] 0x2f################################cF566.maxSwapLimit{value: 3144.9758 ether}(0x00################################00000, false)

[32m INFO[0m ==========================================
[32m INFO[0m [Testcase #0] run time: 0h-0m-22s, clients: 1, corpus: 45, objectives: 0, executions: 302, exec/sec: 167.9
[32m INFO[0m ============= Coverage Summary =============
[32m INFO[0m 0x2f################################cf566: 43.07% Instruction Covered, 39.81% Branch Covered
[32m INFO[0m 0xbb################################c095c: 11.03% Instruction Covered, 13.16% Branch Covered
[32m INFO[0m [Stats #0] run time: 0h-0m-22s, clients: 1, corpus: 45, objectives: 0, executions: 302, exec/sec: 167.5
[32m INFO[0m ============= New Corpus Item =============
[32m INFO[0m Reverted? true 
 Txn:
[Sender] 0x8E################################d79dd
   [1] Router.swapExactETHForTokens{value: 3116.4275 ether}(0, path:(WETH  0x2f################################cF566), address(this), block.timestamp);
   [1] Router.swapExactETHForTokens{value: 2376.7553 ether}(0, path:(WETH  0x2f################################cF566), address(this), block.timestamp);
[Sender] 0xe1################################c8510
   [1] 0x2f################################cF566.approve(0x68################################c9024, 762422947222384039394719081260178024193778377397729575508.9069 ether)
       0x01
[Sender] 0x8E################################d79dd
   [1] 0x2f################################cF566.renounceOwnership{value: 1}()

[32m INFO[0m ==========================================
[32m INFO[0m [Testcase #0] run time: 0h-0m-22s, clients: 1, corpus: 46, objectives: 0, executions: 321, exec/sec: 178.0
[32m INFO[0m [Stats #0] run time: 0h-0m-22s, clients: 1, corpus: 46, objectives: 0, executions: 321, exec/sec: 178.0
[32m INFO[0m ============= New Corpus Item =============
[32m INFO[0m Reverted? true 
 Txn:
[Sender] 0x8E################################d79dd
   [1] Router.swapExactETHForTokens{value: 3116.4275 ether}(0, path:(WETH  0x2f################################cF566), address(this), block.timestamp);
   [1] Router.swapExactETHForTokens{value: 3916.9970 ether}(0, path:(WETH  0x2f################################cF566), address(this), block.timestamp);
   [1] Router.swapExactETHForTokens{value: 1192.4292 ether}(0, path:(WETH  0x2f################################cF566), address(this), block.timestamp);
[Sender] 0x35################################31dDb
   [1] 0x2f################################cF566.renounceOwnership()
       0x08################################000000000000000000000000000000000002000000000000000000000000000000000000000000000000000000000000000204f776e61626c653a2063616c6c6572206973206e6f7420746865206f776e6572

[32m INFO[0m ==========================================
[32m INFO[0m [Testcase #0] run time: 0h-0m-22s, clients: 1, corpus: 47, objectives: 0, executions: 322, exec/sec: 178.5
[32m INFO[0m ============= Coverage Summary =============
[32m INFO[0m 0xbb################################c095c: 11.03% Instruction Covered, 13.16% Branch Covered
[32m INFO[0m 0x2f################################cf566: 43.11% Instruction Covered, 40.05% Branch Covered
[32m INFO[0m [Stats #0] run time: 0h-0m-22s, clients: 1, corpus: 47, objectives: 0, executions: 322, exec/sec: 178.1
[32m INFO[0m ============= New Corpus Item =============
[32m INFO[0m Reverted? true 
 Txn:
[Sender] 0x8E################################d79dd
   [1] Router.swapExactETHForTokens{value: 3116.4275 ether}(0, path:(WETH  0x2f################################cF566), address(this), block.timestamp);
   [1] Router.swapExactETHForTokens{value: 3916.9970 ether}(0, path:(WETH  0x2f################################cF566), address(this), block.timestamp);
   [1] Router.swapExactETHForTokens{value: 4226.6379 ether}(0, path:(WETH  0x2f################################cF566), address(this), block.timestamp);
[Sender] 0x68################################c9024
   [1] 0x2f################################cF566.setLiquidityFeePercent(107579307858429366666474489461138147.6411 ether)
       0x08################################000000000000000000000000000000000002000000000000000000000000000000000000000000000000000000000000000204f776e61626c653a2063616c6c6572206973206e6f7420746865206f776e6572

[32m INFO[0m ==========================================
[32m INFO[0m [Testcase #0] run time: 0h-0m-22s, clients: 1, corpus: 48, objectives: 0, executions: 352, exec/sec: 194.7
[32m INFO[0m [Stats #0] run time: 0h-0m-22s, clients: 1, corpus: 48, objectives: 0, executions: 352, exec/sec: 194.6
[32m INFO[0m ============= New Corpus Item =============
[32m INFO[0m Reverted? true 
 Txn:
[Sender] 0x8E################################d79dd
   [1] Router.swapExactETHForTokens{value: 3116.4275 ether}(0, path:(WETH  0x2f################################cF566), address(this), block.timestamp);
   [1] Router.swapExactETHForTokens{value: 3916.9970 ether}(0, path:(WETH  0x2f################################cF566), address(this), block.timestamp);
   [1] Router.swapExactETHForTokens{value: 1192.4292 ether}(0, path:(WETH  0x2f################################cF566), address(this), block.timestamp);
[Sender] 0x68################################c9024
   [1] 0x2f################################cF566.setLiquidityFeePercent{value: 4639.3564 ether}(13615273529962816788300317161502706770531895815507.2884 ether)

[32m INFO[0m ==========================================
[32m INFO[0m [Testcase #0] run time: 0h-0m-22s, clients: 1, corpus: 49, objectives: 0, executions: 363, exec/sec: 200.6
[32m INFO[0m ============= Coverage Summary =============
[32m INFO[0m 0x2f################################cf566: 43.14% Instruction Covered, 40.28% Branch Covered
[32m INFO[0m 0xbb################################c095c: 11.03% Instruction Covered, 13.16% Branch Covered
[32m INFO[0m [Stats #0] run time: 0h-0m-22s, clients: 1, corpus: 49, objectives: 0, executions: 363, exec/sec: 200.1
[32m INFO[0m ============= New Corpus Item =============
[32m INFO[0m Reverted? true 
 Txn:
[Sender] 0x8E################################d79dd
   [1] Router.swapExactETHForTokens{value: 3116.4275 ether}(0, path:(WETH  0x2f################################cF566), address(this), block.timestamp);
[Sender] 0xe1################################c8510
   [1] 0x2f################################cF566.setMaxTxPercent(53920304710440609890844568916334900684900534529047.5534 ether)
       0x08################################000000000000000000000000000000000002000000000000000000000000000000000000000000000000000000000000000204f776e61626c653a2063616c6c6572206973206e6f7420746865206f776e6572

[32m INFO[0m ==========================================
[32m INFO[0m [Testcase #0] run time: 0h-0m-22s, clients: 1, corpus: 50, objectives: 0, executions: 384, exec/sec: 211.7
[32m INFO[0m [Stats #0] run time: 0h-0m-22s, clients: 1, corpus: 50, objectives: 0, executions: 384, exec/sec: 211.6
[32m INFO[0m ============= New Corpus Item =============
[32m INFO[0m Reverted? true 
 Txn:
[Sender] 0x8E################################d79dd
   [1] Router.swapExactETHForTokens{value: 3116.4275 ether}(0, path:(WETH  0x2f################################cF566), address(this), block.timestamp);
[Sender] 0xe1################################c8510
   [1] 0x2f################################cF566.setMaxTxPercent{value: 17705713}(0)

[32m INFO[0m ==========================================
[32m INFO[0m [Testcase #0] run time: 0h-0m-22s, clients: 1, corpus: 51, objectives: 0, executions: 398, exec/sec: 219.2
[32m INFO[0m ============= Coverage Summary =============
[32m INFO[0m 0x2f################################cf566: 43.17% Instruction Covered, 40.52% Branch Covered
[32m INFO[0m 0xbb################################c095c: 11.03% Instruction Covered, 13.16% Branch Covered
[32m INFO[0m [Stats #0] run time: 0h-0m-22s, clients: 1, corpus: 51, objectives: 0, executions: 398, exec/sec: 218.8
[32m INFO[0m ============= New Corpus Item =============
[32m INFO[0m Reverted? true 
 Txn:
[Sender] 0x8E################################d79dd
   [1] Router.swapExactETHForTokens{value: 3116.4275 ether}(0, path:(WETH  0x2f################################cF566), address(this), block.timestamp);
   [1] Router.swapExactETHForTokens{value: 2376.7553 ether}(0, path:(WETH  0x2f################################cF566), address(this), block.timestamp);
[Sender] 0xe1################################c8510
   [1] 0x2f################################cF566.approve(0x68################################c9024, 762422947222384039394719081260178024193778377397729575508.9069 ether)
       0x01
[Sender] 0x68################################c9024
   [1] 0x2f################################cF566.setSwapAndLiquifyEnabled(false)
       0x08################################000000000000000000000000000000000002000000000000000000000000000000000000000000000000000000000000000204f776e61626c653a2063616c6c6572206973206e6f7420746865206f776e6572

[32m INFO[0m ==========================================
[32m INFO[0m [Testcase #0] run time: 0h-0m-22s, clients: 1, corpus: 52, objectives: 0, executions: 416, exec/sec: 228.6
[32m INFO[0m [Stats #0] run time: 0h-0m-22s, clients: 1, corpus: 52, objectives: 0, executions: 416, exec/sec: 228.6
[32m INFO[0m ============= New Corpus Item =============
[32m INFO[0m Reverted? true 
 Txn:
[Sender] 0x8E################################d79dd
   [1] Router.swapExactETHForTokens{value: 3116.4275 ether}(0, path:(WETH  0x2f################################cF566), address(this), block.timestamp);
   [1] Router.swapExactETHForTokens{value: 3916.9970 ether}(0, path:(WETH  0x2f################################cF566), address(this), block.timestamp);
   [1] Router.swapExactETHForTokens{value: 1192.4292 ether}(0, path:(WETH  0x2f################################cF566), address(this), block.timestamp);
   [1] Router.swapExactETHForTokens{value: 4718.6939 ether}(0, path:(WETH  0x2f################################cF566), address(this), block.timestamp);
[Sender] 0x68################################c9024
   [1] 0x2f################################cF566.setSwapAndLiquifyEnabled{value: 5}(true)

[32m INFO[0m ==========================================
[32m INFO[0m [Testcase #0] run time: 0h-0m-22s, clients: 1, corpus: 53, objectives: 0, executions: 417, exec/sec: 229.1
[32m INFO[0m ============= Coverage Summary =============
[32m INFO[0m 0x2f################################cf566: 43.21% Instruction Covered, 40.76% Branch Covered
[32m INFO[0m 0xbb################################c095c: 11.03% Instruction Covered, 13.16% Branch Covered
[32m INFO[0m [Stats #0] run time: 0h-0m-22s, clients: 1, corpus: 53, objectives: 0, executions: 417, exec/sec: 228.4
[32m INFO[0m ============= New Corpus Item =============
[32m INFO[0m Reverted? true 
 Txn:
[Sender] 0x8E################################d79dd
   [1] Router.swapExactETHForTokens{value: 3116.4275 ether}(0, path:(WETH  0x2f################################cF566), address(this), block.timestamp);
   [1] Router.swapExactETHForTokens{value: 2272.4504 ether}(0, path:(WETH  0x2f################################cF566), address(this), block.timestamp);
   [1] Router.swapExactETHForTokens{value: 1321.3448 ether}(0, path:(WETH  0x2f################################cF566), address(this), block.timestamp);
   [1] Router.swapExactETHForTokens{value: 4722.3664 ether}(0, path:(WETH  0x2f################################cF566), address(this), block.timestamp);
   [1] 0x2f################################cF566.setTaxFeePercent{value: 1797.8058 ether}(26567219784938711653760999334070757384751432487836.3680 ether)

[32m INFO[0m ==========================================
[32m INFO[0m [Testcase #0] run time: 0h-0m-22s, clients: 1, corpus: 54, objectives: 0, executions: 448, exec/sec: 245.3
[32m INFO[0m [Stats #0] run time: 0h-0m-22s, clients: 1, corpus: 54, objectives: 0, executions: 448, exec/sec: 245.2
[32m INFO[0m ============= New Corpus Item =============
[32m INFO[0m Reverted? true 
 Txn:
[Sender] 0x8E################################d79dd
   [1] Router.swapExactETHForTokens{value: 3116.4275 ether}(0, path:(WETH  0x2f################################cF566), address(this), block.timestamp);
   [1] 0x2f################################cF566.setTaxFeePercent(67015675556640105265316239503793209761119048927616582639843.1847 ether)
       0x08################################000000000000000000000000000000000002000000000000000000000000000000000000000000000000000000000000000204f776e61626c653a2063616c6c6572206973206e6f7420746865206f776e6572

[32m INFO[0m ==========================================
[32m INFO[0m [Testcase #0] run time: 0h-0m-22s, clients: 1, corpus: 55, objectives: 0, executions: 450, exec/sec: 240.6
[32m INFO[0m ============= Coverage Summary =============
[32m INFO[0m 0xbb################################c095c: 11.03% Instruction Covered, 13.16% Branch Covered
[32m INFO[0m 0x2f################################cf566: 43.24% Instruction Covered, 41.00% Branch Covered
[32m INFO[0m [Stats #0] run time: 0h-0m-23s, clients: 1, corpus: 55, objectives: 0, executions: 450, exec/sec: 171.4
[32m INFO[0m ============= New Corpus Item =============
[32m INFO[0m Reverted? true 
 Txn:
[Sender] 0x8E################################d79dd
   [1] Router.swapExactETHForTokens{value: 3116.4275 ether}(0, path:(WETH  0x2f################################cF566), address(this), block.timestamp);
   [1] Router.swapExactETHForTokens{value: 2376.7553 ether}(0, path:(WETH  0x2f################################cF566), address(this), block.timestamp);
[Sender] 0xe1################################c8510
   [1] 0x2f################################cF566.approve(0x68################################c9024, 762422947222384039394719081260178024193778377397729575508.9069 ether)
       0x01
[Sender] 0x68################################c9024
   [1] 0x2f################################cF566.transfer(0x00################################00000, 0)
       0x08################################0000000000000000000000000000000000020000000000000000000000000000000000000000000000000000000000000002345524332303a207472616e7366657220746f20746865207a65726f20616464726573730000000000000000000000000000000000000000000000000000000000

[32m INFO[0m ==========================================
[32m INFO[0m [Testcase #0] run time: 0h-0m-23s, clients: 1, corpus: 56, objectives: 0, executions: 480, exec/sec: 179.3
[32m INFO[0m [Stats #0] run time: 0h-0m-23s, clients: 1, corpus: 56, objectives: 0, executions: 480, exec/sec: 169.2
[32m INFO[0m ============= New Corpus Item =============
[32m INFO[0m Reverted? true 
 Txn:
[Sender] 0x8E################################d79dd
   [1] Router.swapExactETHForTokens{value: 3116.4275 ether}(0, path:(WETH  0x2f################################cF566), address(this), block.timestamp);
   [1] Router.swapExactETHForTokens{value: 3916.9970 ether}(0, path:(WETH  0x2f################################cF566), address(this), block.timestamp);
[Sender] 0x68################################c9024
   [1] 0x2f################################cF566.transfer{value: 224}(0x8E################################d79dd, 99066754212592616320477833743968030019951735121327582991502.6511 ether)

[32m INFO[0m ==========================================
[32m INFO[0m [Testcase #0] run time: 0h-0m-23s, clients: 1, corpus: 57, objectives: 0, executions: 490, exec/sec: 171.6
[32m INFO[0m [Stats #0] run time: 0h-0m-23s, clients: 1, corpus: 57, objectives: 0, executions: 490, exec/sec: 167.0
[32m INFO[0m ============= New Corpus Item =============
[32m INFO[0m Reverted? true 
 Txn:
[Sender] 0x8E################################d79dd
   [1] Router.swapExactETHForTokens{value: 3116.4275 ether}(0, path:(WETH  0x2f################################cF566), address(this), block.timestamp);
   [1] Router.swapExactETHForTokens{value: 3916.9970 ether}(0, path:(WETH  0x2f################################cF566), address(this), block.timestamp);
   [1] Router.swapExactETHForTokens{value: 4226.6379 ether}(0, path:(WETH  0x2f################################cF566), address(this), block.timestamp);
[Sender] 0x68################################c9024
   [1] 0x2f################################cF566.transfer(0x35################################31dDb, 7.2057 ether)
       0x08################################00000000000000000000000000000000000200000000000000000000000000000000000000000000000000000000000000021536166654d6174683a206d756c7469706c69636174696f6e206f766572666c6f7700000000000000000000000000000000000000000000000000000000000000

[32m INFO[0m ==========================================
[32m INFO[0m [Testcase #0] run time: 0h-0m-23s, clients: 1, corpus: 58, objectives: 0, executions: 510, exec/sec: 173.0
[32m INFO[0m ============= Coverage Summary =============
[32m INFO[0m 0x2f################################cf566: 43.70% Instruction Covered, 41.47% Branch Covered
[32m INFO[0m 0xbb################################c095c: 11.03% Instruction Covered, 13.16% Branch Covered
[32m INFO[0m [Stats #0] run time: 0h-0m-23s, clients: 1, corpus: 58, objectives: 0, executions: 511, exec/sec: 143.0
[32m INFO[0m [Stats #0] run time: 0h-0m-23s, clients: 1, corpus: 58, objectives: 0, executions: 511, exec/sec: 143.0
[32m INFO[0m ============= New Corpus Item =============
[32m INFO[0m Reverted? true 
 Txn:
[Sender] 0x8E################################d79dd
   [1] Router.swapExactETHForTokens{value: 3116.4275 ether}(0, path:(WETH  0x2f################################cF566), address(this), block.timestamp);
   [1] 0x2f################################cF566.approve(0x2f################################cF566, 3450873576736734071457890263293774113175553712611231.5289 ether)
       0x01
[Sender] 0x35################################31dDb
   [1] 0x2f################################cF566.approve(0x8E################################d79dd, 252015620447234677601280600161529708231997015082306875316.5431 ether)
       0x01
[Sender] 0xe1################################c8510
   [1] 0x2f################################cF566.approve(0x8E################################d79dd, 187450736968290149881295052975634727913824674408122.7987 ether)
       0x01
[Sender] 0x35################################31dDb
   [1] 0x2f################################cF566.transferFrom(0x35################################31dDb, 0xe1################################c8510, 31057772995124028427862786191441375459634291644525061.9584 ether)
       0x08################################000000000000000000000000000000000002000000000000000000000000000000000000000000000000000000000000000285472616e7366657220616d6f756e74206578636565647320746865206d61785478416d6f756e742e000000000000000000000000000000000000000000000000

[32m INFO[0m ==========================================
[32m INFO[0m [Testcase #0] run time: 0h-0m-24s, clients: 1, corpus: 59, objectives: 0, executions: 512, exec/sec: 138.9
[32m INFO[0m [Stats #0] run time: 0h-0m-24s, clients: 1, corpus: 59, objectives: 0, executions: 512, exec/sec: 138.9
[32m INFO[0m ============= New Corpus Item =============
[32m INFO[0m Reverted? true 
 Txn:
[Sender] 0x8E################################d79dd
   [1] Router.swapExactETHForTokens{value: 3116.4275 ether}(0, path:(WETH  0x2f################################cF566), address(this), block.timestamp);
   [1] Router.swapExactETHForTokens{value: 3916.9970 ether}(0, path:(WETH  0x2f################################cF566), address(this), block.timestamp);
   [1] Router.swapExactETHForTokens{value: 4226.6379 ether}(0, path:(WETH  0x2f################################cF566), address(this), block.timestamp);
[Sender] 0xe1################################c8510
   [1] 0x2f################################cF566.transferFrom(0x00################################00000, 0x00################################00000, 0)
       0x08################################0000000000000000000000000000000000020000000000000000000000000000000000000000000000000000000000000002545524332303a207472616e736665722066726f6d20746865207a65726f2061646472657373000000000000000000000000000000000000000000000000000000

[32m INFO[0m ==========================================
[32m INFO[0m [Testcase #0] run time: 0h-0m-24s, clients: 1, corpus: 60, objectives: 0, executions: 513, exec/sec: 138.5
[32m INFO[0m [Stats #0] run time: 0h-0m-24s, clients: 1, corpus: 60, objectives: 0, executions: 513, exec/sec: 138.5
[32m INFO[0m ============= New Corpus Item =============
[32m INFO[0m Reverted? true 
 Txn:
[Sender] 0x8E################################d79dd
   [1] Router.swapExactETHForTokens{value: 3116.4275 ether}(0, path:(WETH  0x2f################################cF566), address(this), block.timestamp);
   [1] Router.swapExactETHForTokens{value: 2272.4504 ether}(0, path:(WETH  0x2f################################cF566), address(this), block.timestamp);
   [1] Router.swapExactETHForTokens{value: 1321.3448 ether}(0, path:(WETH  0x2f################################cF566), address(this), block.timestamp);
   [1] Router.swapExactETHForTokens{value: 4722.3664 ether}(0, path:(WETH  0x2f################################cF566), address(this), block.timestamp);
[Sender] 0xe1################################c8510
   [1] 0x2f################################cF566.transferFrom{value: 1614.1984 ether}(0x68################################c9024, 0xe1################################c8510, 57364700673499407569877232884827404293805873647634852627326.9184 ether)

[32m INFO[0m ==========================================
[32m INFO[0m [Testcase #0] run time: 0h-0m-24s, clients: 1, corpus: 61, objectives: 0, executions: 515, exec/sec: 138.3
[32m INFO[0m ============= Coverage Summary =============
[32m INFO[0m 0x2f################################cf566: 44.16% Instruction Covered, 41.94% Branch Covered
[32m INFO[0m 0xbb################################c095c: 11.03% Instruction Covered, 13.16% Branch Covered
[32m INFO[0m [Stats #0] run time: 0h-0m-25s, clients: 1, corpus: 61, objectives: 0, executions: 543, exec/sec: 99.48
[32m INFO[0m [Stats #0] run time: 0h-0m-25s, clients: 1, corpus: 61, objectives: 0, executions: 543, exec/sec: 99.47
[32m INFO[0m ============= New Corpus Item =============
[32m INFO[0m Reverted? true 
 Txn:
[Sender] 0x8E################################d79dd
   [1] Router.swapExactETHForTokens{value: 10.0 ether}(0, path:(WETH  0x2f################################cF566), address(this), block.timestamp);
   [1] Router.swapExactETHForTokens{value: 3247.2933 ether}(0, path:(WETH  0x2f################################cF566), address(this), block.timestamp);
[Sender] 0xe1################################c8510
   [1] 0x2f################################cF566.transferOwnership(0xe1################################c8510)
       0x08################################000000000000000000000000000000000002000000000000000000000000000000000000000000000000000000000000000204f776e61626c653a2063616c6c6572206973206e6f7420746865206f776e6572

[32m INFO[0m ==========================================
[32m INFO[0m [Testcase #0] run time: 0h-0m-25s, clients: 1, corpus: 62, objectives: 0, executions: 544, exec/sec: 99.64
[32m INFO[0m [Stats #0] run time: 0h-0m-25s, clients: 1, corpus: 62, objectives: 0, executions: 544, exec/sec: 99.61
[32m INFO[0m ============= New Corpus Item =============
[32m INFO[0m Reverted? true 
 Txn:
[Sender] 0x8E################################d79dd
   [1] Router.swapExactETHForTokens{value: 3116.4275 ether}(0, path:(WETH  0x2f################################cF566), address(this), block.timestamp);
   [1] Router.swapExactETHForTokens{value: 3916.9970 ether}(0, path:(WETH  0x2f################################cF566), address(this), block.timestamp);
   [1] Router.swapExactETHForTokens{value: 4226.6379 ether}(0, path:(WETH  0x2f################################cF566), address(this), block.timestamp);
[Sender] 0x35################################31dDb
   [1] 0x2f################################cF566.transferOwnership{value: 4212}(0x8E################################d79dd)

[32m INFO[0m ==========================================
[32m INFO[0m [Testcase #0] run time: 0h-0m-25s, clients: 1, corpus: 63, objectives: 0, executions: 557, exec/sec: 102.0
[32m INFO[0m ============= Coverage Summary =============
[32m INFO[0m 0xbb################################c095c: 11.03% Instruction Covered, 13.16% Branch Covered
[32m INFO[0m 0x2f################################cf566: 44.19% Instruction Covered, 42.18% Branch Covered
[32m INFO[0m [Stats #0] run time: 0h-0m-25s, clients: 1, corpus: 63, objectives: 0, executions: 557, exec/sec: 101.8
[32m INFO[0m ============= New Corpus Item =============
[32m INFO[0m Reverted? true 
 Txn:
[Sender] 0x8E################################d79dd
   [1] Router.swapExactETHForTokens{value: 3116.4275 ether}(0, path:(WETH  0x2f################################cF566), address(this), block.timestamp);
   [1] Router.swapExactETHForTokens{value: 3916.9970 ether}(0, path:(WETH  0x2f################################cF566), address(this), block.timestamp);
   [1] Router.swapExactETHForTokens{value: 4226.6379 ether}(0, path:(WETH  0x2f################################cF566), address(this), block.timestamp);
[Sender] 0x35################################31dDb
   [1] 0x2f################################cF566.unlock{value: 2474.8034 ether}()

[32m INFO[0m ==========================================
[32m INFO[0m [Testcase #0] run time: 0h-0m-25s, clients: 1, corpus: 64, objectives: 0, executions: 576, exec/sec: 105.2
[32m INFO[0m [Stats #0] run time: 0h-0m-25s, clients: 1, corpus: 64, objectives: 0, executions: 576, exec/sec: 105.2
[32m INFO[0m ============= New Corpus Item =============
[32m INFO[0m Reverted? true 
 Txn:
[Sender] 0x8E################################d79dd
   [1] Router.swapExactETHForTokens{value: 3116.4275 ether}(0, path:(WETH  0x2f################################cF566), address(this), block.timestamp);
[Sender] 0x35################################31dDb
   [1] 0x2f################################cF566.unlock()
       0x08################################00000000000000000000000000000000000200000000000000000000000000000000000000000000000000000000000000023596f7520646f6e27742068617665207065726d697373696f6e20746f20756e6c6f636b0000000000000000000000000000000000000000000000000000000000

[32m INFO[0m ==========================================
[32m INFO[0m [Testcase #0] run time: 0h-0m-25s, clients: 1, corpus: 65, objectives: 0, executions: 578, exec/sec: 105.6
[32m INFO[0m ============= Coverage Summary =============
[32m INFO[0m 0xbb################################c095c: 11.03% Instruction Covered, 13.16% Branch Covered
[32m INFO[0m 0x2f################################cf566: 44.23% Instruction Covered, 42.42% Branch Covered
[32m INFO[0m [Stats #0] run time: 0h-0m-25s, clients: 1, corpus: 65, objectives: 0, executions: 578, exec/sec: 105.4
[32m INFO[0m ============= New Corpus Item =============
[32m INFO[0m Reverted? false 
 Txn:
[Sender] 0xe1################################c8510
   [1] 0x2f################################cF566.approve(0x68################################c9024, 0)
       0x01
[Sender] 0x68################################c9024
   [1] 0x2f################################cF566.call{value: 148598732884136}()

[32m INFO[0m ==========================================
[32m INFO[0m [Testcase #0] run time: 0h-0m-25s, clients: 1, corpus: 66, objectives: 0, executions: 608, exec/sec: 110.9
[32m INFO[0m ============= Coverage Summary =============
[32m INFO[0m 0x2f################################cf566: 44.23% Instruction Covered, 42.42% Branch Covered
[32m INFO[0m 0xbb################################c095c: 11.03% Instruction Covered, 13.16% Branch Covered
[32m INFO[0m [Stats #0] run time: 0h-0m-26s, clients: 1, corpus: 66, objectives: 0, executions: 608, exec/sec: 107.6
[32m INFO[0m ============= New Corpus Item =============
[32m INFO[0m Reverted? false 
 Txn:
[Sender] 0x8E################################d79dd
   [1] Router.swapExactETHForTokens{value: 3116.4275 ether}(0, path:(WETH  0x2f################################cF566), address(this), block.timestamp);
   [1] Router.swapExactETHForTokens{value: 3916.9970 ether}(0, path:(WETH  0x2f################################cF566), address(this), block.timestamp);
   [1] Router.swapExactETHForTokens{value: 4226.6379 ether}(0, path:(WETH  0x2f################################cF566), address(this), block.timestamp);
   [1] 0x2f################################cF566.decreaseAllowance(0x35################################31dDb, 0)
       0x01

[32m INFO[0m ==========================================
[32m INFO[0m [Testcase #0] run time: 0h-0m-26s, clients: 1, corpus: 67, objectives: 0, executions: 906, exec/sec: 160.4
[32m INFO[0m ============= Coverage Summary =============
[32m INFO[0m 0xbb################################c095c: 11.03% Instruction Covered, 13.16% Branch Covered
[32m INFO[0m 0x2f################################cf566: 44.54% Instruction Covered, 42.42% Branch Covered
[32m INFO[0m [Stats #0] run time: 0h-0m-26s, clients: 1, corpus: 67, objectives: 0, executions: 3097, exec/sec: 472.6
[32m INFO[0m [Stats #0] run time: 0h-0m-27s, clients: 1, corpus: 67, objectives: 0, executions: 8373, exec/sec: 1.105k
[32m INFO[0m [Stats #0] run time: 0h-0m-28s, clients: 1, corpus: 67, objectives: 0, executions: 19944, exec/sec: 2.322k
[32m INFO[0m [Stats #0] run time: 0h-0m-29s, clients: 1, corpus: 67, objectives: 0, executions: 30849, exec/sec: 3.215k
[32m INFO[0m [Stats #0] run time: 0h-0m-30s, clients: 1, corpus: 67, objectives: 0, executions: 42827, exec/sec: 4.042k
[32m INFO[0m [Stats #0] run time: 0h-0m-31s, clients: 1, corpus: 67, objectives: 0, executions: 50115, exec/sec: 4.320k
[32m INFO[0m [Stats #0] run time: 0h-0m-32s, clients: 1, corpus: 67, objectives: 0, executions: 62097, exec/sec: 4.927k
[32m INFO[0m [Stats #0] run time: 0h-0m-33s, clients: 1, corpus: 67, objectives: 0, executions: 73502, exec/sec: 5.399k
[32m INFO[0m [Stats #0] run time: 0h-0m-34s, clients: 1, corpus: 67, objectives: 0, executions: 85075, exec/sec: 5.821k
[32m INFO[0m [Stats #0] run time: 0h-0m-35s, clients: 1, corpus: 67, objectives: 0, executions: 96805, exec/sec: 6.200k
[32m INFO[0m [Stats #0] run time: 0h-0m-36s, clients: 1, corpus: 67, objectives: 0, executions: 108023, exec/sec: 6.501k
[32m INFO[0m [Stats #0] run time: 0h-0m-37s, clients: 1, corpus: 67, objectives: 0, executions: 120005, exec/sec: 6.812k
[32m INFO[0m [Stats #0] run time: 0h-0m-38s, clients: 1, corpus: 67, objectives: 0, executions: 131420, exec/sec: 7.059k
[32m INFO[0m [Stats #0] run time: 0h-0m-39s, clients: 1, corpus: 67, objectives: 0, executions: 131420, exec/sec: 6.944k
[32m INFO[0m ============= New Corpus Item =============
[32m INFO[0m Reverted? false 
 Txn:
[Sender] 0x8E################################d79dd
   [1] Router.swapExactETHForTokens{value: 0.3627 ether}(0, path:(WETH  0x2f################################cF566), address(this), block.timestamp);
   [1] 0x2f################################cF566.transfer(0xe1################################c8510, 32218)
       0x01

[32m INFO[0m ==========================================
[32m INFO[0m [Testcase #0] run time: 0h-0m-39s, clients: 1, corpus: 68, objectives: 0, executions: 135399, exec/sec: 7.143k
[32m INFO[0m ============= Coverage Summary =============
[32m INFO[0m 0xbb################################c095c: 11.03% Instruction Covered, 13.16% Branch Covered
[32m INFO[0m 0x2f################################cf566: 44.54% Instruction Covered, 42.42% Branch Covered
[32m INFO[0m [Stats #0] run time: 0h-0m-40s, clients: 1, corpus: 68, objectives: 0, executions: 135414, exec/sec: 6.695k
[32m INFO[0m [Stats #0] run time: 0h-0m-41s, clients: 1, corpus: 68, objectives: 0, executions: 146117, exec/sec: 6.884k
[32m INFO[0m [Stats #0] run time: 0h-0m-42s, clients: 1, corpus: 68, objectives: 0, executions: 157300, exec/sec: 7.072k
[32m INFO[0m [Stats #0] run time: 0h-0m-42s, clients: 1, corpus: 68, objectives: 0, executions: 157300, exec/sec: 6.972k
[32m INFO[0m ============= New Corpus Item =============
[32m INFO[0m Reverted? false 
 Txn:
[Sender] 0x8E################################d79dd
   [1] Router.swapExactETHForTokens{value: 4722.3664 ether}(0, path:(WETH  0x2f################################cF566), address(this), block.timestamp);
   [1] Router.swapExactETHForTokens{value: 4722.3664 ether}(0, path:(WETH  0x2f################################cF566), address(this), block.timestamp);
   [1] 0x2f################################cF566.transfer(0xe1################################c8510, 1)
       0x01

[32m INFO[0m ==========================================
[32m INFO[0m [Testcase #0] run time: 0h-0m-42s, clients: 1, corpus: 69, objectives: 0, executions: 160957, exec/sec: 7.134k
[32m INFO[0m ============= Coverage Summary =============
[32m INFO[0m 0xbb################################c095c: 11.03% Instruction Covered, 13.16% Branch Covered
[32m INFO[0m 0x2f################################cf566: 44.54% Instruction Covered, 42.42% Branch Covered
[32m INFO[0m [Stats #0] run time: 0h-0m-43s, clients: 1, corpus: 69, objectives: 0, executions: 160957, exec/sec: 6.997k
[32m INFO[0m ============= New Corpus Item =============
[32m INFO[0m Reverted? false 
 Txn:
[Sender] 0x8E################################d79dd
   [1] Router.swapExactETHForTokens{value: 1611.1429 ether}(0, path:(WETH  0x2f################################cF566), address(this), block.timestamp);
   [1] 0x2f################################cF566.transfer(0xe1################################c8510, 32218)
       0x01
   [1] 0x2f################################cF566.transfer(0xe1################################c8510, 1)
       0x01

[32m INFO[0m ==========================================
[32m INFO[0m [Testcase #0] run time: 0h-0m-43s, clients: 1, corpus: 70, objectives: 0, executions: 165403, exec/sec: 7.190k
[32m INFO[0m ============= Coverage Summary =============
[32m INFO[0m 0x2f################################cf566: 44.54% Instruction Covered, 42.42% Branch Covered
[32m INFO[0m 0xbb################################c095c: 11.03% Instruction Covered, 13.16% Branch Covered
[32m INFO[0m [Stats #0] run time: 0h-0m-43s, clients: 1, corpus: 70, objectives: 0, executions: 167652, exec/sec: 7.212k
[32m INFO[0m [Stats #0] run time: 0h-0m-44s, clients: 1, corpus: 70, objectives: 0, executions: 177365, exec/sec: 7.314k
[32m INFO[0m [Stats #0] run time: 0h-0m-45s, clients: 1, corpus: 70, objectives: 0, executions: 187749, exec/sec: 7.435k
[32m INFO[0m [Stats #0] run time: 0h-0m-46s, clients: 1, corpus: 70, objectives: 0, executions: 197598, exec/sec: 7.526k
[32m INFO[0m [Stats #0] run time: 0h-0m-47s, clients: 1, corpus: 70, objectives: 0, executions: 207978, exec/sec: 7.629k
[32m INFO[0m [Stats #0] run time: 0h-0m-48s, clients: 1, corpus: 70, objectives: 0, executions: 217852, exec/sec: 7.708k
[32m INFO[0m [Stats #0] run time: 0h-0m-49s, clients: 1, corpus: 70, objectives: 0, executions: 228072, exec/sec: 7.791k
[32m INFO[0m [Stats #0] run time: 0h-0m-50s, clients: 1, corpus: 70, objectives: 0, executions: 238334, exec/sec: 7.871k
[32m INFO[0m [Stats #0] run time: 0h-0m-51s, clients: 1, corpus: 70, objectives: 0, executions: 245617, exec/sec: 7.842k
[32m INFO[0m [Stats #0] run time: 0h-0m-52s, clients: 1, corpus: 70, objectives: 0, executions: 255591, exec/sec: 7.904k
[32m INFO[0m [Stats #0] run time: 0h-0m-53s, clients: 1, corpus: 70, objectives: 0, executions: 266042, exec/sec: 7.977k
[32m INFO[0m [Stats #0] run time: 0h-0m-54s, clients: 1, corpus: 70, objectives: 0, executions: 275795, exec/sec: 8.027k
[32m INFO[0m [Stats #0] run time: 0h-0m-55s, clients: 1, corpus: 70, objectives: 0, executions: 286184, exec/sec: 8.092k
[32m INFO[0m [Stats #0] run time: 0h-0m-56s, clients: 1, corpus: 70, objectives: 0, executions: 296060, exec/sec: 8.139k
[32m INFO[0m [Stats #0] run time: 0h-0m-57s, clients: 1, corpus: 70, objectives: 0, executions: 306483, exec/sec: 8.200k
[32m INFO[0m [Stats #0] run time: 0h-0m-58s, clients: 1, corpus: 70, objectives: 0, executions: 316651, exec/sec: 8.249k
[32m INFO[0m [Stats #0] run time: 0h-0m-59s, clients: 1, corpus: 70, objectives: 0, executions: 326908, exec/sec: 8.300k
[32m INFO[0m [Stats #0] run time: 0h-1m-0s, clients: 1, corpus: 70, objectives: 0, executions: 336784, exec/sec: 8.336k
[32m INFO[0m [Stats #0] run time: 0h-1m-1s, clients: 1, corpus: 70, objectives: 0, executions: 347300, exec/sec: 8.388k
[32m INFO[0m [Stats #0] run time: 0h-1m-2s, clients: 1, corpus: 70, objectives: 0, executions: 357621, exec/sec: 8.433k
[32m INFO[0m [Stats #0] run time: 0h-1m-3s, clients: 1, corpus: 70, objectives: 0, executions: 367467, exec/sec: 8.463k
[32m INFO[0m [Stats #0] run time: 0h-1m-4s, clients: 1, corpus: 70, objectives: 0, executions: 377912, exec/sec: 8.506k
[32m INFO[0m [Stats #0] run time: 0h-1m-5s, clients: 1, corpus: 70, objectives: 0, executions: 387620, exec/sec: 8.531k
[32m INFO[0m [Stats #0] run time: 0h-1m-6s, clients: 1, corpus: 70, objectives: 0, executions: 398106, exec/sec: 8.573k
[32m INFO[0m [Stats #0] run time: 0h-1m-7s, clients: 1, corpus: 70, objectives: 0, executions: 407914, exec/sec: 8.597k
[32m INFO[0m [Stats #0] run time: 0h-1m-8s, clients: 1, corpus: 70, objectives: 0, executions: 418231, exec/sec: 8.630k
[32m INFO[0m [Stats #0] run time: 0h-1m-9s, clients: 1, corpus: 70, objectives: 0, executions: 428038, exec/sec: 8.652k
[32m INFO[0m [Stats #0] run time: 0h-1m-10s, clients: 1, corpus: 70, objectives: 0, executions: 438353, exec/sec: 8.685k
[32m INFO[0m [Stats #0] run time: 0h-1m-11s, clients: 1, corpus: 70, objectives: 0, executions: 448200, exec/sec: 8.708k
[32m INFO[0m [Stats #0] run time: 0h-1m-12s, clients: 1, corpus: 70, objectives: 0, executions: 458490, exec/sec: 8.736k
[32m INFO[0m [Stats #0] run time: 0h-1m-13s, clients: 1, corpus: 70, objectives: 0, executions: 468302, exec/sec: 8.756k
[32m INFO[0m [Stats #0] run time: 0h-1m-14s, clients: 1, corpus: 70, objectives: 0, executions: 478624, exec/sec: 8.783k
[32m INFO[0m [Stats #0] run time: 0h-1m-15s, clients: 1, corpus: 70, objectives: 0, executions: 488441, exec/sec: 8.801k
[32m INFO[0m [Stats #0] run time: 0h-1m-16s, clients: 1, corpus: 70, objectives: 0, executions: 498826, exec/sec: 8.829k
[32m INFO[0m [Stats #0] run time: 0h-1m-17s, clients: 1, corpus: 70, objectives: 0, executions: 508890, exec/sec: 8.850k
[32m INFO[0m [Stats #0] run time: 0h-1m-18s, clients: 1, corpus: 70, objectives: 0, executions: 518928, exec/sec: 8.870k
[32m INFO[0m [Stats #0] run time: 0h-1m-19s, clients: 1, corpus: 70, objectives: 0, executions: 529156, exec/sec: 8.891k
[32m INFO[0m [Stats #0] run time: 0h-1m-20s, clients: 1, corpus: 70, objectives: 0, executions: 539153, exec/sec: 8.909k
[32m INFO[0m [Stats #0] run time: 0h-1m-21s, clients: 1, corpus: 70, objectives: 0, executions: 549278, exec/sec: 8.928k
[32m INFO[0m [Stats #0] run time: 0h-1m-22s, clients: 1, corpus: 70, objectives: 0, executions: 559696, exec/sec: 8.951k
[32m INFO[0m [Stats #0] run time: 0h-1m-23s, clients: 1, corpus: 70, objectives: 0, executions: 569637, exec/sec: 8.967k
[32m INFO[0m [Stats #0] run time: 0h-1m-24s, clients: 1, corpus: 70, objectives: 0, executions: 579385, exec/sec: 8.979k
[32m INFO[0m [Stats #0] run time: 0h-1m-25s, clients: 1, corpus: 70, objectives: 0, executions: 589391, exec/sec: 8.994k
[32m INFO[0m [Stats #0] run time: 0h-1m-26s, clients: 1, corpus: 70, objectives: 0, executions: 599934, exec/sec: 9.017k
[32m INFO[0m [Stats #0] run time: 0h-1m-27s, clients: 1, corpus: 70, objectives: 0, executions: 609718, exec/sec: 9.029k
[32m INFO[0m [Stats #0] run time: 0h-1m-28s, clients: 1, corpus: 70, objectives: 0, executions: 620205, exec/sec: 9.049k
[32m INFO[0m [Stats #0] run time: 0h-1m-29s, clients: 1, corpus: 70, objectives: 0, executions: 630498, exec/sec: 9.067k
[32m INFO[0m [Stats #0] run time: 0h-1m-30s, clients: 1, corpus: 70, objectives: 0, executions: 640375, exec/sec: 9.078k
[32m INFO[0m [Stats #0] run time: 0h-1m-31s, clients: 1, corpus: 70, objectives: 0, executions: 649990, exec/sec: 9.085k
[32m INFO[0m [Stats #0] run time: 0h-1m-32s, clients: 1, corpus: 70, objectives: 0, executions: 660249, exec/sec: 9.101k
[32m INFO[0m [Stats #0] run time: 0h-1m-33s, clients: 1, corpus: 70, objectives: 0, executions: 670224, exec/sec: 9.113k
[32m INFO[0m [Stats #0] run time: 0h-1m-34s, clients: 1, corpus: 70, objectives: 0, executions: 670224, exec/sec: 9.023k
[32m INFO[0m ============= New Corpus Item =============
[32m INFO[0m Reverted? false 
 Txn:
[Sender] 0x8E################################d79dd
   [1] Router.swapExactETHForTokens{value: 4722.3664 ether}(0, path:(WETH  0x2f################################cF566), address(this), block.timestamp);
   [1] Router.swapExactETHForTokens{value: 4722.3664 ether}(0, path:(WETH  0x2f################################cF566), address(this), block.timestamp);
   [1] 0x2f################################cF566.transfer(0x68################################c9024, 18)
       0x01
   [1] 0x2f################################cF566.transfer(0xe1################################c8510, 1)
       0x01

[32m INFO[0m ==========================================
[32m INFO[0m [Testcase #0] run time: 0h-1m-34s, clients: 1, corpus: 71, objectives: 0, executions: 677698, exec/sec: 9.123k
[32m INFO[0m ============= Coverage Summary =============
[32m INFO[0m 0x2f################################cf566: 44.54% Instruction Covered, 42.42% Branch Covered
[32m INFO[0m 0xbb################################c095c: 11.03% Instruction Covered, 13.16% Branch Covered
[32m INFO[0m [Stats #0] run time: 0h-1m-34s, clients: 1, corpus: 71, objectives: 0, executions: 678465, exec/sec: 9.100k
[32m INFO[0m [Stats #0] run time: 0h-1m-35s, clients: 1, corpus: 71, objectives: 0, executions: 678465, exec/sec: 9.053k
[32m INFO[0m ============= New Corpus Item =============
[32m INFO[0m Reverted? false 
 Txn:
[Sender] 0x8E################################d79dd
   [1] Router.swapExactETHForTokens{value: 4722.3664 ether}(0, path:(WETH  0x2f################################cF566), address(this), block.timestamp);
   [1] Router.swapExactETHForTokens{value: 4722.3664 ether}(0, path:(WETH  0x2f################################cF566), address(this), block.timestamp);
   [1] 0x2f################################cF566.transfer(0x68################################c9024, 18)
       0x01
   [1] 0x2f################################cF566.transfer(0x35################################31dDb, 549755813723)
       0x01

[32m INFO[0m ==========================================
[32m INFO[0m [Testcase #0] run time: 0h-1m-35s, clients: 1, corpus: 72, objectives: 0, executions: 682283, exec/sec: 9.104k
[32m INFO[0m ============= Coverage Summary =============
[32m INFO[0m 0xbb################################c095c: 11.03% Instruction Covered, 13.16% Branch Covered
[32m INFO[0m 0x2f################################cf566: 44.54% Instruction Covered, 42.42% Branch Covered
[32m INFO[0m [Stats #0] run time: 0h-1m-35s, clients: 1, corpus: 72, objectives: 0, executions: 687634, exec/sec: 9.101k
[32m INFO[0m [Stats #0] run time: 0h-1m-36s, clients: 1, corpus: 72, objectives: 0, executions: 696837, exec/sec: 9.101k
[32m INFO[0m [Stats #0] run time: 0h-1m-37s, clients: 1, corpus: 72, objectives: 0, executions: 706045, exec/sec: 9.102k
Timeout