[32m INFO[0m fetching abi from https://api.etherscan.io/api?module=contract&action=getabi&address=0x38################################4ed0b&format=json&apikey=GS896CZ6PQ13S3HGE6FRK1Z9DYCZFWF2RC
[32m INFO[0m fetching code from 38d24e971187004bc4ccda0fdef37c8286a4ed0b
Contract loaded: 0x38################################4ed0b
[32m INFO[0m 

 ================ EVM Fuzzer Start ===================


[32m INFO[0m Deploying contract: 0x38################################4ed0b
[32m INFO[0m Contract 0x38################################4ed0b deployed to: 0x38################################4ed0b -> balacne is 0
[32m INFO[0m Deployed all contracts

[32m INFO[0m fetching pairs for 0x38################################4ed0b
[32m INFO[0m fetching pairs for 0x38################################4ed0b
[32m INFO[0m fetching code from fa5e14a4a3bb92b78c048af27a6916d523eecc8f
[32m INFO[0m fetching code from c02aaa39b223fe8d0a0e5c4f27ead9083c756cc2
[32m INFO[0m [Stats #0] run time: 0h-0m-5s, clients: 1, corpus: 0, objectives: 0, executions: 0, exec/sec: 0.000
[32m INFO[0m ============= New Corpus Item =============
[32m INFO[0m Reverted? false 
 Txn:
[Sender] 0x35################################31dDb
   [1] Router.swapExactETHForTokens{value: 4722.3664 ether}(0, path:(WETH  0x38################################4Ed0B), address(this), block.timestamp);

[32m INFO[0m ==========================================
[32m INFO[0m [Testcase #0] run time: 0h-0m-5s, clients: 1, corpus: 14, objectives: 0, executions: 1, exec/sec: 0.000
[32m INFO[0m [Stats #0] run time: 0h-0m-5s, clients: 1, corpus: 14, objectives: 0, executions: 1, exec/sec: 0.000
[32m INFO[0m ============= New Corpus Item =============
[32m INFO[0m Reverted? true 
 Txn:
[Sender] 0x35################################31dDb
   [1] Router.swapExactETHForTokens{value: 4722.3664 ether}(0, path:(WETH  0x38################################4Ed0B), address(this), block.timestamp);
   [1] Router.swapExactETHForTokens{value: 3225.6897 ether}(0, path:(WETH  0x38################################4Ed0B), address(this), block.timestamp);

[32m INFO[0m ==========================================
[32m INFO[0m [Testcase #0] run time: 0h-0m-5s, clients: 1, corpus: 15, objectives: 0, executions: 4, exec/sec: 0.000
[32m INFO[0m ============= Coverage Summary =============
[32m INFO[0m 0xc0################################56cc2: 11.03% Instruction Covered, 13.16% Branch Covered
[32m INFO[0m 0x38################################4ed0b: 43.79% Instruction Covered, 40.29% Branch Covered
[32m INFO[0m [Stats #0] run time: 0h-0m-6s, clients: 1, corpus: 15, objectives: 0, executions: 4, exec/sec: 0.000
[32m INFO[0m ============= New Corpus Item =============
[32m INFO[0m Reverted? true 
 Txn:
[Sender] 0x35################################31dDb
   [1] Router.swapExactETHForTokens{value: 18.4467 ether}(0, path:(WETH  0x38################################4Ed0B), address(this), block.timestamp);
[Sender] 0x68################################c9024
   [1] 0x38################################4Ed0B.approve(0x00################################00000, 0)
       0x08################################0000000000000000000000000000000000020000000000000000000000000000000000000000000000000000000000000002245524332303a20617070726f766520746f20746865207a65726f2061646472657373000000000000000000000000000000000000000000000000000000000000

[32m INFO[0m ==========================================
[32m INFO[0m [Testcase #0] run time: 0h-0m-6s, clients: 1, corpus: 16, objectives: 0, executions: 33, exec/sec: 0.000
[32m INFO[0m [Stats #0] run time: 0h-0m-6s, clients: 1, corpus: 16, objectives: 0, executions: 33, exec/sec: 0.000
[32m INFO[0m ============= New Corpus Item =============
[32m INFO[0m Reverted? false 
 Txn:
[Sender] 0x35################################31dDb
   [1] Router.swapExactETHForTokens{value: 18.4467 ether}(0, path:(WETH  0x38################################4Ed0B), address(this), block.timestamp);
[Sender] 0x68################################c9024
   [1] 0x38################################4Ed0B.approve(0x68################################c9024, 678080712643764704893118959809070767752939165035691819085.1683 ether)
       0x01

[32m INFO[0m ==========================================
[32m INFO[0m [Testcase #0] run time: 0h-0m-6s, clients: 1, corpus: 17, objectives: 0, executions: 39, exec/sec: 0.000
[32m INFO[0m [Stats #0] run time: 0h-0m-6s, clients: 1, corpus: 17, objectives: 0, executions: 39, exec/sec: 0.000
[32m INFO[0m ============= New Corpus Item =============
[32m INFO[0m Reverted? true 
 Txn:
[Sender] 0x35################################31dDb
   [1] Router.swapExactETHForTokens{value: 141834852433920}(0, path:(WETH  0x38################################4Ed0B), address(this), block.timestamp);
[Sender] 0x68################################c9024
   [1] 0x38################################4Ed0B.approve{value: 562949953421703}(0x35################################31dDb, 22345168801541509213996174934112222794515435329892.2538 ether)

[32m INFO[0m ==========================================
[32m INFO[0m [Testcase #0] run time: 0h-0m-6s, clients: 1, corpus: 18, objectives: 0, executions: 40, exec/sec: 0.000
[32m INFO[0m [Stats #0] run time: 0h-0m-6s, clients: 1, corpus: 18, objectives: 0, executions: 40, exec/sec: 0.000
[32m INFO[0m ============= New Corpus Item =============
[32m INFO[0m Reverted? false 
 Txn:
[Sender] 0x35################################31dDb
   [1] Router.swapExactETHForTokens{value: 2341}(0, path:(WETH  0x38################################4Ed0B), address(this), block.timestamp);
[Sender] 0x68################################c9024
   [1] 0x38################################4Ed0B.approve(0x38################################4Ed0B, 8096566278802640977538386105757644960914.9663 ether)
       0x01

[32m INFO[0m ==========================================
[32m INFO[0m [Testcase #0] run time: 0h-0m-6s, clients: 1, corpus: 19, objectives: 0, executions: 45, exec/sec: 0.000
[32m INFO[0m ============= Coverage Summary =============
[32m INFO[0m 0xc0################################56cc2: 11.03% Instruction Covered, 13.16% Branch Covered
[32m INFO[0m 0x38################################4ed0b: 45.21% Instruction Covered, 41.26% Branch Covered
[32m INFO[0m [Stats #0] run time: 0h-0m-6s, clients: 1, corpus: 19, objectives: 0, executions: 45, exec/sec: 0.000
[32m INFO[0m ============= New Corpus Item =============
[32m INFO[0m Reverted? true 
 Txn:
[Sender] 0x35################################31dDb
   [1] 0x38################################4Ed0B.decreaseAllowance(0x00################################00000, 549755944960)
       0x08################################0000000000000000000000000000000000020000000000000000000000000000000000000000000000000000000000000002545524332303a2064656372656173656420616c6c6f77616e63652062656c6f77207a65726f000000000000000000000000000000000000000000000000000000

[32m INFO[0m ==========================================
[32m INFO[0m [Testcase #0] run time: 0h-0m-6s, clients: 1, corpus: 20, objectives: 0, executions: 65, exec/sec: 0.000
[32m INFO[0m ============= Coverage Summary =============
[32m INFO[0m 0xc0################################56cc2: 11.03% Instruction Covered, 13.16% Branch Covered
[32m INFO[0m 0x38################################4ed0b: 47.61% Instruction Covered, 43.20% Branch Covered
[32m INFO[0m [Stats #0] run time: 0h-0m-7s, clients: 1, corpus: 20, objectives: 0, executions: 96, exec/sec: 42.98
[32m INFO[0m [Stats #0] run time: 0h-0m-7s, clients: 1, corpus: 20, objectives: 0, executions: 96, exec/sec: 42.98
[32m INFO[0m ============= New Corpus Item =============
[32m INFO[0m Reverted? true 
 Txn:
[Sender] 0x35################################31dDb
   [1] Router.swapExactETHForTokens{value: 2341}(0, path:(WETH  0x38################################4Ed0B), address(this), block.timestamp);
   [1] Router.swapExactETHForTokens{value: 1523.9651 ether}(0, path:(WETH  0x38################################4Ed0B), address(this), block.timestamp);
   [1] 0x38################################4Ed0B.enableFairLaunch()
       0x08################################000000000000000000000000000000000002000000000000000000000000000000000000000000000000000000000000000204f776e61626c653a2063616c6c6572206973206e6f7420746865206f776e6572

[32m INFO[0m ==========================================
[32m INFO[0m [Testcase #0] run time: 0h-0m-7s, clients: 1, corpus: 21, objectives: 0, executions: 97, exec/sec: 43.41
[32m INFO[0m ============= Coverage Summary =============
[32m INFO[0m 0xc0################################56cc2: 11.03% Instruction Covered, 13.16% Branch Covered
[32m INFO[0m 0x38################################4ed0b: 47.61% Instruction Covered, 43.20% Branch Covered
[32m INFO[0m [Stats #0] run time: 0h-0m-7s, clients: 1, corpus: 21, objectives: 0, executions: 97, exec/sec: 43.31
[32m INFO[0m ============= New Corpus Item =============
[32m INFO[0m Reverted? true 
 Txn:
[Sender] 0x35################################31dDb
   [1] Router.swapExactETHForTokens{value: 4722.3664 ether}(0, path:(WETH  0x38################################4Ed0B), address(this), block.timestamp);
[Sender] 0x68################################c9024
   [1] 0x38################################4Ed0B.excludeAccount(0x35################################31dDb)
       0x08################################000000000000000000000000000000000002000000000000000000000000000000000000000000000000000000000000000204f776e61626c653a2063616c6c6572206973206e6f7420746865206f776e6572

[32m INFO[0m ==========================================
[32m INFO[0m [Testcase #0] run time: 0h-0m-7s, clients: 1, corpus: 22, objectives: 0, executions: 129, exec/sec: 57.58
[32m INFO[0m ============= Coverage Summary =============
[32m INFO[0m 0xc0################################56cc2: 11.03% Instruction Covered, 13.16% Branch Covered
[32m INFO[0m 0x38################################4ed0b: 47.61% Instruction Covered, 43.20% Branch Covered
[32m INFO[0m [Stats #0] run time: 0h-0m-7s, clients: 1, corpus: 22, objectives: 0, executions: 129, exec/sec: 57.48
[32m INFO[0m ============= New Corpus Item =============
[32m INFO[0m Reverted? true 
 Txn:
[Sender] 0x35################################31dDb
   [1] Router.swapExactETHForTokens{value: 18.4467 ether}(0, path:(WETH  0x38################################4Ed0B), address(this), block.timestamp);
[Sender] 0xe1################################c8510
   [1] 0x38################################4Ed0B.includeAccount(0x00################################00000)
       0x08################################000000000000000000000000000000000002000000000000000000000000000000000000000000000000000000000000000204f776e61626c653a2063616c6c6572206973206e6f7420746865206f776e6572

[32m INFO[0m ==========================================
[32m INFO[0m [Testcase #0] run time: 0h-0m-7s, clients: 1, corpus: 23, objectives: 0, executions: 161, exec/sec: 71.72
[32m INFO[0m ============= Coverage Summary =============
[32m INFO[0m 0x38################################4ed0b: 47.61% Instruction Covered, 43.20% Branch Covered
[32m INFO[0m 0xc0################################56cc2: 11.03% Instruction Covered, 13.16% Branch Covered
[32m INFO[0m [Stats #0] run time: 0h-0m-7s, clients: 1, corpus: 23, objectives: 0, executions: 161, exec/sec: 71.59
[32m INFO[0m ============= New Corpus Item =============
[32m INFO[0m Reverted? true 
 Txn:
[Sender] 0x35################################31dDb
   [1] Router.swapExactETHForTokens{value: 2341}(0, path:(WETH  0x38################################4Ed0B), address(this), block.timestamp);
[Sender] 0x68################################c9024
   [1] 0x38################################4Ed0B.approve(0x38################################4Ed0B, 8096566278802640977538386105757644960914.9663 ether)
       0x01
[Sender] 0x8E################################d79dd
   [1] 0x38################################4Ed0B.increaseAllowance(0x00################################00000, 1467199390616841560656255304615.9558 ether)
       0x08################################0000000000000000000000000000000000020000000000000000000000000000000000000000000000000000000000000002245524332303a20617070726f766520746f20746865207a65726f2061646472657373000000000000000000000000000000000000000000000000000000000000

[32m INFO[0m ==========================================
[32m INFO[0m [Testcase #0] run time: 0h-0m-7s, clients: 1, corpus: 24, objectives: 0, executions: 194, exec/sec: 86.24
[32m INFO[0m [Stats #0] run time: 0h-0m-7s, clients: 1, corpus: 24, objectives: 0, executions: 194, exec/sec: 79.47
[32m INFO[0m ============= New Corpus Item =============
[32m INFO[0m Reverted? false 
 Txn:
[Sender] 0x35################################31dDb
   [1] Router.swapExactETHForTokens{value: 2341}(0, path:(WETH  0x38################################4Ed0B), address(this), block.timestamp);
   [1] Router.swapExactETHForTokens{value: 1523.9651 ether}(0, path:(WETH  0x38################################4Ed0B), address(this), block.timestamp);
[Sender] 0x8E################################d79dd
   [1] 0x38################################4Ed0B.increaseAllowance(0xe1################################c8510, 3878)
       0x01

[32m INFO[0m ==========================================
[32m INFO[0m [Testcase #0] run time: 0h-0m-7s, clients: 1, corpus: 25, objectives: 0, executions: 202, exec/sec: 82.70
[32m INFO[0m ============= Coverage Summary =============
[32m INFO[0m 0x38################################4ed0b: 47.61% Instruction Covered, 43.20% Branch Covered
[32m INFO[0m 0xc0################################56cc2: 11.03% Instruction Covered, 13.16% Branch Covered
[32m INFO[0m [Stats #0] run time: 0h-0m-8s, clients: 1, corpus: 25, objectives: 0, executions: 224, exec/sec: 68.90
[32m INFO[0m [Stats #0] run time: 0h-0m-8s, clients: 1, corpus: 25, objectives: 0, executions: 224, exec/sec: 68.89
[32m INFO[0m ============= New Corpus Item =============
[32m INFO[0m Reverted? true 
 Txn:
[Sender] 0x35################################31dDb
   [1] Router.swapExactETHForTokens{value: 4722.3664 ether}(0, path:(WETH  0x38################################4Ed0B), address(this), block.timestamp);
   [1] 0x38################################4Ed0B.reflect(57894277771593319327455909208299048256169641009131550764697.3711 ether)
       0x08################################00000000000000000000000000000000000200000000000000000000000000000000000000000000000000000000000000021536166654d6174683a206d756c7469706c69636174696f6e206f766572666c6f7700000000000000000000000000000000000000000000000000000000000000

[32m INFO[0m ==========================================
[32m INFO[0m [Testcase #0] run time: 0h-0m-8s, clients: 1, corpus: 26, objectives: 0, executions: 225, exec/sec: 69.18
[32m INFO[0m [Stats #0] run time: 0h-0m-8s, clients: 1, corpus: 26, objectives: 0, executions: 225, exec/sec: 69.17
[32m INFO[0m ============= New Corpus Item =============
[32m INFO[0m Reverted? false 
 Txn:
[Sender] 0x35################################31dDb
   [1] Router.swapExactETHForTokens{value: 141834852433920}(0, path:(WETH  0x38################################4Ed0B), address(this), block.timestamp);
   [1] 0x38################################4Ed0B.reflect(0)

[32m INFO[0m ==========================================
[32m INFO[0m [Testcase #0] run time: 0h-0m-8s, clients: 1, corpus: 27, objectives: 0, executions: 226, exec/sec: 69.46
[32m INFO[0m ============= Coverage Summary =============
[32m INFO[0m 0x38################################4ed0b: 48.54% Instruction Covered, 43.69% Branch Covered
[32m INFO[0m 0xc0################################56cc2: 11.03% Instruction Covered, 13.16% Branch Covered
[32m INFO[0m [Stats #0] run time: 0h-0m-8s, clients: 1, corpus: 27, objectives: 0, executions: 226, exec/sec: 69.27
[32m INFO[0m ============= New Corpus Item =============
[32m INFO[0m Reverted? true 
 Txn:
[Sender] 0x35################################31dDb
   [1] Router.swapExactETHForTokens{value: 2341}(0, path:(WETH  0x38################################4Ed0B), address(this), block.timestamp);
   [1] Router.swapExactETHForTokens{value: 1523.9651 ether}(0, path:(WETH  0x38################################4Ed0B), address(this), block.timestamp);
[Sender] 0x8E################################d79dd
   [1] 0x38################################4Ed0B.increaseAllowance(0xe1################################c8510, 3878)
       0x01
[Sender] 0xe1################################c8510
   [1] 0x38################################4Ed0B.renounceOwnership()
       0x08################################000000000000000000000000000000000002000000000000000000000000000000000000000000000000000000000000000204f776e61626c653a2063616c6c6572206973206e6f7420746865206f776e6572

[32m INFO[0m ==========================================
[32m INFO[0m [Testcase #0] run time: 0h-0m-8s, clients: 1, corpus: 28, objectives: 0, executions: 257, exec/sec: 78.76
[32m INFO[0m ============= Coverage Summary =============
[32m INFO[0m 0xc0################################56cc2: 11.03% Instruction Covered, 13.16% Branch Covered
[32m INFO[0m 0x38################################4ed0b: 48.54% Instruction Covered, 43.69% Branch Covered
[32m INFO[0m [Stats #0] run time: 0h-0m-8s, clients: 1, corpus: 28, objectives: 0, executions: 257, exec/sec: 78.70
[32m INFO[0m ============= New Corpus Item =============
[32m INFO[0m Reverted? false 
 Txn:
[Sender] 0x35################################31dDb
   [1] Router.swapExactETHForTokens{value: 18.4467 ether}(0, path:(WETH  0x38################################4Ed0B), address(this), block.timestamp);
[Sender] 0xe1################################c8510
   [1] 0x38################################4Ed0B.totalSupply()
       0xd3c21bcecceda1000000

[32m INFO[0m ==========================================
[32m INFO[0m [Testcase #0] run time: 0h-0m-8s, clients: 1, corpus: 29, objectives: 0, executions: 292, exec/sec: 89.41
[32m INFO[0m ============= Coverage Summary =============
[32m INFO[0m 0xc0################################56cc2: 11.03% Instruction Covered, 13.16% Branch Covered
[32m INFO[0m 0x38################################4ed0b: 48.54% Instruction Covered, 43.69% Branch Covered
[32m INFO[0m [Stats #0] run time: 0h-0m-8s, clients: 1, corpus: 29, objectives: 0, executions: 292, exec/sec: 89.25
[32m INFO[0m ============= New Corpus Item =============
[32m INFO[0m Reverted? true 
 Txn:
[Sender] 0x35################################31dDb
   [1] Router.swapExactETHForTokens{value: 141834852433920}(0, path:(WETH  0x38################################4Ed0B), address(this), block.timestamp);
   [1] 0x38################################4Ed0B.transfer(0x00################################00000, 17186322413535142591635662658460788422359189272780365269570.4008 ether)
       0x08################################0000000000000000000000000000000000020000000000000000000000000000000000000000000000000000000000000002345524332303a207472616e7366657220746f20746865207a65726f20616464726573730000000000000000000000000000000000000000000000000000000000

[32m INFO[0m ==========================================
[32m INFO[0m [Testcase #0] run time: 0h-0m-8s, clients: 1, corpus: 30, objectives: 0, executions: 324, exec/sec: 99.02
[32m INFO[0m ============= Coverage Summary =============
[32m INFO[0m 0xc0################################56cc2: 11.03% Instruction Covered, 13.16% Branch Covered
[32m INFO[0m 0x38################################4ed0b: 48.54% Instruction Covered, 43.69% Branch Covered
[32m INFO[0m [Stats #0] run time: 0h-0m-8s, clients: 1, corpus: 30, objectives: 0, executions: 324, exec/sec: 93.53
[32m INFO[0m ============= New Corpus Item =============
[32m INFO[0m Reverted? true 
 Txn:
[Sender] 0x35################################31dDb
   [1] Router.swapExactETHForTokens{value: 2341}(0, path:(WETH  0x38################################4Ed0B), address(this), block.timestamp);
   [1] Router.swapExactETHForTokens{value: 1523.9651 ether}(0, path:(WETH  0x38################################4Ed0B), address(this), block.timestamp);
[Sender] 0x8E################################d79dd
   [1] 0x38################################4Ed0B.increaseAllowance(0xe1################################c8510, 3878)
       0x01
[Sender] 0xe1################################c8510
   [1] 0x38################################4Ed0B.transferFrom(0x35################################31dDb, 0x00################################00000, 0)
       0x08################################0000000000000000000000000000000000020000000000000000000000000000000000000000000000000000000000000002345524332303a207472616e7366657220746f20746865207a65726f20616464726573730000000000000000000000000000000000000000000000000000000000

[32m INFO[0m ==========================================
[32m INFO[0m [Testcase #0] run time: 0h-0m-8s, clients: 1, corpus: 31, objectives: 0, executions: 353, exec/sec: 101.9
[32m INFO[0m [Stats #0] run time: 0h-0m-8s, clients: 1, corpus: 31, objectives: 0, executions: 353, exec/sec: 101.8
[32m INFO[0m ============= New Corpus Item =============
[32m INFO[0m Reverted? true 
 Txn:
[Sender] 0x68################################c9024
   [1] 0x38################################4Ed0B.approve(0x38################################4Ed0B, 36696319872334022834549958050962895450546959600664065660131.5264 ether)
       0x01
[Sender] 0xe1################################c8510
   [1] 0x38################################4Ed0B.transferFrom(0x00################################00000, 0x00################################00000, 0)
       0x08################################0000000000000000000000000000000000020000000000000000000000000000000000000000000000000000000000000002545524332303a207472616e736665722066726f6d20746865207a65726f2061646472657373000000000000000000000000000000000000000000000000000000

[32m INFO[0m ==========================================
[32m INFO[0m [Testcase #0] run time: 0h-0m-8s, clients: 1, corpus: 32, objectives: 0, executions: 356, exec/sec: 102.7
[32m INFO[0m ============= Coverage Summary =============
[32m INFO[0m 0x38################################4ed0b: 48.54% Instruction Covered, 43.69% Branch Covered
[32m INFO[0m 0xc0################################56cc2: 11.03% Instruction Covered, 13.16% Branch Covered
[32m INFO[0m [Stats #0] run time: 0h-0m-8s, clients: 1, corpus: 32, objectives: 0, executions: 356, exec/sec: 102.5
[32m INFO[0m ============= New Corpus Item =============
[32m INFO[0m Reverted? true 
 Txn:
[Sender] 0x35################################31dDb
   [1] Router.swapExactETHForTokens{value: 2361.1832 ether}(0, path:(WETH  0x38################################4Ed0B), address(this), block.timestamp);
[Sender] 0x68################################c9024
   [1] 0x38################################4Ed0B.transferOwnership(0x35################################31dDb)
       0x08################################000000000000000000000000000000000002000000000000000000000000000000000000000000000000000000000000000204f776e61626c653a2063616c6c6572206973206e6f7420746865206f776e6572

[32m INFO[0m ==========================================
[32m INFO[0m [Testcase #0] run time: 0h-0m-8s, clients: 1, corpus: 33, objectives: 0, executions: 384, exec/sec: 110.5
[32m INFO[0m ============= Coverage Summary =============
[32m INFO[0m 0x38################################4ed0b: 48.54% Instruction Covered, 43.69% Branch Covered
[32m INFO[0m 0xc0################################56cc2: 11.03% Instruction Covered, 13.16% Branch Covered
[32m INFO[0m [Stats #0] run time: 0h-0m-10s, clients: 1, corpus: 33, objectives: 0, executions: 799, exec/sec: 167.6
[32m INFO[0m [Stats #0] run time: 0h-0m-10s, clients: 1, corpus: 33, objectives: 0, executions: 799, exec/sec: 159.7
[32m INFO[0m ============= New Corpus Item =============
[32m INFO[0m Reverted? false 
 Txn:
[Sender] 0x35################################31dDb
   [1] Router.swapExactETHForTokens{value: 2361.1832 ether}(0, path:(WETH  0x38################################4Ed0B), address(this), block.timestamp);
   [1] 0x38################################4Ed0B.decreaseAllowance(0x8E################################d79dd, 0)
       0x01

[32m INFO[0m ==========================================
[32m INFO[0m [Testcase #0] run time: 0h-0m-10s, clients: 1, corpus: 34, objectives: 0, executions: 1139, exec/sec: 227.6
[32m INFO[0m ============= Coverage Summary =============
[32m INFO[0m 0x38################################4ed0b: 48.54% Instruction Covered, 43.69% Branch Covered
[32m INFO[0m 0xc0################################56cc2: 11.03% Instruction Covered, 13.16% Branch Covered
[32m INFO[0m [Stats #0] run time: 0h-0m-10s, clients: 1, corpus: 34, objectives: 0, executions: 1139, exec/sec: 218.3
[32m INFO[0m ============= New Corpus Item =============
[32m INFO[0m Reverted? false 
 Txn:
[Sender] 0x35################################31dDb
   [1] Router.swapExactETHForTokens{value: 55.3692 ether}(0, path:(WETH  0x38################################4Ed0B), address(this), block.timestamp);
   [1] 0x38################################4Ed0B.reflect(0)

[32m INFO[0m ==========================================
[32m INFO[0m [Testcase #0] run time: 0h-0m-10s, clients: 1, corpus: 35, objectives: 0, executions: 1297, exec/sec: 248.5
[32m INFO[0m ============= Coverage Summary =============
[32m INFO[0m 0x38################################4ed0b: 48.54% Instruction Covered, 43.69% Branch Covered
[32m INFO[0m 0xc0################################56cc2: 11.03% Instruction Covered, 13.16% Branch Covered
[32m INFO[0m [Stats #0] run time: 0h-0m-11s, clients: 1, corpus: 35, objectives: 0, executions: 2140, exec/sec: 370.7
[32m INFO[0m [Stats #0] run time: 0h-0m-11s, clients: 1, corpus: 35, objectives: 0, executions: 2140, exec/sec: 338.4
[32m INFO[0m ============= New Corpus Item =============
[32m INFO[0m Reverted? false 
 Txn:
[Sender] 0x35################################31dDb
   [1] Router.swapExactETHForTokens{value: 3225.6897 ether}(0, path:(WETH  0x38################################4Ed0B), address(this), block.timestamp);
   [1] 0x38################################4Ed0B.reflect(1099511627776)

[32m INFO[0m ==========================================
[32m INFO[0m [Testcase #0] run time: 0h-0m-11s, clients: 1, corpus: 36, objectives: 0, executions: 3264, exec/sec: 516.1
[32m INFO[0m ============= Coverage Summary =============
[32m INFO[0m 0xc0################################56cc2: 11.03% Instruction Covered, 13.16% Branch Covered
[32m INFO[0m 0x38################################4ed0b: 48.54% Instruction Covered, 43.69% Branch Covered
[32m INFO[0m [Stats #0] run time: 0h-0m-12s, clients: 1, corpus: 36, objectives: 0, executions: 7718, exec/sec: 1.139k
[32m INFO[0m [Stats #0] run time: 0h-0m-12s, clients: 1, corpus: 36, objectives: 0, executions: 7718, exec/sec: 1.036k
[32m INFO[0m ============= New Corpus Item =============
[32m INFO[0m Reverted? false 
 Txn:
[Sender] 0x35################################31dDb
   [1] Router.swapExactETHForTokens{value: 0.7074 ether}(0, path:(WETH  0x38################################4Ed0B), address(this), block.timestamp);
   [1] 0x38################################4Ed0B.transfer(0x68################################c9024, 39)
       0x01
[Sender] 0xe1################################c8510
   [1] 0x38################################4Ed0B.totalSupply()
       0xd3c21bcecceda1000000

[32m INFO[0m ==========================================
[32m INFO[0m [Testcase #0] run time: 0h-0m-12s, clients: 1, corpus: 37, objectives: 0, executions: 12247, exec/sec: 1.643k
[32m INFO[0m ============= Coverage Summary =============
[32m INFO[0m 0xc0################################56cc2: 11.03% Instruction Covered, 13.16% Branch Covered
[32m INFO[0m 0x38################################4ed0b: 48.54% Instruction Covered, 43.69% Branch Covered
[32m INFO[0m [Stats #0] run time: 0h-0m-13s, clients: 1, corpus: 37, objectives: 0, executions: 14319, exec/sec: 1.842k
[32m INFO[0m [Stats #0] run time: 0h-0m-13s, clients: 1, corpus: 37, objectives: 0, executions: 14319, exec/sec: 1.833k
[32m INFO[0m ============= New Corpus Item =============
[32m INFO[0m Reverted? false 
 Txn:
[Sender] 0x35################################31dDb
   [1] Router.swapExactETHForTokens{value: 0.7074 ether}(0, path:(WETH  0x38################################4Ed0B), address(this), block.timestamp);
   [1] 0x38################################4Ed0B.transfer(0x68################################c9024, 39)
       0x01
   [1] 0x38################################4Ed0B.decreaseAllowance(0x8E################################d79dd, 0)
       0x01

[32m INFO[0m ==========================================
[32m INFO[0m [Testcase #0] run time: 0h-0m-13s, clients: 1, corpus: 38, objectives: 0, executions: 14787, exec/sec: 1.893k
[32m INFO[0m ============= Coverage Summary =============
[32m INFO[0m 0xc0################################56cc2: 11.03% Instruction Covered, 13.16% Branch Covered
[32m INFO[0m 0x38################################4ed0b: 48.54% Instruction Covered, 43.69% Branch Covered
[32m INFO[0m [Stats #0] run time: 0h-0m-13s, clients: 1, corpus: 38, objectives: 0, executions: 14787, exec/sec: 1.759k
[32m INFO[0m ============= New Corpus Item =============
[32m INFO[0m Reverted? false 
 Txn:
[Sender] 0x35################################31dDb
   [1] Router.swapExactETHForTokens{value: 10.0 ether}(0, path:(WETH  0x38################################4Ed0B), address(this), block.timestamp);
   [1] 0x38################################4Ed0B.transfer(0xe1################################c8510, 3051)
       0x01

[32m INFO[0m ==========================================
[32m INFO[0m [Testcase #0] run time: 0h-0m-13s, clients: 1, corpus: 39, objectives: 0, executions: 20084, exec/sec: 2.389k
[32m INFO[0m ============= Coverage Summary =============
[32m INFO[0m 0xc0################################56cc2: 11.03% Instruction Covered, 13.16% Branch Covered
[32m INFO[0m 0x38################################4ed0b: 48.54% Instruction Covered, 43.69% Branch Covered
[32m INFO[0m [Stats #0] run time: 0h-0m-14s, clients: 1, corpus: 39, objectives: 0, executions: 20084, exec/sec: 2.317k
[32m INFO[0m ============= New Corpus Item =============
[32m INFO[0m Reverted? false 
 Txn:
[Sender] 0x35################################31dDb
   [1] Router.swapExactETHForTokens{value: 3748.6399 ether}(0, path:(WETH  0x38################################4Ed0B), address(this), block.timestamp);
   [1] 0x38################################4Ed0B.transfer(0xe1################################c8510, 27)
       0x01

[32m INFO[0m ==========================================
[32m INFO[0m [Testcase #0] run time: 0h-0m-14s, clients: 1, corpus: 40, objectives: 0, executions: 22236, exec/sec: 2.565k
[32m INFO[0m ============= Coverage Summary =============
[32m INFO[0m 0x38################################4ed0b: 48.54% Instruction Covered, 43.69% Branch Covered
[32m INFO[0m 0xc0################################56cc2: 11.03% Instruction Covered, 13.16% Branch Covered
[32m INFO[0m [Stats #0] run time: 0h-0m-14s, clients: 1, corpus: 40, objectives: 0, executions: 23146, exec/sec: 2.638k
[32m INFO[0m [Stats #0] run time: 0h-0m-15s, clients: 1, corpus: 40, objectives: 0, executions: 31305, exec/sec: 3.203k
[32m INFO[0m [Stats #0] run time: 0h-0m-16s, clients: 1, corpus: 40, objectives: 0, executions: 39571, exec/sec: 3.672k
[32m INFO[0m [Stats #0] run time: 0h-0m-17s, clients: 1, corpus: 40, objectives: 0, executions: 47799, exec/sec: 4.059k
[32m INFO[0m [Stats #0] run time: 0h-0m-17s, clients: 1, corpus: 40, objectives: 0, executions: 47799, exec/sec: 3.909k
[32m INFO[0m ============= New Corpus Item =============
[32m INFO[0m Reverted? false 
 Txn:
[Sender] 0x35################################31dDb
   [1] Router.swapExactETHForTokens{value: 275.7707 ether}(0, path:(WETH  0x38################################4Ed0B), address(this), block.timestamp);
   [1] 0x38################################4Ed0B.transfer(0xe1################################c8510, 3051)
       0x01
   [1] Router.swapExactETHForTokens{value: 830.6980 ether}(0, path:(WETH  0x38################################4Ed0B), address(this), block.timestamp);
   [1] 0x38################################4Ed0B.transfer(0xe1################################c8510, 27)
       0x01
   [1] Router.swapExactETHForTokens{value: 10.0 ether}(0, path:(WETH  0x38################################4Ed0B), address(this), block.timestamp);
   [1] 0x38################################4Ed0B.transfer(0x8E################################d79dd, 3051)
       0x01
   [1] Router.swapExactETHForTokens{value: 10.0 ether}(0, path:(WETH  0x38################################4Ed0B), address(this), block.timestamp);
   [1] 0x38################################4Ed0B.transfer(0xe1################################c8510, 3051)
       0x01

[32m INFO[0m ==========================================
[32m INFO[0m [Testcase #0] run time: 0h-0m-17s, clients: 1, corpus: 41, objectives: 0, executions: 51579, exec/sec: 4.218k
[32m INFO[0m ============= Coverage Summary =============
[32m INFO[0m 0xc0################################56cc2: 11.03% Instruction Covered, 13.16% Branch Covered
[32m INFO[0m 0x38################################4ed0b: 48.54% Instruction Covered, 43.69% Branch Covered
[32m INFO[0m [Stats #0] run time: 0h-0m-18s, clients: 1, corpus: 41, objectives: 0, executions: 56034, exec/sec: 4.383k
[32m INFO[0m [Stats #0] run time: 0h-0m-19s, clients: 1, corpus: 41, objectives: 0, executions: 64035, exec/sec: 4.644k
[32m INFO[0m [Stats #0] run time: 0h-0m-20s, clients: 1, corpus: 41, objectives: 0, executions: 72143, exec/sec: 4.877k
[32m INFO[0m [Stats #0] run time: 0h-0m-21s, clients: 1, corpus: 41, objectives: 0, executions: 80254, exec/sec: 5.081k
[32m INFO[0m [Stats #0] run time: 0h-0m-22s, clients: 1, corpus: 41, objectives: 0, executions: 88162, exec/sec: 5.247k
[32m INFO[0m [Stats #0] run time: 0h-0m-23s, clients: 1, corpus: 41, objectives: 0, executions: 96063, exec/sec: 5.396k
[32m INFO[0m [Stats #0] run time: 0h-0m-24s, clients: 1, corpus: 41, objectives: 0, executions: 103977, exec/sec: 5.529k
[32m INFO[0m [Stats #0] run time: 0h-0m-25s, clients: 1, corpus: 41, objectives: 0, executions: 111821, exec/sec: 5.645k
[32m INFO[0m [Stats #0] run time: 0h-0m-26s, clients: 1, corpus: 41, objectives: 0, executions: 119853, exec/sec: 5.760k
[32m INFO[0m [Stats #0] run time: 0h-0m-27s, clients: 1, corpus: 41, objectives: 0, executions: 128114, exec/sec: 5.872k
[32m INFO[0m [Stats #0] run time: 0h-0m-28s, clients: 1, corpus: 41, objectives: 0, executions: 135957, exec/sec: 5.959k
[32m INFO[0m [Stats #0] run time: 0h-0m-29s, clients: 1, corpus: 41, objectives: 0, executions: 144152, exec/sec: 6.052k
[32m INFO[0m [Stats #0] run time: 0h-0m-30s, clients: 1, corpus: 41, objectives: 0, executions: 152288, exec/sec: 6.135k
[32m INFO[0m [Stats #0] run time: 0h-0m-30s, clients: 1, corpus: 41, objectives: 0, executions: 152288, exec/sec: 6.103k
[32m INFO[0m ============= New Corpus Item =============
[32m INFO[0m Reverted? false 
 Txn:
[Sender] 0x35################################31dDb
   [1] Router.swapExactETHForTokens{value: 4722.3664 ether}(0, path:(WETH  0x38################################4Ed0B), address(this), block.timestamp);
   [1] 0x38################################4Ed0B.transfer(0x68################################c9024, 1)
       0x01
   [1] 0x38################################4Ed0B.reflect(0)

[32m INFO[0m ==========================================
[32m INFO[0m [Testcase #0] run time: 0h-0m-30s, clients: 1, corpus: 42, objectives: 0, executions: 153437, exec/sec: 6.149k
[32m INFO[0m ============= Coverage Summary =============
[32m INFO[0m 0xc0################################56cc2: 11.03% Instruction Covered, 13.16% Branch Covered
[32m INFO[0m 0x38################################4ed0b: 48.54% Instruction Covered, 43.69% Branch Covered
[32m INFO[0m [Stats #0] run time: 0h-0m-31s, clients: 1, corpus: 42, objectives: 0, executions: 160165, exec/sec: 6.202k
[32m INFO[0m [Stats #0] run time: 0h-0m-32s, clients: 1, corpus: 42, objectives: 0, executions: 168077, exec/sec: 6.265k
[32m INFO[0m [Stats #0] run time: 0h-0m-33s, clients: 1, corpus: 42, objectives: 0, executions: 176080, exec/sec: 6.328k
[32m INFO[0m [Stats #0] run time: 0h-0m-34s, clients: 1, corpus: 42, objectives: 0, executions: 183771, exec/sec: 6.374k
[32m INFO[0m [Stats #0] run time: 0h-0m-35s, clients: 1, corpus: 42, objectives: 0, executions: 191746, exec/sec: 6.427k
[32m INFO[0m [Stats #0] run time: 0h-0m-36s, clients: 1, corpus: 42, objectives: 0, executions: 199565, exec/sec: 6.472k
[32m INFO[0m [Stats #0] run time: 0h-0m-37s, clients: 1, corpus: 42, objectives: 0, executions: 207405, exec/sec: 6.515k
[32m INFO[0m [Stats #0] run time: 0h-0m-38s, clients: 1, corpus: 42, objectives: 0, executions: 215320, exec/sec: 6.558k
[32m INFO[0m [Stats #0] run time: 0h-0m-39s, clients: 1, corpus: 42, objectives: 0, executions: 223221, exec/sec: 6.597k
[32m INFO[0m [Stats #0] run time: 0h-0m-40s, clients: 1, corpus: 42, objectives: 0, executions: 231222, exec/sec: 6.637k
[32m INFO[0m [Stats #0] run time: 0h-0m-41s, clients: 1, corpus: 42, objectives: 0, executions: 239065, exec/sec: 6.670k
[32m INFO[0m [Stats #0] run time: 0h-0m-42s, clients: 1, corpus: 42, objectives: 0, executions: 246723, exec/sec: 6.697k
[32m INFO[0m [Stats #0] run time: 0h-0m-43s, clients: 1, corpus: 42, objectives: 0, executions: 254826, exec/sec: 6.734k
[32m INFO[0m [Stats #0] run time: 0h-0m-44s, clients: 1, corpus: 42, objectives: 0, executions: 262803, exec/sec: 6.766k
[32m INFO[0m [Stats #0] run time: 0h-0m-45s, clients: 1, corpus: 42, objectives: 0, executions: 270774, exec/sec: 6.795k
[32m INFO[0m [Stats #0] run time: 0h-0m-46s, clients: 1, corpus: 42, objectives: 0, executions: 279061, exec/sec: 6.831k
[32m INFO[0m [Stats #0] run time: 0h-0m-47s, clients: 1, corpus: 42, objectives: 0, executions: 286844, exec/sec: 6.853k
[32m INFO[0m [Stats #0] run time: 0h-0m-48s, clients: 1, corpus: 42, objectives: 0, executions: 294789, exec/sec: 6.877k
[32m INFO[0m [Stats #0] run time: 0h-0m-49s, clients: 1, corpus: 42, objectives: 0, executions: 302834, exec/sec: 6.902k
[32m INFO[0m [Stats #0] run time: 0h-0m-50s, clients: 1, corpus: 42, objectives: 0, executions: 310876, exec/sec: 6.927k
[32m INFO[0m [Stats #0] run time: 0h-0m-51s, clients: 1, corpus: 42, objectives: 0, executions: 318586, exec/sec: 6.944k
[32m INFO[0m [Stats #0] run time: 0h-0m-52s, clients: 1, corpus: 42, objectives: 0, executions: 326630, exec/sec: 6.967k
[32m INFO[0m [Stats #0] run time: 0h-0m-53s, clients: 1, corpus: 42, objectives: 0, executions: 334702, exec/sec: 6.990k
[32m INFO[0m [Stats #0] run time: 0h-0m-54s, clients: 1, corpus: 42, objectives: 0, executions: 342547, exec/sec: 7.006k
[32m INFO[0m [Stats #0] run time: 0h-0m-55s, clients: 1, corpus: 42, objectives: 0, executions: 350554, exec/sec: 7.026k
[32m INFO[0m [Stats #0] run time: 0h-0m-56s, clients: 1, corpus: 42, objectives: 0, executions: 358532, exec/sec: 7.044k
[32m INFO[0m [Stats #0] run time: 0h-0m-56s, clients: 1, corpus: 42, objectives: 0, executions: 358532, exec/sec: 7.042k
[32m INFO[0m ============= New Corpus Item =============
[32m INFO[0m Reverted? false 
 Txn:
[Sender] 0x35################################31dDb
   [1] Router.swapExactETHForTokens{value: 4722.3664 ether}(0, path:(WETH  0x38################################4Ed0B), address(this), block.timestamp);
   [1] 0x38################################4Ed0B.transfer(0x8E################################d79dd, 536870912)
       0x01
   [1] 0x38################################4Ed0B.transfer(0xe1################################c8510, 27)
       0x01

[32m INFO[0m ==========================================
[32m INFO[0m [Testcase #0] run time: 0h-0m-56s, clients: 1, corpus: 43, objectives: 0, executions: 358576, exec/sec: 7.043k
[32m INFO[0m ============= Coverage Summary =============
[32m INFO[0m 0x38################################4ed0b: 48.54% Instruction Covered, 43.69% Branch Covered
[32m INFO[0m 0xc0################################56cc2: 11.03% Instruction Covered, 13.16% Branch Covered
[32m INFO[0m [Stats #0] run time: 0h-0m-57s, clients: 1, corpus: 43, objectives: 0, executions: 366031, exec/sec: 7.052k
[32m INFO[0m [Stats #0] run time: 0h-0m-58s, clients: 1, corpus: 43, objectives: 0, executions: 373716, exec/sec: 7.063k
[32m INFO[0m [Stats #0] run time: 0h-0m-59s, clients: 1, corpus: 43, objectives: 0, executions: 381506, exec/sec: 7.077k
[32m INFO[0m [Stats #0] run time: 0h-1m-0s, clients: 1, corpus: 43, objectives: 0, executions: 389102, exec/sec: 7.086k
[32m INFO[0m [Stats #0] run time: 0h-1m-1s, clients: 1, corpus: 43, objectives: 0, executions: 396936, exec/sec: 7.099k
[32m INFO[0m [Stats #0] run time: 0h-1m-2s, clients: 1, corpus: 43, objectives: 0, executions: 404559, exec/sec: 7.108k
[32m INFO[0m [Stats #0] run time: 0h-1m-3s, clients: 1, corpus: 43, objectives: 0, executions: 412284, exec/sec: 7.118k
[32m INFO[0m [Stats #0] run time: 0h-1m-4s, clients: 1, corpus: 43, objectives: 0, executions: 420277, exec/sec: 7.132k
[32m INFO[0m [Stats #0] run time: 0h-1m-5s, clients: 1, corpus: 43, objectives: 0, executions: 428062, exec/sec: 7.142k
[32m INFO[0m [Stats #0] run time: 0h-1m-6s, clients: 1, corpus: 43, objectives: 0, executions: 435846, exec/sec: 7.153k
[32m INFO[0m [Stats #0] run time: 0h-1m-7s, clients: 1, corpus: 43, objectives: 0, executions: 443564, exec/sec: 7.162k
[32m INFO[0m [Stats #0] run time: 0h-1m-8s, clients: 1, corpus: 43, objectives: 0, executions: 451477, exec/sec: 7.174k
[32m INFO[0m [Stats #0] run time: 0h-1m-9s, clients: 1, corpus: 43, objectives: 0, executions: 459196, exec/sec: 7.182k
[32m INFO[0m [Stats #0] run time: 0h-1m-10s, clients: 1, corpus: 43, objectives: 0, executions: 466857, exec/sec: 7.189k
[32m INFO[0m [Stats #0] run time: 0h-1m-11s, clients: 1, corpus: 43, objectives: 0, executions: 474514, exec/sec: 7.196k
[32m INFO[0m [Stats #0] run time: 0h-1m-12s, clients: 1, corpus: 43, objectives: 0, executions: 482136, exec/sec: 7.202k
[32m INFO[0m [Stats #0] run time: 0h-1m-13s, clients: 1, corpus: 43, objectives: 0, executions: 489885, exec/sec: 7.210k
[32m INFO[0m [Stats #0] run time: 0h-1m-14s, clients: 1, corpus: 43, objectives: 0, executions: 497478, exec/sec: 7.215k
[32m INFO[0m [Stats #0] run time: 0h-1m-15s, clients: 1, corpus: 43, objectives: 0, executions: 505289, exec/sec: 7.223k
[32m INFO[0m [Stats #0] run time: 0h-1m-16s, clients: 1, corpus: 43, objectives: 0, executions: 513105, exec/sec: 7.231k
[32m INFO[0m [Stats #0] run time: 0h-1m-17s, clients: 1, corpus: 43, objectives: 0, executions: 520877, exec/sec: 7.238k
[32m INFO[0m [Stats #0] run time: 0h-1m-18s, clients: 1, corpus: 43, objectives: 0, executions: 528663, exec/sec: 7.246k
[32m INFO[0m [Stats #0] run time: 0h-1m-19s, clients: 1, corpus: 43, objectives: 0, executions: 536414, exec/sec: 7.252k
[32m INFO[0m [Stats #0] run time: 0h-1m-20s, clients: 1, corpus: 43, objectives: 0, executions: 544222, exec/sec: 7.260k
[32m INFO[0m [Stats #0] run time: 0h-1m-21s, clients: 1, corpus: 43, objectives: 0, executions: 551901, exec/sec: 7.265k
[32m INFO[0m [Stats #0] run time: 0h-1m-22s, clients: 1, corpus: 43, objectives: 0, executions: 559461, exec/sec: 7.268k
[32m INFO[0m [Stats #0] run time: 0h-1m-23s, clients: 1, corpus: 43, objectives: 0, executions: 567177, exec/sec: 7.274k
[32m INFO[0m [Stats #0] run time: 0h-1m-24s, clients: 1, corpus: 43, objectives: 0, executions: 575165, exec/sec: 7.282k
[32m INFO[0m [Stats #0] run time: 0h-1m-25s, clients: 1, corpus: 43, objectives: 0, executions: 582689, exec/sec: 7.285k
[32m INFO[0m [Stats #0] run time: 0h-1m-26s, clients: 1, corpus: 43, objectives: 0, executions: 590469, exec/sec: 7.290k
[32m INFO[0m [Stats #0] run time: 0h-1m-27s, clients: 1, corpus: 43, objectives: 0, executions: 598162, exec/sec: 7.295k
[32m INFO[0m [Stats #0] run time: 0h-1m-28s, clients: 1, corpus: 43, objectives: 0, executions: 605914, exec/sec: 7.301k
[32m INFO[0m [Stats #0] run time: 0h-1m-29s, clients: 1, corpus: 43, objectives: 0, executions: 613635, exec/sec: 7.305k
[32m INFO[0m [Stats #0] run time: 0h-1m-30s, clients: 1, corpus: 43, objectives: 0, executions: 621418, exec/sec: 7.310k
[32m INFO[0m [Stats #0] run time: 0h-1m-31s, clients: 1, corpus: 43, objectives: 0, executions: 629074, exec/sec: 7.314k
[32m INFO[0m [Stats #0] run time: 0h-1m-32s, clients: 1, corpus: 43, objectives: 0, executions: 636912, exec/sec: 7.320k
[32m INFO[0m [Stats #0] run time: 0h-1m-33s, clients: 1, corpus: 43, objectives: 0, executions: 644626, exec/sec: 7.324k
[32m INFO[0m [Stats #0] run time: 0h-1m-34s, clients: 1, corpus: 43, objectives: 0, executions: 652181, exec/sec: 7.326k
[32m INFO[0m [Stats #0] run time: 0h-1m-35s, clients: 1, corpus: 43, objectives: 0, executions: 660189, exec/sec: 7.333k
[32m INFO[0m [Stats #0] run time: 0h-1m-36s, clients: 1, corpus: 43, objectives: 0, executions: 667838, exec/sec: 7.336k
[32m INFO[0m [Stats #0] run time: 0h-1m-37s, clients: 1, corpus: 43, objectives: 0, executions: 675496, exec/sec: 7.340k
[32m INFO[0m [Stats #0] run time: 0h-1m-38s, clients: 1, corpus: 43, objectives: 0, executions: 683496, exec/sec: 7.346k
[32m INFO[0m [Stats #0] run time: 0h-1m-39s, clients: 1, corpus: 43, objectives: 0, executions: 691269, exec/sec: 7.351k
[32m INFO[0m [Stats #0] run time: 0h-1m-40s, clients: 1, corpus: 43, objectives: 0, executions: 699085, exec/sec: 7.356k
[32m INFO[0m [Stats #0] run time: 0h-1m-41s, clients: 1, corpus: 43, objectives: 0, executions: 706894, exec/sec: 7.360k
[32m INFO[0m [Stats #0] run time: 0h-1m-42s, clients: 1, corpus: 43, objectives: 0, executions: 714669, exec/sec: 7.364k
[32m INFO[0m [Stats #0] run time: 0h-1m-43s, clients: 1, corpus: 43, objectives: 0, executions: 722321, exec/sec: 7.367k
[32m INFO[0m [Stats #0] run time: 0h-1m-44s, clients: 1, corpus: 43, objectives: 0, executions: 722321, exec/sec: 7.317k
[32m INFO[0m ============= New Corpus Item =============
[32m INFO[0m Reverted? false 
 Txn:
[Sender] 0x35################################31dDb
   [1] Router.swapExactETHForTokens{value: 4722.3664 ether}(0, path:(WETH  0x38################################4Ed0B), address(this), block.timestamp);
   [1] 0x38################################4Ed0B.transfer(0x68################################c9024, 2165381670)
       0x01
   [1] 0x38################################4Ed0B.transfer(0x8E################################d79dd, 5359)
       0x01
   [1] 0x38################################4Ed0B.transfer(0xe1################################c8510, 3051)
       0x01

[32m INFO[0m ==========================================
[32m INFO[0m [Testcase #0] run time: 0h-1m-44s, clients: 1, corpus: 44, objectives: 0, executions: 727473, exec/sec: 7.369k
[32m INFO[0m ============= Coverage Summary =============
[32m INFO[0m 0x38################################4ed0b: 48.54% Instruction Covered, 43.69% Branch Covered
[32m INFO[0m 0xc0################################56cc2: 11.03% Instruction Covered, 13.16% Branch Covered
[32m INFO[0m [Stats #0] run time: 0h-1m-44s, clients: 1, corpus: 44, objectives: 0, executions: 730125, exec/sec: 7.371k
[32m INFO[0m [Stats #0] run time: 0h-1m-45s, clients: 1, corpus: 44, objectives: 0, executions: 737339, exec/sec: 7.369k
[32m INFO[0m [Stats #0] run time: 0h-1m-46s, clients: 1, corpus: 44, objectives: 0, executions: 744678, exec/sec: 7.369k
[32m INFO[0m [Stats #0] run time: 0h-1m-47s, clients: 1, corpus: 44, objectives: 0, executions: 752296, exec/sec: 7.371k
[32m INFO[0m [Stats #0] run time: 0h-1m-48s, clients: 1, corpus: 44, objectives: 0, executions: 752296, exec/sec: 7.317k
[32m INFO[0m ============= New Corpus Item =============
[32m INFO[0m Reverted? false 
 Txn:
[Sender] 0x35################################31dDb
   [1] Router.swapExactETHForTokens{value: 4722.3664 ether}(0, path:(WETH  0x38################################4Ed0B), address(this), block.timestamp);
   [1] 0x38################################4Ed0B.transfer(0x68################################c9024, 2165381670)
       0x01
   [1] 0x38################################4Ed0B.transfer(0x8E################################d79dd, 5359)
       0x01
   [1] 0x38################################4Ed0B.transfer(0xe1################################c8510, 3906)
       0x01
[Sender] 0x8E################################d79dd
   [1] 0x38################################4Ed0B.increaseAllowance(0xe1################################c8510, 3878)
       0x01

[32m INFO[0m ==========================================
[32m INFO[0m [Testcase #0] run time: 0h-1m-48s, clients: 1, corpus: 45, objectives: 0, executions: 757843, exec/sec: 7.371k
[32m INFO[0m ============= Coverage Summary =============
[32m INFO[0m 0xc0################################56cc2: 11.03% Instruction Covered, 13.16% Branch Covered
[32m INFO[0m 0x38################################4ed0b: 48.54% Instruction Covered, 43.69% Branch Covered
[32m INFO[0m [Stats #0] run time: 0h-1m-48s, clients: 1, corpus: 45, objectives: 0, executions: 759628, exec/sec: 7.371k
[32m INFO[0m [Stats #0] run time: 0h-1m-49s, clients: 1, corpus: 45, objectives: 0, executions: 766135, exec/sec: 7.362k
[32m INFO[0m [Stats #0] run time: 0h-1m-50s, clients: 1, corpus: 45, objectives: 0, executions: 772895, exec/sec: 7.356k
[32m INFO[0m [Stats #0] run time: 0h-1m-51s, clients: 1, corpus: 45, objectives: 0, executions: 779883, exec/sec: 7.352k
[32m INFO[0m [Stats #0] run time: 0h-1m-52s, clients: 1, corpus: 45, objectives: 0, executions: 786996, exec/sec: 7.350k
[32m INFO[0m [Stats #0] run time: 0h-1m-53s, clients: 1, corpus: 45, objectives: 0, executions: 794072, exec/sec: 7.347k
[32m INFO[0m [Stats #0] run time: 0h-1m-54s, clients: 1, corpus: 45, objectives: 0, executions: 800638, exec/sec: 7.340k
[32m INFO[0m [Stats #0] run time: 0h-1m-55s, clients: 1, corpus: 45, objectives: 0, executions: 807521, exec/sec: 7.336k
[32m INFO[0m [Stats #0] run time: 0h-1m-56s, clients: 1, corpus: 45, objectives: 0, executions: 814404, exec/sec: 7.331k
[32m INFO[0m [Stats #0] run time: 0h-1m-57s, clients: 1, corpus: 45, objectives: 0, executions: 821365, exec/sec: 7.328k
[32m INFO[0m [Stats #0] run time: 0h-1m-58s, clients: 1, corpus: 45, objectives: 0, executions: 828151, exec/sec: 7.322k
[32m INFO[0m [Stats #0] run time: 0h-1m-59s, clients: 1, corpus: 45, objectives: 0, executions: 835011, exec/sec: 7.318k
[32m INFO[0m [Stats #0] run time: 0h-2m-0s, clients: 1, corpus: 45, objectives: 0, executions: 841716, exec/sec: 7.312k
[32m INFO[0m [Stats #0] run time: 0h-2m-1s, clients: 1, corpus: 45, objectives: 0, executions: 848826, exec/sec: 7.310k
[32m INFO[0m [Stats #0] run time: 0h-2m-2s, clients: 1, corpus: 45, objectives: 0, executions: 855706, exec/sec: 7.307k
[32m INFO[0m [Stats #0] run time: 0h-2m-3s, clients: 1, corpus: 45, objectives: 0, executions: 862529, exec/sec: 7.302k
[32m INFO[0m [Stats #0] run time: 0h-2m-4s, clients: 1, corpus: 45, objectives: 0, executions: 869407, exec/sec: 7.299k
[32m INFO[0m [Stats #0] run time: 0h-2m-5s, clients: 1, corpus: 45, objectives: 0, executions: 876108, exec/sec: 7.293k
[32m INFO[0m [Stats #0] run time: 0h-2m-6s, clients: 1, corpus: 45, objectives: 0, executions: 883156, exec/sec: 7.291k
[32m INFO[0m [Stats #0] run time: 0h-2m-7s, clients: 1, corpus: 45, objectives: 0, executions: 890166, exec/sec: 7.288k
[32m INFO[0m [Stats #0] run time: 0h-2m-8s, clients: 1, corpus: 45, objectives: 0, executions: 897017, exec/sec: 7.284k
[32m INFO[0m [Stats #0] run time: 0h-2m-9s, clients: 1, corpus: 45, objectives: 0, executions: 903945, exec/sec: 7.281k
[32m INFO[0m [Stats #0] run time: 0h-2m-10s, clients: 1, corpus: 45, objectives: 0, executions: 910881, exec/sec: 7.278k
[32m INFO[0m [Stats #0] run time: 0h-2m-11s, clients: 1, corpus: 45, objectives: 0, executions: 917711, exec/sec: 7.274k
[32m INFO[0m [Stats #0] run time: 0h-2m-12s, clients: 1, corpus: 45, objectives: 0, executions: 924722, exec/sec: 7.272k
[32m INFO[0m [Stats #0] run time: 0h-2m-13s, clients: 1, corpus: 45, objectives: 0, executions: 931518, exec/sec: 7.268k
[32m INFO[0m [Stats #0] run time: 0h-2m-14s, clients: 1, corpus: 45, objectives: 0, executions: 938274, exec/sec: 7.264k
[32m INFO[0m [Stats #0] run time: 0h-2m-15s, clients: 1, corpus: 45, objectives: 0, executions: 944999, exec/sec: 7.259k
[32m INFO[0m [Stats #0] run time: 0h-2m-16s, clients: 1, corpus: 45, objectives: 0, executions: 952040, exec/sec: 7.257k
[32m INFO[0m [Stats #0] run time: 0h-2m-17s, clients: 1, corpus: 45, objectives: 0, executions: 958864, exec/sec: 7.254k
[32m INFO[0m [Stats #0] run time: 0h-2m-18s, clients: 1, corpus: 45, objectives: 0, executions: 965855, exec/sec: 7.252k
[32m INFO[0m [Stats #0] run time: 0h-2m-19s, clients: 1, corpus: 45, objectives: 0, executions: 972520, exec/sec: 7.247k
[32m INFO[0m [Stats #0] run time: 0h-2m-20s, clients: 1, corpus: 45, objectives: 0, executions: 979437, exec/sec: 7.244k
[32m INFO[0m [Stats #0] run time: 0h-2m-21s, clients: 1, corpus: 45, objectives: 0, executions: 986430, exec/sec: 7.241k
[32m INFO[0m [Stats #0] run time: 0h-2m-22s, clients: 1, corpus: 45, objectives: 0, executions: 993166, exec/sec: 7.238k
[32m INFO[0m [Stats #0] run time: 0h-2m-23s, clients: 1, corpus: 45, objectives: 0, executions: 999988, exec/sec: 7.234k
[32m INFO[0m [Stats #0] run time: 0h-2m-24s, clients: 1, corpus: 45, objectives: 0, executions: 1006713, exec/sec: 7.231k
[32m INFO[0m [Stats #0] run time: 0h-2m-25s, clients: 1, corpus: 45, objectives: 0, executions: 1013755, exec/sec: 7.229k
[32m INFO[0m [Stats #0] run time: 0h-2m-26s, clients: 1, corpus: 45, objectives: 0, executions: 1020836, exec/sec: 7.228k
[32m INFO[0m [Stats #0] run time: 0h-2m-27s, clients: 1, corpus: 45, objectives: 0, executions: 1027628, exec/sec: 7.225k
[32m INFO[0m [Stats #0] run time: 0h-2m-28s, clients: 1, corpus: 45, objectives: 0, executions: 1034299, exec/sec: 7.221k
[32m INFO[0m [Stats #0] run time: 0h-2m-29s, clients: 1, corpus: 45, objectives: 0, executions: 1041163, exec/sec: 7.218k
[32m INFO[0m [Stats #0] run time: 0h-2m-30s, clients: 1, corpus: 45, objectives: 0, executions: 1048206, exec/sec: 7.216k
[32m INFO[0m [Stats #0] run time: 0h-2m-31s, clients: 1, corpus: 45, objectives: 0, executions: 1055258, exec/sec: 7.215k
[32m INFO[0m [Stats #0] run time: 0h-2m-32s, clients: 1, corpus: 45, objectives: 0, executions: 1061864, exec/sec: 7.211k
[32m INFO[0m [Stats #0] run time: 0h-2m-33s, clients: 1, corpus: 45, objectives: 0, executions: 1068816, exec/sec: 7.209k
[32m INFO[0m [Stats #0] run time: 0h-2m-34s, clients: 1, corpus: 45, objectives: 0, executions: 1075607, exec/sec: 7.206k
[32m INFO[0m [Stats #0] run time: 0h-2m-35s, clients: 1, corpus: 45, objectives: 0, executions: 1082750, exec/sec: 7.205k
[32m INFO[0m [Stats #0] run time: 0h-2m-36s, clients: 1, corpus: 45, objectives: 0, executions: 1089766, exec/sec: 7.204k
[32m INFO[0m [Stats #0] run time: 0h-2m-37s, clients: 1, corpus: 45, objectives: 0, executions: 1096845, exec/sec: 7.203k
[32m INFO[0m [Stats #0] run time: 0h-2m-38s, clients: 1, corpus: 45, objectives: 0, executions: 1103678, exec/sec: 7.200k
[32m INFO[0m [Stats #0] run time: 0h-2m-39s, clients: 1, corpus: 45, objectives: 0, executions: 1110502, exec/sec: 7.197k
[32m INFO[0m [Stats #0] run time: 0h-2m-40s, clients: 1, corpus: 45, objectives: 0, executions: 1117518, exec/sec: 7.196k
[32m INFO[0m [Stats #0] run time: 0h-2m-41s, clients: 1, corpus: 45, objectives: 0, executions: 1124404, exec/sec: 7.194k
[32m INFO[0m [Stats #0] run time: 0h-2m-42s, clients: 1, corpus: 45, objectives: 0, executions: 1131349, exec/sec: 7.192k
[32m INFO[0m [Stats #0] run time: 0h-2m-43s, clients: 1, corpus: 45, objectives: 0, executions: 1138401, exec/sec: 7.191k
[32m INFO[0m [Stats #0] run time: 0h-2m-44s, clients: 1, corpus: 45, objectives: 0, executions: 1145136, exec/sec: 7.188k
[32m INFO[0m [Stats #0] run time: 0h-2m-45s, clients: 1, corpus: 45, objectives: 0, executions: 1151769, exec/sec: 7.184k
[32m INFO[0m [Stats #0] run time: 0h-2m-46s, clients: 1, corpus: 45, objectives: 0, executions: 1158857, exec/sec: 7.183k
[32m INFO[0m [Stats #0] run time: 0h-2m-47s, clients: 1, corpus: 45, objectives: 0, executions: 1165917, exec/sec: 7.183k
[32m INFO[0m [Stats #0] run time: 0h-2m-48s, clients: 1, corpus: 45, objectives: 0, executions: 1172872, exec/sec: 7.181k
[32m INFO[0m [Stats #0] run time: 0h-2m-49s, clients: 1, corpus: 45, objectives: 0, executions: 1179702, exec/sec: 7.179k
[32m INFO[0m [Stats #0] run time: 0h-2m-50s, clients: 1, corpus: 45, objectives: 0, executions: 1186397, exec/sec: 7.176k
[32m INFO[0m [Stats #0] run time: 0h-2m-51s, clients: 1, corpus: 45, objectives: 0, executions: 1193254, exec/sec: 7.174k
[32m INFO[0m [Stats #0] run time: 0h-2m-52s, clients: 1, corpus: 45, objectives: 0, executions: 1200236, exec/sec: 7.172k
[32m INFO[0m [Stats #0] run time: 0h-2m-53s, clients: 1, corpus: 45, objectives: 0, executions: 1207322, exec/sec: 7.172k
[32m INFO[0m [Stats #0] run time: 0h-2m-54s, clients: 1, corpus: 45, objectives: 0, executions: 1213958, exec/sec: 7.168k
[32m INFO[0m [Stats #0] run time: 0h-2m-55s, clients: 1, corpus: 45, objectives: 0, executions: 1220650, exec/sec: 7.165k
[32m INFO[0m [Stats #0] run time: 0h-2m-56s, clients: 1, corpus: 45, objectives: 0, executions: 1227737, exec/sec: 7.165k
[32m INFO[0m [Stats #0] run time: 0h-2m-57s, clients: 1, corpus: 45, objectives: 0, executions: 1234757, exec/sec: 7.164k
[32m INFO[0m [Stats #0] run time: 0h-2m-58s, clients: 1, corpus: 45, objectives: 0, executions: 1241746, exec/sec: 7.163k
[32m INFO[0m [Stats #0] run time: 0h-2m-59s, clients: 1, corpus: 45, objectives: 0, executions: 1248349, exec/sec: 7.159k
[32m INFO[0m [Stats #0] run time: 0h-3m-0s, clients: 1, corpus: 45, objectives: 0, executions: 1255273, exec/sec: 7.158k
[32m INFO[0m [Stats #0] run time: 0h-3m-1s, clients: 1, corpus: 45, objectives: 0, executions: 1262225, exec/sec: 7.156k
[32m INFO[0m [Stats #0] run time: 0h-3m-2s, clients: 1, corpus: 45, objectives: 0, executions: 1269373, exec/sec: 7.156k
[32m INFO[0m [Stats #0] run time: 0h-3m-3s, clients: 1, corpus: 45, objectives: 0, executions: 1276423, exec/sec: 7.155k
[32m INFO[0m [Stats #0] run time: 0h-3m-4s, clients: 1, corpus: 45, objectives: 0, executions: 1283443, exec/sec: 7.154k
[32m INFO[0m [Stats #0] run time: 0h-3m-5s, clients: 1, corpus: 45, objectives: 0, executions: 1290336, exec/sec: 7.153k
[32m INFO[0m [Stats #0] run time: 0h-3m-6s, clients: 1, corpus: 45, objectives: 0, executions: 1297107, exec/sec: 7.151k
[32m INFO[0m [Stats #0] run time: 0h-3m-7s, clients: 1, corpus: 45, objectives: 0, executions: 1303898, exec/sec: 7.148k
[32m INFO[0m [Stats #0] run time: 0h-3m-8s, clients: 1, corpus: 45, objectives: 0, executions: 1310985, exec/sec: 7.148k
[32m INFO[0m [Stats #0] run time: 0h-3m-9s, clients: 1, corpus: 45, objectives: 0, executions: 1318004, exec/sec: 7.147k
[32m INFO[0m [Stats #0] run time: 0h-3m-10s, clients: 1, corpus: 45, objectives: 0, executions: 1324836, exec/sec: 7.145k
[32m INFO[0m [Stats #0] run time: 0h-3m-11s, clients: 1, corpus: 45, objectives: 0, executions: 1331792, exec/sec: 7.144k
[32m INFO[0m [Stats #0] run time: 0h-3m-12s, clients: 1, corpus: 45, objectives: 0, executions: 1338719, exec/sec: 7.143k
[32m INFO[0m [Stats #0] run time: 0h-3m-13s, clients: 1, corpus: 45, objectives: 0, executions: 1345505, exec/sec: 7.141k
[32m INFO[0m [Stats #0] run time: 0h-3m-14s, clients: 1, corpus: 45, objectives: 0, executions: 1352556, exec/sec: 7.140k
[32m INFO[0m [Stats #0] run time: 0h-3m-15s, clients: 1, corpus: 45, objectives: 0, executions: 1359508, exec/sec: 7.139k
[32m INFO[0m [Stats #0] run time: 0h-3m-16s, clients: 1, corpus: 45, objectives: 0, executions: 1366146, exec/sec: 7.136k
[32m INFO[0m [Stats #0] run time: 0h-3m-17s, clients: 1, corpus: 45, objectives: 0, executions: 1372778, exec/sec: 7.134k
[32m INFO[0m [Stats #0] run time: 0h-3m-18s, clients: 1, corpus: 45, objectives: 0, executions: 1379833, exec/sec: 7.133k
[32m INFO[0m [Stats #0] run time: 0h-3m-19s, clients: 1, corpus: 45, objectives: 0, executions: 1386882, exec/sec: 7.132k
[32m INFO[0m [Stats #0] run time: 0h-3m-20s, clients: 1, corpus: 45, objectives: 0, executions: 1393641, exec/sec: 7.130k
[32m INFO[0m [Stats #0] run time: 0h-3m-21s, clients: 1, corpus: 45, objectives: 0, executions: 1400491, exec/sec: 7.129k
[32m INFO[0m [Stats #0] run time: 0h-3m-22s, clients: 1, corpus: 45, objectives: 0, executions: 1407253, exec/sec: 7.127k
[32m INFO[0m [Stats #0] run time: 0h-3m-23s, clients: 1, corpus: 45, objectives: 0, executions: 1414265, exec/sec: 7.126k
[32m INFO[0m [Stats #0] run time: 0h-3m-24s, clients: 1, corpus: 45, objectives: 0, executions: 1421367, exec/sec: 7.125k
[32m INFO[0m [Stats #0] run time: 0h-3m-25s, clients: 1, corpus: 45, objectives: 0, executions: 1428099, exec/sec: 7.123k
[32m INFO[0m [Stats #0] run time: 0h-3m-26s, clients: 1, corpus: 45, objectives: 0, executions: 1435025, exec/sec: 7.122k
[32m INFO[0m [Stats #0] run time: 0h-3m-27s, clients: 1, corpus: 45, objectives: 0, executions: 1441943, exec/sec: 7.121k
[32m INFO[0m [Stats #0] run time: 0h-3m-28s, clients: 1, corpus: 45, objectives: 0, executions: 1448788, exec/sec: 7.120k
[32m INFO[0m [Stats #0] run time: 0h-3m-29s, clients: 1, corpus: 45, objectives: 0, executions: 1455798, exec/sec: 7.119k
[32m INFO[0m [Stats #0] run time: 0h-3m-30s, clients: 1, corpus: 45, objectives: 0, executions: 1462523, exec/sec: 7.117k
[32m INFO[0m [Stats #0] run time: 0h-3m-31s, clients: 1, corpus: 45, objectives: 0, executions: 1469510, exec/sec: 7.117k
[32m INFO[0m [Stats #0] run time: 0h-3m-32s, clients: 1, corpus: 45, objectives: 0, executions: 1476384, exec/sec: 7.115k
[32m INFO[0m [Stats #0] run time: 0h-3m-33s, clients: 1, corpus: 45, objectives: 0, executions: 1483270, exec/sec: 7.114k
[32m INFO[0m [Stats #0] run time: 0h-3m-34s, clients: 1, corpus: 45, objectives: 0, executions: 1490277, exec/sec: 7.113k
[32m INFO[0m [Stats #0] run time: 0h-3m-35s, clients: 1, corpus: 45, objectives: 0, executions: 1497328, exec/sec: 7.113k
[32m INFO[0m [Stats #0] run time: 0h-3m-36s, clients: 1, corpus: 45, objectives: 0, executions: 1503964, exec/sec: 7.111k
[32m INFO[0m [Stats #0] run time: 0h-3m-37s, clients: 1, corpus: 45, objectives: 0, executions: 1510721, exec/sec: 7.109k
[32m INFO[0m [Stats #0] run time: 0h-3m-38s, clients: 1, corpus: 45, objectives: 0, executions: 1517643, exec/sec: 7.108k
[32m INFO[0m [Stats #0] run time: 0h-3m-39s, clients: 1, corpus: 45, objectives: 0, executions: 1524659, exec/sec: 7.107k
[32m INFO[0m [Stats #0] run time: 0h-3m-40s, clients: 1, corpus: 45, objectives: 0, executions: 1531389, exec/sec: 7.105k
[32m INFO[0m [Stats #0] run time: 0h-3m-41s, clients: 1, corpus: 45, objectives: 0, executions: 1538080, exec/sec: 7.103k
[32m INFO[0m [Stats #0] run time: 0h-3m-42s, clients: 1, corpus: 45, objectives: 0, executions: 1544944, exec/sec: 7.102k
[32m INFO[0m [Stats #0] run time: 0h-3m-43s, clients: 1, corpus: 45, objectives: 0, executions: 1551956, exec/sec: 7.101k
[32m INFO[0m [Stats #0] run time: 0h-3m-44s, clients: 1, corpus: 45, objectives: 0, executions: 1559035, exec/sec: 7.101k
[32m INFO[0m [Stats #0] run time: 0h-3m-45s, clients: 1, corpus: 45, objectives: 0, executions: 1565832, exec/sec: 7.100k
[32m INFO[0m [Stats #0] run time: 0h-3m-46s, clients: 1, corpus: 45, objectives: 0, executions: 1572525, exec/sec: 7.098k
[32m INFO[0m [Stats #0] run time: 0h-3m-47s, clients: 1, corpus: 45, objectives: 0, executions: 1579419, exec/sec: 7.097k
[32m INFO[0m [Stats #0] run time: 0h-3m-48s, clients: 1, corpus: 45, objectives: 0, executions: 1586467, exec/sec: 7.096k
[32m INFO[0m [Stats #0] run time: 0h-3m-49s, clients: 1, corpus: 45, objectives: 0, executions: 1593107, exec/sec: 7.094k
[32m INFO[0m [Stats #0] run time: 0h-3m-50s, clients: 1, corpus: 45, objectives: 0, executions: 1599780, exec/sec: 7.092k
[32m INFO[0m [Stats #0] run time: 0h-3m-51s, clients: 1, corpus: 45, objectives: 0, executions: 1606644, exec/sec: 7.091k
[32m INFO[0m [Stats #0] run time: 0h-3m-52s, clients: 1, corpus: 45, objectives: 0, executions: 1613598, exec/sec: 7.091k
[32m INFO[0m [Stats #0] run time: 0h-3m-53s, clients: 1, corpus: 45, objectives: 0, executions: 1620456, exec/sec: 7.090k
[32m INFO[0m [Stats #0] run time: 0h-3m-54s, clients: 1, corpus: 45, objectives: 0, executions: 1627254, exec/sec: 7.088k
[32m INFO[0m [Stats #0] run time: 0h-3m-55s, clients: 1, corpus: 45, objectives: 0, executions: 1633987, exec/sec: 7.086k
[32m INFO[0m [Stats #0] run time: 0h-3m-56s, clients: 1, corpus: 45, objectives: 0, executions: 1641035, exec/sec: 7.086k
[32m INFO[0m [Stats #0] run time: 0h-3m-57s, clients: 1, corpus: 45, objectives: 0, executions: 1648115, exec/sec: 7.086k
[32m INFO[0m [Stats #0] run time: 0h-3m-58s, clients: 1, corpus: 45, objectives: 0, executions: 1654083, exec/sec: 7.081k
[32m INFO[0m [Stats #0] run time: 0h-3m-59s, clients: 1, corpus: 45, objectives: 0, executions: 1661070, exec/sec: 7.080k
[32m INFO[0m [Stats #0] run time: 0h-4m-0s, clients: 1, corpus: 45, objectives: 0, executions: 1668053, exec/sec: 7.080k
[32m INFO[0m [Stats #0] run time: 0h-4m-1s, clients: 1, corpus: 45, objectives: 0, executions: 1668053, exec/sec: 7.061k
[32m INFO[0m ============= New Corpus Item =============
[32m INFO[0m Reverted? false 
 Txn:
[Sender] 0x35################################31dDb
   [1] Router.swapExactETHForTokens{value: 4722.3664 ether}(0, path:(WETH  0x38################################4Ed0B), address(this), block.timestamp);
   [1] 0x38################################4Ed0B.transfer(0x8E################################d79dd, 536870912)
       0x01
   [1] 0x38################################4Ed0B.transfer(0xe1################################c8510, 27)
       0x01
   [1] 0x38################################4Ed0B.reflect(0)

[32m INFO[0m ==========================================
[32m INFO[0m [Testcase #0] run time: 0h-4m-1s, clients: 1, corpus: 46, objectives: 0, executions: 1672387, exec/sec: 7.079k
[32m INFO[0m ============= Coverage Summary =============
[32m INFO[0m 0xc0################################56cc2: 11.03% Instruction Covered, 13.16% Branch Covered
[32m INFO[0m 0x38################################4ed0b: 48.54% Instruction Covered, 43.69% Branch Covered
[32m INFO[0m [Stats #0] run time: 0h-4m-1s, clients: 1, corpus: 46, objectives: 0, executions: 1674303, exec/sec: 7.076k
[32m INFO[0m [Stats #0] run time: 0h-4m-2s, clients: 1, corpus: 46, objectives: 0, executions: 1681190, exec/sec: 7.075k
[32m INFO[0m [Stats #0] run time: 0h-4m-3s, clients: 1, corpus: 46, objectives: 0, executions: 1687511, exec/sec: 7.072k
[32m INFO[0m [Stats #0] run time: 0h-4m-4s, clients: 1, corpus: 46, objectives: 0, executions: 1694625, exec/sec: 7.072k
[32m INFO[0m [Stats #0] run time: 0h-4m-5s, clients: 1, corpus: 46, objectives: 0, executions: 1701547, exec/sec: 7.072k
[32m INFO[0m [Stats #0] run time: 0h-4m-6s, clients: 1, corpus: 46, objectives: 0, executions: 1708089, exec/sec: 7.069k
[32m INFO[0m [Stats #0] run time: 0h-4m-7s, clients: 1, corpus: 46, objectives: 0, executions: 1715143, exec/sec: 7.069k
[32m INFO[0m [Stats #0] run time: 0h-4m-8s, clients: 1, corpus: 46, objectives: 0, executions: 1721941, exec/sec: 7.068k
[32m INFO[0m [Stats #0] run time: 0h-4m-9s, clients: 1, corpus: 46, objectives: 0, executions: 1728494, exec/sec: 7.066k
[32m INFO[0m [Stats #0] run time: 0h-4m-10s, clients: 1, corpus: 46, objectives: 0, executions: 1735157, exec/sec: 7.064k
[32m INFO[0m [Stats #0] run time: 0h-4m-11s, clients: 1, corpus: 46, objectives: 0, executions: 1741763, exec/sec: 7.062k
[32m INFO[0m [Stats #0] run time: 0h-4m-12s, clients: 1, corpus: 46, objectives: 0, executions: 1748935, exec/sec: 7.063k
[32m INFO[0m [Stats #0] run time: 0h-4m-13s, clients: 1, corpus: 46, objectives: 0, executions: 1755792, exec/sec: 7.062k
[32m INFO[0m [Stats #0] run time: 0h-4m-14s, clients: 1, corpus: 46, objectives: 0, executions: 1762686, exec/sec: 7.061k
[32m INFO[0m [Stats #0] run time: 0h-4m-15s, clients: 1, corpus: 46, objectives: 0, executions: 1769481, exec/sec: 7.060k
[32m INFO[0m [Stats #0] run time: 0h-4m-16s, clients: 1, corpus: 46, objectives: 0, executions: 1776110, exec/sec: 7.058k
[32m INFO[0m [Stats #0] run time: 0h-4m-17s, clients: 1, corpus: 46, objectives: 0, executions: 1782839, exec/sec: 7.057k
[32m INFO[0m [Stats #0] run time: 0h-4m-18s, clients: 1, corpus: 46, objectives: 0, executions: 1789953, exec/sec: 7.057k
[32m INFO[0m [Stats #0] run time: 0h-4m-19s, clients: 1, corpus: 46, objectives: 0, executions: 1796615, exec/sec: 7.055k
[32m INFO[0m [Stats #0] run time: 0h-4m-20s, clients: 1, corpus: 46, objectives: 0, executions: 1803376, exec/sec: 7.054k
[32m INFO[0m [Stats #0] run time: 0h-4m-21s, clients: 1, corpus: 46, objectives: 0, executions: 1810460, exec/sec: 7.054k
[32m INFO[0m [Stats #0] run time: 0h-4m-23s, clients: 1, corpus: 46, objectives: 0, executions: 1817160, exec/sec: 7.052k
[32m INFO[0m [Stats #0] run time: 0h-4m-24s, clients: 1, corpus: 46, objectives: 0, executions: 1823917, exec/sec: 7.051k
[32m INFO[0m [Stats #0] run time: 0h-4m-25s, clients: 1, corpus: 46, objectives: 0, executions: 1830987, exec/sec: 7.051k
[32m INFO[0m [Stats #0] run time: 0h-4m-26s, clients: 1, corpus: 46, objectives: 0, executions: 1837584, exec/sec: 7.049k
[32m INFO[0m [Stats #0] run time: 0h-4m-27s, clients: 1, corpus: 46, objectives: 0, executions: 1844406, exec/sec: 7.048k
[32m INFO[0m [Stats #0] run time: 0h-4m-28s, clients: 1, corpus: 46, objectives: 0, executions: 1851518, exec/sec: 7.048k
[32m INFO[0m [Stats #0] run time: 0h-4m-29s, clients: 1, corpus: 46, objectives: 0, executions: 1858092, exec/sec: 7.047k
[32m INFO[0m [Stats #0] run time: 0h-4m-30s, clients: 1, corpus: 46, objectives: 0, executions: 1864721, exec/sec: 7.045k
[32m INFO[0m [Stats #0] run time: 0h-4m-31s, clients: 1, corpus: 46, objectives: 0, executions: 1871067, exec/sec: 7.042k
[32m INFO[0m [Stats #0] run time: 0h-4m-32s, clients: 1, corpus: 46, objectives: 0, executions: 1877930, exec/sec: 7.042k
[32m INFO[0m [Stats #0] run time: 0h-4m-33s, clients: 1, corpus: 46, objectives: 0, executions: 1884472, exec/sec: 7.040k
[32m INFO[0m [Stats #0] run time: 0h-4m-34s, clients: 1, corpus: 46, objectives: 0, executions: 1891039, exec/sec: 7.038k
[32m INFO[0m [Stats #0] run time: 0h-4m-35s, clients: 1, corpus: 46, objectives: 0, executions: 1897511, exec/sec: 7.036k
[32m INFO[0m [Stats #0] run time: 0h-4m-36s, clients: 1, corpus: 46, objectives: 0, executions: 1904466, exec/sec: 7.035k
[32m INFO[0m [Stats #0] run time: 0h-4m-37s, clients: 1, corpus: 46, objectives: 0, executions: 1911542, exec/sec: 7.035k
[32m INFO[0m [Stats #0] run time: 0h-4m-38s, clients: 1, corpus: 46, objectives: 0, executions: 1917895, exec/sec: 7.033k
[32m INFO[0m [Stats #0] run time: 0h-4m-39s, clients: 1, corpus: 46, objectives: 0, executions: 1924905, exec/sec: 7.033k
[32m INFO[0m [Stats #0] run time: 0h-4m-40s, clients: 1, corpus: 46, objectives: 0, executions: 1931575, exec/sec: 7.031k
[32m INFO[0m [Stats #0] run time: 0h-4m-41s, clients: 1, corpus: 46, objectives: 0, executions: 1938282, exec/sec: 7.030k
[32m INFO[0m [Stats #0] run time: 0h-4m-42s, clients: 1, corpus: 46, objectives: 0, executions: 1945426, exec/sec: 7.030k
[32m INFO[0m [Stats #0] run time: 0h-4m-43s, clients: 1, corpus: 46, objectives: 0, executions: 1952277, exec/sec: 7.029k
[32m INFO[0m [Stats #0] run time: 0h-4m-44s, clients: 1, corpus: 46, objectives: 0, executions: 1958835, exec/sec: 7.028k
[32m INFO[0m [Stats #0] run time: 0h-4m-45s, clients: 1, corpus: 46, objectives: 0, executions: 1965885, exec/sec: 7.027k
[32m INFO[0m [Stats #0] run time: 0h-4m-46s, clients: 1, corpus: 46, objectives: 0, executions: 1972488, exec/sec: 7.026k
[32m INFO[0m [Stats #0] run time: 0h-4m-47s, clients: 1, corpus: 46, objectives: 0, executions: 1979309, exec/sec: 7.025k
[32m INFO[0m [Stats #0] run time: 0h-4m-48s, clients: 1, corpus: 46, objectives: 0, executions: 1986355, exec/sec: 7.025k
[32m INFO[0m [Stats #0] run time: 0h-4m-49s, clients: 1, corpus: 46, objectives: 0, executions: 1992960, exec/sec: 7.023k
[32m INFO[0m [Stats #0] run time: 0h-4m-50s, clients: 1, corpus: 46, objectives: 0, executions: 1999307, exec/sec: 7.021k
[32m INFO[0m [Stats #0] run time: 0h-4m-51s, clients: 1, corpus: 46, objectives: 0, executions: 2005748, exec/sec: 7.019k
[32m INFO[0m [Stats #0] run time: 0h-4m-52s, clients: 1, corpus: 46, objectives: 0, executions: 2012922, exec/sec: 7.019k
[32m INFO[0m [Stats #0] run time: 0h-4m-53s, clients: 1, corpus: 46, objectives: 0, executions: 2019428, exec/sec: 7.017k
[32m INFO[0m [Stats #0] run time: 0h-4m-53s, clients: 1, corpus: 46, objectives: 0, executions: 2019428, exec/sec: 7.011k
[32m INFO[0m ============= New Corpus Item =============
[32m INFO[0m Reverted? false 
 Txn:
[Sender] 0x35################################31dDb
   [1] Router.swapExactETHForTokens{value: 4722.3664 ether}(0, path:(WETH  0x38################################4Ed0B), address(this), block.timestamp);
   [1] 0x38################################4Ed0B.transfer(0x68################################c9024, 2165381670)
       0x01
   [1] 0x38################################4Ed0B.transfer(0x8E################################d79dd, 5359)
       0x01
   [1] 0x38################################4Ed0B.transfer(0xe1################################c8510, 6368)
       0x01
[Sender] 0x68################################c9024
   [1] 0x38################################4Ed0B.approve(0x8E################################d79dd, 0)
       0x01

[32m INFO[0m ==========================================
[32m INFO[0m [Testcase #0] run time: 0h-4m-53s, clients: 1, corpus: 47, objectives: 0, executions: 2021052, exec/sec: 7.017k
[32m INFO[0m ============= Coverage Summary =============
[32m INFO[0m 0x38################################4ed0b: 48.54% Instruction Covered, 43.69% Branch Covered
[32m INFO[0m 0xc0################################56cc2: 11.03% Instruction Covered, 13.16% Branch Covered
[32m INFO[0m [Stats #0] run time: 0h-4m-54s, clients: 1, corpus: 47, objectives: 0, executions: 2025746, exec/sec: 7.015k
[32m INFO[0m [Stats #0] run time: 0h-4m-55s, clients: 1, corpus: 47, objectives: 0, executions: 2032125, exec/sec: 7.012k
[32m INFO[0m [Stats #0] run time: 0h-4m-56s, clients: 1, corpus: 47, objectives: 0, executions: 2038283, exec/sec: 7.009k
[32m INFO[0m [Stats #0] run time: 0h-4m-57s, clients: 1, corpus: 47, objectives: 0, executions: 2044277, exec/sec: 7.006k
[32m INFO[0m [Stats #0] run time: 0h-4m-58s, clients: 1, corpus: 47, objectives: 0, executions: 2050439, exec/sec: 7.002k
[32m INFO[0m [Stats #0] run time: 0h-4m-59s, clients: 1, corpus: 47, objectives: 0, executions: 2056783, exec/sec: 7.000k
Timeout