[32m INFO[0m fetching abi from https://api.etherscan.io/api?module=contract&action=getabi&address=0x39################################6116f&format=json&apikey=GS896CZ6PQ13S3HGE6FRK1Z9DYCZFWF2RC
[32m INFO[0m fetching code from 3918c445eca2cdf389a35bb96e6dfd92eac6116f
Contract loaded: 0x39################################6116f
[32m INFO[0m fetching abi from https://api.etherscan.io/api?module=contract&action=getabi&address=0x10################################6024e&format=json&apikey=GS896CZ6PQ13S3HGE6FRK1Z9DYCZFWF2RC
[32m INFO[0m fetching code from 10ed43c718714eb63d5aa57b78b54704e256024e
Contract loaded: 0x10################################6024e
[32m INFO[0m fetching abi from https://api.etherscan.io/api?module=contract&action=getabi&address=0xbb################################c095c&format=json&apikey=GS896CZ6PQ13S3HGE6FRK1Z9DYCZFWF2RC
[32m INFO[0m fetching code from bb4cdb9cbd36b01bd1cbaebf2de08d9173bc095c
Contract loaded: 0xbb################################c095c
[32m INFO[0m 

 ================ EVM Fuzzer Start ===================


[32m INFO[0m Deploying contract: 0x39################################6116f
[32m INFO[0m Contract 0x39################################6116f deployed to: 0x39################################6116f -> balacne is 0
[32m INFO[0m Deploying contract: 0x10################################6024e
[32m INFO[0m Contract 0x10################################6024e deployed to: 0x10################################6024e -> balacne is 0
[32m INFO[0m Deploying contract: 0xbb################################c095c
[32m INFO[0m Contract 0xbb################################c095c deployed to: 0xbb################################c095c -> balacne is 0
[32m INFO[0m Deployed all contracts

[32m INFO[0m fetching pairs for 0x39################################6116f
[32m INFO[0m fetching pairs for 0x39################################6116f
[32m INFO[0m fetching code from 42b9c1fc8bfdd764d4d19322c24e84bb1c4fd36b
[32m INFO[0m fetching code from c02aaa39b223fe8d0a0e5c4f27ead9083c756cc2
[32m INFO[0m Contract 0xbb################################c095c has no abi
[32m INFO[0m Too many unknown function signature for "0xbb################################c095c", we are going to decompile this contract using EVMole
[32m INFO[0m [Stats #0] run time: 0h-0m-3s, clients: 1, corpus: 0, objectives: 0, executions: 0, exec/sec: 0.000
[32m INFO[0m ============= New Corpus Item =============
[32m INFO[0m Reverted? false 
 Txn:
[Sender] 0x35################################31dDb
   [1] Router.swapExactETHForTokens{value: 3840.5144 ether}(0, path:(WETH  0x39################################6116f), address(this), block.timestamp);

[32m INFO[0m ==========================================
[32m INFO[0m [Testcase #0] run time: 0h-0m-3s, clients: 1, corpus: 12, objectives: 0, executions: 1, exec/sec: 0.000
[32m INFO[0m ============= Coverage Summary =============
[32m INFO[0m 0xc0################################56cc2: 11.03% Instruction Covered, 13.16% Branch Covered
[32m INFO[0m 0x39################################6116f: 47.94% Instruction Covered, 45.08% Branch Covered
[32m INFO[0m [Stats #0] run time: 0h-0m-4s, clients: 1, corpus: 12, objectives: 0, executions: 1, exec/sec: 0.000
[32m INFO[0m ============= New Corpus Item =============
[32m INFO[0m Reverted? true 
 Txn:
[Sender] 0x35################################31dDb
   [1] Router.swapExactETHForTokens{value: 3840.5144 ether}(0, path:(WETH  0x39################################6116f), address(this), block.timestamp);
   [1] Router.swapExactETHForTokens{value: 8}(0, path:(WETH  0x39################################6116f), address(this), block.timestamp);
[Sender] 0xe1################################c8510
   [1] 0x39################################6116f.addMinter(0x35################################31dDb)
       0x08################################0000000000000000000000000000000000020000000000000000000000000000000000000000000000000000000000000000b21676f7665726e616e6365000000000000000000000000000000000000000000

[32m INFO[0m ==========================================
[32m INFO[0m [Testcase #0] run time: 0h-0m-4s, clients: 1, corpus: 13, objectives: 0, executions: 33, exec/sec: 0.000
[32m INFO[0m [Stats #0] run time: 0h-0m-4s, clients: 1, corpus: 13, objectives: 0, executions: 33, exec/sec: 0.000
[32m INFO[0m ============= New Corpus Item =============
[32m INFO[0m Reverted? true 
 Txn:
[Sender] 0x35################################31dDb
   [1] Router.swapExactETHForTokens{value: 18.4467 ether}(0, path:(WETH  0x39################################6116f), address(this), block.timestamp);
[Sender] 0xe1################################c8510
   [1] 0x39################################6116f.addMinter{value: 9.2416 ether}(0x00################################00000)

[32m INFO[0m ==========================================
[32m INFO[0m [Testcase #0] run time: 0h-0m-4s, clients: 1, corpus: 14, objectives: 0, executions: 34, exec/sec: 0.000
[32m INFO[0m ============= Coverage Summary =============
[32m INFO[0m 0xc0################################56cc2: 11.03% Instruction Covered, 13.16% Branch Covered
[32m INFO[0m 0x39################################6116f: 48.03% Instruction Covered, 45.90% Branch Covered
[32m INFO[0m [Stats #0] run time: 0h-0m-4s, clients: 1, corpus: 14, objectives: 0, executions: 34, exec/sec: 0.000
[32m INFO[0m ============= New Corpus Item =============
[32m INFO[0m Reverted? true 
 Txn:
[Sender] 0x35################################31dDb
   [1] Router.swapExactETHForTokens{value: 5306}(0, path:(WETH  0x39################################6116f), address(this), block.timestamp);
   [1] 0x39################################6116f.approve(0x00################################00000, 0)
       0x08################################0000000000000000000000000000000000020000000000000000000000000000000000000000000000000000000000000002245524332303a20617070726f766520746f20746865207a65726f2061646472657373000000000000000000000000000000000000000000000000000000000000

[32m INFO[0m ==========================================
[32m INFO[0m [Testcase #0] run time: 0h-0m-4s, clients: 1, corpus: 15, objectives: 0, executions: 65, exec/sec: 0.000
[32m INFO[0m [Stats #0] run time: 0h-0m-4s, clients: 1, corpus: 15, objectives: 0, executions: 65, exec/sec: 0.000
[32m INFO[0m ============= New Corpus Item =============
[32m INFO[0m Reverted? false 
 Txn:
[Sender] 0x35################################31dDb
   [1] 0x39################################6116f.approve(0x10################################6024E, 0)
       0x01

[32m INFO[0m ==========================================
[32m INFO[0m [Testcase #0] run time: 0h-0m-4s, clients: 1, corpus: 16, objectives: 0, executions: 67, exec/sec: 0.000
[32m INFO[0m [Stats #0] run time: 0h-0m-4s, clients: 1, corpus: 16, objectives: 0, executions: 67, exec/sec: 57.11
[32m INFO[0m ============= New Corpus Item =============
[32m INFO[0m Reverted? false 
 Txn:
[Sender] 0x35################################31dDb
   [1] Router.swapExactETHForTokens{value: 285}(0, path:(WETH  0x39################################6116f), address(this), block.timestamp);
   [1] Router.swapExactETHForTokens{value: 4.6116 ether}(0, path:(WETH  0x39################################6116f), address(this), block.timestamp);
   [1] 0x39################################6116f.approve(0x10################################6024E, 24877235555656648101874300500621018258247386015370293909657.7268 ether)
       0x01

[32m INFO[0m ==========================================
[32m INFO[0m [Testcase #0] run time: 0h-0m-4s, clients: 1, corpus: 17, objectives: 0, executions: 70, exec/sec: 59.61
[32m INFO[0m ============= Coverage Summary =============
[32m INFO[0m 0xc0################################56cc2: 11.03% Instruction Covered, 13.16% Branch Covered
[32m INFO[0m 0x39################################6116f: 51.23% Instruction Covered, 46.72% Branch Covered
[32m INFO[0m [Stats #0] run time: 0h-0m-4s, clients: 1, corpus: 17, objectives: 0, executions: 70, exec/sec: 59.08
[32m INFO[0m ============= New Corpus Item =============
[32m INFO[0m Reverted? false 
 Txn:
[Sender] 0x35################################31dDb
   [1] Router.swapExactETHForTokens{value: 10.0 ether}(0, path:(WETH  0x39################################6116f), address(this), block.timestamp);
   [1] 0x39################################6116f.burn(1)

[32m INFO[0m ==========================================
[32m INFO[0m [Testcase #0] run time: 0h-0m-4s, clients: 1, corpus: 18, objectives: 0, executions: 99, exec/sec: 83.48
[32m INFO[0m [Stats #0] run time: 0h-0m-4s, clients: 1, corpus: 18, objectives: 0, executions: 99, exec/sec: 83.44
[32m INFO[0m ============= New Corpus Item =============
[32m INFO[0m Reverted? true 
 Txn:
[Sender] 0x35################################31dDb
   [1] 0x39################################6116f.burn(6870236110369668172126179471013742172476723648461.4494 ether)
       0x08################################0000000000000000000000000000000000020000000000000000000000000000000000000000000000000000000000000002245524332303a206275726e20616d6f756e7420657863656564732062616c616e6365000000000000000000000000000000000000000000000000000000000000

[32m INFO[0m ==========================================
[32m INFO[0m [Testcase #0] run time: 0h-0m-4s, clients: 1, corpus: 19, objectives: 0, executions: 101, exec/sec: 85.07
[32m INFO[0m ============= Coverage Summary =============
[32m INFO[0m 0x39################################6116f: 54.59% Instruction Covered, 50.00% Branch Covered
[32m INFO[0m 0xc0################################56cc2: 11.03% Instruction Covered, 13.16% Branch Covered
[32m INFO[0m [Stats #0] run time: 0h-0m-4s, clients: 1, corpus: 19, objectives: 0, executions: 101, exec/sec: 84.33
[32m INFO[0m ============= New Corpus Item =============
[32m INFO[0m Reverted? true 
 Txn:
[Sender] 0xe1################################c8510
   [1] 0x39################################6116f.decreaseAllowance(0x00################################00000, 207295001363146513959988044226742120810186630.5603 ether)
       0x08################################0000000000000000000000000000000000020000000000000000000000000000000000000000000000000000000000000002545524332303a2064656372656173656420616c6c6f77616e63652062656c6f77207a65726f000000000000000000000000000000000000000000000000000000

[32m INFO[0m ==========================================
[32m INFO[0m [Testcase #0] run time: 0h-0m-4s, clients: 1, corpus: 20, objectives: 0, executions: 129, exec/sec: 107.7
[32m INFO[0m [Stats #0] run time: 0h-0m-5s, clients: 1, corpus: 20, objectives: 0, executions: 129, exec/sec: 60.02
[32m INFO[0m ============= New Corpus Item =============
[32m INFO[0m Reverted? false 
 Txn:
[Sender] 0x35################################31dDb
   [1] Router.swapExactETHForTokens{value: 5306}(0, path:(WETH  0x39################################6116f), address(this), block.timestamp);
   [1] Router.swapExactETHForTokens{value: 10.0 ether}(0, path:(WETH  0x39################################6116f), address(this), block.timestamp);
[Sender] 0x68################################c9024
   [1] 0x39################################6116f.decreaseAllowance(0x10################################6024E, 0)
       0x01

[32m INFO[0m ==========================================
[32m INFO[0m [Testcase #0] run time: 0h-0m-5s, clients: 1, corpus: 21, objectives: 0, executions: 150, exec/sec: 69.74
[32m INFO[0m ============= Coverage Summary =============
[32m INFO[0m 0x39################################6116f: 55.55% Instruction Covered, 50.00% Branch Covered
[32m INFO[0m 0xc0################################56cc2: 11.03% Instruction Covered, 13.16% Branch Covered
[32m INFO[0m [Stats #0] run time: 0h-0m-5s, clients: 1, corpus: 21, objectives: 0, executions: 160, exec/sec: 63.13
[32m INFO[0m [Stats #0] run time: 0h-0m-6s, clients: 1, corpus: 21, objectives: 0, executions: 160, exec/sec: 58.73
[32m INFO[0m ============= New Corpus Item =============
[32m INFO[0m Reverted? false 
 Txn:
[Sender] 0x35################################31dDb
   [1] 0x39################################6116f.approve(0x39################################6116f, 0)
       0x01
[Sender] 0x68################################c9024
   [1] 0x39################################6116f.increaseAllowance(0xbb################################c095c, 44158875341260270331016474508563791761945061732981252152591.7183 ether)
       0x01

[32m INFO[0m ==========================================
[32m INFO[0m [Testcase #0] run time: 0h-0m-6s, clients: 1, corpus: 22, objectives: 0, executions: 161, exec/sec: 59.07
[32m INFO[0m [Stats #0] run time: 0h-0m-6s, clients: 1, corpus: 22, objectives: 0, executions: 161, exec/sec: 59.04
[32m INFO[0m ============= New Corpus Item =============
[32m INFO[0m Reverted? false 
 Txn:
[Sender] 0x35################################31dDb
   [1] Router.swapExactETHForTokens{value: 10.0 ether}(0, path:(WETH  0x39################################6116f), address(this), block.timestamp);
[Sender] 0x68################################c9024
   [1] 0x39################################6116f.increaseAllowance(0xbb################################c095c, 28015)
       0x01

[32m INFO[0m ==========================================
[32m INFO[0m [Testcase #0] run time: 0h-0m-6s, clients: 1, corpus: 23, objectives: 0, executions: 166, exec/sec: 60.85
[32m INFO[0m ============= Coverage Summary =============
[32m INFO[0m 0x39################################6116f: 56.51% Instruction Covered, 50.00% Branch Covered
[32m INFO[0m 0xc0################################56cc2: 11.03% Instruction Covered, 13.16% Branch Covered
[32m INFO[0m [Stats #0] run time: 0h-0m-6s, clients: 1, corpus: 23, objectives: 0, executions: 166, exec/sec: 50.23
[32m INFO[0m ============= New Corpus Item =============
[32m INFO[0m Reverted? true 
 Txn:
[Sender] 0x35################################31dDb
   [1] Router.swapExactETHForTokens{value: 3840.5144 ether}(0, path:(WETH  0x39################################6116f), address(this), block.timestamp);
[Sender] 0x8E################################d79dd
   [1] 0x39################################6116f.approve(0xbb################################c095c, 22345168801541509213996174934112222798080702643034.1490 ether)
       0x01
   [1] 0x39################################6116f.mint(0x39################################6116f, 266499334461980218655181897238872284808048432045.5586 ether)
       0x08################################00000000000000000000000000000000000200000000000000000000000000000000000000000000000000000000000000007216d696e74657200000000000000000000000000000000000000000000000000

[32m INFO[0m ==========================================
[32m INFO[0m [Testcase #0] run time: 0h-0m-6s, clients: 1, corpus: 24, objectives: 0, executions: 193, exec/sec: 58.38
[32m INFO[0m ============= Coverage Summary =============
[32m INFO[0m 0x39################################6116f: 56.51% Instruction Covered, 50.00% Branch Covered
[32m INFO[0m 0xc0################################56cc2: 11.03% Instruction Covered, 13.16% Branch Covered
[32m INFO[0m [Stats #0] run time: 0h-0m-7s, clients: 1, corpus: 24, objectives: 0, executions: 224, exec/sec: 60.74
[32m INFO[0m [Stats #0] run time: 0h-0m-7s, clients: 1, corpus: 24, objectives: 0, executions: 224, exec/sec: 60.74
[32m INFO[0m ============= New Corpus Item =============
[32m INFO[0m Reverted? true 
 Txn:
[Sender] 0x35################################31dDb
   [1] Router.swapExactETHForTokens{value: 5306}(0, path:(WETH  0x39################################6116f), address(this), block.timestamp);
   [1] 0x39################################6116f.removeMinter(0x10################################6024E)
       0x08################################0000000000000000000000000000000000020000000000000000000000000000000000000000000000000000000000000000b21676f7665726e616e6365000000000000000000000000000000000000000000

[32m INFO[0m ==========================================
[32m INFO[0m [Testcase #0] run time: 0h-0m-7s, clients: 1, corpus: 25, objectives: 0, executions: 225, exec/sec: 61.00
[32m INFO[0m ============= Coverage Summary =============
[32m INFO[0m 0xc0################################56cc2: 11.03% Instruction Covered, 13.16% Branch Covered
[32m INFO[0m 0x39################################6116f: 56.51% Instruction Covered, 50.00% Branch Covered
[32m INFO[0m [Stats #0] run time: 0h-0m-7s, clients: 1, corpus: 25, objectives: 0, executions: 225, exec/sec: 60.91
[32m INFO[0m ============= New Corpus Item =============
[32m INFO[0m Reverted? true 
 Txn:
[Sender] 0x35################################31dDb
   [1] Router.swapExactETHForTokens{value: 3840.5144 ether}(0, path:(WETH  0x39################################6116f), address(this), block.timestamp);
   [1] Router.swapExactETHForTokens{value: 8}(0, path:(WETH  0x39################################6116f), address(this), block.timestamp);
[Sender] 0x68################################c9024
   [1] 0x39################################6116f.setGovernance(0x68################################c9024)
       0x08################################0000000000000000000000000000000000020000000000000000000000000000000000000000000000000000000000000000b21676f7665726e616e6365000000000000000000000000000000000000000000

[32m INFO[0m ==========================================
[32m INFO[0m [Testcase #0] run time: 0h-0m-7s, clients: 1, corpus: 26, objectives: 0, executions: 258, exec/sec: 69.82
[32m INFO[0m ============= Coverage Summary =============
[32m INFO[0m 0x39################################6116f: 56.51% Instruction Covered, 50.00% Branch Covered
[32m INFO[0m 0xc0################################56cc2: 11.03% Instruction Covered, 13.16% Branch Covered
[32m INFO[0m [Stats #0] run time: 0h-0m-7s, clients: 1, corpus: 26, objectives: 0, executions: 258, exec/sec: 69.75
[32m INFO[0m ============= New Corpus Item =============
[32m INFO[0m Reverted? true 
 Txn:
[Sender] 0x68################################c9024
   [1] 0x39################################6116f.transfer(0x00################################00000, 0)
       0x08################################0000000000000000000000000000000000020000000000000000000000000000000000000000000000000000000000000002345524332303a207472616e7366657220746f20746865207a65726f20616464726573730000000000000000000000000000000000000000000000000000000000

[32m INFO[0m ==========================================
[32m INFO[0m [Testcase #0] run time: 0h-0m-7s, clients: 1, corpus: 27, objectives: 0, executions: 289, exec/sec: 78.12
[32m INFO[0m ============= Coverage Summary =============
[32m INFO[0m 0xc0################################56cc2: 11.03% Instruction Covered, 13.16% Branch Covered
[32m INFO[0m 0x39################################6116f: 56.51% Instruction Covered, 50.00% Branch Covered
[32m INFO[0m [Stats #0] run time: 0h-0m-7s, clients: 1, corpus: 27, objectives: 0, executions: 289, exec/sec: 78.01
[32m INFO[0m ============= New Corpus Item =============
[32m INFO[0m Reverted? true 
 Txn:
[Sender] 0x35################################31dDb
   [1] Router.swapExactETHForTokens{value: 285}(0, path:(WETH  0x39################################6116f), address(this), block.timestamp);
   [1] Router.swapExactETHForTokens{value: 4.6116 ether}(0, path:(WETH  0x39################################6116f), address(this), block.timestamp);
   [1] 0x39################################6116f.approve(0x10################################6024E, 24877235555656648101874300500621018258247386015370293909657.7268 ether)
       0x01
   [1] 0x39################################6116f.transferFrom(0x00################################00000, 0x00################################00000, 115792089237316195417293883273301227089434195242432896414466.3024 ether)
       0x08################################0000000000000000000000000000000000020000000000000000000000000000000000000000000000000000000000000002545524332303a207472616e736665722066726f6d20746865207a65726f2061646472657373000000000000000000000000000000000000000000000000000000

[32m INFO[0m ==========================================
[32m INFO[0m [Testcase #0] run time: 0h-0m-7s, clients: 1, corpus: 28, objectives: 0, executions: 321, exec/sec: 86.62
[32m INFO[0m ============= Coverage Summary =============
[32m INFO[0m 0xc0################################56cc2: 11.03% Instruction Covered, 13.16% Branch Covered
[32m INFO[0m 0x39################################6116f: 56.51% Instruction Covered, 50.00% Branch Covered
[32m INFO[0m [Stats #0] run time: 0h-0m-7s, clients: 1, corpus: 28, objectives: 0, executions: 321, exec/sec: 81.60
[32m INFO[0m ============= New Corpus Item =============
[32m INFO[0m Reverted? false 
 Txn:
[Sender] 0x35################################31dDb
   [1] Router.swapExactETHForTokens{value: 10.0 ether}(0, path:(WETH  0x39################################6116f), address(this), block.timestamp);
   [1] 0x39################################6116f.burn(1)

[32m INFO[0m ==========================================
[32m INFO[0m [Testcase #0] run time: 0h-0m-7s, clients: 1, corpus: 29, objectives: 0, executions: 559, exec/sec: 142.1
[32m INFO[0m ============= Coverage Summary =============
[32m INFO[0m 0x39################################6116f: 56.51% Instruction Covered, 50.00% Branch Covered
[32m INFO[0m 0xc0################################56cc2: 11.03% Instruction Covered, 13.16% Branch Covered
[32m INFO[0m [Stats #0] run time: 0h-0m-8s, clients: 1, corpus: 29, objectives: 0, executions: 640, exec/sec: 129.9
[32m INFO[0m [Stats #0] run time: 0h-0m-9s, clients: 1, corpus: 29, objectives: 0, executions: 736, exec/sec: 119.5
[32m INFO[0m [Stats #0] run time: 0h-0m-11s, clients: 1, corpus: 29, objectives: 0, executions: 1088, exec/sec: 143.8
[32m INFO[0m [Stats #0] run time: 0h-0m-11s, clients: 1, corpus: 29, objectives: 0, executions: 1088, exec/sec: 139.5
[32m INFO[0m ============= New Corpus Item =============
[32m INFO[0m Reverted? true 
 Txn:
[Sender] 0x35################################31dDb
   [1] Router.swapExactETHForTokens{value: 10.0 ether}(0, path:(WETH  0x39################################6116f), address(this), block.timestamp);
[Sender] 0x68################################c9024
   [1] 0x39################################6116f.increaseAllowance(0xbb################################c095c, 28015)
       0x01
   [1] 0x39################################6116f.increaseAllowance(0xbb################################c095c, 115279445178640294478135483421724385822142091708755488112463.9941 ether)
       0x01
   [1] 0x39################################6116f.increaseAllowance(0xbb################################c095c, 44158875341260270331016474508563791761945061732981252152591.7183 ether)
       0x08################################0000000000000000000000000000000000020000000000000000000000000000000000000000000000000000000000000001b536166654d6174683a206164646974696f6e206f766572666c6f770000000000

[32m INFO[0m ==========================================
[32m INFO[0m [Testcase #0] run time: 0h-0m-11s, clients: 1, corpus: 30, objectives: 0, executions: 1620, exec/sec: 207.6
[32m INFO[0m ============= Coverage Summary =============
[32m INFO[0m 0x39################################6116f: 57.72% Instruction Covered, 50.82% Branch Covered
[32m INFO[0m 0xc0################################56cc2: 11.03% Instruction Covered, 13.16% Branch Covered
[32m INFO[0m [Stats #0] run time: 0h-0m-11s, clients: 1, corpus: 30, objectives: 0, executions: 1620, exec/sec: 196.2
[32m INFO[0m ============= New Corpus Item =============
[32m INFO[0m Reverted? false 
 Txn:
[Sender] 0x35################################31dDb
   [1] Router.swapExactETHForTokens{value: 390.6698 ether}(0, path:(WETH  0x39################################6116f), address(this), block.timestamp);
   [1] 0x39################################6116f.burn(1)
   [1] 0x39################################6116f.transferFrom(0xe1################################c8510, 0x35################################31dDb, 0)
       0x01

[32m INFO[0m ==========================================
[32m INFO[0m [Testcase #0] run time: 0h-0m-11s, clients: 1, corpus: 31, objectives: 0, executions: 2226, exec/sec: 269.5
[32m INFO[0m ============= Coverage Summary =============
[32m INFO[0m 0x39################################6116f: 61.02% Instruction Covered, 50.82% Branch Covered
[32m INFO[0m 0xc0################################56cc2: 11.03% Instruction Covered, 13.16% Branch Covered
[32m INFO[0m [Stats #0] run time: 0h-0m-12s, clients: 1, corpus: 31, objectives: 0, executions: 2784, exec/sec: 312.8
[32m INFO[0m [Stats #0] run time: 0h-0m-13s, clients: 1, corpus: 31, objectives: 0, executions: 2784, exec/sec: 283.6
[32m INFO[0m ============= New Corpus Item =============
[32m INFO[0m Reverted? false 
 Txn:
[Sender] 0x35################################31dDb
   [1] Router.swapExactETHForTokens{value: 4386.8968 ether}(0, path:(WETH  0x39################################6116f), address(this), block.timestamp);
[Sender] 0x68################################c9024
   [1] 0x39################################6116f.transfer(0xe1################################c8510, 0)
       0x01

[32m INFO[0m ==========================================
[32m INFO[0m [Testcase #0] run time: 0h-0m-13s, clients: 1, corpus: 32, objectives: 0, executions: 4169, exec/sec: 424.6
[32m INFO[0m ============= Coverage Summary =============
[32m INFO[0m 0x39################################6116f: 61.02% Instruction Covered, 50.82% Branch Covered
[32m INFO[0m 0xc0################################56cc2: 11.03% Instruction Covered, 13.16% Branch Covered
[32m INFO[0m [Stats #0] run time: 0h-0m-13s, clients: 1, corpus: 32, objectives: 0, executions: 5280, exec/sec: 533.1
[32m INFO[0m [Stats #0] run time: 0h-0m-14s, clients: 1, corpus: 32, objectives: 0, executions: 16160, exec/sec: 1.482k
[32m INFO[0m [Stats #0] run time: 0h-0m-15s, clients: 1, corpus: 32, objectives: 0, executions: 29952, exec/sec: 2.515k
[32m INFO[0m [Stats #0] run time: 0h-0m-16s, clients: 1, corpus: 32, objectives: 0, executions: 37696, exec/sec: 2.920k
[32m INFO[0m [Stats #0] run time: 0h-0m-17s, clients: 1, corpus: 32, objectives: 0, executions: 46144, exec/sec: 3.318k
[32m INFO[0m [Stats #0] run time: 0h-0m-18s, clients: 1, corpus: 32, objectives: 0, executions: 59904, exec/sec: 4.018k
[32m INFO[0m [Stats #0] run time: 0h-0m-19s, clients: 1, corpus: 32, objectives: 0, executions: 69728, exec/sec: 4.382k
[32m INFO[0m [Stats #0] run time: 0h-0m-20s, clients: 1, corpus: 32, objectives: 0, executions: 83648, exec/sec: 4.946k
[32m INFO[0m [Stats #0] run time: 0h-0m-20s, clients: 1, corpus: 32, objectives: 0, executions: 83648, exec/sec: 4.802k
[32m INFO[0m ============= New Corpus Item =============
[32m INFO[0m Reverted? false 
 Txn:
[Sender] 0x35################################31dDb
   [1] Router.swapExactETHForTokens{value: 117300739}(0, path:(WETH  0x39################################6116f), address(this), block.timestamp);
   [1] 0x39################################6116f.transfer(0xe1################################c8510, 1)
       0x01
[Sender] 0x68################################c9024
   [1] 0x39################################6116f.decreaseAllowance(0x10################################6024E, 0)
       0x01

[32m INFO[0m ==========================================
[32m INFO[0m [Testcase #0] run time: 0h-0m-20s, clients: 1, corpus: 33, objectives: 0, executions: 90556, exec/sec: 5.198k
[32m INFO[0m ============= Coverage Summary =============
[32m INFO[0m 0x39################################6116f: 61.02% Instruction Covered, 50.82% Branch Covered
[32m INFO[0m 0xc0################################56cc2: 11.03% Instruction Covered, 13.16% Branch Covered
[32m INFO[0m [Stats #0] run time: 0h-0m-21s, clients: 1, corpus: 33, objectives: 0, executions: 97152, exec/sec: 5.423k
[32m INFO[0m [Stats #0] run time: 0h-0m-22s, clients: 1, corpus: 33, objectives: 0, executions: 110624, exec/sec: 5.848k
[32m INFO[0m [Stats #0] run time: 0h-0m-23s, clients: 1, corpus: 33, objectives: 0, executions: 123840, exec/sec: 6.217k
[32m INFO[0m [Stats #0] run time: 0h-0m-24s, clients: 1, corpus: 33, objectives: 0, executions: 137376, exec/sec: 6.566k
[32m INFO[0m [Stats #0] run time: 0h-0m-25s, clients: 1, corpus: 33, objectives: 0, executions: 150848, exec/sec: 6.881k
[32m INFO[0m [Stats #0] run time: 0h-0m-26s, clients: 1, corpus: 33, objectives: 0, executions: 164544, exec/sec: 7.177k
[32m INFO[0m [Stats #0] run time: 0h-0m-27s, clients: 1, corpus: 33, objectives: 0, executions: 178144, exec/sec: 7.445k
[32m INFO[0m [Stats #0] run time: 0h-0m-28s, clients: 1, corpus: 33, objectives: 0, executions: 191648, exec/sec: 7.686k
[32m INFO[0m [Stats #0] run time: 0h-0m-29s, clients: 1, corpus: 33, objectives: 0, executions: 205088, exec/sec: 7.908k
[32m INFO[0m [Stats #0] run time: 0h-0m-30s, clients: 1, corpus: 33, objectives: 0, executions: 218688, exec/sec: 8.119k
[32m INFO[0m [Stats #0] run time: 0h-0m-31s, clients: 1, corpus: 33, objectives: 0, executions: 232320, exec/sec: 8.316k
[32m INFO[0m [Stats #0] run time: 0h-0m-32s, clients: 1, corpus: 33, objectives: 0, executions: 245888, exec/sec: 8.497k
[32m INFO[0m [Stats #0] run time: 0h-0m-33s, clients: 1, corpus: 33, objectives: 0, executions: 259552, exec/sec: 8.669k
[32m INFO[0m [Stats #0] run time: 0h-0m-34s, clients: 1, corpus: 33, objectives: 0, executions: 259552, exec/sec: 8.421k
[32m INFO[0m ============= New Corpus Item =============
[32m INFO[0m Reverted? false 
 Txn:
[Sender] 0x35################################31dDb
   [1] Router.swapExactETHForTokens{value: 3840.5144 ether}(0, path:(WETH  0x39################################6116f), address(this), block.timestamp);
   [1] 0x39################################6116f.transfer(0x68################################c9024, 3)
       0x01
   [1] 0x39################################6116f.transferFrom(0x10################################6024E, 0x10################################6024E, 0)
       0x01

[32m INFO[0m ==========================================
[32m INFO[0m [Testcase #0] run time: 0h-0m-34s, clients: 1, corpus: 34, objectives: 0, executions: 271429, exec/sec: 8.806k
[32m INFO[0m ============= Coverage Summary =============
[32m INFO[0m 0xc0################################56cc2: 11.03% Instruction Covered, 13.16% Branch Covered
[32m INFO[0m 0x39################################6116f: 61.02% Instruction Covered, 50.82% Branch Covered
[32m INFO[0m [Stats #0] run time: 0h-0m-34s, clients: 1, corpus: 34, objectives: 0, executions: 272960, exec/sec: 8.822k
[32m INFO[0m [Stats #0] run time: 0h-0m-35s, clients: 1, corpus: 34, objectives: 0, executions: 286240, exec/sec: 8.960k
[32m INFO[0m [Stats #0] run time: 0h-0m-36s, clients: 1, corpus: 34, objectives: 0, executions: 299328, exec/sec: 9.085k
[32m INFO[0m [Stats #0] run time: 0h-0m-37s, clients: 1, corpus: 34, objectives: 0, executions: 299328, exec/sec: 8.875k
[32m INFO[0m ============= New Corpus Item =============
[32m INFO[0m Reverted? false 
 Txn:
[Sender] 0x35################################31dDb
   [1] Router.swapExactETHForTokens{value: 4722.3664 ether}(0, path:(WETH  0x39################################6116f), address(this), block.timestamp);
   [1] 0x39################################6116f.transfer(0x68################################c9024, 1)
       0x01

[32m INFO[0m ==========================================
[32m INFO[0m [Testcase #0] run time: 0h-0m-37s, clients: 1, corpus: 35, objectives: 0, executions: 309554, exec/sec: 9.178k
[32m INFO[0m ============= Coverage Summary =============
[32m INFO[0m 0xc0################################56cc2: 11.03% Instruction Covered, 13.16% Branch Covered
[32m INFO[0m 0x39################################6116f: 61.02% Instruction Covered, 50.82% Branch Covered
[32m INFO[0m [Stats #0] run time: 0h-0m-37s, clients: 1, corpus: 35, objectives: 0, executions: 312256, exec/sec: 9.198k
[32m INFO[0m [Stats #0] run time: 0h-0m-38s, clients: 1, corpus: 35, objectives: 0, executions: 325120, exec/sec: 9.303k
[32m INFO[0m [Stats #0] run time: 0h-0m-39s, clients: 1, corpus: 35, objectives: 0, executions: 337824, exec/sec: 9.397k
[32m INFO[0m [Stats #0] run time: 0h-0m-40s, clients: 1, corpus: 35, objectives: 0, executions: 350688, exec/sec: 9.491k
[32m INFO[0m [Stats #0] run time: 0h-0m-41s, clients: 1, corpus: 35, objectives: 0, executions: 363456, exec/sec: 9.576k
[32m INFO[0m [Stats #0] run time: 0h-0m-42s, clients: 1, corpus: 35, objectives: 0, executions: 376416, exec/sec: 9.662k
[32m INFO[0m [Stats #0] run time: 0h-0m-43s, clients: 1, corpus: 35, objectives: 0, executions: 389280, exec/sec: 9.742k
[32m INFO[0m [Stats #0] run time: 0h-0m-44s, clients: 1, corpus: 35, objectives: 0, executions: 402240, exec/sec: 9.821k
[32m INFO[0m [Stats #0] run time: 0h-0m-45s, clients: 1, corpus: 35, objectives: 0, executions: 415296, exec/sec: 9.898k
[32m INFO[0m [Stats #0] run time: 0h-0m-46s, clients: 1, corpus: 35, objectives: 0, executions: 428192, exec/sec: 9.967k
[32m INFO[0m [Stats #0] run time: 0h-0m-47s, clients: 1, corpus: 35, objectives: 0, executions: 441088, exec/sec: 10.03k
[32m INFO[0m [Stats #0] run time: 0h-0m-48s, clients: 1, corpus: 35, objectives: 0, executions: 453856, exec/sec: 10.09k
[32m INFO[0m [Stats #0] run time: 0h-0m-49s, clients: 1, corpus: 35, objectives: 0, executions: 466496, exec/sec: 10.15k
[32m INFO[0m [Stats #0] run time: 0h-0m-50s, clients: 1, corpus: 35, objectives: 0, executions: 479392, exec/sec: 10.21k
[32m INFO[0m [Stats #0] run time: 0h-0m-51s, clients: 1, corpus: 35, objectives: 0, executions: 492224, exec/sec: 10.26k
[32m INFO[0m [Stats #0] run time: 0h-0m-52s, clients: 1, corpus: 35, objectives: 0, executions: 505280, exec/sec: 10.32k
[32m INFO[0m [Stats #0] run time: 0h-0m-53s, clients: 1, corpus: 35, objectives: 0, executions: 518080, exec/sec: 10.37k
[32m INFO[0m [Stats #0] run time: 0h-0m-54s, clients: 1, corpus: 35, objectives: 0, executions: 530976, exec/sec: 10.42k
[32m INFO[0m [Stats #0] run time: 0h-0m-55s, clients: 1, corpus: 35, objectives: 0, executions: 543648, exec/sec: 10.46k
[32m INFO[0m [Stats #0] run time: 0h-0m-56s, clients: 1, corpus: 35, objectives: 0, executions: 556448, exec/sec: 10.50k
[32m INFO[0m [Stats #0] run time: 0h-0m-57s, clients: 1, corpus: 35, objectives: 0, executions: 569504, exec/sec: 10.55k
[32m INFO[0m [Stats #0] run time: 0h-0m-58s, clients: 1, corpus: 35, objectives: 0, executions: 582304, exec/sec: 10.59k
[32m INFO[0m [Stats #0] run time: 0h-0m-59s, clients: 1, corpus: 35, objectives: 0, executions: 595232, exec/sec: 10.63k
[32m INFO[0m [Stats #0] run time: 0h-1m-0s, clients: 1, corpus: 35, objectives: 0, executions: 607968, exec/sec: 10.67k
[32m INFO[0m [Stats #0] run time: 0h-1m-1s, clients: 1, corpus: 35, objectives: 0, executions: 620896, exec/sec: 10.71k
[32m INFO[0m [Stats #0] run time: 0h-1m-2s, clients: 1, corpus: 35, objectives: 0, executions: 633664, exec/sec: 10.74k
[32m INFO[0m [Stats #0] run time: 0h-1m-3s, clients: 1, corpus: 35, objectives: 0, executions: 646368, exec/sec: 10.77k
[32m INFO[0m [Stats #0] run time: 0h-1m-4s, clients: 1, corpus: 35, objectives: 0, executions: 659040, exec/sec: 10.80k
[32m INFO[0m [Stats #0] run time: 0h-1m-5s, clients: 1, corpus: 35, objectives: 0, executions: 671712, exec/sec: 10.83k
[32m INFO[0m [Stats #0] run time: 0h-1m-6s, clients: 1, corpus: 35, objectives: 0, executions: 684608, exec/sec: 10.87k
[32m INFO[0m [Stats #0] run time: 0h-1m-7s, clients: 1, corpus: 35, objectives: 0, executions: 697248, exec/sec: 10.89k
[32m INFO[0m [Stats #0] run time: 0h-1m-8s, clients: 1, corpus: 35, objectives: 0, executions: 710176, exec/sec: 10.93k
[32m INFO[0m [Stats #0] run time: 0h-1m-9s, clients: 1, corpus: 35, objectives: 0, executions: 722912, exec/sec: 10.95k
[32m INFO[0m [Stats #0] run time: 0h-1m-10s, clients: 1, corpus: 35, objectives: 0, executions: 735648, exec/sec: 10.98k
[32m INFO[0m [Stats #0] run time: 0h-1m-11s, clients: 1, corpus: 35, objectives: 0, executions: 748576, exec/sec: 11.01k
[32m INFO[0m [Stats #0] run time: 0h-1m-12s, clients: 1, corpus: 35, objectives: 0, executions: 761088, exec/sec: 11.03k
[32m INFO[0m [Stats #0] run time: 0h-1m-13s, clients: 1, corpus: 35, objectives: 0, executions: 774048, exec/sec: 11.06k
[32m INFO[0m [Stats #0] run time: 0h-1m-14s, clients: 1, corpus: 35, objectives: 0, executions: 786784, exec/sec: 11.08k
[32m INFO[0m [Stats #0] run time: 0h-1m-15s, clients: 1, corpus: 35, objectives: 0, executions: 799648, exec/sec: 11.10k
[32m INFO[0m [Stats #0] run time: 0h-1m-16s, clients: 1, corpus: 35, objectives: 0, executions: 812512, exec/sec: 11.13k
[32m INFO[0m [Stats #0] run time: 0h-1m-17s, clients: 1, corpus: 35, objectives: 0, executions: 825408, exec/sec: 11.15k
[32m INFO[0m [Stats #0] run time: 0h-1m-18s, clients: 1, corpus: 35, objectives: 0, executions: 838240, exec/sec: 11.17k
[32m INFO[0m [Stats #0] run time: 0h-1m-19s, clients: 1, corpus: 35, objectives: 0, executions: 851072, exec/sec: 11.20k
[32m INFO[0m [Stats #0] run time: 0h-1m-20s, clients: 1, corpus: 35, objectives: 0, executions: 864000, exec/sec: 11.22k
[32m INFO[0m [Stats #0] run time: 0h-1m-21s, clients: 1, corpus: 35, objectives: 0, executions: 876768, exec/sec: 11.24k
[32m INFO[0m [Stats #0] run time: 0h-1m-22s, clients: 1, corpus: 35, objectives: 0, executions: 889440, exec/sec: 11.25k
[32m INFO[0m [Stats #0] run time: 0h-1m-23s, clients: 1, corpus: 35, objectives: 0, executions: 902144, exec/sec: 11.27k
[32m INFO[0m [Stats #0] run time: 0h-1m-24s, clients: 1, corpus: 35, objectives: 0, executions: 914848, exec/sec: 11.29k
[32m INFO[0m [Stats #0] run time: 0h-1m-25s, clients: 1, corpus: 35, objectives: 0, executions: 927840, exec/sec: 11.31k
[32m INFO[0m [Stats #0] run time: 0h-1m-26s, clients: 1, corpus: 35, objectives: 0, executions: 940736, exec/sec: 11.33k
[32m INFO[0m [Stats #0] run time: 0h-1m-27s, clients: 1, corpus: 35, objectives: 0, executions: 953632, exec/sec: 11.35k
[32m INFO[0m [Stats #0] run time: 0h-1m-28s, clients: 1, corpus: 35, objectives: 0, executions: 966592, exec/sec: 11.37k
[32m INFO[0m [Stats #0] run time: 0h-1m-29s, clients: 1, corpus: 35, objectives: 0, executions: 979424, exec/sec: 11.38k
[32m INFO[0m [Stats #0] run time: 0h-1m-30s, clients: 1, corpus: 35, objectives: 0, executions: 979424, exec/sec: 11.30k
[32m INFO[0m ============= New Corpus Item =============
[32m INFO[0m Reverted? false 
 Txn:
[Sender] 0x35################################31dDb
   [1] Router.swapExactETHForTokens{value: 4722.3664 ether}(0, path:(WETH  0x39################################6116f), address(this), block.timestamp);
   [1] 0x39################################6116f.transfer(0x68################################c9024, 1)
       0x01
[Sender] 0x68################################c9024
   [1] 0x39################################6116f.increaseAllowance(0xbb################################c095c, 115792089237316195423570985008687907853269984665640564039457.5840 ether)
       0x01

[32m INFO[0m ==========================================
[32m INFO[0m [Testcase #0] run time: 0h-1m-30s, clients: 1, corpus: 36, objectives: 0, executions: 987438, exec/sec: 11.39k
[32m INFO[0m ============= Coverage Summary =============
[32m INFO[0m 0xc0################################56cc2: 11.03% Instruction Covered, 13.16% Branch Covered
[32m INFO[0m 0x39################################6116f: 61.02% Instruction Covered, 50.82% Branch Covered
[32m INFO[0m [Stats #0] run time: 0h-1m-30s, clients: 1, corpus: 36, objectives: 0, executions: 991904, exec/sec: 11.40k
[32m INFO[0m [Stats #0] run time: 0h-1m-31s, clients: 1, corpus: 36, objectives: 0, executions: 1004384, exec/sec: 11.41k
[32m INFO[0m [Stats #0] run time: 0h-1m-32s, clients: 1, corpus: 36, objectives: 0, executions: 1016448, exec/sec: 11.41k
[32m INFO[0m [Stats #0] run time: 0h-1m-33s, clients: 1, corpus: 36, objectives: 0, executions: 1028736, exec/sec: 11.42k
[32m INFO[0m [Stats #0] run time: 0h-1m-34s, clients: 1, corpus: 36, objectives: 0, executions: 1040928, exec/sec: 11.43k
[32m INFO[0m [Stats #0] run time: 0h-1m-35s, clients: 1, corpus: 36, objectives: 0, executions: 1053088, exec/sec: 11.44k
[32m INFO[0m [Stats #0] run time: 0h-1m-36s, clients: 1, corpus: 36, objectives: 0, executions: 1065376, exec/sec: 11.45k
[32m INFO[0m [Stats #0] run time: 0h-1m-37s, clients: 1, corpus: 36, objectives: 0, executions: 1077600, exec/sec: 11.46k
[32m INFO[0m [Stats #0] run time: 0h-1m-38s, clients: 1, corpus: 36, objectives: 0, executions: 1089728, exec/sec: 11.46k
Timeout