[32m INFO[0m fetching abi from https://api.bscscan.com/api?module=contract&action=getabi&address=0x47################################9c805&format=json&apikey=6ZUCAR738XJSX6WK3BGN2K8DX4RI9A875M
[32m INFO[0m fetching code from 47708fb36655f3c186de6adc2f382941d629c805
Contract loaded: 0x47################################9c805
[32m INFO[0m 

 ================ EVM Fuzzer Start ===================


[32m INFO[0m Deploying contract: 0x47################################9c805
[32m INFO[0m Contract 0x47################################9c805 deployed to: 0x47################################9c805 -> balacne is 0
[32m INFO[0m Deployed all contracts

[32m INFO[0m fetching pairs for 0x47################################9c805
[32m INFO[0m fetching pairs for 0x47################################9c805
[32m INFO[0m fetching code from f3b45c6efbaf52ed5491c1a43ab4bda419ef4e04
[32m INFO[0m fetching code from bb4cdb9cbd36b01bd1cbaebf2de08d9173bc095c
[32m INFO[0m [Stats #0] run time: 0h-0m-16s, clients: 1, corpus: 0, objectives: 0, executions: 0, exec/sec: 0.000
[32m INFO[0m ============= New Corpus Item =============
[32m INFO[0m Reverted? false 
 Txn:
[Sender] 0x35################################31dDb
   [1] Router.swapExactETHForTokens{value: 3116.4275 ether}(0, path:(WETH  0x47################################9C805), address(this), block.timestamp);

[32m INFO[0m ==========================================
[32m INFO[0m [Testcase #0] run time: 0h-0m-16s, clients: 1, corpus: 21, objectives: 0, executions: 1, exec/sec: 0.000
[32m INFO[0m [Stats #0] run time: 0h-0m-16s, clients: 1, corpus: 21, objectives: 0, executions: 1, exec/sec: 0.000
[32m INFO[0m ============= New Corpus Item =============
[32m INFO[0m Reverted? true 
 Txn:
[Sender] 0x35################################31dDb
   [1] Router.swapExactETHForTokens{value: 3116.4275 ether}(0, path:(WETH  0x47################################9C805), address(this), block.timestamp);
   [1] Router.swapExactETHForTokens{value: 3916.9970 ether}(0, path:(WETH  0x47################################9C805), address(this), block.timestamp);
   [1] Router.swapExactETHForTokens{value: 1}(0, path:(WETH  0x47################################9C805), address(this), block.timestamp);

[32m INFO[0m ==========================================
[32m INFO[0m [Testcase #0] run time: 0h-0m-16s, clients: 1, corpus: 22, objectives: 0, executions: 4, exec/sec: 0.000
[32m INFO[0m [Stats #0] run time: 0h-0m-16s, clients: 1, corpus: 22, objectives: 0, executions: 4, exec/sec: 0.000
[32m INFO[0m ============= New Corpus Item =============
[32m INFO[0m Reverted? false 
 Txn:
[Sender] 0x35################################31dDb
   [1] Router.swapExactETHForTokens{value: 3116.4275 ether}(0, path:(WETH  0x47################################9C805), address(this), block.timestamp);
   [1] Router.swapExactETHForTokens{value: 3800.1685 ether}(0, path:(WETH  0x47################################9C805), address(this), block.timestamp);
   [1] Router.swapExactETHForTokens{value: 10.0 ether}(0, path:(WETH  0x47################################9C805), address(this), block.timestamp);
   [1] Router.swapExactETHForTokens{value: 1699.7855 ether}(0, path:(WETH  0x47################################9C805), address(this), block.timestamp);
   [1] Router.swapExactETHForTokens{value: 16427}(0, path:(WETH  0x47################################9C805), address(this), block.timestamp);

[32m INFO[0m ==========================================
[32m INFO[0m [Testcase #0] run time: 0h-0m-16s, clients: 1, corpus: 23, objectives: 0, executions: 18, exec/sec: 0.000
[32m INFO[0m ============= Coverage Summary =============
[32m INFO[0m 0xbb################################c095c: 11.03% Instruction Covered, 13.16% Branch Covered
[32m INFO[0m 0x47################################9c805: 39.56% Instruction Covered, 36.70% Branch Covered
[32m INFO[0m [Stats #0] run time: 0h-0m-18s, clients: 1, corpus: 23, objectives: 0, executions: 18, exec/sec: 11.74
[32m INFO[0m ============= New Corpus Item =============
[32m INFO[0m Reverted? false 
 Txn:
[Sender] 0x35################################31dDb
   [1] Router.swapExactETHForTokens{value: 310.3847 ether}(0, path:(WETH  0x47################################9C805), address(this), block.timestamp);
[Sender] 0x68################################c9024
   [1] 0x47################################9C805.approve(0x8E################################d79dd, 1684996666696914987166688442938726917102321526408.7857 ether)
       0x01

[32m INFO[0m ==========================================
[32m INFO[0m [Testcase #0] run time: 0h-0m-18s, clients: 1, corpus: 24, objectives: 0, executions: 33, exec/sec: 21.52
[32m INFO[0m [Stats #0] run time: 0h-0m-18s, clients: 1, corpus: 24, objectives: 0, executions: 33, exec/sec: 21.52
[32m INFO[0m ============= New Corpus Item =============
[32m INFO[0m Reverted? true 
 Txn:
[Sender] 0x35################################31dDb
   [1] Router.swapExactETHForTokens{value: 3116.4275 ether}(0, path:(WETH  0x47################################9C805), address(this), block.timestamp);
[Sender] 0x68################################c9024
   [1] 0x47################################9C805.approve(0x00################################00000, 0)
       0x08################################0000000000000000000000000000000000020000000000000000000000000000000000000000000000000000000000000002245524332303a20617070726f766520746f20746865207a65726f2061646472657373000000000000000000000000000000000000000000000000000000000000

[32m INFO[0m ==========================================
[32m INFO[0m [Testcase #0] run time: 0h-0m-18s, clients: 1, corpus: 25, objectives: 0, executions: 34, exec/sec: 22.16
[32m INFO[0m [Stats #0] run time: 0h-0m-18s, clients: 1, corpus: 25, objectives: 0, executions: 34, exec/sec: 22.13
[32m INFO[0m ============= New Corpus Item =============
[32m INFO[0m Reverted? true 
 Txn:
[Sender] 0x35################################31dDb
   [1] Router.swapExactETHForTokens{value: 3116.4275 ether}(0, path:(WETH  0x47################################9C805), address(this), block.timestamp);
   [1] Router.swapExactETHForTokens{value: 3800.1685 ether}(0, path:(WETH  0x47################################9C805), address(this), block.timestamp);
   [1] Router.swapExactETHForTokens{value: 10.0 ether}(0, path:(WETH  0x47################################9C805), address(this), block.timestamp);
[Sender] 0x68################################c9024
   [1] 0x47################################9C805.approve{value: 4308.3769 ether}(0xe1################################c8510, 83653014248756794414095279907147941172888278848494638932016.3009 ether)

[32m INFO[0m ==========================================
[32m INFO[0m [Testcase #0] run time: 0h-0m-18s, clients: 1, corpus: 26, objectives: 0, executions: 48, exec/sec: 31.23
[32m INFO[0m [Stats #0] run time: 0h-0m-19s, clients: 1, corpus: 26, objectives: 0, executions: 48, exec/sec: 19.93
[32m INFO[0m ============= New Corpus Item =============
[32m INFO[0m Reverted? false 
 Txn:
[Sender] 0x35################################31dDb
   [1] Router.swapExactETHForTokens{value: 3116.4275 ether}(0, path:(WETH  0x47################################9C805), address(this), block.timestamp);
[Sender] 0x68################################c9024
   [1] 0x47################################9C805.approve(0xe1################################c8510, 37717655047492280691531796868126900736673477644559742.5080 ether)
       0x01

[32m INFO[0m ==========================================
[32m INFO[0m [Testcase #0] run time: 0h-0m-19s, clients: 1, corpus: 27, objectives: 0, executions: 55, exec/sec: 22.83
[32m INFO[0m ============= Coverage Summary =============
[32m INFO[0m 0xbb################################c095c: 11.03% Instruction Covered, 13.16% Branch Covered
[32m INFO[0m 0x47################################9c805: 40.74% Instruction Covered, 37.19% Branch Covered
[32m INFO[0m [Stats #0] run time: 0h-0m-19s, clients: 1, corpus: 27, objectives: 0, executions: 55, exec/sec: 22.68
[32m INFO[0m ============= New Corpus Item =============
[32m INFO[0m Reverted? true 
 Txn:
[Sender] 0x35################################31dDb
   [1] Router.swapExactETHForTokens{value: 3116.4275 ether}(0, path:(WETH  0x47################################9C805), address(this), block.timestamp);
   [1] Router.swapExactETHForTokens{value: 3916.9970 ether}(0, path:(WETH  0x47################################9C805), address(this), block.timestamp);
   [1] Router.swapExactETHForTokens{value: 1053.7288 ether}(0, path:(WETH  0x47################################9C805), address(this), block.timestamp);
   [1] 0x47################################9C805.decreaseAllowance(0x00################################00000, 0)
       0x08################################0000000000000000000000000000000000020000000000000000000000000000000000000000000000000000000000000002245524332303a20617070726f766520746f20746865207a65726f2061646472657373000000000000000000000000000000000000000000000000000000000000

[32m INFO[0m ==========================================
[32m INFO[0m [Testcase #0] run time: 0h-0m-19s, clients: 1, corpus: 28, objectives: 0, executions: 65, exec/sec: 26.80
[32m INFO[0m [Stats #0] run time: 0h-0m-19s, clients: 1, corpus: 28, objectives: 0, executions: 65, exec/sec: 23.61
[32m INFO[0m ============= New Corpus Item =============
[32m INFO[0m Reverted? true 
 Txn:
[Sender] 0x35################################31dDb
   [1] Router.swapExactETHForTokens{value: 3116.4275 ether}(0, path:(WETH  0x47################################9C805), address(this), block.timestamp);
   [1] Router.swapExactETHForTokens{value: 10.0 ether}(0, path:(WETH  0x47################################9C805), address(this), block.timestamp);
[Sender] 0xe1################################c8510
   [1] 0x47################################9C805.approve(0x68################################c9024, 85387853635825902492906834748294065366572340058543142690775.5880 ether)
       0x01
[Sender] 0x35################################31dDb
   [1] 0x47################################9C805.decreaseAllowance(0x68################################c9024, 10594726662070535864564018026832190997196666791657540021313.1694 ether)
       0x08################################0000000000000000000000000000000000020000000000000000000000000000000000000000000000000000000000000002545524332303a2064656372656173656420616c6c6f77616e63652062656c6f77207a65726f000000000000000000000000000000000000000000000000000000

[32m INFO[0m ==========================================
[32m INFO[0m [Testcase #0] run time: 0h-0m-19s, clients: 1, corpus: 29, objectives: 0, executions: 66, exec/sec: 23.96
[32m INFO[0m [Stats #0] run time: 0h-0m-22s, clients: 1, corpus: 29, objectives: 0, executions: 66, exec/sec: 12.00
[32m INFO[0m ============= New Corpus Item =============
[32m INFO[0m Reverted? true 
 Txn:
[Sender] 0x35################################31dDb
   [1] Router.swapExactETHForTokens{value: 3116.4275 ether}(0, path:(WETH  0x47################################9C805), address(this), block.timestamp);
   [1] Router.swapExactETHForTokens{value: 3800.1685 ether}(0, path:(WETH  0x47################################9C805), address(this), block.timestamp);
   [1] Router.swapExactETHForTokens{value: 10.0 ether}(0, path:(WETH  0x47################################9C805), address(this), block.timestamp);
[Sender] 0x68################################c9024
   [1] 0x47################################9C805.approve(0x68################################c9024, 220855883097298041197962187592864814478435487109452369.7652 ether)
       0x01
[Sender] 0x35################################31dDb
   [1] 0x47################################9C805.decreaseAllowance{value: 1806.1373 ether}(0x8E################################d79dd, 2074)

[32m INFO[0m ==========================================
[32m INFO[0m [Testcase #0] run time: 0h-0m-22s, clients: 1, corpus: 30, objectives: 0, executions: 90, exec/sec: 16.36
[32m INFO[0m ============= Coverage Summary =============
[32m INFO[0m 0x47################################9c805: 41.99% Instruction Covered, 38.42% Branch Covered
[32m INFO[0m 0xbb################################c095c: 11.03% Instruction Covered, 13.16% Branch Covered
[32m INFO[0m [Stats #0] run time: 0h-0m-22s, clients: 1, corpus: 30, objectives: 0, executions: 96, exec/sec: 16.40
[32m INFO[0m [Stats #0] run time: 0h-0m-22s, clients: 1, corpus: 30, objectives: 0, executions: 96, exec/sec: 16.40
[32m INFO[0m ============= New Corpus Item =============
[32m INFO[0m Reverted? true 
 Txn:
[Sender] 0x35################################31dDb
   [1] Router.swapExactETHForTokens{value: 3116.4275 ether}(0, path:(WETH  0x47################################9C805), address(this), block.timestamp);
   [1] Router.swapExactETHForTokens{value: 4722.3664 ether}(0, path:(WETH  0x47################################9C805), address(this), block.timestamp);
   [1] Router.swapExactETHForTokens{value: 1737}(0, path:(WETH  0x47################################9C805), address(this), block.timestamp);
   [1] 0x47################################9C805.deliver(57449559011701552701986797247229084273928507553.1556 ether)
       0x08################################00000000000000000000000000000000000200000000000000000000000000000000000000000000000000000000000000021536166654d6174683a206d756c7469706c69636174696f6e206f766572666c6f7700000000000000000000000000000000000000000000000000000000000000

[32m INFO[0m ==========================================
[32m INFO[0m [Testcase #0] run time: 0h-0m-22s, clients: 1, corpus: 31, objectives: 0, executions: 97, exec/sec: 16.57
[32m INFO[0m [Stats #0] run time: 0h-0m-22s, clients: 1, corpus: 31, objectives: 0, executions: 97, exec/sec: 16.57
[32m INFO[0m ============= New Corpus Item =============
[32m INFO[0m Reverted? false 
 Txn:
[Sender] 0x68################################c9024
   [1] 0x47################################9C805.approve(0x35################################31dDb, 69695055613231930756176443445950753611541898068780204055088.1032 ether)
       0x01
[Sender] 0x35################################31dDb
   [1] 0x47################################9C805.deliver(0)

[32m INFO[0m ==========================================
[32m INFO[0m [Testcase #0] run time: 0h-0m-22s, clients: 1, corpus: 32, objectives: 0, executions: 99, exec/sec: 16.91
[32m INFO[0m [Stats #0] run time: 0h-0m-22s, clients: 1, corpus: 32, objectives: 0, executions: 99, exec/sec: 16.90
[32m INFO[0m ============= New Corpus Item =============
[32m INFO[0m Reverted? true 
 Txn:
[Sender] 0x35################################31dDb
   [1] Router.swapExactETHForTokens{value: 3116.4275 ether}(0, path:(WETH  0x47################################9C805), address(this), block.timestamp);
   [1] Router.swapExactETHForTokens{value: 3916.9970 ether}(0, path:(WETH  0x47################################9C805), address(this), block.timestamp);
[Sender] 0xe1################################c8510
   [1] 0x47################################9C805.deliver{value: 0.1442 ether}(6863135805445395164276717409151230589207009032565734762033.1450 ether)

[32m INFO[0m ==========================================
[32m INFO[0m [Testcase #0] run time: 0h-0m-22s, clients: 1, corpus: 33, objectives: 0, executions: 103, exec/sec: 17.58
[32m INFO[0m ============= Coverage Summary =============
[32m INFO[0m 0x47################################9c805: 42.47% Instruction Covered, 38.92% Branch Covered
[32m INFO[0m 0xbb################################c095c: 11.03% Instruction Covered, 13.16% Branch Covered
[32m INFO[0m [Stats #0] run time: 0h-0m-22s, clients: 1, corpus: 33, objectives: 0, executions: 103, exec/sec: 17.56
[32m INFO[0m ============= New Corpus Item =============
[32m INFO[0m Reverted? true 
 Txn:
[Sender] 0x35################################31dDb
   [1] Router.swapExactETHForTokens{value: 3116.4275 ether}(0, path:(WETH  0x47################################9C805), address(this), block.timestamp);
   [1] Router.swapExactETHForTokens{value: 10.0 ether}(0, path:(WETH  0x47################################9C805), address(this), block.timestamp);
[Sender] 0xe1################################c8510
   [1] 0x47################################9C805.approve(0x68################################c9024, 85387853635825902492906834748294065366572340058543142690775.5880 ether)
       0x01
[Sender] 0x68################################c9024
   [1] 0x47################################9C805.excludeFromFee(0x8E################################d79dd)
       0x08################################000000000000000000000000000000000002000000000000000000000000000000000000000000000000000000000000000204f776e61626c653a2063616c6c6572206973206e6f7420746865206f776e6572

[32m INFO[0m ==========================================
[32m INFO[0m [Testcase #0] run time: 0h-0m-22s, clients: 1, corpus: 34, objectives: 0, executions: 129, exec/sec: 22.00
[32m INFO[0m [Stats #0] run time: 0h-0m-22s, clients: 1, corpus: 34, objectives: 0, executions: 129, exec/sec: 21.99
[32m INFO[0m ============= New Corpus Item =============
[32m INFO[0m Reverted? true 
 Txn:
[Sender] 0x35################################31dDb
   [1] Router.swapExactETHForTokens{value: 3116.4275 ether}(0, path:(WETH  0x47################################9C805), address(this), block.timestamp);
   [1] Router.swapExactETHForTokens{value: 3800.1685 ether}(0, path:(WETH  0x47################################9C805), address(this), block.timestamp);
   [1] Router.swapExactETHForTokens{value: 10.0 ether}(0, path:(WETH  0x47################################9C805), address(this), block.timestamp);
   [1] Router.swapExactETHForTokens{value: 2361.1829 ether}(0, path:(WETH  0x47################################9C805), address(this), block.timestamp);
[Sender] 0x68################################c9024
   [1] 0x47################################9C805.approve(0x47################################9C805, 19255748555718617878219192915980088793830565912672926166447.3471 ether)
       0x01
   [1] 0x47################################9C805.excludeFromFee{value: 2}(0x00################################00000)

[32m INFO[0m ==========================================
[32m INFO[0m [Testcase #0] run time: 0h-0m-22s, clients: 1, corpus: 35, objectives: 0, executions: 133, exec/sec: 22.67
[32m INFO[0m ============= Coverage Summary =============
[32m INFO[0m 0xbb################################c095c: 11.03% Instruction Covered, 13.16% Branch Covered
[32m INFO[0m 0x47################################9c805: 42.50% Instruction Covered, 39.16% Branch Covered
[32m INFO[0m [Stats #0] run time: 0h-0m-22s, clients: 1, corpus: 35, objectives: 0, executions: 133, exec/sec: 22.66
[32m INFO[0m ============= New Corpus Item =============
[32m INFO[0m Reverted? true 
 Txn:
[Sender] 0x35################################31dDb
   [1] Router.swapExactETHForTokens{value: 3116.4275 ether}(0, path:(WETH  0x47################################9C805), address(this), block.timestamp);
[Sender] 0xe1################################c8510
   [1] 0x47################################9C805.excludeFromReward(0x35################################31dDb)
       0x08################################000000000000000000000000000000000002000000000000000000000000000000000000000000000000000000000000000204f776e61626c653a2063616c6c6572206973206e6f7420746865206f776e6572

[32m INFO[0m ==========================================
[32m INFO[0m [Testcase #0] run time: 0h-0m-22s, clients: 1, corpus: 36, objectives: 0, executions: 161, exec/sec: 27.43
[32m INFO[0m [Stats #0] run time: 0h-0m-22s, clients: 1, corpus: 36, objectives: 0, executions: 161, exec/sec: 27.43
[32m INFO[0m ============= New Corpus Item =============
[32m INFO[0m Reverted? true 
 Txn:
[Sender] 0x68################################c9024
   [1] 0x47################################9C805.approve(0x35################################31dDb, 69695055613231930756176443445950753611541898068780204055088.1032 ether)
       0x01
[Sender] 0xe1################################c8510
   [1] 0x47################################9C805.excludeFromReward{value: 1881.6400 ether}(0x68################################c9024)

[32m INFO[0m ==========================================
[32m INFO[0m [Testcase #0] run time: 0h-0m-22s, clients: 1, corpus: 37, objectives: 0, executions: 164, exec/sec: 27.93
[32m INFO[0m ============= Coverage Summary =============
[32m INFO[0m 0x47################################9c805: 42.54% Instruction Covered, 39.41% Branch Covered
[32m INFO[0m 0xbb################################c095c: 11.03% Instruction Covered, 13.16% Branch Covered
[32m INFO[0m [Stats #0] run time: 0h-0m-22s, clients: 1, corpus: 37, objectives: 0, executions: 164, exec/sec: 27.90
[32m INFO[0m ============= New Corpus Item =============
[32m INFO[0m Reverted? true 
 Txn:
[Sender] 0x35################################31dDb
   [1] Router.swapExactETHForTokens{value: 3116.4275 ether}(0, path:(WETH  0x47################################9C805), address(this), block.timestamp);
   [1] Router.swapExactETHForTokens{value: 4722.3664 ether}(0, path:(WETH  0x47################################9C805), address(this), block.timestamp);
   [1] Router.swapExactETHForTokens{value: 10.5368 ether}(0, path:(WETH  0x47################################9C805), address(this), block.timestamp);
[Sender] 0x8E################################d79dd
   [1] 0x47################################9C805.includeInFee{value: 4500.5335 ether}(0x00################################00000)

[32m INFO[0m ==========================================
[32m INFO[0m [Testcase #0] run time: 0h-0m-22s, clients: 1, corpus: 38, objectives: 0, executions: 193, exec/sec: 32.83
[32m INFO[0m [Stats #0] run time: 0h-0m-22s, clients: 1, corpus: 38, objectives: 0, executions: 193, exec/sec: 32.83
[32m INFO[0m ============= New Corpus Item =============
[32m INFO[0m Reverted? true 
 Txn:
[Sender] 0x35################################31dDb
   [1] Router.swapExactETHForTokens{value: 3116.4275 ether}(0, path:(WETH  0x47################################9C805), address(this), block.timestamp);
   [1] Router.swapExactETHForTokens{value: 3916.9970 ether}(0, path:(WETH  0x47################################9C805), address(this), block.timestamp);
[Sender] 0x8E################################d79dd
   [1] 0x47################################9C805.includeInFee(0x00################################00000)
       0x08################################000000000000000000000000000000000002000000000000000000000000000000000000000000000000000000000000000204f776e61626c653a2063616c6c6572206973206e6f7420746865206f776e6572

[32m INFO[0m ==========================================
[32m INFO[0m [Testcase #0] run time: 0h-0m-22s, clients: 1, corpus: 39, objectives: 0, executions: 194, exec/sec: 32.99
[32m INFO[0m ============= Coverage Summary =============
[32m INFO[0m 0xbb################################c095c: 11.03% Instruction Covered, 13.16% Branch Covered
[32m INFO[0m 0x47################################9c805: 42.57% Instruction Covered, 39.66% Branch Covered
[32m INFO[0m [Stats #0] run time: 0h-0m-22s, clients: 1, corpus: 39, objectives: 0, executions: 194, exec/sec: 32.95
[32m INFO[0m ============= New Corpus Item =============
[32m INFO[0m Reverted? true 
 Txn:
[Sender] 0x35################################31dDb
   [1] Router.swapExactETHForTokens{value: 3116.4275 ether}(0, path:(WETH  0x47################################9C805), address(this), block.timestamp);
   [1] Router.swapExactETHForTokens{value: 3916.9970 ether}(0, path:(WETH  0x47################################9C805), address(this), block.timestamp);
   [1] Router.swapExactETHForTokens{value: 2399.2476 ether}(0, path:(WETH  0x47################################9C805), address(this), block.timestamp);
   [1] 0x47################################9C805.includeInReward(0x35################################31dDb)
       0x08################################000000000000000000000000000000000002000000000000000000000000000000000000000000000000000000000000000204f776e61626c653a2063616c6c6572206973206e6f7420746865206f776e6572

[32m INFO[0m ==========================================
[32m INFO[0m [Testcase #0] run time: 0h-0m-22s, clients: 1, corpus: 40, objectives: 0, executions: 225, exec/sec: 38.21
[32m INFO[0m [Stats #0] run time: 0h-0m-22s, clients: 1, corpus: 40, objectives: 0, executions: 225, exec/sec: 38.21
[32m INFO[0m ============= New Corpus Item =============
[32m INFO[0m Reverted? true 
 Txn:
[Sender] 0x35################################31dDb
   [1] Router.swapExactETHForTokens{value: 3116.4275 ether}(0, path:(WETH  0x47################################9C805), address(this), block.timestamp);
   [1] Router.swapExactETHForTokens{value: 3800.1685 ether}(0, path:(WETH  0x47################################9C805), address(this), block.timestamp);
   [1] Router.swapExactETHForTokens{value: 10.0 ether}(0, path:(WETH  0x47################################9C805), address(this), block.timestamp);
   [1] Router.swapExactETHForTokens{value: 2361.1829 ether}(0, path:(WETH  0x47################################9C805), address(this), block.timestamp);
   [1] Router.swapExactETHForTokens{value: 10.0 ether}(0, path:(WETH  0x47################################9C805), address(this), block.timestamp);
   [1] 0x47################################9C805.includeInReward{value: 0.2260 ether}(0xe1################################c8510)

[32m INFO[0m ==========================================
[32m INFO[0m [Testcase #0] run time: 0h-0m-22s, clients: 1, corpus: 41, objectives: 0, executions: 226, exec/sec: 38.38
[32m INFO[0m ============= Coverage Summary =============
[32m INFO[0m 0x47################################9c805: 42.61% Instruction Covered, 39.90% Branch Covered
[32m INFO[0m 0xbb################################c095c: 11.03% Instruction Covered, 13.16% Branch Covered
[32m INFO[0m [Stats #0] run time: 0h-0m-22s, clients: 1, corpus: 41, objectives: 0, executions: 226, exec/sec: 38.36
[32m INFO[0m ============= New Corpus Item =============
[32m INFO[0m Reverted? true 
 Txn:
[Sender] 0x35################################31dDb
   [1] Router.swapExactETHForTokens{value: 3116.4275 ether}(0, path:(WETH  0x47################################9C805), address(this), block.timestamp);
   [1] Router.swapExactETHForTokens{value: 10.0 ether}(0, path:(WETH  0x47################################9C805), address(this), block.timestamp);
   [1] Router.swapExactETHForTokens{value: 18.4468 ether}(0, path:(WETH  0x47################################9C805), address(this), block.timestamp);
[Sender] 0xe1################################c8510
   [1] 0x47################################9C805.increaseAllowance(0x00################################00000, 4096)
       0x08################################0000000000000000000000000000000000020000000000000000000000000000000000000000000000000000000000000002245524332303a20617070726f766520746f20746865207a65726f2061646472657373000000000000000000000000000000000000000000000000000000000000

[32m INFO[0m ==========================================
[32m INFO[0m [Testcase #0] run time: 0h-0m-22s, clients: 1, corpus: 42, objectives: 0, executions: 257, exec/sec: 43.62
[32m INFO[0m [Stats #0] run time: 0h-0m-22s, clients: 1, corpus: 42, objectives: 0, executions: 257, exec/sec: 43.62
[32m INFO[0m ============= New Corpus Item =============
[32m INFO[0m Reverted? true 
 Txn:
[Sender] 0x35################################31dDb
   [1] Router.swapExactETHForTokens{value: 3116.4275 ether}(0, path:(WETH  0x47################################9C805), address(this), block.timestamp);
   [1] Router.swapExactETHForTokens{value: 10.0 ether}(0, path:(WETH  0x47################################9C805), address(this), block.timestamp);
[Sender] 0xe1################################c8510
   [1] 0x47################################9C805.increaseAllowance{value: 0.9007 ether}(0x47################################9C805, 24519928655312846574935168937922300044004.2126 ether)

[32m INFO[0m ==========================================
[32m INFO[0m [Testcase #0] run time: 0h-0m-22s, clients: 1, corpus: 43, objectives: 0, executions: 258, exec/sec: 43.78
[32m INFO[0m ============= Coverage Summary =============
[32m INFO[0m 0x47################################9c805: 42.64% Instruction Covered, 40.15% Branch Covered
[32m INFO[0m 0xbb################################c095c: 11.03% Instruction Covered, 13.16% Branch Covered
[32m INFO[0m [Stats #0] run time: 0h-0m-24s, clients: 1, corpus: 43, objectives: 0, executions: 288, exec/sec: 39.41
[32m INFO[0m [Stats #0] run time: 0h-0m-24s, clients: 1, corpus: 43, objectives: 0, executions: 288, exec/sec: 39.41
[32m INFO[0m ============= New Corpus Item =============
[32m INFO[0m Reverted? true 
 Txn:
[Sender] 0x35################################31dDb
   [1] Router.swapExactETHForTokens{value: 3116.4275 ether}(0, path:(WETH  0x47################################9C805), address(this), block.timestamp);
   [1] Router.swapExactETHForTokens{value: 3916.9970 ether}(0, path:(WETH  0x47################################9C805), address(this), block.timestamp);
   [1] Router.swapExactETHForTokens{value: 1053.7288 ether}(0, path:(WETH  0x47################################9C805), address(this), block.timestamp);
   [1] Router.swapExactETHForTokens{value: 10.0 ether}(0, path:(WETH  0x47################################9C805), address(this), block.timestamp);
[Sender] 0x68################################c9024
   [1] 0x47################################9C805.approve(0x35################################31dDb, 13479973333575320045593292576028327167504758166718.3393 ether)
       0x01
[Sender] 0xe1################################c8510
   [1] 0x47################################9C805.lock(0)
       0x08################################000000000000000000000000000000000002000000000000000000000000000000000000000000000000000000000000000204f776e61626c653a2063616c6c6572206973206e6f7420746865206f776e6572

[32m INFO[0m ==========================================
[32m INFO[0m [Testcase #0] run time: 0h-0m-24s, clients: 1, corpus: 44, objectives: 0, executions: 289, exec/sec: 39.54
[32m INFO[0m [Stats #0] run time: 0h-0m-24s, clients: 1, corpus: 44, objectives: 0, executions: 289, exec/sec: 39.53
[32m INFO[0m ============= New Corpus Item =============
[32m INFO[0m Reverted? true 
 Txn:
[Sender] 0x35################################31dDb
   [1] Router.swapExactETHForTokens{value: 3116.4275 ether}(0, path:(WETH  0x47################################9C805), address(this), block.timestamp);
[Sender] 0x68################################c9024
   [1] 0x47################################9C805.approve(0xe1################################c8510, 37717655047492280691531796868126900736673477644559742.5080 ether)
       0x01
[Sender] 0xe1################################c8510
   [1] 0x47################################9C805.lock{value: 477.6166 ether}(1601286032295412250604247361093530963860678192976797302.5872 ether)

[32m INFO[0m ==========================================
[32m INFO[0m [Testcase #0] run time: 0h-0m-24s, clients: 1, corpus: 45, objectives: 0, executions: 302, exec/sec: 41.30
[32m INFO[0m ============= Coverage Summary =============
[32m INFO[0m 0xbb################################c095c: 11.03% Instruction Covered, 13.16% Branch Covered
[32m INFO[0m 0x47################################9c805: 42.67% Instruction Covered, 40.39% Branch Covered
[32m INFO[0m [Stats #0] run time: 0h-0m-24s, clients: 1, corpus: 45, objectives: 0, executions: 302, exec/sec: 41.25
[32m INFO[0m ============= New Corpus Item =============
[32m INFO[0m Reverted? true 
 Txn:
[Sender] 0x35################################31dDb
   [1] Router.swapExactETHForTokens{value: 3116.4275 ether}(0, path:(WETH  0x47################################9C805), address(this), block.timestamp);
   [1] Router.swapExactETHForTokens{value: 3916.9970 ether}(0, path:(WETH  0x47################################9C805), address(this), block.timestamp);
   [1] Router.swapExactETHForTokens{value: 1053.7288 ether}(0, path:(WETH  0x47################################9C805), address(this), block.timestamp);
   [1] 0x47################################9C805.renounceOwnership{value: 2657.1130 ether}()

[32m INFO[0m ==========================================
[32m INFO[0m [Testcase #0] run time: 0h-0m-24s, clients: 1, corpus: 46, objectives: 0, executions: 321, exec/sec: 43.84
[32m INFO[0m [Stats #0] run time: 0h-0m-24s, clients: 1, corpus: 46, objectives: 0, executions: 321, exec/sec: 43.84
[32m INFO[0m ============= New Corpus Item =============
[32m INFO[0m Reverted? true 
 Txn:
[Sender] 0x35################################31dDb
   [1] Router.swapExactETHForTokens{value: 3116.4275 ether}(0, path:(WETH  0x47################################9C805), address(this), block.timestamp);
   [1] Router.swapExactETHForTokens{value: 10.0 ether}(0, path:(WETH  0x47################################9C805), address(this), block.timestamp);
   [1] Router.swapExactETHForTokens{value: 18.4468 ether}(0, path:(WETH  0x47################################9C805), address(this), block.timestamp);
   [1] Router.swapExactETHForTokens{value: 3938.5325 ether}(0, path:(WETH  0x47################################9C805), address(this), block.timestamp);
   [1] 0x47################################9C805.renounceOwnership()
       0x08################################000000000000000000000000000000000002000000000000000000000000000000000000000000000000000000000000000204f776e61626c653a2063616c6c6572206973206e6f7420746865206f776e6572

[32m INFO[0m ==========================================
[32m INFO[0m [Testcase #0] run time: 0h-0m-24s, clients: 1, corpus: 47, objectives: 0, executions: 322, exec/sec: 43.97
[32m INFO[0m ============= Coverage Summary =============
[32m INFO[0m 0x47################################9c805: 42.71% Instruction Covered, 40.64% Branch Covered
[32m INFO[0m 0xbb################################c095c: 11.03% Instruction Covered, 13.16% Branch Covered
[32m INFO[0m [Stats #0] run time: 0h-0m-24s, clients: 1, corpus: 47, objectives: 0, executions: 322, exec/sec: 43.95
[32m INFO[0m ============= New Corpus Item =============
[32m INFO[0m Reverted? true 
 Txn:
[Sender] 0x35################################31dDb
   [1] Router.swapExactETHForTokens{value: 3116.4275 ether}(0, path:(WETH  0x47################################9C805), address(this), block.timestamp);
   [1] Router.swapExactETHForTokens{value: 3916.9970 ether}(0, path:(WETH  0x47################################9C805), address(this), block.timestamp);
[Sender] 0xe1################################c8510
   [1] 0x47################################9C805.setLiquidityFeePercent{value: 549755813779}(115169159206538569067418727539840243192509113403303139668703.9758 ether)

[32m INFO[0m ==========================================
[32m INFO[0m [Testcase #0] run time: 0h-0m-24s, clients: 1, corpus: 48, objectives: 0, executions: 353, exec/sec: 48.17
[32m INFO[0m [Stats #0] run time: 0h-0m-24s, clients: 1, corpus: 48, objectives: 0, executions: 353, exec/sec: 48.17
[32m INFO[0m ============= New Corpus Item =============
[32m INFO[0m Reverted? true 
 Txn:
[Sender] 0x35################################31dDb
   [1] Router.swapExactETHForTokens{value: 3116.4275 ether}(0, path:(WETH  0x47################################9C805), address(this), block.timestamp);
   [1] Router.swapExactETHForTokens{value: 3916.9970 ether}(0, path:(WETH  0x47################################9C805), address(this), block.timestamp);
   [1] Router.swapExactETHForTokens{value: 1053.7288 ether}(0, path:(WETH  0x47################################9C805), address(this), block.timestamp);
[Sender] 0xe1################################c8510
   [1] 0x47################################9C805.setLiquidityFeePercent(0)
       0x08################################000000000000000000000000000000000002000000000000000000000000000000000000000000000000000000000000000204f776e61626c653a2063616c6c6572206973206e6f7420746865206f776e6572

[32m INFO[0m ==========================================
[32m INFO[0m [Testcase #0] run time: 0h-0m-24s, clients: 1, corpus: 49, objectives: 0, executions: 354, exec/sec: 48.31
[32m INFO[0m ============= Coverage Summary =============
[32m INFO[0m 0xbb################################c095c: 11.03% Instruction Covered, 13.16% Branch Covered
[32m INFO[0m 0x47################################9c805: 42.74% Instruction Covered, 40.89% Branch Covered
[32m INFO[0m [Stats #0] run time: 0h-0m-24s, clients: 1, corpus: 49, objectives: 0, executions: 354, exec/sec: 48.25
[32m INFO[0m ============= New Corpus Item =============
[32m INFO[0m Reverted? true 
 Txn:
[Sender] 0x35################################31dDb
   [1] Router.swapExactETHForTokens{value: 310.3847 ether}(0, path:(WETH  0x47################################9C805), address(this), block.timestamp);
[Sender] 0x68################################c9024
   [1] 0x47################################9C805.setMaxTxPercent(0)
       0x08################################000000000000000000000000000000000002000000000000000000000000000000000000000000000000000000000000000204f776e61626c653a2063616c6c6572206973206e6f7420746865206f776e6572

[32m INFO[0m ==========================================
[32m INFO[0m [Testcase #0] run time: 0h-0m-24s, clients: 1, corpus: 50, objectives: 0, executions: 385, exec/sec: 52.48
[32m INFO[0m ============= Coverage Summary =============
[32m INFO[0m 0x47################################9c805: 42.74% Instruction Covered, 40.89% Branch Covered
[32m INFO[0m 0xbb################################c095c: 11.03% Instruction Covered, 13.16% Branch Covered
[32m INFO[0m [Stats #0] run time: 0h-0m-24s, clients: 1, corpus: 50, objectives: 0, executions: 385, exec/sec: 52.45
[32m INFO[0m ============= New Corpus Item =============
[32m INFO[0m Reverted? true 
 Txn:
[Sender] 0x35################################31dDb
   [1] Router.swapExactETHForTokens{value: 3116.4275 ether}(0, path:(WETH  0x47################################9C805), address(this), block.timestamp);
[Sender] 0xe1################################c8510
   [1] 0x47################################9C805.setSwapAndLiquifyEnabled(false)
       0x08################################000000000000000000000000000000000002000000000000000000000000000000000000000000000000000000000000000204f776e61626c653a2063616c6c6572206973206e6f7420746865206f776e6572

[32m INFO[0m ==========================================
[32m INFO[0m [Testcase #0] run time: 0h-0m-24s, clients: 1, corpus: 51, objectives: 0, executions: 417, exec/sec: 56.81
[32m INFO[0m [Stats #0] run time: 0h-0m-24s, clients: 1, corpus: 51, objectives: 0, executions: 417, exec/sec: 56.81
[32m INFO[0m ============= New Corpus Item =============
[32m INFO[0m Reverted? true 
 Txn:
[Sender] 0x35################################31dDb
   [1] Router.swapExactETHForTokens{value: 3116.4275 ether}(0, path:(WETH  0x47################################9C805), address(this), block.timestamp);
   [1] Router.swapExactETHForTokens{value: 3916.9970 ether}(0, path:(WETH  0x47################################9C805), address(this), block.timestamp);
   [1] Router.swapExactETHForTokens{value: 2399.2476 ether}(0, path:(WETH  0x47################################9C805), address(this), block.timestamp);
   [1] 0x47################################9C805.setSwapAndLiquifyEnabled{value: 22.8453 ether}(true)

[32m INFO[0m ==========================================
[32m INFO[0m [Testcase #0] run time: 0h-0m-24s, clients: 1, corpus: 52, objectives: 0, executions: 421, exec/sec: 57.35
[32m INFO[0m ============= Coverage Summary =============
[32m INFO[0m 0xbb################################c095c: 11.03% Instruction Covered, 13.16% Branch Covered
[32m INFO[0m 0x47################################9c805: 42.78% Instruction Covered, 41.13% Branch Covered
[32m INFO[0m [Stats #0] run time: 0h-0m-24s, clients: 1, corpus: 52, objectives: 0, executions: 421, exec/sec: 57.32
[32m INFO[0m ============= New Corpus Item =============
[32m INFO[0m Reverted? true 
 Txn:
[Sender] 0x35################################31dDb
   [1] Router.swapExactETHForTokens{value: 3116.4275 ether}(0, path:(WETH  0x47################################9C805), address(this), block.timestamp);
   [1] Router.swapExactETHForTokens{value: 3800.1685 ether}(0, path:(WETH  0x47################################9C805), address(this), block.timestamp);
[Sender] 0xe1################################c8510
   [1] 0x47################################9C805.setTaxFeePercent(14474238157626307479142055466773646778039224905475676792472.2667 ether)
       0x08################################000000000000000000000000000000000002000000000000000000000000000000000000000000000000000000000000000204f776e61626c653a2063616c6c6572206973206e6f7420746865206f776e6572

[32m INFO[0m ==========================================
[32m INFO[0m [Testcase #0] run time: 0h-0m-24s, clients: 1, corpus: 53, objectives: 0, executions: 449, exec/sec: 61.13
[32m INFO[0m [Stats #0] run time: 0h-0m-24s, clients: 1, corpus: 53, objectives: 0, executions: 449, exec/sec: 61.13
[32m INFO[0m ============= New Corpus Item =============
[32m INFO[0m Reverted? true 
 Txn:
[Sender] 0x68################################c9024
   [1] 0x47################################9C805.approve(0x35################################31dDb, 69695055613231930756176443445950753611541898068780204055088.1032 ether)
       0x01
[Sender] 0x35################################31dDb
   [1] 0x47################################9C805.setTaxFeePercent{value: 2941.8898 ether}(0)

[32m INFO[0m ==========================================
[32m INFO[0m [Testcase #0] run time: 0h-0m-24s, clients: 1, corpus: 54, objectives: 0, executions: 453, exec/sec: 61.67
[32m INFO[0m ============= Coverage Summary =============
[32m INFO[0m 0x47################################9c805: 42.81% Instruction Covered, 41.38% Branch Covered
[32m INFO[0m 0xbb################################c095c: 11.03% Instruction Covered, 13.16% Branch Covered
[32m INFO[0m [Stats #0] run time: 0h-0m-24s, clients: 1, corpus: 54, objectives: 0, executions: 453, exec/sec: 61.64
[32m INFO[0m ============= New Corpus Item =============
[32m INFO[0m Reverted? true 
 Txn:
[Sender] 0x35################################31dDb
   [1] Router.swapExactETHForTokens{value: 3116.4275 ether}(0, path:(WETH  0x47################################9C805), address(this), block.timestamp);
   [1] Router.swapExactETHForTokens{value: 3916.9970 ether}(0, path:(WETH  0x47################################9C805), address(this), block.timestamp);
[Sender] 0x8E################################d79dd
   [1] 0x47################################9C805.transfer(0x00################################00000, 3647405955246831185527820018763052298746601.6619 ether)
       0x08################################0000000000000000000000000000000000020000000000000000000000000000000000000000000000000000000000000002345524332303a207472616e7366657220746f20746865207a65726f20616464726573730000000000000000000000000000000000000000000000000000000000

[32m INFO[0m ==========================================
[32m INFO[0m [Testcase #0] run time: 0h-0m-24s, clients: 1, corpus: 55, objectives: 0, executions: 481, exec/sec: 65.44
[32m INFO[0m [Stats #0] run time: 0h-0m-24s, clients: 1, corpus: 55, objectives: 0, executions: 481, exec/sec: 65.44
[32m INFO[0m ============= New Corpus Item =============
[32m INFO[0m Reverted? true 
 Txn:
[Sender] 0x35################################31dDb
   [1] Router.swapExactETHForTokens{value: 3116.4275 ether}(0, path:(WETH  0x47################################9C805), address(this), block.timestamp);
   [1] Router.swapExactETHForTokens{value: 4722.3664 ether}(0, path:(WETH  0x47################################9C805), address(this), block.timestamp);
   [1] Router.swapExactETHForTokens{value: 1737}(0, path:(WETH  0x47################################9C805), address(this), block.timestamp);
[Sender] 0xe1################################c8510
   [1] 0x47################################9C805.transfer(0x35################################31dDb, 74636259277303573828227402590909154268129782290128526940223.1705 ether)
       0x08################################000000000000000000000000000000000002000000000000000000000000000000000000000000000000000000000000000285472616e7366657220616d6f756e74206578636565647320746865206d61785478416d6f756e742e000000000000000000000000000000000000000000000000

[32m INFO[0m ==========================================
[32m INFO[0m [Testcase #0] run time: 0h-0m-24s, clients: 1, corpus: 56, objectives: 0, executions: 482, exec/sec: 65.57
[32m INFO[0m [Stats #0] run time: 0h-0m-24s, clients: 1, corpus: 56, objectives: 0, executions: 482, exec/sec: 65.57
[32m INFO[0m ============= New Corpus Item =============
[32m INFO[0m Reverted? true 
 Txn:
[Sender] 0x68################################c9024
   [1] 0x47################################9C805.approve(0x35################################31dDb, 69695055613231930756176443445950753611541898068780204055088.1032 ether)
       0x01
[Sender] 0xe1################################c8510
   [1] 0x47################################9C805.transfer{value: 310.1221 ether}(0x00################################00000, 0)

[32m INFO[0m ==========================================
[32m INFO[0m [Testcase #0] run time: 0h-0m-24s, clients: 1, corpus: 57, objectives: 0, executions: 483, exec/sec: 65.70
[32m INFO[0m ============= Coverage Summary =============
[32m INFO[0m 0xbb################################c095c: 11.03% Instruction Covered, 13.16% Branch Covered
[32m INFO[0m 0x47################################9c805: 43.29% Instruction Covered, 41.87% Branch Covered
[32m INFO[0m [Stats #0] run time: 0h-0m-24s, clients: 1, corpus: 57, objectives: 0, executions: 483, exec/sec: 59.52
[32m INFO[0m ============= New Corpus Item =============
[32m INFO[0m Reverted? true 
 Txn:
[Sender] 0x8E################################d79dd
   [1] 0x47################################9C805.transferFrom(0x00################################00000, 0x47################################9C805, 107896945911485746257707047291351806423611778482489.6335 ether)
       0x08################################0000000000000000000000000000000000020000000000000000000000000000000000000000000000000000000000000002545524332303a207472616e736665722066726f6d20746865207a65726f2061646472657373000000000000000000000000000000000000000000000000000000

[32m INFO[0m ==========================================
[32m INFO[0m [Testcase #0] run time: 0h-0m-24s, clients: 1, corpus: 58, objectives: 0, executions: 513, exec/sec: 63.22
[32m INFO[0m [Stats #0] run time: 0h-0m-27s, clients: 1, corpus: 58, objectives: 0, executions: 513, exec/sec: 48.79
[32m INFO[0m ============= New Corpus Item =============
[32m INFO[0m Reverted? true 
 Txn:
[Sender] 0x35################################31dDb
   [1] Router.swapExactETHForTokens{value: 3116.4275 ether}(0, path:(WETH  0x47################################9C805), address(this), block.timestamp);
[Sender] 0x68################################c9024
   [1] 0x47################################9C805.approve(0xe1################################c8510, 37717655047492280691531796868126900736673477644559742.5080 ether)
       0x01
[Sender] 0x8E################################d79dd
   [1] 0x47################################9C805.transferFrom(0x47################################9C805, 0x68################################c9024, 2)
       0x08################################0000000000000000000000000000000000020000000000000000000000000000000000000000000000000000000000000002845524332303a207472616e7366657220616d6f756e74206578636565647320616c6c6f77616e6365000000000000000000000000000000000000000000000000

[32m INFO[0m ==========================================
[32m INFO[0m [Testcase #0] run time: 0h-0m-27s, clients: 1, corpus: 59, objectives: 0, executions: 515, exec/sec: 48.98
[32m INFO[0m [Stats #0] run time: 0h-0m-27s, clients: 1, corpus: 59, objectives: 0, executions: 515, exec/sec: 48.97
[32m INFO[0m ============= New Corpus Item =============
[32m INFO[0m Reverted? true 
 Txn:
[Sender] 0x35################################31dDb
   [1] Router.swapExactETHForTokens{value: 310.3847 ether}(0, path:(WETH  0x47################################9C805), address(this), block.timestamp);
[Sender] 0x8E################################d79dd
   [1] 0x47################################9C805.transferFrom{value: 4382.3723 ether}(0x68################################c9024, 0x68################################c9024, 7.2057 ether)

[32m INFO[0m ==========================================
[32m INFO[0m [Testcase #0] run time: 0h-0m-27s, clients: 1, corpus: 60, objectives: 0, executions: 517, exec/sec: 49.16
[32m INFO[0m ============= Coverage Summary =============
[32m INFO[0m 0xbb################################c095c: 11.03% Instruction Covered, 13.16% Branch Covered
[32m INFO[0m 0x47################################9c805: 44.86% Instruction Covered, 43.60% Branch Covered
[32m INFO[0m [Stats #0] run time: 0h-0m-27s, clients: 1, corpus: 60, objectives: 0, executions: 544, exec/sec: 51.67
[32m INFO[0m [Stats #0] run time: 0h-0m-27s, clients: 1, corpus: 60, objectives: 0, executions: 544, exec/sec: 51.67
[32m INFO[0m ============= New Corpus Item =============
[32m INFO[0m Reverted? true 
 Txn:
[Sender] 0x68################################c9024
   [1] 0x47################################9C805.approve(0x35################################31dDb, 69695055613231930756176443445950753611541898068780204055088.1032 ether)
       0x01
   [1] 0x47################################9C805.transferOwnership(0x00################################00000)
       0x08################################000000000000000000000000000000000002000000000000000000000000000000000000000000000000000000000000000204f776e61626c653a2063616c6c6572206973206e6f7420746865206f776e6572

[32m INFO[0m ==========================================
[32m INFO[0m [Testcase #0] run time: 0h-0m-27s, clients: 1, corpus: 61, objectives: 0, executions: 545, exec/sec: 51.76
[32m INFO[0m [Stats #0] run time: 0h-0m-27s, clients: 1, corpus: 61, objectives: 0, executions: 545, exec/sec: 51.76
[32m INFO[0m ============= New Corpus Item =============
[32m INFO[0m Reverted? true 
 Txn:
[Sender] 0x68################################c9024
   [1] 0x47################################9C805.approve(0x35################################31dDb, 69695055613231930756176443445950753611541898068780204055088.1032 ether)
       0x01
   [1] 0x47################################9C805.transferOwnership{value: 0.1274 ether}(0x8E################################d79dd)

[32m INFO[0m ==========================================
[32m INFO[0m [Testcase #0] run time: 0h-0m-27s, clients: 1, corpus: 62, objectives: 0, executions: 556, exec/sec: 52.80
[32m INFO[0m ============= Coverage Summary =============
[32m INFO[0m 0xbb################################c095c: 11.03% Instruction Covered, 13.16% Branch Covered
[32m INFO[0m 0x47################################9c805: 44.89% Instruction Covered, 43.84% Branch Covered
[32m INFO[0m [Stats #0] run time: 0h-0m-27s, clients: 1, corpus: 62, objectives: 0, executions: 556, exec/sec: 52.78
[32m INFO[0m ============= New Corpus Item =============
[32m INFO[0m Reverted? true 
 Txn:
[Sender] 0x68################################c9024
   [1] 0x47################################9C805.approve(0x35################################31dDb, 69695055613231930756176443445950753611541898068780204055088.1032 ether)
       0x01
[Sender] 0xe1################################c8510
   [1] 0x47################################9C805.unlock()
       0x08################################00000000000000000000000000000000000200000000000000000000000000000000000000000000000000000000000000023596f7520646f6e27742068617665207065726d697373696f6e20746f20756e6c6f636b0000000000000000000000000000000000000000000000000000000000

[32m INFO[0m ==========================================
[32m INFO[0m [Testcase #0] run time: 0h-0m-27s, clients: 1, corpus: 63, objectives: 0, executions: 577, exec/sec: 54.77
[32m INFO[0m [Stats #0] run time: 0h-0m-27s, clients: 1, corpus: 63, objectives: 0, executions: 577, exec/sec: 54.77
[32m INFO[0m ============= New Corpus Item =============
[32m INFO[0m Reverted? true 
 Txn:
[Sender] 0x35################################31dDb
   [1] Router.swapExactETHForTokens{value: 3116.4275 ether}(0, path:(WETH  0x47################################9C805), address(this), block.timestamp);
   [1] Router.swapExactETHForTokens{value: 3800.1685 ether}(0, path:(WETH  0x47################################9C805), address(this), block.timestamp);
   [1] Router.swapExactETHForTokens{value: 10.0 ether}(0, path:(WETH  0x47################################9C805), address(this), block.timestamp);
[Sender] 0x8E################################d79dd
   [1] 0x47################################9C805.unlock{value: 4722.3664 ether}()

[32m INFO[0m ==========================================
[32m INFO[0m [Testcase #0] run time: 0h-0m-27s, clients: 1, corpus: 64, objectives: 0, executions: 580, exec/sec: 55.05
[32m INFO[0m ============= Coverage Summary =============
[32m INFO[0m 0x47################################9c805: 44.93% Instruction Covered, 44.09% Branch Covered
[32m INFO[0m 0xbb################################c095c: 11.03% Instruction Covered, 13.16% Branch Covered
[32m INFO[0m [Stats #0] run time: 0h-0m-27s, clients: 1, corpus: 64, objectives: 0, executions: 580, exec/sec: 55.04
[32m INFO[0m ============= New Corpus Item =============
[32m INFO[0m Reverted? false 
 Txn:
[Sender] 0x68################################c9024
   [1] 0x47################################9C805.call{value: 0}()

[32m INFO[0m ==========================================
[32m INFO[0m [Testcase #0] run time: 0h-0m-27s, clients: 1, corpus: 65, objectives: 0, executions: 609, exec/sec: 57.79
[32m INFO[0m ============= Coverage Summary =============
[32m INFO[0m 0xbb################################c095c: 11.03% Instruction Covered, 13.16% Branch Covered
[32m INFO[0m 0x47################################9c805: 44.93% Instruction Covered, 44.09% Branch Covered
[32m INFO[0m [Stats #0] run time: 0h-0m-28s, clients: 1, corpus: 65, objectives: 0, executions: 1344, exec/sec: 111.4
[32m INFO[0m [Stats #0] run time: 0h-0m-30s, clients: 1, corpus: 65, objectives: 0, executions: 2175, exec/sec: 158.0
[32m INFO[0m [Stats #0] run time: 0h-0m-30s, clients: 1, corpus: 65, objectives: 0, executions: 2175, exec/sec: 158.0
[32m INFO[0m ============= New Corpus Item =============
[32m INFO[0m Reverted? false 
 Txn:
[Sender] 0x35################################31dDb
   [1] Router.swapExactETHForTokens{value: 3116.4275 ether}(0, path:(WETH  0x47################################9C805), address(this), block.timestamp);
   [1] Router.swapExactETHForTokens{value: 10.0 ether}(0, path:(WETH  0x47################################9C805), address(this), block.timestamp);
   [1] 0x47################################9C805.deliver(15937)

[32m INFO[0m ==========================================
[32m INFO[0m [Testcase #0] run time: 0h-0m-30s, clients: 1, corpus: 66, objectives: 0, executions: 2181, exec/sec: 158.4
[32m INFO[0m ============= Coverage Summary =============
[32m INFO[0m 0xbb################################c095c: 11.03% Instruction Covered, 13.16% Branch Covered
[32m INFO[0m 0x47################################9c805: 44.93% Instruction Covered, 44.09% Branch Covered
[32m INFO[0m [Stats #0] run time: 0h-0m-31s, clients: 1, corpus: 66, objectives: 0, executions: 2181, exec/sec: 149.0
[32m INFO[0m ============= New Corpus Item =============
[32m INFO[0m Reverted? false 
 Txn:
[Sender] 0x35################################31dDb
   [1] Router.swapExactETHForTokens{value: 3116.4275 ether}(0, path:(WETH  0x47################################9C805), address(this), block.timestamp);
   [1] Router.swapExactETHForTokens{value: 3916.9970 ether}(0, path:(WETH  0x47################################9C805), address(this), block.timestamp);
   [1] Router.swapExactETHForTokens{value: 2399.2476 ether}(0, path:(WETH  0x47################################9C805), address(this), block.timestamp);
[Sender] 0xe1################################c8510
   [1] 0x47################################9C805.increaseAllowance(0x68################################c9024, 115792089237316195423570985008687907853269984665640564039457.5840 ether)
       0x01

[32m INFO[0m ==========================================
[32m INFO[0m [Testcase #0] run time: 0h-0m-31s, clients: 1, corpus: 67, objectives: 0, executions: 2352, exec/sec: 160.7
[32m INFO[0m ============= Coverage Summary =============
[32m INFO[0m 0xbb################################c095c: 11.03% Instruction Covered, 13.16% Branch Covered
[32m INFO[0m 0x47################################9c805: 45.25% Instruction Covered, 44.09% Branch Covered
[32m INFO[0m [Stats #0] run time: 0h-0m-31s, clients: 1, corpus: 67, objectives: 0, executions: 2623, exec/sec: 174.3
[32m INFO[0m [Stats #0] run time: 0h-0m-32s, clients: 1, corpus: 67, objectives: 0, executions: 2623, exec/sec: 163.5
[32m INFO[0m ============= New Corpus Item =============
[32m INFO[0m Reverted? false 
 Txn:
[Sender] 0x35################################31dDb
   [1] Router.swapExactETHForTokens{value: 3116.4275 ether}(0, path:(WETH  0x47################################9C805), address(this), block.timestamp);
   [1] Router.swapExactETHForTokens{value: 3800.1685 ether}(0, path:(WETH  0x47################################9C805), address(this), block.timestamp);
   [1] Router.swapExactETHForTokens{value: 10.0 ether}(0, path:(WETH  0x47################################9C805), address(this), block.timestamp);
   [1] Router.swapExactETHForTokens{value: 2361.1829 ether}(0, path:(WETH  0x47################################9C805), address(this), block.timestamp);
[Sender] 0x68################################c9024
   [1] 0x47################################9C805.approve(0x47################################9C805, 19255748555718617878219192915980088793830565912672926166447.3471 ether)
       0x01
[Sender] 0x35################################31dDb
   [1] Router.swapExactETHForTokens{value: 310.3847 ether}(0, path:(WETH  0x47################################9C805), address(this), block.timestamp);
   [1] Router.swapExactETHForTokens{value: 2812.2607 ether}(0, path:(WETH  0x47################################9C805), address(this), block.timestamp);
   [1] 0x47################################9C805.deliver(1025)

[32m INFO[0m ==========================================
[32m INFO[0m [Testcase #0] run time: 0h-0m-32s, clients: 1, corpus: 68, objectives: 0, executions: 4170, exec/sec: 260.0
[32m INFO[0m ============= Coverage Summary =============
[32m INFO[0m 0x47################################9c805: 45.25% Instruction Covered, 44.09% Branch Covered
[32m INFO[0m 0xbb################################c095c: 11.03% Instruction Covered, 13.16% Branch Covered
[32m INFO[0m [Stats #0] run time: 0h-0m-32s, clients: 1, corpus: 68, objectives: 0, executions: 4190, exec/sec: 261.1
[32m INFO[0m [Stats #0] run time: 0h-0m-33s, clients: 1, corpus: 68, objectives: 0, executions: 6141, exec/sec: 359.5
[32m INFO[0m [Stats #0] run time: 0h-0m-33s, clients: 1, corpus: 68, objectives: 0, executions: 6141, exec/sec: 358.3
[32m INFO[0m ============= New Corpus Item =============
[32m INFO[0m Reverted? false 
 Txn:
[Sender] 0x35################################31dDb
   [1] Router.swapExactETHForTokens{value: 3116.4275 ether}(0, path:(WETH  0x47################################9C805), address(this), block.timestamp);
   [1] Router.swapExactETHForTokens{value: 3800.1685 ether}(0, path:(WETH  0x47################################9C805), address(this), block.timestamp);
   [1] Router.swapExactETHForTokens{value: 10.0 ether}(0, path:(WETH  0x47################################9C805), address(this), block.timestamp);
   [1] Router.swapExactETHForTokens{value: 2361.1829 ether}(0, path:(WETH  0x47################################9C805), address(this), block.timestamp);
[Sender] 0x68################################c9024
   [1] 0x47################################9C805.approve(0x47################################9C805, 19255748555718617878219192915980088793830565912672926166447.3471 ether)
       0x01
[Sender] 0x35################################31dDb
   [1] Router.swapExactETHForTokens{value: 310.3847 ether}(0, path:(WETH  0x47################################9C805), address(this), block.timestamp);
   [1] Router.swapExactETHForTokens{value: 2812.2607 ether}(0, path:(WETH  0x47################################9C805), address(this), block.timestamp);
   [1] 0x47################################9C805.deliver(4)
   [1] 0x47################################9C805.decreaseAllowance(0x68################################c9024, 0)
       0x01

[32m INFO[0m ==========================================
[32m INFO[0m [Testcase #0] run time: 0h-0m-33s, clients: 1, corpus: 69, objectives: 0, executions: 6512, exec/sec: 379.9
[32m INFO[0m ============= Coverage Summary =============
[32m INFO[0m 0xbb################################c095c: 11.03% Instruction Covered, 13.16% Branch Covered
[32m INFO[0m 0x47################################9c805: 45.58% Instruction Covered, 44.09% Branch Covered
[32m INFO[0m [Stats #0] run time: 0h-0m-35s, clients: 1, corpus: 69, objectives: 0, executions: 6715, exec/sec: 359.4
[32m INFO[0m [Stats #0] run time: 0h-0m-36s, clients: 1, corpus: 69, objectives: 0, executions: 13077, exec/sec: 663.8
[32m INFO[0m [Stats #0] run time: 0h-0m-37s, clients: 1, corpus: 69, objectives: 0, executions: 22728, exec/sec: 1.098k
[32m INFO[0m [Stats #0] run time: 0h-0m-38s, clients: 1, corpus: 69, objectives: 0, executions: 33017, exec/sec: 1.521k
[32m INFO[0m [Stats #0] run time: 0h-0m-39s, clients: 1, corpus: 69, objectives: 0, executions: 42735, exec/sec: 1.882k
[32m INFO[0m [Stats #0] run time: 0h-0m-40s, clients: 1, corpus: 69, objectives: 0, executions: 53157, exec/sec: 2.242k
[32m INFO[0m [Stats #0] run time: 0h-0m-41s, clients: 1, corpus: 69, objectives: 0, executions: 63382, exec/sec: 2.565k
[32m INFO[0m [Stats #0] run time: 0h-0m-42s, clients: 1, corpus: 69, objectives: 0, executions: 73253, exec/sec: 2.847k
[32m INFO[0m [Stats #0] run time: 0h-0m-43s, clients: 1, corpus: 69, objectives: 0, executions: 83286, exec/sec: 3.116k
[32m INFO[0m [Stats #0] run time: 0h-0m-44s, clients: 1, corpus: 69, objectives: 0, executions: 92650, exec/sec: 3.341k
[32m INFO[0m [Stats #0] run time: 0h-0m-45s, clients: 1, corpus: 69, objectives: 0, executions: 102108, exec/sec: 3.554k
[32m INFO[0m [Stats #0] run time: 0h-0m-46s, clients: 1, corpus: 69, objectives: 0, executions: 112307, exec/sec: 3.776k
[32m INFO[0m [Stats #0] run time: 0h-0m-47s, clients: 1, corpus: 69, objectives: 0, executions: 121958, exec/sec: 3.967k
[32m INFO[0m [Stats #0] run time: 0h-0m-48s, clients: 1, corpus: 69, objectives: 0, executions: 131418, exec/sec: 4.140k
[32m INFO[0m [Stats #0] run time: 0h-0m-49s, clients: 1, corpus: 69, objectives: 0, executions: 141142, exec/sec: 4.310k
[32m INFO[0m [Stats #0] run time: 0h-0m-50s, clients: 1, corpus: 69, objectives: 0, executions: 150475, exec/sec: 4.458k
[32m INFO[0m [Stats #0] run time: 0h-0m-51s, clients: 1, corpus: 69, objectives: 0, executions: 160739, exec/sec: 4.625k
[32m INFO[0m [Stats #0] run time: 0h-0m-52s, clients: 1, corpus: 69, objectives: 0, executions: 170265, exec/sec: 4.761k
[32m INFO[0m [Stats #0] run time: 0h-0m-53s, clients: 1, corpus: 69, objectives: 0, executions: 179309, exec/sec: 4.877k
[32m INFO[0m [Stats #0] run time: 0h-0m-54s, clients: 1, corpus: 69, objectives: 0, executions: 189507, exec/sec: 5.016k
[32m INFO[0m [Stats #0] run time: 0h-0m-55s, clients: 1, corpus: 69, objectives: 0, executions: 199281, exec/sec: 5.138k
[32m INFO[0m [Stats #0] run time: 0h-0m-56s, clients: 1, corpus: 69, objectives: 0, executions: 209251, exec/sec: 5.259k
[32m INFO[0m [Stats #0] run time: 0h-0m-57s, clients: 1, corpus: 69, objectives: 0, executions: 218901, exec/sec: 5.366k
[32m INFO[0m [Stats #0] run time: 0h-0m-58s, clients: 1, corpus: 69, objectives: 0, executions: 229191, exec/sec: 5.482k
[32m INFO[0m [Stats #0] run time: 0h-0m-59s, clients: 1, corpus: 69, objectives: 0, executions: 238939, exec/sec: 5.582k
[32m INFO[0m [Stats #0] run time: 0h-1m-0s, clients: 1, corpus: 69, objectives: 0, executions: 248818, exec/sec: 5.680k
[32m INFO[0m [Stats #0] run time: 0h-1m-1s, clients: 1, corpus: 69, objectives: 0, executions: 258499, exec/sec: 5.768k
[32m INFO[0m [Stats #0] run time: 0h-1m-2s, clients: 1, corpus: 69, objectives: 0, executions: 268529, exec/sec: 5.861k
[32m INFO[0m [Stats #0] run time: 0h-1m-3s, clients: 1, corpus: 69, objectives: 0, executions: 277709, exec/sec: 5.931k
[32m INFO[0m [Stats #0] run time: 0h-1m-4s, clients: 1, corpus: 69, objectives: 0, executions: 287391, exec/sec: 6.009k
[32m INFO[0m [Stats #0] run time: 0h-1m-5s, clients: 1, corpus: 69, objectives: 0, executions: 297911, exec/sec: 6.101k
[32m INFO[0m [Stats #0] run time: 0h-1m-6s, clients: 1, corpus: 69, objectives: 0, executions: 307023, exec/sec: 6.161k
[32m INFO[0m [Stats #0] run time: 0h-1m-7s, clients: 1, corpus: 69, objectives: 0, executions: 317282, exec/sec: 6.241k
[32m INFO[0m [Stats #0] run time: 0h-1m-8s, clients: 1, corpus: 69, objectives: 0, executions: 326871, exec/sec: 6.304k
[32m INFO[0m [Stats #0] run time: 0h-1m-9s, clients: 1, corpus: 69, objectives: 0, executions: 337001, exec/sec: 6.377k
[32m INFO[0m [Stats #0] run time: 0h-1m-10s, clients: 1, corpus: 69, objectives: 0, executions: 346749, exec/sec: 6.438k
[32m INFO[0m [Stats #0] run time: 0h-1m-11s, clients: 1, corpus: 69, objectives: 0, executions: 357040, exec/sec: 6.507k
[32m INFO[0m [Stats #0] run time: 0h-1m-12s, clients: 1, corpus: 69, objectives: 0, executions: 366246, exec/sec: 6.556k
[32m INFO[0m [Stats #0] run time: 0h-1m-13s, clients: 1, corpus: 69, objectives: 0, executions: 375581, exec/sec: 6.604k
[32m INFO[0m [Stats #0] run time: 0h-1m-14s, clients: 1, corpus: 69, objectives: 0, executions: 385810, exec/sec: 6.667k
[32m INFO[0m [Stats #0] run time: 0h-1m-15s, clients: 1, corpus: 69, objectives: 0, executions: 395429, exec/sec: 6.716k
[32m INFO[0m [Stats #0] run time: 0h-1m-16s, clients: 1, corpus: 69, objectives: 0, executions: 405470, exec/sec: 6.771k
[32m INFO[0m [Stats #0] run time: 0h-1m-17s, clients: 1, corpus: 69, objectives: 0, executions: 415122, exec/sec: 6.817k
[32m INFO[0m [Stats #0] run time: 0h-1m-18s, clients: 1, corpus: 69, objectives: 0, executions: 425444, exec/sec: 6.873k
[32m INFO[0m [Stats #0] run time: 0h-1m-19s, clients: 1, corpus: 69, objectives: 0, executions: 434295, exec/sec: 6.904k
[32m INFO[0m [Stats #0] run time: 0h-1m-20s, clients: 1, corpus: 69, objectives: 0, executions: 444111, exec/sec: 6.950k
[32m INFO[0m [Stats #0] run time: 0h-1m-21s, clients: 1, corpus: 69, objectives: 0, executions: 454183, exec/sec: 6.997k
[32m INFO[0m [Stats #0] run time: 0h-1m-22s, clients: 1, corpus: 69, objectives: 0, executions: 463936, exec/sec: 7.039k
[32m INFO[0m [Stats #0] run time: 0h-1m-23s, clients: 1, corpus: 69, objectives: 0, executions: 473873, exec/sec: 7.082k
[32m INFO[0m [Stats #0] run time: 0h-1m-24s, clients: 1, corpus: 69, objectives: 0, executions: 483462, exec/sec: 7.118k
[32m INFO[0m [Stats #0] run time: 0h-1m-25s, clients: 1, corpus: 69, objectives: 0, executions: 493243, exec/sec: 7.157k
[32m INFO[0m [Stats #0] run time: 0h-1m-26s, clients: 1, corpus: 69, objectives: 0, executions: 503313, exec/sec: 7.197k
[32m INFO[0m [Stats #0] run time: 0h-1m-27s, clients: 1, corpus: 69, objectives: 0, executions: 513344, exec/sec: 7.237k
[32m INFO[0m [Stats #0] run time: 0h-1m-28s, clients: 1, corpus: 69, objectives: 0, executions: 523158, exec/sec: 7.272k
[32m INFO[0m [Stats #0] run time: 0h-1m-29s, clients: 1, corpus: 69, objectives: 0, executions: 532873, exec/sec: 7.305k
[32m INFO[0m [Stats #0] run time: 0h-1m-30s, clients: 1, corpus: 69, objectives: 0, executions: 542367, exec/sec: 7.334k
[32m INFO[0m [Stats #0] run time: 0h-1m-31s, clients: 1, corpus: 69, objectives: 0, executions: 551824, exec/sec: 7.360k
[32m INFO[0m [Stats #0] run time: 0h-1m-32s, clients: 1, corpus: 69, objectives: 0, executions: 561699, exec/sec: 7.393k
[32m INFO[0m [Stats #0] run time: 0h-1m-33s, clients: 1, corpus: 69, objectives: 0, executions: 571675, exec/sec: 7.426k
[32m INFO[0m [Stats #0] run time: 0h-1m-34s, clients: 1, corpus: 69, objectives: 0, executions: 581461, exec/sec: 7.456k
[32m INFO[0m [Stats #0] run time: 0h-1m-35s, clients: 1, corpus: 69, objectives: 0, executions: 590797, exec/sec: 7.479k
[32m INFO[0m [Stats #0] run time: 0h-1m-36s, clients: 1, corpus: 69, objectives: 0, executions: 600416, exec/sec: 7.505k
[32m INFO[0m [Stats #0] run time: 0h-1m-37s, clients: 1, corpus: 69, objectives: 0, executions: 600416, exec/sec: 7.470k
[32m INFO[0m ============= New Corpus Item =============
[32m INFO[0m Reverted? false 
 Txn:
[Sender] 0x35################################31dDb
   [1] Router.swapExactETHForTokens{value: 4722.3664 ether}(0, path:(WETH  0x47################################9C805), address(this), block.timestamp);
   [1] Router.swapExactETHForTokens{value: 77.5117 ether}(0, path:(WETH  0x47################################9C805), address(this), block.timestamp);
   [1] 0x47################################9C805.deliver(1025)
   [1] Router.swapExactETHForTokens{value: 10.0 ether}(0, path:(WETH  0x47################################9C805), address(this), block.timestamp);
   [1] Router.swapExactETHForTokens{value: 2386}(0, path:(WETH  0x47################################9C805), address(this), block.timestamp);
   [1] Router.swapExactETHForTokens{value: 8.4947 ether}(0, path:(WETH  0x47################################9C805), address(this), block.timestamp);
   [1] 0x47################################9C805.transfer(0x35################################31dDb, 89790086)
       0x01

[32m INFO[0m ==========================================
[32m INFO[0m [Testcase #0] run time: 0h-1m-37s, clients: 1, corpus: 70, objectives: 0, executions: 604589, exec/sec: 7.521k
[32m INFO[0m ============= Coverage Summary =============
[32m INFO[0m 0xbb################################c095c: 11.03% Instruction Covered, 13.16% Branch Covered
[32m INFO[0m 0x47################################9c805: 45.58% Instruction Covered, 44.09% Branch Covered
[32m INFO[0m [Stats #0] run time: 0h-1m-37s, clients: 1, corpus: 70, objectives: 0, executions: 604589, exec/sec: 7.505k
[32m INFO[0m ============= New Corpus Item =============
[32m INFO[0m Reverted? false 
 Txn:
[Sender] 0x35################################31dDb
   [1] Router.swapExactETHForTokens{value: 4722.3664 ether}(0, path:(WETH  0x47################################9C805), address(this), block.timestamp);
   [1] Router.swapExactETHForTokens{value: 77.5117 ether}(0, path:(WETH  0x47################################9C805), address(this), block.timestamp);
   [1] 0x47################################9C805.deliver(1025)
   [1] Router.swapExactETHForTokens{value: 10.0 ether}(0, path:(WETH  0x47################################9C805), address(this), block.timestamp);
   [1] Router.swapExactETHForTokens{value: 2386}(0, path:(WETH  0x47################################9C805), address(this), block.timestamp);
   [1] Router.swapExactETHForTokens{value: 8.4947 ether}(0, path:(WETH  0x47################################9C805), address(this), block.timestamp);
   [1] 0x47################################9C805.transfer(0x8E################################d79dd, 0.1441 ether)
       0x01

[32m INFO[0m ==========================================
[32m INFO[0m [Testcase #0] run time: 0h-1m-37s, clients: 1, corpus: 71, objectives: 0, executions: 606304, exec/sec: 7.526k
[32m INFO[0m ============= Coverage Summary =============
[32m INFO[0m 0x47################################9c805: 45.58% Instruction Covered, 44.09% Branch Covered
[32m INFO[0m 0xbb################################c095c: 11.03% Instruction Covered, 13.16% Branch Covered
[32m INFO[0m [Stats #0] run time: 0h-1m-37s, clients: 1, corpus: 71, objectives: 0, executions: 609845, exec/sec: 7.529k
Timeout