[32m INFO[0m fetching abi from https://api.bscscan.com/api?module=contract&action=getabi&address=0x72################################2e04d&format=json&apikey=6ZUCAR738XJSX6WK3BGN2K8DX4RI9A875M
[32m INFO[0m fetching code from 729222198ae7d2034616e5af2405eecdfed2e04d
Contract loaded: 0x72################################2e04d
[32m INFO[0m 

 ================ EVM Fuzzer Start ===================


[32m INFO[0m Deploying contract: 0x72################################2e04d
[32m INFO[0m Contract 0x72################################2e04d deployed to: 0x72################################2e04d -> balacne is 0
[32m INFO[0m Deployed all contracts

[32m INFO[0m fetching pairs for 0x72################################2e04d
[32m INFO[0m fetching pairs for 0x72################################2e04d
[32m INFO[0m fetching code from de8cd206cc615d5f0e5dc315bc3b3a5235b08624
[32m INFO[0m fetching code from bb4cdb9cbd36b01bd1cbaebf2de08d9173bc095c
[32m INFO[0m [Stats #0] run time: 0h-0m-6s, clients: 1, corpus: 0, objectives: 0, executions: 0, exec/sec: 0.000
[32m INFO[0m ============= New Corpus Item =============
[32m INFO[0m Reverted? false 
 Txn:
[Sender] 0x8E################################d79dd
   [1] Router.swapExactETHForTokens{value: 4722.3663 ether}(0, path:(WETH  0x72################################2E04D), address(this), block.timestamp);

[32m INFO[0m ==========================================
[32m INFO[0m [Testcase #0] run time: 0h-0m-6s, clients: 1, corpus: 17, objectives: 0, executions: 1, exec/sec: 0.000
[32m INFO[0m [Stats #0] run time: 0h-0m-6s, clients: 1, corpus: 17, objectives: 0, executions: 1, exec/sec: 0.000
[32m INFO[0m ============= New Corpus Item =============
[32m INFO[0m Reverted? true 
 Txn:
[Sender] 0x8E################################d79dd
   [1] Router.swapExactETHForTokens{value: 4722.3663 ether}(0, path:(WETH  0x72################################2E04D), address(this), block.timestamp);
   [1] Router.swapExactETHForTokens{value: 5181}(0, path:(WETH  0x72################################2E04D), address(this), block.timestamp);
   [1] Router.swapExactETHForTokens{value: 10.0 ether}(0, path:(WETH  0x72################################2E04D), address(this), block.timestamp);
   [1] Router.swapExactETHForTokens{value: 0}(0, path:(WETH  0x72################################2E04D), address(this), block.timestamp);

[32m INFO[0m ==========================================
[32m INFO[0m [Testcase #0] run time: 0h-0m-6s, clients: 1, corpus: 18, objectives: 0, executions: 18, exec/sec: 0.000
[32m INFO[0m ============= Coverage Summary =============
[32m INFO[0m 0x72################################2e04d: 41.33% Instruction Covered, 32.21% Branch Covered
[32m INFO[0m 0xbb################################c095c: 11.03% Instruction Covered, 13.16% Branch Covered
[32m INFO[0m [Stats #0] run time: 0h-0m-6s, clients: 1, corpus: 18, objectives: 0, executions: 18, exec/sec: 0.000
[32m INFO[0m ============= New Corpus Item =============
[32m INFO[0m Reverted? true 
 Txn:
[Sender] 0x8E################################d79dd
   [1] Router.swapExactETHForTokens{value: 4722.3663 ether}(0, path:(WETH  0x72################################2E04D), address(this), block.timestamp);
   [1] Router.swapExactETHForTokens{value: 5181}(0, path:(WETH  0x72################################2E04D), address(this), block.timestamp);
   [1] Router.swapExactETHForTokens{value: 10.0 ether}(0, path:(WETH  0x72################################2E04D), address(this), block.timestamp);
   [1] Router.swapExactETHForTokens{value: 1320.4629 ether}(0, path:(WETH  0x72################################2E04D), address(this), block.timestamp);
   [1] Router.swapExactETHForTokens{value: 1078.6960 ether}(0, path:(WETH  0x72################################2E04D), address(this), block.timestamp);
[Sender] 0x68################################c9024
   [1] 0x72################################2E04D.approve(0x00################################00000, 0)
       0x08################################0000000000000000000000000000000000020000000000000000000000000000000000000000000000000000000000000002242455032303a20617070726f766520746f20746865207a65726f2061646472657373000000000000000000000000000000000000000000000000000000000000

[32m INFO[0m ==========================================
[32m INFO[0m [Testcase #0] run time: 0h-0m-6s, clients: 1, corpus: 19, objectives: 0, executions: 33, exec/sec: 0.000
[32m INFO[0m [Stats #0] run time: 0h-0m-6s, clients: 1, corpus: 19, objectives: 0, executions: 33, exec/sec: 0.000
[32m INFO[0m ============= New Corpus Item =============
[32m INFO[0m Reverted? true 
 Txn:
[Sender] 0x8E################################d79dd
   [1] Router.swapExactETHForTokens{value: 4722.3663 ether}(0, path:(WETH  0x72################################2E04D), address(this), block.timestamp);
   [1] Router.swapExactETHForTokens{value: 4708.5314 ether}(0, path:(WETH  0x72################################2E04D), address(this), block.timestamp);
[Sender] 0x68################################c9024
   [1] 0x72################################2E04D.approve{value: 1927.6132 ether}(0x00################################00000, 0)

[32m INFO[0m ==========================================
[32m INFO[0m [Testcase #0] run time: 0h-0m-6s, clients: 1, corpus: 20, objectives: 0, executions: 35, exec/sec: 0.000
[32m INFO[0m [Stats #0] run time: 0h-0m-6s, clients: 1, corpus: 20, objectives: 0, executions: 35, exec/sec: 0.000
[32m INFO[0m ============= New Corpus Item =============
[32m INFO[0m Reverted? false 
 Txn:
[Sender] 0x8E################################d79dd
   [1] Router.swapExactETHForTokens{value: 4722.3663 ether}(0, path:(WETH  0x72################################2E04D), address(this), block.timestamp);
   [1] Router.swapExactETHForTokens{value: 5181}(0, path:(WETH  0x72################################2E04D), address(this), block.timestamp);
   [1] Router.swapExactETHForTokens{value: 10.0 ether}(0, path:(WETH  0x72################################2E04D), address(this), block.timestamp);
   [1] Router.swapExactETHForTokens{value: 3353.8051 ether}(0, path:(WETH  0x72################################2E04D), address(this), block.timestamp);
[Sender] 0x68################################c9024
   [1] 0x72################################2E04D.approve(0x8E################################d79dd, 205847475981193123926567762596984962129381529774907846906.3923 ether)
       0x01

[32m INFO[0m ==========================================
[32m INFO[0m [Testcase #0] run time: 0h-0m-6s, clients: 1, corpus: 21, objectives: 0, executions: 38, exec/sec: 0.000
[32m INFO[0m [Stats #0] run time: 0h-0m-6s, clients: 1, corpus: 21, objectives: 0, executions: 38, exec/sec: 0.000
[32m INFO[0m ============= New Corpus Item =============
[32m INFO[0m Reverted? false 
 Txn:
[Sender] 0x8E################################d79dd
   [1] Router.swapExactETHForTokens{value: 4722.3663 ether}(0, path:(WETH  0x72################################2E04D), address(this), block.timestamp);
   [1] Router.swapExactETHForTokens{value: 229}(0, path:(WETH  0x72################################2E04D), address(this), block.timestamp);
   [1] Router.swapExactETHForTokens{value: 2073.2281 ether}(0, path:(WETH  0x72################################2E04D), address(this), block.timestamp);
   [1] Router.swapExactETHForTokens{value: 10.0 ether}(0, path:(WETH  0x72################################2E04D), address(this), block.timestamp);
[Sender] 0x68################################c9024
   [1] 0x72################################2E04D.approve(0x8E################################d79dd, 0)
       0x01

[32m INFO[0m ==========================================
[32m INFO[0m [Testcase #0] run time: 0h-0m-6s, clients: 1, corpus: 22, objectives: 0, executions: 43, exec/sec: 0.000
[32m INFO[0m ============= Coverage Summary =============
[32m INFO[0m 0x72################################2e04d: 42.51% Instruction Covered, 32.89% Branch Covered
[32m INFO[0m 0xbb################################c095c: 11.03% Instruction Covered, 13.16% Branch Covered
[32m INFO[0m [Stats #0] run time: 0h-0m-6s, clients: 1, corpus: 22, objectives: 0, executions: 43, exec/sec: 0.000
[32m INFO[0m ============= New Corpus Item =============
[32m INFO[0m Reverted? false 
 Txn:
[Sender] 0x8E################################d79dd
   [1] Router.swapExactETHForTokens{value: 4722.3663 ether}(0, path:(WETH  0x72################################2E04D), address(this), block.timestamp);
   [1] 0x72################################2E04D.decimals()
       0x12

[32m INFO[0m ==========================================
[32m INFO[0m [Testcase #0] run time: 0h-0m-6s, clients: 1, corpus: 23, objectives: 0, executions: 66, exec/sec: 0.000
[32m INFO[0m ============= Coverage Summary =============
[32m INFO[0m 0xbb################################c095c: 11.03% Instruction Covered, 13.16% Branch Covered
[32m INFO[0m 0x72################################2e04d: 42.51% Instruction Covered, 32.89% Branch Covered
[32m INFO[0m [Stats #0] run time: 0h-0m-6s, clients: 1, corpus: 23, objectives: 0, executions: 66, exec/sec: 0.000
[32m INFO[0m ============= New Corpus Item =============
[32m INFO[0m Reverted? true 
 Txn:
[Sender] 0x8E################################d79dd
   [1] Router.swapExactETHForTokens{value: 4722.3663 ether}(0, path:(WETH  0x72################################2E04D), address(this), block.timestamp);
   [1] Router.swapExactETHForTokens{value: 5181}(0, path:(WETH  0x72################################2E04D), address(this), block.timestamp);
   [1] Router.swapExactETHForTokens{value: 10.0 ether}(0, path:(WETH  0x72################################2E04D), address(this), block.timestamp);
   [1] Router.swapExactETHForTokens{value: 3353.8051 ether}(0, path:(WETH  0x72################################2E04D), address(this), block.timestamp);
[Sender] 0x68################################c9024
   [1] 0x72################################2E04D.approve(0x8E################################d79dd, 205847475981193123926567762596984962129381529774907846906.3923 ether)
       0x01
[Sender] 0x8E################################d79dd
   [1] 0x72################################2E04D.decreaseAllowance(0x00################################00000, 0)
       0x08################################0000000000000000000000000000000000020000000000000000000000000000000000000000000000000000000000000002242455032303a20617070726f766520746f20746865207a65726f2061646472657373000000000000000000000000000000000000000000000000000000000000

[32m INFO[0m ==========================================
[32m INFO[0m [Testcase #0] run time: 0h-0m-6s, clients: 1, corpus: 24, objectives: 0, executions: 97, exec/sec: 0.000
[32m INFO[0m [Stats #0] run time: 0h-0m-6s, clients: 1, corpus: 24, objectives: 0, executions: 97, exec/sec: 0.000
[32m INFO[0m ============= New Corpus Item =============
[32m INFO[0m Reverted? true 
 Txn:
[Sender] 0x8E################################d79dd
   [1] Router.swapExactETHForTokens{value: 4722.3663 ether}(0, path:(WETH  0x72################################2E04D), address(this), block.timestamp);
   [1] Router.swapExactETHForTokens{value: 5181}(0, path:(WETH  0x72################################2E04D), address(this), block.timestamp);
[Sender] 0x68################################c9024
   [1] 0x72################################2E04D.approve(0xe1################################c8510, 904970002602041650953030948660721267970431580159439198046.8467 ether)
       0x01
[Sender] 0x8E################################d79dd
   [1] 0x72################################2E04D.decreaseAllowance(0x35################################31dDb, 2453599837277716687053720709326222863614.5487 ether)
       0x08################################0000000000000000000000000000000000020000000000000000000000000000000000000000000000000000000000000002542455032303a2064656372656173656420616c6c6f77616e63652062656c6f77207a65726f000000000000000000000000000000000000000000000000000000

[32m INFO[0m ==========================================
[32m INFO[0m [Testcase #0] run time: 0h-0m-6s, clients: 1, corpus: 25, objectives: 0, executions: 98, exec/sec: 0.000
[32m INFO[0m ============= Coverage Summary =============
[32m INFO[0m 0xbb################################c095c: 11.03% Instruction Covered, 13.16% Branch Covered
[32m INFO[0m 0x72################################2e04d: 42.78% Instruction Covered, 33.22% Branch Covered
[32m INFO[0m [Stats #0] run time: 0h-0m-7s, clients: 1, corpus: 25, objectives: 0, executions: 98, exec/sec: 0.000
[32m INFO[0m ============= New Corpus Item =============
[32m INFO[0m Reverted? true 
 Txn:
[Sender] 0x68################################c9024
   [1] 0x72################################2E04D.excludeAccount(0x00################################00000)
       0x08################################000000000000000000000000000000000002000000000000000000000000000000000000000000000000000000000000000204f776e61626c653a2063616c6c6572206973206e6f7420746865206f776e6572

[32m INFO[0m ==========================================
[32m INFO[0m [Testcase #0] run time: 0h-0m-7s, clients: 1, corpus: 26, objectives: 0, executions: 129, exec/sec: 0.000
[32m INFO[0m ============= Coverage Summary =============
[32m INFO[0m 0x72################################2e04d: 42.78% Instruction Covered, 33.22% Branch Covered
[32m INFO[0m 0xbb################################c095c: 11.03% Instruction Covered, 13.16% Branch Covered
[32m INFO[0m [Stats #0] run time: 0h-0m-7s, clients: 1, corpus: 26, objectives: 0, executions: 129, exec/sec: 0.000
[32m INFO[0m ============= New Corpus Item =============
[32m INFO[0m Reverted? true 
 Txn:
[Sender] 0x8E################################d79dd
   [1] Router.swapExactETHForTokens{value: 4722.3663 ether}(0, path:(WETH  0x72################################2E04D), address(this), block.timestamp);
   [1] Router.swapExactETHForTokens{value: 5181}(0, path:(WETH  0x72################################2E04D), address(this), block.timestamp);
[Sender] 0x68################################c9024
   [1] 0x72################################2E04D.approve(0xe1################################c8510, 904970002602041650953030948660721267970431580159439198046.8467 ether)
       0x01
[Sender] 0xe1################################c8510
   [1] 0x72################################2E04D.includeAccount(0x00################################00000)
       0x08################################000000000000000000000000000000000002000000000000000000000000000000000000000000000000000000000000000204f776e61626c653a2063616c6c6572206973206e6f7420746865206f776e6572

[32m INFO[0m ==========================================
[32m INFO[0m [Testcase #0] run time: 0h-0m-7s, clients: 1, corpus: 27, objectives: 0, executions: 161, exec/sec: 0.000
[32m INFO[0m ============= Coverage Summary =============
[32m INFO[0m 0xbb################################c095c: 11.03% Instruction Covered, 13.16% Branch Covered
[32m INFO[0m 0x72################################2e04d: 42.78% Instruction Covered, 33.22% Branch Covered
[32m INFO[0m [Stats #0] run time: 0h-0m-7s, clients: 1, corpus: 27, objectives: 0, executions: 161, exec/sec: 0.000
[32m INFO[0m ============= New Corpus Item =============
[32m INFO[0m Reverted? false 
 Txn:
[Sender] 0x8E################################d79dd
   [1] Router.swapExactETHForTokens{value: 4722.3663 ether}(0, path:(WETH  0x72################################2E04D), address(this), block.timestamp);
[Sender] 0x35################################31dDb
   [1] 0x72################################2E04D.increaseAllowance(0xe1################################c8510, 0)
       0x01

[32m INFO[0m ==========================================
[32m INFO[0m [Testcase #0] run time: 0h-0m-7s, clients: 1, corpus: 28, objectives: 0, executions: 193, exec/sec: 0.000
[32m INFO[0m [Stats #0] run time: 0h-0m-7s, clients: 1, corpus: 28, objectives: 0, executions: 193, exec/sec: 0.000
[32m INFO[0m ============= New Corpus Item =============
[32m INFO[0m Reverted? false 
 Txn:
[Sender] 0x8E################################d79dd
   [1] Router.swapExactETHForTokens{value: 4722.3663 ether}(0, path:(WETH  0x72################################2E04D), address(this), block.timestamp);
   [1] Router.swapExactETHForTokens{value: 5181}(0, path:(WETH  0x72################################2E04D), address(this), block.timestamp);
   [1] Router.swapExactETHForTokens{value: 10.0 ether}(0, path:(WETH  0x72################################2E04D), address(this), block.timestamp);
   [1] Router.swapExactETHForTokens{value: 3353.8051 ether}(0, path:(WETH  0x72################################2E04D), address(this), block.timestamp);
[Sender] 0x68################################c9024
   [1] 0x72################################2E04D.approve(0x8E################################d79dd, 205847475981193123926567762596984962129381529774907846906.3923 ether)
       0x01
   [1] 0x72################################2E04D.approve(0x68################################c9024, 56635094607365226292001898207068654305419838814197025433.8186 ether)
       0x01
[Sender] 0x35################################31dDb
   [1] 0x72################################2E04D.increaseAllowance(0x35################################31dDb, 441711766194599220946692091362074630146940674984688301.9000 ether)
       0x01

[32m INFO[0m ==========================================
[32m INFO[0m [Testcase #0] run time: 0h-0m-7s, clients: 1, corpus: 29, objectives: 0, executions: 203, exec/sec: 202.7
[32m INFO[0m ============= Coverage Summary =============
[32m INFO[0m 0x72################################2e04d: 42.78% Instruction Covered, 33.22% Branch Covered
[32m INFO[0m 0xbb################################c095c: 11.03% Instruction Covered, 13.16% Branch Covered
[32m INFO[0m [Stats #0] run time: 0h-0m-7s, clients: 1, corpus: 29, objectives: 0, executions: 203, exec/sec: 175.4
[32m INFO[0m ============= New Corpus Item =============
[32m INFO[0m Reverted? false 
 Txn:
[Sender] 0x8E################################d79dd
   [1] Router.swapExactETHForTokens{value: 4722.3663 ether}(0, path:(WETH  0x72################################2E04D), address(this), block.timestamp);
   [1] Router.swapExactETHForTokens{value: 4708.5314 ether}(0, path:(WETH  0x72################################2E04D), address(this), block.timestamp);
   [1] 0x72################################2E04D.name()
       0x00################################00000000000000000000000000020000000000000000000000000000000000000000000000000000000000000000a5368696261205275736800000000000000000000000000000000000000000000

[32m INFO[0m ==========================================
[32m INFO[0m [Testcase #0] run time: 0h-0m-7s, clients: 1, corpus: 30, objectives: 0, executions: 226, exec/sec: 195.0
[32m INFO[0m ============= Coverage Summary =============
[32m INFO[0m 0x72################################2e04d: 42.78% Instruction Covered, 33.22% Branch Covered
[32m INFO[0m 0xbb################################c095c: 11.03% Instruction Covered, 13.16% Branch Covered
[32m INFO[0m [Stats #0] run time: 0h-0m-7s, clients: 1, corpus: 30, objectives: 0, executions: 226, exec/sec: 192.9
[32m INFO[0m ============= New Corpus Item =============
[32m INFO[0m Reverted? false 
 Txn:
[Sender] 0x8E################################d79dd
   [1] Router.swapExactETHForTokens{value: 4722.3663 ether}(0, path:(WETH  0x72################################2E04D), address(this), block.timestamp);
   [1] Router.swapExactETHForTokens{value: 5181}(0, path:(WETH  0x72################################2E04D), address(this), block.timestamp);
   [1] Router.swapExactETHForTokens{value: 7}(0, path:(WETH  0x72################################2E04D), address(this), block.timestamp);
[Sender] 0xe1################################c8510
   [1] 0x72################################2E04D.payTax(0)

[32m INFO[0m ==========================================
[32m INFO[0m [Testcase #0] run time: 0h-0m-7s, clients: 1, corpus: 31, objectives: 0, executions: 257, exec/sec: 219.3
[32m INFO[0m [Stats #0] run time: 0h-0m-7s, clients: 1, corpus: 31, objectives: 0, executions: 257, exec/sec: 219.3
[32m INFO[0m ============= New Corpus Item =============
[32m INFO[0m Reverted? true 
 Txn:
[Sender] 0x8E################################d79dd
   [1] Router.swapExactETHForTokens{value: 4722.3663 ether}(0, path:(WETH  0x72################################2E04D), address(this), block.timestamp);
[Sender] 0xe1################################c8510
   [1] 0x72################################2E04D.payTax(31090492834658537681439256902534212963234455026015.9112 ether)
       0x4e################################0000000000000000000000000000000000011

[32m INFO[0m ==========================================
[32m INFO[0m [Testcase #0] run time: 0h-0m-7s, clients: 1, corpus: 32, objectives: 0, executions: 259, exec/sec: 220.9
[32m INFO[0m [Stats #0] run time: 0h-0m-7s, clients: 1, corpus: 32, objectives: 0, executions: 259, exec/sec: 220.2
[32m INFO[0m ============= New Corpus Item =============
[32m INFO[0m Reverted? true 
 Txn:
[Sender] 0x8E################################d79dd
   [1] Router.swapExactETHForTokens{value: 4722.3663 ether}(0, path:(WETH  0x72################################2E04D), address(this), block.timestamp);
[Sender] 0x68################################c9024
   [1] 0x72################################2E04D.approve(0xe1################################c8510, 1766847169714889175606368719223291790725517606551905573.7127 ether)
       0x01
[Sender] 0xe1################################c8510
   [1] 0x72################################2E04D.payTax(40564833444205.2667 ether)
       0x4e################################0000000000000000000000000000000000011

[32m INFO[0m ==========================================
[32m INFO[0m [Testcase #0] run time: 0h-0m-7s, clients: 1, corpus: 33, objectives: 0, executions: 273, exec/sec: 232.0
[32m INFO[0m ============= Coverage Summary =============
[32m INFO[0m 0x72################################2e04d: 43.10% Instruction Covered, 33.89% Branch Covered
[32m INFO[0m 0xbb################################c095c: 11.03% Instruction Covered, 13.16% Branch Covered
[32m INFO[0m [Stats #0] run time: 0h-0m-7s, clients: 1, corpus: 33, objectives: 0, executions: 288, exec/sec: 242.9
[32m INFO[0m [Stats #0] run time: 0h-0m-7s, clients: 1, corpus: 33, objectives: 0, executions: 288, exec/sec: 242.9
[32m INFO[0m ============= New Corpus Item =============
[32m INFO[0m Reverted? true 
 Txn:
[Sender] 0x8E################################d79dd
   [1] Router.swapExactETHForTokens{value: 4722.3663 ether}(0, path:(WETH  0x72################################2E04D), address(this), block.timestamp);
   [1] Router.swapExactETHForTokens{value: 229}(0, path:(WETH  0x72################################2E04D), address(this), block.timestamp);
   [1] Router.swapExactETHForTokens{value: 6463}(0, path:(WETH  0x72################################2E04D), address(this), block.timestamp);
   [1] Router.swapExactETHForTokens{value: 140737488355328}(0, path:(WETH  0x72################################2E04D), address(this), block.timestamp);
[Sender] 0x35################################31dDb
   [1] 0x72################################2E04D.renounceOwnership()
       0x08################################000000000000000000000000000000000002000000000000000000000000000000000000000000000000000000000000000204f776e61626c653a2063616c6c6572206973206e6f7420746865206f776e6572

[32m INFO[0m ==========================================
[32m INFO[0m [Testcase #0] run time: 0h-0m-7s, clients: 1, corpus: 34, objectives: 0, executions: 289, exec/sec: 243.6
[32m INFO[0m ============= Coverage Summary =============
[32m INFO[0m 0x72################################2e04d: 43.10% Instruction Covered, 33.89% Branch Covered
[32m INFO[0m 0xbb################################c095c: 11.03% Instruction Covered, 13.16% Branch Covered
[32m INFO[0m [Stats #0] run time: 0h-0m-7s, clients: 1, corpus: 34, objectives: 0, executions: 289, exec/sec: 242.5
[32m INFO[0m ============= New Corpus Item =============
[32m INFO[0m Reverted? true 
 Txn:
[Sender] 0x8E################################d79dd
   [1] Router.swapExactETHForTokens{value: 4722.3663 ether}(0, path:(WETH  0x72################################2E04D), address(this), block.timestamp);
   [1] Router.swapExactETHForTokens{value: 5181}(0, path:(WETH  0x72################################2E04D), address(this), block.timestamp);
   [1] Router.swapExactETHForTokens{value: 10.0 ether}(0, path:(WETH  0x72################################2E04D), address(this), block.timestamp);
   [1] Router.swapExactETHForTokens{value: 3353.8051 ether}(0, path:(WETH  0x72################################2E04D), address(this), block.timestamp);
[Sender] 0x68################################c9024
   [1] 0x72################################2E04D.approve(0x8E################################d79dd, 205847475981193123926567762596984962129381529774907846906.3923 ether)
       0x01
   [1] 0x72################################2E04D.approve(0x68################################c9024, 56635094607365226292001898207068654305419838814197025433.8186 ether)
       0x01
[Sender] 0x8E################################d79dd
   [1] 0x72################################2E04D.setBurnFee(81260610736868759241399805643991756172285242635971420708.6240 ether)
       0x08################################000000000000000000000000000000000002000000000000000000000000000000000000000000000000000000000000000204f776e61626c653a2063616c6c6572206973206e6f7420746865206f776e6572

[32m INFO[0m ==========================================
[32m INFO[0m [Testcase #0] run time: 0h-0m-7s, clients: 1, corpus: 35, objectives: 0, executions: 322, exec/sec: 270.0
[32m INFO[0m ============= Coverage Summary =============
[32m INFO[0m 0xbb################################c095c: 11.03% Instruction Covered, 13.16% Branch Covered
[32m INFO[0m 0x72################################2e04d: 43.10% Instruction Covered, 33.89% Branch Covered
[32m INFO[0m [Stats #0] run time: 0h-0m-7s, clients: 1, corpus: 35, objectives: 0, executions: 322, exec/sec: 269.0
[32m INFO[0m ============= New Corpus Item =============
[32m INFO[0m Reverted? true 
 Txn:
[Sender] 0x8E################################d79dd
   [1] Router.swapExactETHForTokens{value: 4722.3663 ether}(0, path:(WETH  0x72################################2E04D), address(this), block.timestamp);
   [1] Router.swapExactETHForTokens{value: 5181}(0, path:(WETH  0x72################################2E04D), address(this), block.timestamp);
   [1] Router.swapExactETHForTokens{value: 10.0 ether}(0, path:(WETH  0x72################################2E04D), address(this), block.timestamp);
   [1] Router.swapExactETHForTokens{value: 4698}(0, path:(WETH  0x72################################2E04D), address(this), block.timestamp);
[Sender] 0xe1################################c8510
   [1] 0x72################################2E04D.setTaxFee(224389577226854809857078782594350651680231638363672839413.1312 ether)
       0x08################################000000000000000000000000000000000002000000000000000000000000000000000000000000000000000000000000000204f776e61626c653a2063616c6c6572206973206e6f7420746865206f776e6572

[32m INFO[0m ==========================================
[32m INFO[0m [Testcase #0] run time: 0h-0m-7s, clients: 1, corpus: 36, objectives: 0, executions: 353, exec/sec: 294.7
[32m INFO[0m ============= Coverage Summary =============
[32m INFO[0m 0xbb################################c095c: 11.03% Instruction Covered, 13.16% Branch Covered
[32m INFO[0m 0x72################################2e04d: 43.10% Instruction Covered, 33.89% Branch Covered
[32m INFO[0m [Stats #0] run time: 0h-0m-7s, clients: 1, corpus: 36, objectives: 0, executions: 353, exec/sec: 293.6
[32m INFO[0m ============= New Corpus Item =============
[32m INFO[0m Reverted? false 
 Txn:
[Sender] 0x8E################################d79dd
   [1] Router.swapExactETHForTokens{value: 4722.3663 ether}(0, path:(WETH  0x72################################2E04D), address(this), block.timestamp);
   [1] Router.swapExactETHForTokens{value: 229}(0, path:(WETH  0x72################################2E04D), address(this), block.timestamp);
   [1] Router.swapExactETHForTokens{value: 10.0 ether}(0, path:(WETH  0x72################################2E04D), address(this), block.timestamp);
   [1] Router.swapExactETHForTokens{value: 1053691}(0, path:(WETH  0x72################################2E04D), address(this), block.timestamp);
[Sender] 0x68################################c9024
   [1] 0x72################################2E04D.symbol()
       0x00################################0000000000000000000000000002000000000000000000000000000000000000000000000000000000000000000075348494241476f00000000000000000000000000000000000000000000000000

[32m INFO[0m ==========================================
[32m INFO[0m [Testcase #0] run time: 0h-0m-7s, clients: 1, corpus: 37, objectives: 0, executions: 385, exec/sec: 320.1
[32m INFO[0m [Stats #0] run time: 0h-0m-7s, clients: 1, corpus: 37, objectives: 0, executions: 385, exec/sec: 319.9
[32m INFO[0m ============= New Corpus Item =============
[32m INFO[0m Reverted? false 
 Txn:
[Sender] 0x8E################################d79dd
   [1] Router.swapExactETHForTokens{value: 4722.3663 ether}(0, path:(WETH  0x72################################2E04D), address(this), block.timestamp);
   [1] Router.swapExactETHForTokens{value: 6412}(0, path:(WETH  0x72################################2E04D), address(this), block.timestamp);
[Sender] 0x68################################c9024
   [1] 0x72################################2E04D.symbol()
       0x00################################0000000000000000000000000002000000000000000000000000000000000000000000000000000000000000000075348494241476f00000000000000000000000000000000000000000000000000

[32m INFO[0m ==========================================
[32m INFO[0m [Testcase #0] run time: 0h-0m-7s, clients: 1, corpus: 38, objectives: 0, executions: 386, exec/sec: 320.6
[32m INFO[0m ============= Coverage Summary =============
[32m INFO[0m 0x72################################2e04d: 43.10% Instruction Covered, 33.89% Branch Covered
[32m INFO[0m 0xbb################################c095c: 11.03% Instruction Covered, 13.16% Branch Covered
[32m INFO[0m [Stats #0] run time: 0h-0m-7s, clients: 1, corpus: 38, objectives: 0, executions: 386, exec/sec: 316.6
[32m INFO[0m ============= New Corpus Item =============
[32m INFO[0m Reverted? true 
 Txn:
[Sender] 0x8E################################d79dd
   [1] Router.swapExactETHForTokens{value: 4722.3663 ether}(0, path:(WETH  0x72################################2E04D), address(this), block.timestamp);
   [1] Router.swapExactETHForTokens{value: 4708.5314 ether}(0, path:(WETH  0x72################################2E04D), address(this), block.timestamp);
[Sender] 0xe1################################c8510
   [1] 0x72################################2E04D.transfer(0x00################################00000, 0)
       0x08################################0000000000000000000000000000000000020000000000000000000000000000000000000000000000000000000000000002342455032303a207472616e7366657220746f20746865207a65726f20616464726573730000000000000000000000000000000000000000000000000000000000

[32m INFO[0m ==========================================
[32m INFO[0m [Testcase #0] run time: 0h-0m-7s, clients: 1, corpus: 39, objectives: 0, executions: 419, exec/sec: 343.5
[32m INFO[0m [Stats #0] run time: 0h-0m-7s, clients: 1, corpus: 39, objectives: 0, executions: 419, exec/sec: 343.4
[32m INFO[0m ============= New Corpus Item =============
[32m INFO[0m Reverted? true 
 Txn:
[Sender] 0x8E################################d79dd
   [1] Router.swapExactETHForTokens{value: 4722.3663 ether}(0, path:(WETH  0x72################################2E04D), address(this), block.timestamp);
   [1] 0x72################################2E04D.approve(0x72################################2E04D, 12557514732782935664326385880340468521238319818438338494741.8575 ether)
       0x01
[Sender] 0xe1################################c8510
   [1] 0x72################################2E04D.transfer(0x35################################31dDb, 274897406335889092102448825412914446063100086387157708373.8134 ether)
       0x08################################000000000000000000000000000000000002000000000000000000000000000000000000000000000000000000000000000285472616e7366657220616d6f756e74206578636565647320746865206d61785478416d6f756e742e000000000000000000000000000000000000000000000000

[32m INFO[0m ==========================================
[32m INFO[0m [Testcase #0] run time: 0h-0m-7s, clients: 1, corpus: 40, objectives: 0, executions: 420, exec/sec: 344.1
[32m INFO[0m ============= Coverage Summary =============
[32m INFO[0m 0xbb################################c095c: 11.03% Instruction Covered, 13.16% Branch Covered
[32m INFO[0m 0x72################################2e04d: 43.84% Instruction Covered, 34.23% Branch Covered
[32m INFO[0m [Stats #0] run time: 0h-0m-7s, clients: 1, corpus: 40, objectives: 0, executions: 420, exec/sec: 342.4
[32m INFO[0m ============= New Corpus Item =============
[32m INFO[0m Reverted? true 
 Txn:
[Sender] 0x8E################################d79dd
   [1] Router.swapExactETHForTokens{value: 4722.3663 ether}(0, path:(WETH  0x72################################2E04D), address(this), block.timestamp);
   [1] Router.swapExactETHForTokens{value: 229}(0, path:(WETH  0x72################################2E04D), address(this), block.timestamp);
   [1] 0x72################################2E04D.transferFrom(0x00################################00000, 0x00################################00000, 0)
       0x08################################0000000000000000000000000000000000020000000000000000000000000000000000000000000000000000000000000002542455032303a207472616e736665722066726f6d20746865207a65726f2061646472657373000000000000000000000000000000000000000000000000000000

[32m INFO[0m ==========================================
[32m INFO[0m [Testcase #0] run time: 0h-0m-7s, clients: 1, corpus: 41, objectives: 0, executions: 449, exec/sec: 365.9
[32m INFO[0m ============= Coverage Summary =============
[32m INFO[0m 0x72################################2e04d: 43.84% Instruction Covered, 34.23% Branch Covered
[32m INFO[0m 0xbb################################c095c: 11.03% Instruction Covered, 13.16% Branch Covered
[32m INFO[0m [Stats #0] run time: 0h-0m-7s, clients: 1, corpus: 41, objectives: 0, executions: 449, exec/sec: 364.7
[32m INFO[0m ============= New Corpus Item =============
[32m INFO[0m Reverted? true 
 Txn:
[Sender] 0x8E################################d79dd
   [1] Router.swapExactETHForTokens{value: 2165.6474 ether}(0, path:(WETH  0x72################################2E04D), address(this), block.timestamp);
[Sender] 0xe1################################c8510
   [1] 0x72################################2E04D.transferOwnership(0x00################################00000)
       0x08################################000000000000000000000000000000000002000000000000000000000000000000000000000000000000000000000000000204f776e61626c653a2063616c6c6572206973206e6f7420746865206f776e6572

[32m INFO[0m ==========================================
[32m INFO[0m [Testcase #0] run time: 0h-0m-7s, clients: 1, corpus: 42, objectives: 0, executions: 481, exec/sec: 390.6
[32m INFO[0m ============= Coverage Summary =============
[32m INFO[0m 0xbb################################c095c: 11.03% Instruction Covered, 13.16% Branch Covered
[32m INFO[0m 0x72################################2e04d: 43.84% Instruction Covered, 34.23% Branch Covered
[32m INFO[0m [Stats #0] run time: 0h-0m-8s, clients: 1, corpus: 42, objectives: 0, executions: 481, exec/sec: 296.0
[32m INFO[0m ============= New Corpus Item =============
[32m INFO[0m Reverted? false 
 Txn:
[Sender] 0x8E################################d79dd
   [1] Router.swapExactETHForTokens{value: 4722.3663 ether}(0, path:(WETH  0x72################################2E04D), address(this), block.timestamp);
   [1] 0x72################################2E04D.payTax(8301)

[32m INFO[0m ==========================================
[32m INFO[0m [Testcase #0] run time: 0h-0m-8s, clients: 1, corpus: 43, objectives: 0, executions: 1047, exec/sec: 644.0
[32m INFO[0m ============= Coverage Summary =============
[32m INFO[0m 0x72################################2e04d: 43.84% Instruction Covered, 34.23% Branch Covered
[32m INFO[0m 0xbb################################c095c: 11.03% Instruction Covered, 13.16% Branch Covered
[32m INFO[0m [Stats #0] run time: 0h-0m-8s, clients: 1, corpus: 43, objectives: 0, executions: 1047, exec/sec: 634.6
[32m INFO[0m ============= New Corpus Item =============
[32m INFO[0m Reverted? false 
 Txn:
[Sender] 0x8E################################d79dd
   [1] Router.swapExactETHForTokens{value: 4722.3663 ether}(0, path:(WETH  0x72################################2E04D), address(this), block.timestamp);
   [1] 0x72################################2E04D.payTax(8301)

[32m INFO[0m ==========================================
[32m INFO[0m [Testcase #0] run time: 0h-0m-8s, clients: 1, corpus: 44, objectives: 0, executions: 1345, exec/sec: 815.0
[32m INFO[0m ============= Coverage Summary =============
[32m INFO[0m 0x72################################2e04d: 43.84% Instruction Covered, 34.23% Branch Covered
[32m INFO[0m 0xbb################################c095c: 11.03% Instruction Covered, 13.16% Branch Covered
[32m INFO[0m [Stats #0] run time: 0h-0m-8s, clients: 1, corpus: 44, objectives: 0, executions: 1345, exec/sec: 758.8
[32m INFO[0m ============= New Corpus Item =============
[32m INFO[0m Reverted? false 
 Txn:
[Sender] 0x8E################################d79dd
   [1] Router.swapExactETHForTokens{value: 4722.3663 ether}(0, path:(WETH  0x72################################2E04D), address(this), block.timestamp);
   [1] Router.swapExactETHForTokens{value: 229}(0, path:(WETH  0x72################################2E04D), address(this), block.timestamp);
   [1] Router.swapExactETHForTokens{value: 6463}(0, path:(WETH  0x72################################2E04D), address(this), block.timestamp);
   [1] Router.swapExactETHForTokens{value: 140737488355328}(0, path:(WETH  0x72################################2E04D), address(this), block.timestamp);
   [1] Router.swapExactETHForTokens{value: 1}(0, path:(WETH  0x72################################2E04D), address(this), block.timestamp);
[Sender] 0x68################################c9024
   [1] 0x72################################2E04D.approve(0x72################################2E04D, 0)
       0x01
[Sender] 0x8E################################d79dd
   [1] 0x72################################2E04D.decreaseAllowance(0xe1################################c8510, 0)
       0x01

[32m INFO[0m ==========================================
[32m INFO[0m [Testcase #0] run time: 0h-0m-8s, clients: 1, corpus: 45, objectives: 0, executions: 1515, exec/sec: 853.5
[32m INFO[0m ============= Coverage Summary =============
[32m INFO[0m 0x72################################2e04d: 43.84% Instruction Covered, 34.23% Branch Covered
[32m INFO[0m 0xbb################################c095c: 11.03% Instruction Covered, 13.16% Branch Covered
[32m INFO[0m [Stats #0] run time: 0h-0m-8s, clients: 1, corpus: 45, objectives: 0, executions: 2331, exec/sec: 1.047k
[32m INFO[0m [Stats #0] run time: 0h-0m-9s, clients: 1, corpus: 45, objectives: 0, executions: 7937, exec/sec: 2.428k
[32m INFO[0m [Stats #0] run time: 0h-0m-10s, clients: 1, corpus: 45, objectives: 0, executions: 15207, exec/sec: 3.562k
[32m INFO[0m [Stats #0] run time: 0h-0m-11s, clients: 1, corpus: 45, objectives: 0, executions: 23464, exec/sec: 4.444k
[32m INFO[0m [Stats #0] run time: 0h-0m-12s, clients: 1, corpus: 45, objectives: 0, executions: 31601, exec/sec: 5.032k
[32m INFO[0m [Stats #0] run time: 0h-0m-13s, clients: 1, corpus: 45, objectives: 0, executions: 39924, exec/sec: 5.478k
[32m INFO[0m [Stats #0] run time: 0h-0m-14s, clients: 1, corpus: 45, objectives: 0, executions: 48272, exec/sec: 5.823k
[32m INFO[0m [Stats #0] run time: 0h-0m-15s, clients: 1, corpus: 45, objectives: 0, executions: 56600, exec/sec: 6.091k
[32m INFO[0m [Stats #0] run time: 0h-0m-16s, clients: 1, corpus: 45, objectives: 0, executions: 65085, exec/sec: 6.316k
[32m INFO[0m [Stats #0] run time: 0h-0m-17s, clients: 1, corpus: 45, objectives: 0, executions: 73381, exec/sec: 6.490k
[32m INFO[0m [Stats #0] run time: 0h-0m-18s, clients: 1, corpus: 45, objectives: 0, executions: 81549, exec/sec: 6.624k
[32m INFO[0m [Stats #0] run time: 0h-0m-19s, clients: 1, corpus: 45, objectives: 0, executions: 89684, exec/sec: 6.737k
[32m INFO[0m [Stats #0] run time: 0h-0m-20s, clients: 1, corpus: 45, objectives: 0, executions: 89684, exec/sec: 6.488k
[32m INFO[0m ============= New Corpus Item =============
[32m INFO[0m Reverted? false 
 Txn:
[Sender] 0x8E################################d79dd
   [1] Router.swapExactETHForTokens{value: 8589938516}(0, path:(WETH  0x72################################2E04D), address(this), block.timestamp);
   [1] 0x72################################2E04D.transfer(0xe1################################c8510, 1)
       0x01
[Sender] 0x68################################c9024
   [1] 0x72################################2E04D.approve(0x8E################################d79dd, 0)
       0x01

[32m INFO[0m ==========================================
[32m INFO[0m [Testcase #0] run time: 0h-0m-20s, clients: 1, corpus: 46, objectives: 0, executions: 93938, exec/sec: 6.796k
[32m INFO[0m ============= Coverage Summary =============
[32m INFO[0m 0xbb################################c095c: 11.03% Instruction Covered, 13.16% Branch Covered
[32m INFO[0m 0x72################################2e04d: 43.84% Instruction Covered, 34.23% Branch Covered
[32m INFO[0m [Stats #0] run time: 0h-0m-20s, clients: 1, corpus: 46, objectives: 0, executions: 97810, exec/sec: 6.834k
[32m INFO[0m [Stats #0] run time: 0h-0m-21s, clients: 1, corpus: 46, objectives: 0, executions: 97810, exec/sec: 6.742k
[32m INFO[0m ============= New Corpus Item =============
[32m INFO[0m Reverted? false 
 Txn:
[Sender] 0x8E################################d79dd
   [1] Router.swapExactETHForTokens{value: 8589938516}(0, path:(WETH  0x72################################2E04D), address(this), block.timestamp);
   [1] 0x72################################2E04D.transfer(0xe1################################c8510, 1)
       0x01
[Sender] 0x35################################31dDb
   [1] 0x72################################2E04D.increaseAllowance(0x35################################31dDb, 29410130880055922889463394860290561967359714173838694.5521 ether)
       0x01

[32m INFO[0m ==========================================
[32m INFO[0m [Testcase #0] run time: 0h-0m-21s, clients: 1, corpus: 47, objectives: 0, executions: 99326, exec/sec: 6.846k
[32m INFO[0m ============= Coverage Summary =============
[32m INFO[0m 0xbb################################c095c: 11.03% Instruction Covered, 13.16% Branch Covered
[32m INFO[0m 0x72################################2e04d: 43.84% Instruction Covered, 34.23% Branch Covered
[32m INFO[0m [Stats #0] run time: 0h-0m-21s, clients: 1, corpus: 47, objectives: 0, executions: 99326, exec/sec: 6.838k
[32m INFO[0m ============= New Corpus Item =============
[32m INFO[0m Reverted? false 
 Txn:
[Sender] 0x8E################################d79dd
   [1] Router.swapExactETHForTokens{value: 8589938516}(0, path:(WETH  0x72################################2E04D), address(this), block.timestamp);
   [1] 0x72################################2E04D.transfer(0xe1################################c8510, 1)
       0x01
   [1] Router.swapExactETHForTokens{value: 3957.7535 ether}(0, path:(WETH  0x72################################2E04D), address(this), block.timestamp);
   [1] Router.swapExactETHForTokens{value: 1242}(0, path:(WETH  0x72################################2E04D), address(this), block.timestamp);
[Sender] 0x68################################c9024
   [1] 0x72################################2E04D.symbol()
       0x00################################0000000000000000000000000002000000000000000000000000000000000000000000000000000000000000000075348494241476f00000000000000000000000000000000000000000000000000

[32m INFO[0m ==========================================
[32m INFO[0m [Testcase #0] run time: 0h-0m-21s, clients: 1, corpus: 48, objectives: 0, executions: 99502, exec/sec: 6.850k
[32m INFO[0m ============= Coverage Summary =============
[32m INFO[0m 0xbb################################c095c: 11.03% Instruction Covered, 13.16% Branch Covered
[32m INFO[0m 0x72################################2e04d: 43.84% Instruction Covered, 34.23% Branch Covered
[32m INFO[0m [Stats #0] run time: 0h-0m-21s, clients: 1, corpus: 48, objectives: 0, executions: 99502, exec/sec: 6.789k
[32m INFO[0m ============= New Corpus Item =============
[32m INFO[0m Reverted? false 
 Txn:
[Sender] 0x8E################################d79dd
   [1] Router.swapExactETHForTokens{value: 8589938516}(0, path:(WETH  0x72################################2E04D), address(this), block.timestamp);
   [1] 0x72################################2E04D.transfer(0xe1################################c8510, 1)
       0x01
   [1] 0x72################################2E04D.payTax(8301)

[32m INFO[0m ==========================================
[32m INFO[0m [Testcase #0] run time: 0h-0m-21s, clients: 1, corpus: 49, objectives: 0, executions: 100513, exec/sec: 6.858k
[32m INFO[0m ============= Coverage Summary =============
[32m INFO[0m 0x72################################2e04d: 43.84% Instruction Covered, 34.23% Branch Covered
[32m INFO[0m 0xbb################################c095c: 11.03% Instruction Covered, 13.16% Branch Covered
[32m INFO[0m [Stats #0] run time: 0h-0m-21s, clients: 1, corpus: 49, objectives: 0, executions: 100513, exec/sec: 6.856k
[32m INFO[0m ============= New Corpus Item =============
[32m INFO[0m Reverted? false 
 Txn:
[Sender] 0x8E################################d79dd
   [1] Router.swapExactETHForTokens{value: 8589938516}(0, path:(WETH  0x72################################2E04D), address(this), block.timestamp);
   [1] 0x72################################2E04D.transfer(0xe1################################c8510, 1)
       0x01
   [1] Router.swapExactETHForTokens{value: 951}(0, path:(WETH  0x72################################2E04D), address(this), block.timestamp);
   [1] 0x72################################2E04D.decreaseAllowance(0x35################################31dDb, 0)
       0x01

[32m INFO[0m ==========================================
[32m INFO[0m [Testcase #0] run time: 0h-0m-21s, clients: 1, corpus: 50, objectives: 0, executions: 100524, exec/sec: 6.856k
[32m INFO[0m ============= Coverage Summary =============
[32m INFO[0m 0x72################################2e04d: 43.84% Instruction Covered, 34.23% Branch Covered
[32m INFO[0m 0xbb################################c095c: 11.03% Instruction Covered, 13.16% Branch Covered
[32m INFO[0m [Stats #0] run time: 0h-0m-21s, clients: 1, corpus: 50, objectives: 0, executions: 105009, exec/sec: 6.857k
[32m INFO[0m [Stats #0] run time: 0h-0m-22s, clients: 1, corpus: 50, objectives: 0, executions: 111885, exec/sec: 6.856k
[32m INFO[0m [Stats #0] run time: 0h-0m-23s, clients: 1, corpus: 50, objectives: 0, executions: 118931, exec/sec: 6.864k
[32m INFO[0m [Stats #0] run time: 0h-0m-24s, clients: 1, corpus: 50, objectives: 0, executions: 126112, exec/sec: 6.879k
[32m INFO[0m [Stats #0] run time: 0h-0m-25s, clients: 1, corpus: 50, objectives: 0, executions: 133118, exec/sec: 6.882k
[32m INFO[0m [Stats #0] run time: 0h-0m-26s, clients: 1, corpus: 50, objectives: 0, executions: 140043, exec/sec: 6.884k
[32m INFO[0m [Stats #0] run time: 0h-0m-27s, clients: 1, corpus: 50, objectives: 0, executions: 146958, exec/sec: 6.882k
[32m INFO[0m [Stats #0] run time: 0h-0m-28s, clients: 1, corpus: 50, objectives: 0, executions: 154042, exec/sec: 6.890k
[32m INFO[0m [Stats #0] run time: 0h-0m-29s, clients: 1, corpus: 50, objectives: 0, executions: 161155, exec/sec: 6.898k
[32m INFO[0m [Stats #0] run time: 0h-0m-30s, clients: 1, corpus: 50, objectives: 0, executions: 167948, exec/sec: 6.893k
[32m INFO[0m [Stats #0] run time: 0h-0m-31s, clients: 1, corpus: 50, objectives: 0, executions: 175059, exec/sec: 6.902k
[32m INFO[0m [Stats #0] run time: 0h-0m-32s, clients: 1, corpus: 50, objectives: 0, executions: 181976, exec/sec: 6.901k
[32m INFO[0m [Stats #0] run time: 0h-0m-33s, clients: 1, corpus: 50, objectives: 0, executions: 181976, exec/sec: 6.712k
[32m INFO[0m ============= New Corpus Item =============
[32m INFO[0m Reverted? false 
 Txn:
[Sender] 0x8E################################d79dd
   [1] Router.swapExactETHForTokens{value: 912.2585 ether}(0, path:(WETH  0x72################################2E04D), address(this), block.timestamp);
   [1] 0x72################################2E04D.transfer(0x35################################31dDb, 0.1441 ether)
       0x01

[32m INFO[0m ==========================================
[32m INFO[0m [Testcase #0] run time: 0h-0m-33s, clients: 1, corpus: 51, objectives: 0, executions: 187219, exec/sec: 6.906k
[32m INFO[0m ============= Coverage Summary =============
[32m INFO[0m 0xbb################################c095c: 11.03% Instruction Covered, 13.16% Branch Covered
[32m INFO[0m 0x72################################2e04d: 43.84% Instruction Covered, 34.23% Branch Covered
[32m INFO[0m [Stats #0] run time: 0h-0m-33s, clients: 1, corpus: 51, objectives: 0, executions: 188984, exec/sec: 6.903k
[32m INFO[0m [Stats #0] run time: 0h-0m-34s, clients: 1, corpus: 51, objectives: 0, executions: 195647, exec/sec: 6.895k
[32m INFO[0m [Stats #0] run time: 0h-0m-35s, clients: 1, corpus: 51, objectives: 0, executions: 202828, exec/sec: 6.904k
[32m INFO[0m [Stats #0] run time: 0h-0m-36s, clients: 1, corpus: 51, objectives: 0, executions: 209458, exec/sec: 6.895k
[32m INFO[0m [Stats #0] run time: 0h-0m-37s, clients: 1, corpus: 51, objectives: 0, executions: 216149, exec/sec: 6.888k
[32m INFO[0m [Stats #0] run time: 0h-0m-38s, clients: 1, corpus: 51, objectives: 0, executions: 223289, exec/sec: 6.895k
[32m INFO[0m [Stats #0] run time: 0h-0m-39s, clients: 1, corpus: 51, objectives: 0, executions: 230486, exec/sec: 6.903k
[32m INFO[0m [Stats #0] run time: 0h-0m-40s, clients: 1, corpus: 51, objectives: 0, executions: 237086, exec/sec: 6.894k
[32m INFO[0m [Stats #0] run time: 0h-0m-41s, clients: 1, corpus: 51, objectives: 0, executions: 243782, exec/sec: 6.888k
[32m INFO[0m [Stats #0] run time: 0h-0m-42s, clients: 1, corpus: 51, objectives: 0, executions: 250766, exec/sec: 6.890k
[32m INFO[0m [Stats #0] run time: 0h-0m-43s, clients: 1, corpus: 51, objectives: 0, executions: 257622, exec/sec: 6.888k
[32m INFO[0m [Stats #0] run time: 0h-0m-44s, clients: 1, corpus: 51, objectives: 0, executions: 264453, exec/sec: 6.887k
[32m INFO[0m [Stats #0] run time: 0h-0m-45s, clients: 1, corpus: 51, objectives: 0, executions: 271241, exec/sec: 6.883k
[32m INFO[0m [Stats #0] run time: 0h-0m-46s, clients: 1, corpus: 51, objectives: 0, executions: 278136, exec/sec: 6.883k
[32m INFO[0m [Stats #0] run time: 0h-0m-47s, clients: 1, corpus: 51, objectives: 0, executions: 285057, exec/sec: 6.882k
[32m INFO[0m [Stats #0] run time: 0h-0m-48s, clients: 1, corpus: 51, objectives: 0, executions: 291883, exec/sec: 6.881k
[32m INFO[0m [Stats #0] run time: 0h-0m-49s, clients: 1, corpus: 51, objectives: 0, executions: 298872, exec/sec: 6.882k
[32m INFO[0m [Stats #0] run time: 0h-0m-50s, clients: 1, corpus: 51, objectives: 0, executions: 305505, exec/sec: 6.875k
[32m INFO[0m [Stats #0] run time: 0h-0m-51s, clients: 1, corpus: 51, objectives: 0, executions: 312545, exec/sec: 6.878k
[32m INFO[0m [Stats #0] run time: 0h-0m-52s, clients: 1, corpus: 51, objectives: 0, executions: 319265, exec/sec: 6.875k
[32m INFO[0m [Stats #0] run time: 0h-0m-53s, clients: 1, corpus: 51, objectives: 0, executions: 326305, exec/sec: 6.878k
[32m INFO[0m [Stats #0] run time: 0h-0m-55s, clients: 1, corpus: 51, objectives: 0, executions: 333004, exec/sec: 6.873k
[32m INFO[0m [Stats #0] run time: 0h-0m-56s, clients: 1, corpus: 51, objectives: 0, executions: 339656, exec/sec: 6.868k
[32m INFO[0m [Stats #0] run time: 0h-0m-57s, clients: 1, corpus: 51, objectives: 0, executions: 346631, exec/sec: 6.870k
[32m INFO[0m [Stats #0] run time: 0h-0m-58s, clients: 1, corpus: 51, objectives: 0, executions: 353359, exec/sec: 6.867k
[32m INFO[0m [Stats #0] run time: 0h-0m-59s, clients: 1, corpus: 51, objectives: 0, executions: 360317, exec/sec: 6.868k
[32m INFO[0m [Stats #0] run time: 0h-1m-0s, clients: 1, corpus: 51, objectives: 0, executions: 367106, exec/sec: 6.866k
[32m INFO[0m [Stats #0] run time: 0h-1m-1s, clients: 1, corpus: 51, objectives: 0, executions: 373793, exec/sec: 6.861k
[32m INFO[0m [Stats #0] run time: 0h-1m-2s, clients: 1, corpus: 51, objectives: 0, executions: 380846, exec/sec: 6.864k
[32m INFO[0m [Stats #0] run time: 0h-1m-3s, clients: 1, corpus: 51, objectives: 0, executions: 387546, exec/sec: 6.861k
[32m INFO[0m [Stats #0] run time: 0h-1m-4s, clients: 1, corpus: 51, objectives: 0, executions: 394517, exec/sec: 6.863k
[32m INFO[0m [Stats #0] run time: 0h-1m-5s, clients: 1, corpus: 51, objectives: 0, executions: 401275, exec/sec: 6.861k
[32m INFO[0m [Stats #0] run time: 0h-1m-6s, clients: 1, corpus: 51, objectives: 0, executions: 407907, exec/sec: 6.856k
[32m INFO[0m [Stats #0] run time: 0h-1m-7s, clients: 1, corpus: 51, objectives: 0, executions: 414965, exec/sec: 6.858k
[32m INFO[0m [Stats #0] run time: 0h-1m-8s, clients: 1, corpus: 51, objectives: 0, executions: 421851, exec/sec: 6.858k
[32m INFO[0m [Stats #0] run time: 0h-1m-9s, clients: 1, corpus: 51, objectives: 0, executions: 428832, exec/sec: 6.859k
[32m INFO[0m [Stats #0] run time: 0h-1m-10s, clients: 1, corpus: 51, objectives: 0, executions: 435435, exec/sec: 6.854k
[32m INFO[0m [Stats #0] run time: 0h-1m-11s, clients: 1, corpus: 51, objectives: 0, executions: 442298, exec/sec: 6.854k
[32m INFO[0m [Stats #0] run time: 0h-1m-12s, clients: 1, corpus: 51, objectives: 0, executions: 449152, exec/sec: 6.853k
[32m INFO[0m [Stats #0] run time: 0h-1m-13s, clients: 1, corpus: 51, objectives: 0, executions: 456033, exec/sec: 6.854k
[32m INFO[0m [Stats #0] run time: 0h-1m-14s, clients: 1, corpus: 51, objectives: 0, executions: 462986, exec/sec: 6.855k
[32m INFO[0m [Stats #0] run time: 0h-1m-15s, clients: 1, corpus: 51, objectives: 0, executions: 469588, exec/sec: 6.850k
[32m INFO[0m [Stats #0] run time: 0h-1m-16s, clients: 1, corpus: 51, objectives: 0, executions: 476160, exec/sec: 6.846k
[32m INFO[0m [Stats #0] run time: 0h-1m-17s, clients: 1, corpus: 51, objectives: 0, executions: 482759, exec/sec: 6.842k
[32m INFO[0m [Stats #0] run time: 0h-1m-18s, clients: 1, corpus: 51, objectives: 0, executions: 489520, exec/sec: 6.840k
[32m INFO[0m [Stats #0] run time: 0h-1m-19s, clients: 1, corpus: 51, objectives: 0, executions: 496408, exec/sec: 6.841k
[32m INFO[0m [Stats #0] run time: 0h-1m-20s, clients: 1, corpus: 51, objectives: 0, executions: 503171, exec/sec: 6.839k
[32m INFO[0m [Stats #0] run time: 0h-1m-21s, clients: 1, corpus: 51, objectives: 0, executions: 510112, exec/sec: 6.841k
[32m INFO[0m [Stats #0] run time: 0h-1m-22s, clients: 1, corpus: 51, objectives: 0, executions: 516740, exec/sec: 6.837k
[32m INFO[0m [Stats #0] run time: 0h-1m-23s, clients: 1, corpus: 51, objectives: 0, executions: 523503, exec/sec: 6.836k
[32m INFO[0m [Stats #0] run time: 0h-1m-24s, clients: 1, corpus: 51, objectives: 0, executions: 530359, exec/sec: 6.836k
[32m INFO[0m [Stats #0] run time: 0h-1m-25s, clients: 1, corpus: 51, objectives: 0, executions: 537054, exec/sec: 6.834k
[32m INFO[0m [Stats #0] run time: 0h-1m-26s, clients: 1, corpus: 51, objectives: 0, executions: 543812, exec/sec: 6.833k
[32m INFO[0m [Stats #0] run time: 0h-1m-27s, clients: 1, corpus: 51, objectives: 0, executions: 550762, exec/sec: 6.834k
[32m INFO[0m [Stats #0] run time: 0h-1m-28s, clients: 1, corpus: 51, objectives: 0, executions: 557391, exec/sec: 6.832k
[32m INFO[0m [Stats #0] run time: 0h-1m-29s, clients: 1, corpus: 51, objectives: 0, executions: 564055, exec/sec: 6.829k
[32m INFO[0m [Stats #0] run time: 0h-1m-30s, clients: 1, corpus: 51, objectives: 0, executions: 571075, exec/sec: 6.830k
[32m INFO[0m [Stats #0] run time: 0h-1m-31s, clients: 1, corpus: 51, objectives: 0, executions: 577969, exec/sec: 6.831k
[32m INFO[0m [Stats #0] run time: 0h-1m-31s, clients: 1, corpus: 51, objectives: 0, executions: 577969, exec/sec: 6.822k
[32m INFO[0m ============= New Corpus Item =============
[32m INFO[0m Reverted? false 
 Txn:
[Sender] 0x8E################################d79dd
   [1] Router.swapExactETHForTokens{value: 4722.3664 ether}(0, path:(WETH  0x72################################2E04D), address(this), block.timestamp);
   [1] 0x72################################2E04D.transfer(0x68################################c9024, 13)
       0x01
   [1] 0x72################################2E04D.payTax(8301)
   [1] 0x72################################2E04D.transfer(0x35################################31dDb, 0.1441 ether)
       0x01

[32m INFO[0m ==========================================
[32m INFO[0m [Testcase #0] run time: 0h-1m-31s, clients: 1, corpus: 52, objectives: 0, executions: 578667, exec/sec: 6.830k
[32m INFO[0m ============= Coverage Summary =============
[32m INFO[0m 0x72################################2e04d: 43.84% Instruction Covered, 34.23% Branch Covered
[32m INFO[0m 0xbb################################c095c: 11.03% Instruction Covered, 13.16% Branch Covered
[32m INFO[0m [Stats #0] run time: 0h-1m-32s, clients: 1, corpus: 52, objectives: 0, executions: 584629, exec/sec: 6.829k
[32m INFO[0m [Stats #0] run time: 0h-1m-33s, clients: 1, corpus: 52, objectives: 0, executions: 591324, exec/sec: 6.827k
[32m INFO[0m [Stats #0] run time: 0h-1m-34s, clients: 1, corpus: 52, objectives: 0, executions: 597640, exec/sec: 6.821k
[32m INFO[0m [Stats #0] run time: 0h-1m-35s, clients: 1, corpus: 52, objectives: 0, executions: 604462, exec/sec: 6.821k
[32m INFO[0m [Stats #0] run time: 0h-1m-36s, clients: 1, corpus: 52, objectives: 0, executions: 611192, exec/sec: 6.820k
[32m INFO[0m [Stats #0] run time: 0h-1m-37s, clients: 1, corpus: 52, objectives: 0, executions: 617893, exec/sec: 6.818k
[32m INFO[0m [Stats #0] run time: 0h-1m-38s, clients: 1, corpus: 52, objectives: 0, executions: 624688, exec/sec: 6.818k
Timeout