[32m INFO[0m fetching abi from https://api.bscscan.com/api?module=contract&action=getabi&address=0x93################################c1049&format=json&apikey=6ZUCAR738XJSX6WK3BGN2K8DX4RI9A875M
[32m INFO[0m fetching code from 9370a4e57622093a97e9e3bc794253202f9c1049
Contract loaded: 0x93################################c1049
[32m INFO[0m 

 ================ EVM Fuzzer Start ===================


[32m INFO[0m Deploying contract: 0x93################################c1049
[32m INFO[0m Contract 0x93################################c1049 deployed to: 0x93################################c1049 -> balacne is 0
[32m INFO[0m Deployed all contracts

[32m INFO[0m fetching pairs for 0x93################################c1049
[32m INFO[0m fetching pairs for 0x93################################c1049
[32m INFO[0m fetching code from f166e3d407cc13742ac73e78f43f78ac9bbbb298
[32m INFO[0m fetching code from bb4cdb9cbd36b01bd1cbaebf2de08d9173bc095c
[32m INFO[0m [Stats #0] run time: 0h-0m-15s, clients: 1, corpus: 0, objectives: 0, executions: 0, exec/sec: 0.000
[32m INFO[0m ============= New Corpus Item =============
[32m INFO[0m Reverted? false 
 Txn:
[Sender] 0x35################################31dDb
   [1] Router.swapExactETHForTokens{value: 4704.5463 ether}(0, path:(WETH  0x93################################C1049), address(this), block.timestamp);

[32m INFO[0m ==========================================
[32m INFO[0m [Testcase #0] run time: 0h-0m-15s, clients: 1, corpus: 20, objectives: 0, executions: 1, exec/sec: 0.000
[32m INFO[0m [Stats #0] run time: 0h-0m-15s, clients: 1, corpus: 20, objectives: 0, executions: 1, exec/sec: 0.000
[32m INFO[0m ============= New Corpus Item =============
[32m INFO[0m Reverted? true 
 Txn:
[Sender] 0x35################################31dDb
   [1] Router.swapExactETHForTokens{value: 4704.5463 ether}(0, path:(WETH  0x93################################C1049), address(this), block.timestamp);
   [1] Router.swapExactETHForTokens{value: 1170.7340 ether}(0, path:(WETH  0x93################################C1049), address(this), block.timestamp);
   [1] Router.swapExactETHForTokens{value: 1}(0, path:(WETH  0x93################################C1049), address(this), block.timestamp);

[32m INFO[0m ==========================================
[32m INFO[0m [Testcase #0] run time: 0h-0m-15s, clients: 1, corpus: 21, objectives: 0, executions: 4, exec/sec: 0.000
[32m INFO[0m ============= Coverage Summary =============
[32m INFO[0m 0xbb################################c095c: 11.03% Instruction Covered, 13.16% Branch Covered
[32m INFO[0m 0x93################################c1049: 41.14% Instruction Covered, 37.29% Branch Covered
[32m INFO[0m [Stats #0] run time: 0h-0m-15s, clients: 1, corpus: 21, objectives: 0, executions: 4, exec/sec: 0.000
[32m INFO[0m ============= New Corpus Item =============
[32m INFO[0m Reverted? false 
 Txn:
[Sender] 0x35################################31dDb
   [1] Router.swapExactETHForTokens{value: 4704.5463 ether}(0, path:(WETH  0x93################################C1049), address(this), block.timestamp);
   [1] Router.swapExactETHForTokens{value: 10.0 ether}(0, path:(WETH  0x93################################C1049), address(this), block.timestamp);
   [1] Router.swapExactETHForTokens{value: 1099511594887}(0, path:(WETH  0x93################################C1049), address(this), block.timestamp);
[Sender] 0x68################################c9024
   [1] 0x93################################C1049.approve(0x68################################c9024, 0)
       0x01

[32m INFO[0m ==========================================
[32m INFO[0m [Testcase #0] run time: 0h-0m-15s, clients: 1, corpus: 22, objectives: 0, executions: 33, exec/sec: 0.000
[32m INFO[0m [Stats #0] run time: 0h-0m-15s, clients: 1, corpus: 22, objectives: 0, executions: 33, exec/sec: 0.000
[32m INFO[0m ============= New Corpus Item =============
[32m INFO[0m Reverted? true 
 Txn:
[Sender] 0x35################################31dDb
   [1] Router.swapExactETHForTokens{value: 4704.5463 ether}(0, path:(WETH  0x93################################C1049), address(this), block.timestamp);
[Sender] 0x68################################c9024
   [1] 0x93################################C1049.approve{value: 3839.6737 ether}(0x35################################31dDb, 56539106072908298601967880294370601424834076413502698174.8187 ether)

[32m INFO[0m ==========================================
[32m INFO[0m [Testcase #0] run time: 0h-0m-15s, clients: 1, corpus: 23, objectives: 0, executions: 34, exec/sec: 0.000
[32m INFO[0m [Stats #0] run time: 0h-0m-15s, clients: 1, corpus: 23, objectives: 0, executions: 34, exec/sec: 0.000
[32m INFO[0m ============= New Corpus Item =============
[32m INFO[0m Reverted? true 
 Txn:
[Sender] 0x35################################31dDb
   [1] Router.swapExactETHForTokens{value: 4704.5463 ether}(0, path:(WETH  0x93################################C1049), address(this), block.timestamp);
   [1] Router.swapExactETHForTokens{value: 1170.7340 ether}(0, path:(WETH  0x93################################C1049), address(this), block.timestamp);
[Sender] 0x68################################c9024
   [1] 0x93################################C1049.approve(0x00################################00000, 1809330601553568469494263571262020665534498749860846883873.6709 ether)
       0x08################################0000000000000000000000000000000000020000000000000000000000000000000000000000000000000000000000000002245524332303a20617070726f766520746f20746865207a65726f2061646472657373000000000000000000000000000000000000000000000000000000000000

[32m INFO[0m ==========================================
[32m INFO[0m [Testcase #0] run time: 0h-0m-15s, clients: 1, corpus: 24, objectives: 0, executions: 35, exec/sec: 0.000
[32m INFO[0m [Stats #0] run time: 0h-0m-15s, clients: 1, corpus: 24, objectives: 0, executions: 35, exec/sec: 0.000
[32m INFO[0m ============= New Corpus Item =============
[32m INFO[0m Reverted? false 
 Txn:
[Sender] 0x35################################31dDb
   [1] Router.swapExactETHForTokens{value: 4704.5463 ether}(0, path:(WETH  0x93################################C1049), address(this), block.timestamp);
   [1] Router.swapExactETHForTokens{value: 10.0 ether}(0, path:(WETH  0x93################################C1049), address(this), block.timestamp);
   [1] Router.swapExactETHForTokens{value: 1099511594887}(0, path:(WETH  0x93################################C1049), address(this), block.timestamp);
[Sender] 0x68################################c9024
   [1] 0x93################################C1049.approve(0x68################################c9024, 0)
       0x01
   [1] 0x93################################C1049.approve(0xe1################################c8510, 12259965568607574586775765606463197703.6531 ether)
       0x01

[32m INFO[0m ==========================================
[32m INFO[0m [Testcase #0] run time: 0h-0m-15s, clients: 1, corpus: 25, objectives: 0, executions: 41, exec/sec: 0.000
[32m INFO[0m ============= Coverage Summary =============
[32m INFO[0m 0xbb################################c095c: 11.03% Instruction Covered, 13.16% Branch Covered
[32m INFO[0m 0x93################################c1049: 42.16% Instruction Covered, 37.85% Branch Covered
[32m INFO[0m [Stats #0] run time: 0h-0m-15s, clients: 1, corpus: 25, objectives: 0, executions: 41, exec/sec: 0.000
[32m INFO[0m ============= New Corpus Item =============
[32m INFO[0m Reverted? true 
 Txn:
[Sender] 0x35################################31dDb
   [1] Router.swapExactETHForTokens{value: 10.0 ether}(0, path:(WETH  0x93################################C1049), address(this), block.timestamp);
   [1] 0x93################################C1049.decreaseAllowance{value: 1183.8869 ether}(0x68################################c9024, 410572658048206255539477716141200868364976249.8510 ether)

[32m INFO[0m ==========================================
[32m INFO[0m [Testcase #0] run time: 0h-0m-15s, clients: 1, corpus: 26, objectives: 0, executions: 65, exec/sec: 0.000
[32m INFO[0m [Stats #0] run time: 0h-0m-15s, clients: 1, corpus: 26, objectives: 0, executions: 65, exec/sec: 0.000
[32m INFO[0m ============= New Corpus Item =============
[32m INFO[0m Reverted? true 
 Txn:
[Sender] 0x35################################31dDb
   [1] Router.swapExactETHForTokens{value: 4704.5463 ether}(0, path:(WETH  0x93################################C1049), address(this), block.timestamp);
   [1] Router.swapExactETHForTokens{value: 10.0 ether}(0, path:(WETH  0x93################################C1049), address(this), block.timestamp);
   [1] Router.swapExactETHForTokens{value: 10.0 ether}(0, path:(WETH  0x93################################C1049), address(this), block.timestamp);
   [1] 0x93################################C1049.decreaseAllowance(0x00################################00000, 5686690025625308901168979411.9806 ether)
       0x08################################0000000000000000000000000000000000020000000000000000000000000000000000000000000000000000000000000002545524332303a2064656372656173656420616c6c6f77616e63652062656c6f77207a65726f000000000000000000000000000000000000000000000000000000

[32m INFO[0m ==========================================
[32m INFO[0m [Testcase #0] run time: 0h-0m-15s, clients: 1, corpus: 27, objectives: 0, executions: 66, exec/sec: 0.000
[32m INFO[0m [Stats #0] run time: 0h-0m-15s, clients: 1, corpus: 27, objectives: 0, executions: 66, exec/sec: 0.000
[32m INFO[0m ============= New Corpus Item =============
[32m INFO[0m Reverted? true 
 Txn:
[Sender] 0x35################################31dDb
   [1] 0x93################################C1049.decreaseAllowance(0x00################################00000, 0)
       0x08################################0000000000000000000000000000000000020000000000000000000000000000000000000000000000000000000000000002245524332303a20617070726f766520746f20746865207a65726f2061646472657373000000000000000000000000000000000000000000000000000000000000

[32m INFO[0m ==========================================
[32m INFO[0m [Testcase #0] run time: 0h-0m-15s, clients: 1, corpus: 28, objectives: 0, executions: 67, exec/sec: 0.000
[32m INFO[0m ============= Coverage Summary =============
[32m INFO[0m 0x93################################c1049: 43.59% Instruction Covered, 39.27% Branch Covered
[32m INFO[0m 0xbb################################c095c: 11.03% Instruction Covered, 13.16% Branch Covered
[32m INFO[0m [Stats #0] run time: 0h-0m-16s, clients: 1, corpus: 28, objectives: 0, executions: 67, exec/sec: 0.000
[32m INFO[0m ============= New Corpus Item =============
[32m INFO[0m Reverted? false 
 Txn:
[Sender] 0x35################################31dDb
   [1] Router.swapExactETHForTokens{value: 4704.5463 ether}(0, path:(WETH  0x93################################C1049), address(this), block.timestamp);
   [1] 0x93################################C1049.deliver(0)

[32m INFO[0m ==========================================
[32m INFO[0m [Testcase #0] run time: 0h-0m-16s, clients: 1, corpus: 29, objectives: 0, executions: 97, exec/sec: 0.000
[32m INFO[0m [Stats #0] run time: 0h-0m-16s, clients: 1, corpus: 29, objectives: 0, executions: 97, exec/sec: 0.000
[32m INFO[0m ============= New Corpus Item =============
[32m INFO[0m Reverted? true 
 Txn:
[Sender] 0x35################################31dDb
   [1] Router.swapExactETHForTokens{value: 4704.5463 ether}(0, path:(WETH  0x93################################C1049), address(this), block.timestamp);
   [1] Router.swapExactETHForTokens{value: 10.0 ether}(0, path:(WETH  0x93################################C1049), address(this), block.timestamp);
   [1] Router.swapExactETHForTokens{value: 10.0 ether}(0, path:(WETH  0x93################################C1049), address(this), block.timestamp);
   [1] 0x93################################C1049.deliver(13164036458569648337245328646758436734951867101.9476 ether)
       0x4e################################0000000000000000000000000000000000011

[32m INFO[0m ==========================================
[32m INFO[0m [Testcase #0] run time: 0h-0m-16s, clients: 1, corpus: 30, objectives: 0, executions: 99, exec/sec: 0.000
[32m INFO[0m [Stats #0] run time: 0h-0m-16s, clients: 1, corpus: 30, objectives: 0, executions: 99, exec/sec: 0.000
[32m INFO[0m ============= New Corpus Item =============
[32m INFO[0m Reverted? true 
 Txn:
[Sender] 0x35################################31dDb
   [1] Router.swapExactETHForTokens{value: 4704.5463 ether}(0, path:(WETH  0x93################################C1049), address(this), block.timestamp);
[Sender] 0x68################################c9024
   [1] 0x93################################C1049.deliver{value: 3662.8219 ether}(30800128465368865654816202493309736060251067193786.6012 ether)

[32m INFO[0m ==========================================
[32m INFO[0m [Testcase #0] run time: 0h-0m-16s, clients: 1, corpus: 31, objectives: 0, executions: 104, exec/sec: 0.000
[32m INFO[0m [Stats #0] run time: 0h-0m-16s, clients: 1, corpus: 31, objectives: 0, executions: 104, exec/sec: 0.000
[32m INFO[0m ============= New Corpus Item =============
[32m INFO[0m Reverted? false 
 Txn:
[Sender] 0x35################################31dDb
   [1] Router.swapExactETHForTokens{value: 4704.5463 ether}(0, path:(WETH  0x93################################C1049), address(this), block.timestamp);
   [1] Router.swapExactETHForTokens{value: 885.6552 ether}(0, path:(WETH  0x93################################C1049), address(this), block.timestamp);
   [1] Router.swapExactETHForTokens{value: 2293.1178 ether}(0, path:(WETH  0x93################################C1049), address(this), block.timestamp);
   [1] 0x93################################C1049.deliver(0.4503 ether)

[32m INFO[0m ==========================================
[32m INFO[0m [Testcase #0] run time: 0h-0m-16s, clients: 1, corpus: 32, objectives: 0, executions: 127, exec/sec: 0.000
[32m INFO[0m ============= Coverage Summary =============
[32m INFO[0m 0x93################################c1049: 43.88% Instruction Covered, 39.83% Branch Covered
[32m INFO[0m 0xbb################################c095c: 11.03% Instruction Covered, 13.16% Branch Covered
[32m INFO[0m [Stats #0] run time: 0h-0m-16s, clients: 1, corpus: 32, objectives: 0, executions: 127, exec/sec: 0.000
[32m INFO[0m ============= New Corpus Item =============
[32m INFO[0m Reverted? true 
 Txn:
[Sender] 0x35################################31dDb
   [1] Router.swapExactETHForTokens{value: 10.0 ether}(0, path:(WETH  0x93################################C1049), address(this), block.timestamp);
[Sender] 0x8E################################d79dd
   [1] 0x93################################C1049.excludeFromFee(0x68################################c9024)
       0x08################################000000000000000000000000000000000002000000000000000000000000000000000000000000000000000000000000000204f776e61626c653a2063616c6c6572206973206e6f7420746865206f776e6572

[32m INFO[0m ==========================================
[32m INFO[0m [Testcase #0] run time: 0h-0m-16s, clients: 1, corpus: 33, objectives: 0, executions: 129, exec/sec: 0.000
[32m INFO[0m [Stats #0] run time: 0h-0m-16s, clients: 1, corpus: 33, objectives: 0, executions: 129, exec/sec: 0.000
[32m INFO[0m ============= New Corpus Item =============
[32m INFO[0m Reverted? true 
 Txn:
[Sender] 0x35################################31dDb
   [1] Router.swapExactETHForTokens{value: 0.2814 ether}(0, path:(WETH  0x93################################C1049), address(this), block.timestamp);
[Sender] 0x68################################c9024
   [1] 0x93################################C1049.excludeFromFee{value: 4616.2494 ether}(0xe1################################c8510)

[32m INFO[0m ==========================================
[32m INFO[0m [Testcase #0] run time: 0h-0m-16s, clients: 1, corpus: 34, objectives: 0, executions: 130, exec/sec: 0.000
[32m INFO[0m ============= Coverage Summary =============
[32m INFO[0m 0xbb################################c095c: 11.03% Instruction Covered, 13.16% Branch Covered
[32m INFO[0m 0x93################################c1049: 43.93% Instruction Covered, 40.11% Branch Covered
[32m INFO[0m [Stats #0] run time: 0h-0m-16s, clients: 1, corpus: 34, objectives: 0, executions: 130, exec/sec: 0.000
[32m INFO[0m ============= New Corpus Item =============
[32m INFO[0m Reverted? true 
 Txn:
[Sender] 0x35################################31dDb
   [1] Router.swapExactETHForTokens{value: 4704.5463 ether}(0, path:(WETH  0x93################################C1049), address(this), block.timestamp);
   [1] Router.swapExactETHForTokens{value: 885.6552 ether}(0, path:(WETH  0x93################################C1049), address(this), block.timestamp);
   [1] Router.swapExactETHForTokens{value: 2293.1178 ether}(0, path:(WETH  0x93################################C1049), address(this), block.timestamp);
   [1] 0x93################################C1049.deliver(0.4503 ether)
[Sender] 0xe1################################c8510
   [1] 0x93################################C1049.excludeFromReward(0x8E################################d79dd)
       0x08################################000000000000000000000000000000000002000000000000000000000000000000000000000000000000000000000000000204f776e61626c653a2063616c6c6572206973206e6f7420746865206f776e6572

[32m INFO[0m ==========================================
[32m INFO[0m [Testcase #0] run time: 0h-0m-16s, clients: 1, corpus: 35, objectives: 0, executions: 161, exec/sec: 0.000
[32m INFO[0m [Stats #0] run time: 0h-0m-16s, clients: 1, corpus: 35, objectives: 0, executions: 161, exec/sec: 0.000
[32m INFO[0m ============= New Corpus Item =============
[32m INFO[0m Reverted? true 
 Txn:
[Sender] 0x35################################31dDb
   [1] Router.swapExactETHForTokens{value: 10.0 ether}(0, path:(WETH  0x93################################C1049), address(this), block.timestamp);
[Sender] 0xe1################################c8510
   [1] 0x93################################C1049.excludeFromReward{value: 25.6479 ether}(0x8E################################d79dd)

[32m INFO[0m ==========================================
[32m INFO[0m [Testcase #0] run time: 0h-0m-16s, clients: 1, corpus: 36, objectives: 0, executions: 163, exec/sec: 0.000
[32m INFO[0m ============= Coverage Summary =============
[32m INFO[0m 0xbb################################c095c: 11.03% Instruction Covered, 13.16% Branch Covered
[32m INFO[0m 0x93################################c1049: 43.98% Instruction Covered, 40.40% Branch Covered
[32m INFO[0m [Stats #0] run time: 0h-0m-16s, clients: 1, corpus: 36, objectives: 0, executions: 163, exec/sec: 0.000
[32m INFO[0m ============= New Corpus Item =============
[32m INFO[0m Reverted? true 
 Txn:
[Sender] 0x35################################31dDb
   [1] Router.swapExactETHForTokens{value: 4704.5463 ether}(0, path:(WETH  0x93################################C1049), address(this), block.timestamp);
   [1] Router.swapExactETHForTokens{value: 885.6552 ether}(0, path:(WETH  0x93################################C1049), address(this), block.timestamp);
[Sender] 0xe1################################c8510
   [1] 0x93################################C1049.approve(0x8E################################d79dd, 45408847812079762436404254078829475632051818528490912841975.8755 ether)
       0x01
[Sender] 0x8E################################d79dd
   [1] 0x93################################C1049.includeInFee(0x68################################c9024)
       0x08################################000000000000000000000000000000000002000000000000000000000000000000000000000000000000000000000000000204f776e61626c653a2063616c6c6572206973206e6f7420746865206f776e6572

[32m INFO[0m ==========================================
[32m INFO[0m [Testcase #0] run time: 0h-0m-16s, clients: 1, corpus: 37, objectives: 0, executions: 193, exec/sec: 0.000
[32m INFO[0m [Stats #0] run time: 0h-0m-16s, clients: 1, corpus: 37, objectives: 0, executions: 193, exec/sec: 0.000
[32m INFO[0m ============= New Corpus Item =============
[32m INFO[0m Reverted? true 
 Txn:
[Sender] 0x35################################31dDb
   [1] Router.swapExactETHForTokens{value: 10.0 ether}(0, path:(WETH  0x93################################C1049), address(this), block.timestamp);
[Sender] 0x8E################################d79dd
   [1] 0x93################################C1049.includeInFee{value: 4722.3664 ether}(0x00################################00000)

[32m INFO[0m ==========================================
[32m INFO[0m [Testcase #0] run time: 0h-0m-16s, clients: 1, corpus: 38, objectives: 0, executions: 211, exec/sec: 0.000
[32m INFO[0m ============= Coverage Summary =============
[32m INFO[0m 0x93################################c1049: 44.04% Instruction Covered, 40.68% Branch Covered
[32m INFO[0m 0xbb################################c095c: 11.03% Instruction Covered, 13.16% Branch Covered
[32m INFO[0m [Stats #0] run time: 0h-0m-16s, clients: 1, corpus: 38, objectives: 0, executions: 211, exec/sec: 0.000
[32m INFO[0m ============= New Corpus Item =============
[32m INFO[0m Reverted? true 
 Txn:
[Sender] 0x35################################31dDb
   [1] 0x93################################C1049.includeInReward(0xe1################################c8510)
       0x08################################000000000000000000000000000000000002000000000000000000000000000000000000000000000000000000000000000204f776e61626c653a2063616c6c6572206973206e6f7420746865206f776e6572

[32m INFO[0m ==========================================
[32m INFO[0m [Testcase #0] run time: 0h-0m-16s, clients: 1, corpus: 39, objectives: 0, executions: 225, exec/sec: 0.000
[32m INFO[0m [Stats #0] run time: 0h-0m-16s, clients: 1, corpus: 39, objectives: 0, executions: 225, exec/sec: 0.000
[32m INFO[0m ============= New Corpus Item =============
[32m INFO[0m Reverted? true 
 Txn:
[Sender] 0x35################################31dDb
   [1] Router.swapExactETHForTokens{value: 4704.5463 ether}(0, path:(WETH  0x93################################C1049), address(this), block.timestamp);
   [1] Router.swapExactETHForTokens{value: 10.0 ether}(0, path:(WETH  0x93################################C1049), address(this), block.timestamp);
   [1] Router.swapExactETHForTokens{value: 1099511594887}(0, path:(WETH  0x93################################C1049), address(this), block.timestamp);
[Sender] 0x68################################c9024
   [1] 0x93################################C1049.approve(0x68################################c9024, 23764180027823806736666535736.6563 ether)
       0x01
   [1] 0x93################################C1049.approve(0x93################################C1049, 2464901991891602617384113518651455425555.6938 ether)
       0x01
[Sender] 0xe1################################c8510
   [1] 0x93################################C1049.includeInReward{value: 1201.1947 ether}(0x68################################c9024)

[32m INFO[0m ==========================================
[32m INFO[0m [Testcase #0] run time: 0h-0m-16s, clients: 1, corpus: 40, objectives: 0, executions: 229, exec/sec: 0.000
[32m INFO[0m ============= Coverage Summary =============
[32m INFO[0m 0x93################################c1049: 44.09% Instruction Covered, 40.96% Branch Covered
[32m INFO[0m 0xbb################################c095c: 11.03% Instruction Covered, 13.16% Branch Covered
[32m INFO[0m [Stats #0] run time: 0h-0m-16s, clients: 1, corpus: 40, objectives: 0, executions: 229, exec/sec: 0.000
[32m INFO[0m ============= New Corpus Item =============
[32m INFO[0m Reverted? true 
 Txn:
[Sender] 0x35################################31dDb
   [1] Router.swapExactETHForTokens{value: 4704.5463 ether}(0, path:(WETH  0x93################################C1049), address(this), block.timestamp);
[Sender] 0xe1################################c8510
   [1] 0x93################################C1049.increaseAllowance(0x00################################00000, 664593716101824304.4241 ether)
       0x08################################0000000000000000000000000000000000020000000000000000000000000000000000000000000000000000000000000002245524332303a20617070726f766520746f20746865207a65726f2061646472657373000000000000000000000000000000000000000000000000000000000000

[32m INFO[0m ==========================================
[32m INFO[0m [Testcase #0] run time: 0h-0m-16s, clients: 1, corpus: 41, objectives: 0, executions: 257, exec/sec: 0.000
[32m INFO[0m [Stats #0] run time: 0h-0m-16s, clients: 1, corpus: 41, objectives: 0, executions: 257, exec/sec: 0.000
[32m INFO[0m ============= New Corpus Item =============
[32m INFO[0m Reverted? true 
 Txn:
[Sender] 0x35################################31dDb
   [1] Router.swapExactETHForTokens{value: 10.0 ether}(0, path:(WETH  0x93################################C1049), address(this), block.timestamp);
[Sender] 0xe1################################c8510
   [1] 0x93################################C1049.increaseAllowance{value: 6863}(0x00################################00000, 0)

[32m INFO[0m ==========================================
[32m INFO[0m [Testcase #0] run time: 0h-0m-16s, clients: 1, corpus: 42, objectives: 0, executions: 261, exec/sec: 0.000
[32m INFO[0m [Stats #0] run time: 0h-0m-16s, clients: 1, corpus: 42, objectives: 0, executions: 261, exec/sec: 218.9
[32m INFO[0m ============= New Corpus Item =============
[32m INFO[0m Reverted? false 
 Txn:
[Sender] 0x35################################31dDb
   [1] Router.swapExactETHForTokens{value: 4704.5463 ether}(0, path:(WETH  0x93################################C1049), address(this), block.timestamp);
   [1] Router.swapExactETHForTokens{value: 347.8178 ether}(0, path:(WETH  0x93################################C1049), address(this), block.timestamp);
[Sender] 0x68################################c9024
   [1] 0x93################################C1049.approve(0x93################################C1049, 3408758657160347869.4355 ether)
       0x01
[Sender] 0xe1################################c8510
   [1] 0x93################################C1049.increaseAllowance(0x8E################################d79dd, 715144516699724849778861423083419094801839801864067.7188 ether)
       0x01

[32m INFO[0m ==========================================
[32m INFO[0m [Testcase #0] run time: 0h-0m-16s, clients: 1, corpus: 43, objectives: 0, executions: 276, exec/sec: 231.1
[32m INFO[0m ============= Coverage Summary =============
[32m INFO[0m 0x93################################c1049: 44.14% Instruction Covered, 41.24% Branch Covered
[32m INFO[0m 0xbb################################c095c: 11.03% Instruction Covered, 13.16% Branch Covered
[32m INFO[0m [Stats #0] run time: 0h-0m-16s, clients: 1, corpus: 43, objectives: 0, executions: 288, exec/sec: 238.9
[32m INFO[0m [Stats #0] run time: 0h-0m-16s, clients: 1, corpus: 43, objectives: 0, executions: 288, exec/sec: 238.9
[32m INFO[0m ============= New Corpus Item =============
[32m INFO[0m Reverted? true 
 Txn:
[Sender] 0x35################################31dDb
   [1] Router.swapExactETHForTokens{value: 4704.5463 ether}(0, path:(WETH  0x93################################C1049), address(this), block.timestamp);
   [1] Router.swapExactETHForTokens{value: 885.6552 ether}(0, path:(WETH  0x93################################C1049), address(this), block.timestamp);
   [1] Router.swapExactETHForTokens{value: 2293.1178 ether}(0, path:(WETH  0x93################################C1049), address(this), block.timestamp);
   [1] 0x93################################C1049.deliver(0.4503 ether)
[Sender] 0xe1################################c8510
   [1] 0x93################################C1049.renounceOwnership{value: 2241.9621 ether}()

[32m INFO[0m ==========================================
[32m INFO[0m [Testcase #0] run time: 0h-0m-16s, clients: 1, corpus: 44, objectives: 0, executions: 289, exec/sec: 239.6
[32m INFO[0m [Stats #0] run time: 0h-0m-16s, clients: 1, corpus: 44, objectives: 0, executions: 289, exec/sec: 239.5
[32m INFO[0m ============= New Corpus Item =============
[32m INFO[0m Reverted? true 
 Txn:
[Sender] 0x35################################31dDb
   [1] Router.swapExactETHForTokens{value: 4704.5463 ether}(0, path:(WETH  0x93################################C1049), address(this), block.timestamp);
   [1] Router.swapExactETHForTokens{value: 885.6552 ether}(0, path:(WETH  0x93################################C1049), address(this), block.timestamp);
   [1] Router.swapExactETHForTokens{value: 2293.1178 ether}(0, path:(WETH  0x93################################C1049), address(this), block.timestamp);
   [1] 0x93################################C1049.renounceOwnership()
       0x08################################000000000000000000000000000000000002000000000000000000000000000000000000000000000000000000000000000204f776e61626c653a2063616c6c6572206973206e6f7420746865206f776e6572

[32m INFO[0m ==========================================
[32m INFO[0m [Testcase #0] run time: 0h-0m-16s, clients: 1, corpus: 45, objectives: 0, executions: 294, exec/sec: 243.5
[32m INFO[0m ============= Coverage Summary =============
[32m INFO[0m 0x93################################c1049: 44.19% Instruction Covered, 41.53% Branch Covered
[32m INFO[0m 0xbb################################c095c: 11.03% Instruction Covered, 13.16% Branch Covered
[32m INFO[0m [Stats #0] run time: 0h-0m-16s, clients: 1, corpus: 45, objectives: 0, executions: 294, exec/sec: 242.8
[32m INFO[0m ============= New Corpus Item =============
[32m INFO[0m Reverted? true 
 Txn:
[Sender] 0x35################################31dDb
   [1] 0x93################################C1049.setDonationFeePercent(8697)
       0x08################################000000000000000000000000000000000002000000000000000000000000000000000000000000000000000000000000000204f776e61626c653a2063616c6c6572206973206e6f7420746865206f776e6572

[32m INFO[0m ==========================================
[32m INFO[0m [Testcase #0] run time: 0h-0m-16s, clients: 1, corpus: 46, objectives: 0, executions: 321, exec/sec: 265.0
[32m INFO[0m [Stats #0] run time: 0h-0m-16s, clients: 1, corpus: 46, objectives: 0, executions: 321, exec/sec: 265.0
[32m INFO[0m ============= New Corpus Item =============
[32m INFO[0m Reverted? true 
 Txn:
[Sender] 0x35################################31dDb
   [1] Router.swapExactETHForTokens{value: 4704.5463 ether}(0, path:(WETH  0x93################################C1049), address(this), block.timestamp);
   [1] Router.swapExactETHForTokens{value: 10.0 ether}(0, path:(WETH  0x93################################C1049), address(this), block.timestamp);
   [1] Router.swapExactETHForTokens{value: 2154.9386 ether}(0, path:(WETH  0x93################################C1049), address(this), block.timestamp);
   [1] 0x93################################C1049.setDonationFeePercent{value: 1.6441 ether}(4716951651845078788567304495172768098799889453091605.7880 ether)

[32m INFO[0m ==========================================
[32m INFO[0m [Testcase #0] run time: 0h-0m-16s, clients: 1, corpus: 47, objectives: 0, executions: 324, exec/sec: 267.3
[32m INFO[0m ============= Coverage Summary =============
[32m INFO[0m 0x93################################c1049: 44.24% Instruction Covered, 41.81% Branch Covered
[32m INFO[0m 0xbb################################c095c: 11.03% Instruction Covered, 13.16% Branch Covered
[32m INFO[0m [Stats #0] run time: 0h-0m-16s, clients: 1, corpus: 47, objectives: 0, executions: 324, exec/sec: 266.5
[32m INFO[0m ============= New Corpus Item =============
[32m INFO[0m Reverted? true 
 Txn:
[Sender] 0x35################################31dDb
   [1] Router.swapExactETHForTokens{value: 4704.5463 ether}(0, path:(WETH  0x93################################C1049), address(this), block.timestamp);
   [1] Router.swapExactETHForTokens{value: 2066.3991 ether}(0, path:(WETH  0x93################################C1049), address(this), block.timestamp);
   [1] Router.swapExactETHForTokens{value: 545.9226 ether}(0, path:(WETH  0x93################################C1049), address(this), block.timestamp);
[Sender] 0xe1################################c8510
   [1] 0x93################################C1049.increaseAllowance(0x68################################c9024, 1267650600228.3014 ether)
       0x01
   [1] 0x93################################C1049.setLiquidityFeePercent(115792082335780474823282356206318157173573965420331983850108.3159 ether)
       0x08################################000000000000000000000000000000000002000000000000000000000000000000000000000000000000000000000000000204f776e61626c653a2063616c6c6572206973206e6f7420746865206f776e6572

[32m INFO[0m ==========================================
[32m INFO[0m [Testcase #0] run time: 0h-0m-16s, clients: 1, corpus: 48, objectives: 0, executions: 353, exec/sec: 290.2
[32m INFO[0m [Stats #0] run time: 0h-0m-16s, clients: 1, corpus: 48, objectives: 0, executions: 353, exec/sec: 290.2
[32m INFO[0m ============= New Corpus Item =============
[32m INFO[0m Reverted? true 
 Txn:
[Sender] 0x35################################31dDb
   [1] Router.swapExactETHForTokens{value: 4704.5463 ether}(0, path:(WETH  0x93################################C1049), address(this), block.timestamp);
   [1] Router.swapExactETHForTokens{value: 885.6552 ether}(0, path:(WETH  0x93################################C1049), address(this), block.timestamp);
[Sender] 0xe1################################c8510
   [1] 0x93################################C1049.approve(0x8E################################d79dd, 45408847812079762436404254078829475632051818528490912841975.8755 ether)
       0x01
   [1] 0x93################################C1049.increaseAllowance(0x8E################################d79dd, 28269558076668354095581478840358279143858338278944866115.1970 ether)
       0x01
[Sender] 0x68################################c9024
   [1] 0x93################################C1049.setLiquidityFeePercent{value: 1}(26650365783808407618299029336127686814625620906673.4525 ether)

[32m INFO[0m ==========================================
[32m INFO[0m [Testcase #0] run time: 0h-0m-16s, clients: 1, corpus: 49, objectives: 0, executions: 354, exec/sec: 290.9
[32m INFO[0m ============= Coverage Summary =============
[32m INFO[0m 0xbb################################c095c: 11.03% Instruction Covered, 13.16% Branch Covered
[32m INFO[0m 0x93################################c1049: 44.30% Instruction Covered, 42.09% Branch Covered
[32m INFO[0m [Stats #0] run time: 0h-0m-16s, clients: 1, corpus: 49, objectives: 0, executions: 354, exec/sec: 290.0
[32m INFO[0m ============= New Corpus Item =============
[32m INFO[0m Reverted? true 
 Txn:
[Sender] 0x35################################31dDb
   [1] Router.swapExactETHForTokens{value: 4704.5463 ether}(0, path:(WETH  0x93################################C1049), address(this), block.timestamp);
   [1] Router.swapExactETHForTokens{value: 885.6552 ether}(0, path:(WETH  0x93################################C1049), address(this), block.timestamp);
   [1] Router.swapExactETHForTokens{value: 2293.1178 ether}(0, path:(WETH  0x93################################C1049), address(this), block.timestamp);
   [1] 0x93################################C1049.deliver(0.4503 ether)
[Sender] 0x68################################c9024
   [1] 0x93################################C1049.setMaxTxPercent(0)
       0x08################################000000000000000000000000000000000002000000000000000000000000000000000000000000000000000000000000000204f776e61626c653a2063616c6c6572206973206e6f7420746865206f776e6572

[32m INFO[0m ==========================================
[32m INFO[0m [Testcase #0] run time: 0h-0m-16s, clients: 1, corpus: 50, objectives: 0, executions: 385, exec/sec: 315.2
[32m INFO[0m [Stats #0] run time: 0h-0m-16s, clients: 1, corpus: 50, objectives: 0, executions: 385, exec/sec: 315.0
[32m INFO[0m ============= New Corpus Item =============
[32m INFO[0m Reverted? true 
 Txn:
[Sender] 0x35################################31dDb
   [1] Router.swapExactETHForTokens{value: 10.0 ether}(0, path:(WETH  0x93################################C1049), address(this), block.timestamp);
   [1] Router.swapExactETHForTokens{value: 10.0 ether}(0, path:(WETH  0x93################################C1049), address(this), block.timestamp);
[Sender] 0x68################################c9024
   [1] 0x93################################C1049.setMaxTxPercent{value: 2458.6780 ether}(2695995426740722070688451740450706141971474797242152.3814 ether)

[32m INFO[0m ==========================================
[32m INFO[0m [Testcase #0] run time: 0h-0m-16s, clients: 1, corpus: 51, objectives: 0, executions: 396, exec/sec: 323.9
[32m INFO[0m ============= Coverage Summary =============
[32m INFO[0m 0xbb################################c095c: 11.03% Instruction Covered, 13.16% Branch Covered
[32m INFO[0m 0x93################################c1049: 44.35% Instruction Covered, 42.37% Branch Covered
[32m INFO[0m [Stats #0] run time: 0h-0m-16s, clients: 1, corpus: 51, objectives: 0, executions: 396, exec/sec: 323.1
[32m INFO[0m ============= New Corpus Item =============
[32m INFO[0m Reverted? true 
 Txn:
[Sender] 0x35################################31dDb
   [1] Router.swapExactETHForTokens{value: 4704.5463 ether}(0, path:(WETH  0x93################################C1049), address(this), block.timestamp);
   [1] Router.swapExactETHForTokens{value: 2542.4365 ether}(0, path:(WETH  0x93################################C1049), address(this), block.timestamp);
   [1] Router.swapExactETHForTokens{value: 2519.4233 ether}(0, path:(WETH  0x93################################C1049), address(this), block.timestamp);
[Sender] 0xe1################################c8510
   [1] 0x93################################C1049.setSwapAndLiquifyEnabled(true)

[32m INFO[0m ==========================================
[32m INFO[0m [Testcase #0] run time: 0h-0m-16s, clients: 1, corpus: 52, objectives: 0, executions: 417, exec/sec: 340.1
[32m INFO[0m [Stats #0] run time: 0h-0m-16s, clients: 1, corpus: 52, objectives: 0, executions: 417, exec/sec: 340.0
[32m INFO[0m ============= New Corpus Item =============
[32m INFO[0m Reverted? true 
 Txn:
[Sender] 0x35################################31dDb
   [1] Router.swapExactETHForTokens{value: 4704.5463 ether}(0, path:(WETH  0x93################################C1049), address(this), block.timestamp);
   [1] Router.swapExactETHForTokens{value: 10.0 ether}(0, path:(WETH  0x93################################C1049), address(this), block.timestamp);
   [1] Router.swapExactETHForTokens{value: 10.0 ether}(0, path:(WETH  0x93################################C1049), address(this), block.timestamp);
[Sender] 0xe1################################c8510
   [1] 0x93################################C1049.increaseAllowance(0x68################################c9024, 13374661041906762710636303139672503076737064793682.9040 ether)
       0x01
   [1] 0x93################################C1049.increaseAllowance(0x68################################c9024, 4900172899786533471564908316406131912520505244036649251302.1011 ether)
       0x01
   [1] 0x93################################C1049.setSwapAndLiquifyEnabled(false)
       0x08################################000000000000000000000000000000000002000000000000000000000000000000000000000000000000000000000000000204f776e61626c653a2063616c6c6572206973206e6f7420746865206f776e6572

[32m INFO[0m ==========================================
[32m INFO[0m [Testcase #0] run time: 0h-0m-16s, clients: 1, corpus: 53, objectives: 0, executions: 421, exec/sec: 343.1
[32m INFO[0m [Stats #0] run time: 0h-0m-16s, clients: 1, corpus: 53, objectives: 0, executions: 421, exec/sec: 343.1
[32m INFO[0m ============= New Corpus Item =============
[32m INFO[0m Reverted? true 
 Txn:
[Sender] 0x35################################31dDb
   [1] Router.swapExactETHForTokens{value: 4704.5463 ether}(0, path:(WETH  0x93################################C1049), address(this), block.timestamp);
   [1] Router.swapExactETHForTokens{value: 885.6552 ether}(0, path:(WETH  0x93################################C1049), address(this), block.timestamp);
[Sender] 0xe1################################c8510
   [1] 0x93################################C1049.approve(0x8E################################d79dd, 45408847812079762436404254078829475632051818528490912841975.8755 ether)
       0x01
   [1] 0x93################################C1049.increaseAllowance(0x8E################################d79dd, 28269558076668354095581478840358279143858338278944866115.1970 ether)
       0x01
   [1] 0x93################################C1049.setSwapAndLiquifyEnabled{value: 0.4503 ether}(true)

[32m INFO[0m ==========================================
[32m INFO[0m [Testcase #0] run time: 0h-0m-16s, clients: 1, corpus: 54, objectives: 0, executions: 423, exec/sec: 344.5
[32m INFO[0m ============= Coverage Summary =============
[32m INFO[0m 0xbb################################c095c: 11.03% Instruction Covered, 13.16% Branch Covered
[32m INFO[0m 0x93################################c1049: 44.45% Instruction Covered, 42.94% Branch Covered
[32m INFO[0m [Stats #0] run time: 0h-0m-16s, clients: 1, corpus: 54, objectives: 0, executions: 423, exec/sec: 343.6
[32m INFO[0m ============= New Corpus Item =============
[32m INFO[0m Reverted? true 
 Txn:
[Sender] 0x35################################31dDb
   [1] Router.swapExactETHForTokens{value: 4704.5463 ether}(0, path:(WETH  0x93################################C1049), address(this), block.timestamp);
   [1] Router.swapExactETHForTokens{value: 2542.4365 ether}(0, path:(WETH  0x93################################C1049), address(this), block.timestamp);
   [1] 0x93################################C1049.setTaxFeePercent(210624583337114373395836055367340864637790205170.3179 ether)
       0x08################################000000000000000000000000000000000002000000000000000000000000000000000000000000000000000000000000000204f776e61626c653a2063616c6c6572206973206e6f7420746865206f776e6572

[32m INFO[0m ==========================================
[32m INFO[0m [Testcase #0] run time: 0h-0m-16s, clients: 1, corpus: 55, objectives: 0, executions: 449, exec/sec: 364.6
[32m INFO[0m [Stats #0] run time: 0h-0m-16s, clients: 1, corpus: 55, objectives: 0, executions: 449, exec/sec: 364.3
[32m INFO[0m ============= New Corpus Item =============
[32m INFO[0m Reverted? true 
 Txn:
[Sender] 0x35################################31dDb
   [1] Router.swapExactETHForTokens{value: 4704.5463 ether}(0, path:(WETH  0x93################################C1049), address(this), block.timestamp);
   [1] 0x93################################C1049.setTaxFeePercent{value: 2355.4133 ether}(421249166674242010135105393033231828157370423779.5301 ether)

[32m INFO[0m ==========================================
[32m INFO[0m [Testcase #0] run time: 0h-0m-16s, clients: 1, corpus: 56, objectives: 0, executions: 468, exec/sec: 379.5
[32m INFO[0m ============= Coverage Summary =============
[32m INFO[0m 0x93################################c1049: 44.50% Instruction Covered, 43.22% Branch Covered
[32m INFO[0m 0xbb################################c095c: 11.03% Instruction Covered, 13.16% Branch Covered
[32m INFO[0m [Stats #0] run time: 0h-0m-16s, clients: 1, corpus: 56, objectives: 0, executions: 468, exec/sec: 363.5
[32m INFO[0m ============= New Corpus Item =============
[32m INFO[0m Reverted? true 
 Txn:
[Sender] 0x35################################31dDb
   [1] Router.swapExactETHForTokens{value: 4704.5463 ether}(0, path:(WETH  0x93################################C1049), address(this), block.timestamp);
[Sender] 0xe1################################c8510
   [1] 0x93################################C1049.transfer(0x00################################00000, 71155319444609185467298381386951078153529870713123.1020 ether)
       0x08################################0000000000000000000000000000000000020000000000000000000000000000000000000000000000000000000000000002345524332303a207472616e7366657220746f20746865207a65726f20616464726573730000000000000000000000000000000000000000000000000000000000

[32m INFO[0m ==========================================
[32m INFO[0m [Testcase #0] run time: 0h-0m-16s, clients: 1, corpus: 57, objectives: 0, executions: 482, exec/sec: 374.0
[32m INFO[0m [Stats #0] run time: 0h-0m-16s, clients: 1, corpus: 57, objectives: 0, executions: 482, exec/sec: 373.7
[32m INFO[0m ============= New Corpus Item =============
[32m INFO[0m Reverted? true 
 Txn:
[Sender] 0xe1################################c8510
   [1] 0x93################################C1049.transfer{value: 549772595399}(0x68################################c9024, 48444456279650296279282210572033487066333220776428504041.2538 ether)

[32m INFO[0m ==========================================
[32m INFO[0m [Testcase #0] run time: 0h-0m-16s, clients: 1, corpus: 58, objectives: 0, executions: 488, exec/sec: 378.0
[32m INFO[0m [Stats #0] run time: 0h-0m-16s, clients: 1, corpus: 58, objectives: 0, executions: 488, exec/sec: 377.8
[32m INFO[0m ============= New Corpus Item =============
[32m INFO[0m Reverted? true 
 Txn:
[Sender] 0x35################################31dDb
   [1] Router.swapExactETHForTokens{value: 0.2814 ether}(0, path:(WETH  0x93################################C1049), address(this), block.timestamp);
[Sender] 0x68################################c9024
   [1] 0x93################################C1049.transfer(0x68################################c9024, 115634535838429906746550637171655501339222624058626069386714.5558 ether)
       0x08################################000000000000000000000000000000000002000000000000000000000000000000000000000000000000000000000000000285472616e7366657220616d6f756e74206578636565647320746865206d61785478416d6f756e742e000000000000000000000000000000000000000000000000

[32m INFO[0m ==========================================
[32m INFO[0m [Testcase #0] run time: 0h-0m-16s, clients: 1, corpus: 59, objectives: 0, executions: 493, exec/sec: 381.4
[32m INFO[0m [Stats #0] run time: 0h-0m-17s, clients: 1, corpus: 59, objectives: 0, executions: 493, exec/sec: 337.1
[32m INFO[0m ============= New Corpus Item =============
[32m INFO[0m Reverted? true 
 Txn:
[Sender] 0xe1################################c8510
   [1] 0x93################################C1049.increaseAllowance(0x68################################c9024, 7237226433215359512017449466321911117960903185517266008102.1018 ether)
       0x01
[Sender] 0x8E################################d79dd
   [1] 0x93################################C1049.transfer(0x93################################C1049, 2940)
       0x4e################################0000000000000000000000000000000000011

[32m INFO[0m ==========================================
[32m INFO[0m [Testcase #0] run time: 0h-0m-17s, clients: 1, corpus: 60, objectives: 0, executions: 499, exec/sec: 340.9
[32m INFO[0m ============= Coverage Summary =============
[32m INFO[0m 0x93################################c1049: 45.17% Instruction Covered, 44.07% Branch Covered
[32m INFO[0m 0xbb################################c095c: 11.03% Instruction Covered, 13.16% Branch Covered
[32m INFO[0m [Stats #0] run time: 0h-0m-17s, clients: 1, corpus: 60, objectives: 0, executions: 499, exec/sec: 322.8
[32m INFO[0m ============= New Corpus Item =============
[32m INFO[0m Reverted? true 
 Txn:
[Sender] 0x35################################31dDb
   [1] Router.swapExactETHForTokens{value: 4704.5463 ether}(0, path:(WETH  0x93################################C1049), address(this), block.timestamp);
   [1] Router.swapExactETHForTokens{value: 10.0 ether}(0, path:(WETH  0x93################################C1049), address(this), block.timestamp);
   [1] Router.swapExactETHForTokens{value: 1099511594887}(0, path:(WETH  0x93################################C1049), address(this), block.timestamp);
[Sender] 0x8E################################d79dd
   [1] 0x93################################C1049.transferFrom{value: 4294973018}(0xe1################################c8510, 0x35################################31dDb, 75557.8637 ether)

[32m INFO[0m ==========================================
[32m INFO[0m [Testcase #0] run time: 0h-0m-17s, clients: 1, corpus: 61, objectives: 0, executions: 513, exec/sec: 331.6
[32m INFO[0m [Stats #0] run time: 0h-0m-17s, clients: 1, corpus: 61, objectives: 0, executions: 513, exec/sec: 331.6
[32m INFO[0m ============= New Corpus Item =============
[32m INFO[0m Reverted? true 
 Txn:
[Sender] 0x8E################################d79dd
   [1] 0x93################################C1049.transferFrom(0x68################################c9024, 0x00################################00000, 0)
       0x08################################0000000000000000000000000000000000020000000000000000000000000000000000000000000000000000000000000002345524332303a207472616e7366657220746f20746865207a65726f20616464726573730000000000000000000000000000000000000000000000000000000000

[32m INFO[0m ==========================================
[32m INFO[0m [Testcase #0] run time: 0h-0m-17s, clients: 1, corpus: 62, objectives: 0, executions: 515, exec/sec: 332.8
[32m INFO[0m [Stats #0] run time: 0h-0m-17s, clients: 1, corpus: 62, objectives: 0, executions: 515, exec/sec: 332.7
[32m INFO[0m ============= New Corpus Item =============
[32m INFO[0m Reverted? true 
 Txn:
[Sender] 0x35################################31dDb
   [1] Router.swapExactETHForTokens{value: 4704.5463 ether}(0, path:(WETH  0x93################################C1049), address(this), block.timestamp);
   [1] Router.swapExactETHForTokens{value: 885.6552 ether}(0, path:(WETH  0x93################################C1049), address(this), block.timestamp);
[Sender] 0xe1################################c8510
   [1] 0x93################################C1049.approve(0x8E################################d79dd, 45408847812079762436404254078829475632051818528490912841975.8755 ether)
       0x01
[Sender] 0x8E################################d79dd
   [1] 0x93################################C1049.transferFrom(0x00################################00000, 0x8E################################d79dd, 181831001576603997137819716231363258057225802910811620.3466 ether)
       0x08################################0000000000000000000000000000000000020000000000000000000000000000000000000000000000000000000000000002545524332303a207472616e736665722066726f6d20746865207a65726f2061646472657373000000000000000000000000000000000000000000000000000000

[32m INFO[0m ==========================================
[32m INFO[0m [Testcase #0] run time: 0h-0m-17s, clients: 1, corpus: 63, objectives: 0, executions: 516, exec/sec: 333.2
[32m INFO[0m ============= Coverage Summary =============
[32m INFO[0m 0x93################################c1049: 45.23% Instruction Covered, 44.35% Branch Covered
[32m INFO[0m 0xbb################################c095c: 11.03% Instruction Covered, 13.16% Branch Covered
[32m INFO[0m [Stats #0] run time: 0h-0m-17s, clients: 1, corpus: 63, objectives: 0, executions: 516, exec/sec: 332.2
[32m INFO[0m ============= New Corpus Item =============
[32m INFO[0m Reverted? true 
 Txn:
[Sender] 0x35################################31dDb
   [1] Router.swapExactETHForTokens{value: 4704.5463 ether}(0, path:(WETH  0x93################################C1049), address(this), block.timestamp);
   [1] Router.swapExactETHForTokens{value: 2139.8223 ether}(0, path:(WETH  0x93################################C1049), address(this), block.timestamp);
[Sender] 0x68################################c9024
   [1] 0x93################################C1049.transferOwnership{value: 4382.3723 ether}(0x8E################################d79dd)

[32m INFO[0m ==========================================
[32m INFO[0m [Testcase #0] run time: 0h-0m-17s, clients: 1, corpus: 64, objectives: 0, executions: 545, exec/sec: 350.8
[32m INFO[0m [Stats #0] run time: 0h-0m-17s, clients: 1, corpus: 64, objectives: 0, executions: 545, exec/sec: 350.7
[32m INFO[0m ============= New Corpus Item =============
[32m INFO[0m Reverted? true 
 Txn:
[Sender] 0x35################################31dDb
   [1] Router.swapExactETHForTokens{value: 10.0 ether}(0, path:(WETH  0x93################################C1049), address(this), block.timestamp);
[Sender] 0x68################################c9024
   [1] 0x93################################C1049.transferOwnership(0x00################################00000)
       0x08################################000000000000000000000000000000000002000000000000000000000000000000000000000000000000000000000000000204f776e61626c653a2063616c6c6572206973206e6f7420746865206f776e6572

[32m INFO[0m ==========================================
[32m INFO[0m [Testcase #0] run time: 0h-0m-17s, clients: 1, corpus: 65, objectives: 0, executions: 546, exec/sec: 351.2
[32m INFO[0m ============= Coverage Summary =============
[32m INFO[0m 0x93################################c1049: 45.28% Instruction Covered, 44.63% Branch Covered
[32m INFO[0m 0xbb################################c095c: 11.03% Instruction Covered, 13.16% Branch Covered
[32m INFO[0m [Stats #0] run time: 0h-0m-17s, clients: 1, corpus: 65, objectives: 0, executions: 546, exec/sec: 350.2
[32m INFO[0m ============= New Corpus Item =============
[32m INFO[0m Reverted? false 
 Txn:
[Sender] 0x35################################31dDb
   [1] Router.swapExactETHForTokens{value: 4704.5463 ether}(0, path:(WETH  0x93################################C1049), address(this), block.timestamp);
   [1] Router.swapExactETHForTokens{value: 2066.3991 ether}(0, path:(WETH  0x93################################C1049), address(this), block.timestamp);
[Sender] 0x68################################c9024
   [1] 0x93################################C1049.approve(0x8E################################d79dd, 55245746275547296473369622195951401537598057298347929995.7600 ether)
       0x01
[Sender] 0xe1################################c8510
   [1] 0x93################################C1049.increaseAllowance(0x8E################################d79dd, 232608685847305947788678520603835954115161159886752273.8215 ether)
       0x01
[Sender] 0x8E################################d79dd
   [1] 0x93################################C1049.call{value: 0}()

[32m INFO[0m ==========================================
[32m INFO[0m [Testcase #0] run time: 0h-0m-17s, clients: 1, corpus: 66, objectives: 0, executions: 577, exec/sec: 369.9
[32m INFO[0m ============= Coverage Summary =============
[32m INFO[0m 0x93################################c1049: 45.28% Instruction Covered, 44.63% Branch Covered
[32m INFO[0m 0xbb################################c095c: 11.03% Instruction Covered, 13.16% Branch Covered
[32m INFO[0m [Stats #0] run time: 0h-0m-17s, clients: 1, corpus: 66, objectives: 0, executions: 577, exec/sec: 283.7
[32m INFO[0m ============= New Corpus Item =============
[32m INFO[0m Reverted? false 
 Txn:
[Sender] 0x35################################31dDb
   [1] Router.swapExactETHForTokens{value: 4704.5463 ether}(0, path:(WETH  0x93################################C1049), address(this), block.timestamp);
   [1] Router.swapExactETHForTokens{value: 885.6552 ether}(0, path:(WETH  0x93################################C1049), address(this), block.timestamp);
   [1] Router.swapExactETHForTokens{value: 2293.1178 ether}(0, path:(WETH  0x93################################C1049), address(this), block.timestamp);
   [1] 0x93################################C1049.deliver(0.4503 ether)

[32m INFO[0m ==========================================
[32m INFO[0m [Testcase #0] run time: 0h-0m-17s, clients: 1, corpus: 67, objectives: 0, executions: 1020, exec/sec: 501.3
[32m INFO[0m ============= Coverage Summary =============
[32m INFO[0m 0x93################################c1049: 45.28% Instruction Covered, 44.63% Branch Covered
[32m INFO[0m 0xbb################################c095c: 11.03% Instruction Covered, 13.16% Branch Covered
[32m INFO[0m [Stats #0] run time: 0h-0m-17s, clients: 1, corpus: 67, objectives: 0, executions: 1376, exec/sec: 617.6
[32m INFO[0m [Stats #0] run time: 0h-0m-18s, clients: 1, corpus: 67, objectives: 0, executions: 8602, exec/sec: 2.657k
[32m INFO[0m [Stats #0] run time: 0h-0m-19s, clients: 1, corpus: 67, objectives: 0, executions: 8602, exec/sec: 2.055k
[32m INFO[0m ============= New Corpus Item =============
[32m INFO[0m Reverted? false 
 Txn:
[Sender] 0x35################################31dDb
   [1] Router.swapExactETHForTokens{value: 4704.5463 ether}(0, path:(WETH  0x93################################C1049), address(this), block.timestamp);
   [1] Router.swapExactETHForTokens{value: 4560.6685 ether}(0, path:(WETH  0x93################################C1049), address(this), block.timestamp);
   [1] Router.swapExactETHForTokens{value: 10.0 ether}(0, path:(WETH  0x93################################C1049), address(this), block.timestamp);
   [1] 0x93################################C1049.deliver(0.4503 ether)
[Sender] 0xe1################################c8510
   [1] 0x93################################C1049.decreaseAllowance(0x93################################C1049, 0)
       0x01

[32m INFO[0m ==========================================
[32m INFO[0m [Testcase #0] run time: 0h-0m-19s, clients: 1, corpus: 68, objectives: 0, executions: 19349, exec/sec: 4.623k
[32m INFO[0m ============= Coverage Summary =============
[32m INFO[0m 0x93################################c1049: 45.28% Instruction Covered, 44.63% Branch Covered
[32m INFO[0m 0xbb################################c095c: 11.03% Instruction Covered, 13.16% Branch Covered
[32m INFO[0m [Stats #0] run time: 0h-0m-19s, clients: 1, corpus: 68, objectives: 0, executions: 19950, exec/sec: 4.697k
[32m INFO[0m [Stats #0] run time: 0h-0m-20s, clients: 1, corpus: 68, objectives: 0, executions: 30885, exec/sec: 5.886k
[32m INFO[0m [Stats #0] run time: 0h-0m-21s, clients: 1, corpus: 68, objectives: 0, executions: 41977, exec/sec: 6.719k
[32m INFO[0m [Stats #0] run time: 0h-0m-22s, clients: 1, corpus: 68, objectives: 0, executions: 54705, exec/sec: 7.543k
[32m INFO[0m [Stats #0] run time: 0h-0m-23s, clients: 1, corpus: 68, objectives: 0, executions: 67140, exec/sec: 8.130k
[32m INFO[0m [Stats #0] run time: 0h-0m-24s, clients: 1, corpus: 68, objectives: 0, executions: 67140, exec/sec: 7.327k
[32m INFO[0m ============= New Corpus Item =============
[32m INFO[0m Reverted? false 
 Txn:
[Sender] 0x35################################31dDb
   [1] Router.swapExactETHForTokens{value: 4704.5463 ether}(0, path:(WETH  0x93################################C1049), address(this), block.timestamp);
   [1] 0x93################################C1049.transfer(0x68################################c9024, 2244)
       0x01

[32m INFO[0m ==========================================
[32m INFO[0m [Testcase #0] run time: 0h-0m-24s, clients: 1, corpus: 69, objectives: 0, executions: 78458, exec/sec: 8.562k
[32m INFO[0m ============= Coverage Summary =============
[32m INFO[0m 0x93################################c1049: 45.28% Instruction Covered, 44.63% Branch Covered
[32m INFO[0m 0xbb################################c095c: 11.03% Instruction Covered, 13.16% Branch Covered
[32m INFO[0m [Stats #0] run time: 0h-0m-24s, clients: 1, corpus: 69, objectives: 0, executions: 79344, exec/sec: 8.569k
[32m INFO[0m [Stats #0] run time: 0h-0m-26s, clients: 1, corpus: 69, objectives: 0, executions: 89548, exec/sec: 8.037k
[32m INFO[0m [Stats #0] run time: 0h-0m-27s, clients: 1, corpus: 69, objectives: 0, executions: 100997, exec/sec: 8.317k
[32m INFO[0m [Stats #0] run time: 0h-0m-28s, clients: 1, corpus: 69, objectives: 0, executions: 113373, exec/sec: 8.625k
[32m INFO[0m [Stats #0] run time: 0h-0m-29s, clients: 1, corpus: 69, objectives: 0, executions: 125012, exec/sec: 8.837k
[32m INFO[0m [Stats #0] run time: 0h-0m-30s, clients: 1, corpus: 69, objectives: 0, executions: 137067, exec/sec: 9.049k
[32m INFO[0m [Stats #0] run time: 0h-0m-31s, clients: 1, corpus: 69, objectives: 0, executions: 148966, exec/sec: 9.225k
[32m INFO[0m [Stats #0] run time: 0h-0m-32s, clients: 1, corpus: 69, objectives: 0, executions: 160411, exec/sec: 9.352k
[32m INFO[0m [Stats #0] run time: 0h-0m-33s, clients: 1, corpus: 69, objectives: 0, executions: 172658, exec/sec: 9.511k
[32m INFO[0m [Stats #0] run time: 0h-0m-34s, clients: 1, corpus: 69, objectives: 0, executions: 184486, exec/sec: 9.629k
[32m INFO[0m [Stats #0] run time: 0h-0m-35s, clients: 1, corpus: 69, objectives: 0, executions: 195933, exec/sec: 9.718k
[32m INFO[0m [Stats #0] run time: 0h-0m-36s, clients: 1, corpus: 69, objectives: 0, executions: 208175, exec/sec: 9.833k
[32m INFO[0m [Stats #0] run time: 0h-0m-37s, clients: 1, corpus: 69, objectives: 0, executions: 219874, exec/sec: 9.916k
[32m INFO[0m [Stats #0] run time: 0h-0m-38s, clients: 1, corpus: 69, objectives: 0, executions: 231799, exec/sec: 10.00k
[32m INFO[0m [Stats #0] run time: 0h-0m-39s, clients: 1, corpus: 69, objectives: 0, executions: 243470, exec/sec: 10.07k
[32m INFO[0m [Stats #0] run time: 0h-0m-40s, clients: 1, corpus: 69, objectives: 0, executions: 255268, exec/sec: 10.14k
[32m INFO[0m [Stats #0] run time: 0h-0m-41s, clients: 1, corpus: 69, objectives: 0, executions: 267386, exec/sec: 10.21k
[32m INFO[0m [Stats #0] run time: 0h-0m-42s, clients: 1, corpus: 69, objectives: 0, executions: 278867, exec/sec: 10.26k
[32m INFO[0m [Stats #0] run time: 0h-0m-43s, clients: 1, corpus: 69, objectives: 0, executions: 290636, exec/sec: 10.31k
[32m INFO[0m [Stats #0] run time: 0h-0m-44s, clients: 1, corpus: 69, objectives: 0, executions: 302914, exec/sec: 10.38k
[32m INFO[0m [Stats #0] run time: 0h-0m-45s, clients: 1, corpus: 69, objectives: 0, executions: 314679, exec/sec: 10.42k
[32m INFO[0m [Stats #0] run time: 0h-0m-46s, clients: 1, corpus: 69, objectives: 0, executions: 326379, exec/sec: 10.46k
[32m INFO[0m [Stats #0] run time: 0h-0m-47s, clients: 1, corpus: 69, objectives: 0, executions: 338333, exec/sec: 10.50k
[32m INFO[0m [Stats #0] run time: 0h-0m-48s, clients: 1, corpus: 69, objectives: 0, executions: 350004, exec/sec: 10.54k
[32m INFO[0m [Stats #0] run time: 0h-0m-49s, clients: 1, corpus: 69, objectives: 0, executions: 361738, exec/sec: 10.57k
[32m INFO[0m [Stats #0] run time: 0h-0m-50s, clients: 1, corpus: 69, objectives: 0, executions: 373730, exec/sec: 10.61k
[32m INFO[0m [Stats #0] run time: 0h-0m-51s, clients: 1, corpus: 69, objectives: 0, executions: 385436, exec/sec: 10.64k
[32m INFO[0m [Stats #0] run time: 0h-0m-52s, clients: 1, corpus: 69, objectives: 0, executions: 397814, exec/sec: 10.68k
[32m INFO[0m [Stats #0] run time: 0h-0m-53s, clients: 1, corpus: 69, objectives: 0, executions: 409202, exec/sec: 10.70k
[32m INFO[0m [Stats #0] run time: 0h-0m-54s, clients: 1, corpus: 69, objectives: 0, executions: 420973, exec/sec: 10.73k
[32m INFO[0m [Stats #0] run time: 0h-0m-55s, clients: 1, corpus: 69, objectives: 0, executions: 433186, exec/sec: 10.76k
[32m INFO[0m [Stats #0] run time: 0h-0m-56s, clients: 1, corpus: 69, objectives: 0, executions: 444922, exec/sec: 10.79k
[32m INFO[0m [Stats #0] run time: 0h-0m-57s, clients: 1, corpus: 69, objectives: 0, executions: 456621, exec/sec: 10.81k
[32m INFO[0m [Stats #0] run time: 0h-0m-58s, clients: 1, corpus: 69, objectives: 0, executions: 468550, exec/sec: 10.83k
[32m INFO[0m [Stats #0] run time: 0h-0m-59s, clients: 1, corpus: 69, objectives: 0, executions: 480315, exec/sec: 10.85k
[32m INFO[0m [Stats #0] run time: 0h-1m-0s, clients: 1, corpus: 69, objectives: 0, executions: 492340, exec/sec: 10.88k
[32m INFO[0m [Stats #0] run time: 0h-1m-1s, clients: 1, corpus: 69, objectives: 0, executions: 504267, exec/sec: 10.90k
[32m INFO[0m [Stats #0] run time: 0h-1m-2s, clients: 1, corpus: 69, objectives: 0, executions: 515745, exec/sec: 10.91k
[32m INFO[0m [Stats #0] run time: 0h-1m-3s, clients: 1, corpus: 69, objectives: 0, executions: 528059, exec/sec: 10.94k
[32m INFO[0m [Stats #0] run time: 0h-1m-4s, clients: 1, corpus: 69, objectives: 0, executions: 539730, exec/sec: 10.95k
[32m INFO[0m [Stats #0] run time: 0h-1m-5s, clients: 1, corpus: 69, objectives: 0, executions: 551494, exec/sec: 10.97k
[32m INFO[0m [Stats #0] run time: 0h-1m-6s, clients: 1, corpus: 69, objectives: 0, executions: 563390, exec/sec: 10.99k
[32m INFO[0m [Stats #0] run time: 0h-1m-7s, clients: 1, corpus: 69, objectives: 0, executions: 575096, exec/sec: 11.00k
[32m INFO[0m [Stats #0] run time: 0h-1m-8s, clients: 1, corpus: 69, objectives: 0, executions: 587279, exec/sec: 11.02k
[32m INFO[0m [Stats #0] run time: 0h-1m-9s, clients: 1, corpus: 69, objectives: 0, executions: 598788, exec/sec: 11.03k
[32m INFO[0m [Stats #0] run time: 0h-1m-10s, clients: 1, corpus: 69, objectives: 0, executions: 610388, exec/sec: 11.04k
[32m INFO[0m [Stats #0] run time: 0h-1m-11s, clients: 1, corpus: 69, objectives: 0, executions: 622245, exec/sec: 11.05k
[32m INFO[0m [Stats #0] run time: 0h-1m-12s, clients: 1, corpus: 69, objectives: 0, executions: 633975, exec/sec: 11.06k
[32m INFO[0m [Stats #0] run time: 0h-1m-13s, clients: 1, corpus: 69, objectives: 0, executions: 645649, exec/sec: 11.07k
[32m INFO[0m [Stats #0] run time: 0h-1m-14s, clients: 1, corpus: 69, objectives: 0, executions: 657645, exec/sec: 11.09k
[32m INFO[0m [Stats #0] run time: 0h-1m-15s, clients: 1, corpus: 69, objectives: 0, executions: 669281, exec/sec: 11.10k
[32m INFO[0m [Stats #0] run time: 0h-1m-16s, clients: 1, corpus: 69, objectives: 0, executions: 681080, exec/sec: 11.11k
[32m INFO[0m [Stats #0] run time: 0h-1m-17s, clients: 1, corpus: 69, objectives: 0, executions: 693102, exec/sec: 11.12k
[32m INFO[0m [Stats #0] run time: 0h-1m-18s, clients: 1, corpus: 69, objectives: 0, executions: 704676, exec/sec: 11.13k
[32m INFO[0m [Stats #0] run time: 0h-1m-19s, clients: 1, corpus: 69, objectives: 0, executions: 716377, exec/sec: 11.14k
[32m INFO[0m [Stats #0] run time: 0h-1m-20s, clients: 1, corpus: 69, objectives: 0, executions: 728683, exec/sec: 11.15k
[32m INFO[0m [Stats #0] run time: 0h-1m-21s, clients: 1, corpus: 69, objectives: 0, executions: 740163, exec/sec: 11.16k
[32m INFO[0m [Stats #0] run time: 0h-1m-22s, clients: 1, corpus: 69, objectives: 0, executions: 751737, exec/sec: 11.17k
[32m INFO[0m [Stats #0] run time: 0h-1m-23s, clients: 1, corpus: 69, objectives: 0, executions: 764017, exec/sec: 11.18k
[32m INFO[0m [Stats #0] run time: 0h-1m-24s, clients: 1, corpus: 69, objectives: 0, executions: 775268, exec/sec: 11.18k
[32m INFO[0m [Stats #0] run time: 0h-1m-25s, clients: 1, corpus: 69, objectives: 0, executions: 787070, exec/sec: 11.19k
[32m INFO[0m [Stats #0] run time: 0h-1m-26s, clients: 1, corpus: 69, objectives: 0, executions: 799350, exec/sec: 11.21k
[32m INFO[0m [Stats #0] run time: 0h-1m-27s, clients: 1, corpus: 69, objectives: 0, executions: 810862, exec/sec: 11.21k
[32m INFO[0m [Stats #0] run time: 0h-1m-28s, clients: 1, corpus: 69, objectives: 0, executions: 822658, exec/sec: 11.22k
[32m INFO[0m [Stats #0] run time: 0h-1m-29s, clients: 1, corpus: 69, objectives: 0, executions: 834746, exec/sec: 11.23k
[32m INFO[0m [Stats #0] run time: 0h-1m-30s, clients: 1, corpus: 69, objectives: 0, executions: 846419, exec/sec: 11.23k
[32m INFO[0m [Stats #0] run time: 0h-1m-31s, clients: 1, corpus: 69, objectives: 0, executions: 858153, exec/sec: 11.24k
[32m INFO[0m [Stats #0] run time: 0h-1m-32s, clients: 1, corpus: 69, objectives: 0, executions: 870048, exec/sec: 11.25k
[32m INFO[0m [Stats #0] run time: 0h-1m-34s, clients: 1, corpus: 69, objectives: 0, executions: 881690, exec/sec: 11.25k
[32m INFO[0m [Stats #0] run time: 0h-1m-34s, clients: 1, corpus: 69, objectives: 0, executions: 881690, exec/sec: 11.21k
[32m INFO[0m ============= New Corpus Item =============
[32m INFO[0m Reverted? false 
 Txn:
[Sender] 0x35################################31dDb
   [1] Router.swapExactETHForTokens{value: 4722.3664 ether}(0, path:(WETH  0x93################################C1049), address(this), block.timestamp);
   [1] 0x93################################C1049.transfer(0xe1################################c8510, 1.1529 ether)
       0x01
   [1] Router.swapExactETHForTokens{value: 0.2814 ether}(0, path:(WETH  0x93################################C1049), address(this), block.timestamp);
   [1] 0x93################################C1049.transfer(0x68################################c9024, 2244)
       0x01

[32m INFO[0m ==========================================
[32m INFO[0m [Testcase #0] run time: 0h-1m-34s, clients: 1, corpus: 70, objectives: 0, executions: 885437, exec/sec: 11.25k
[32m INFO[0m ============= Coverage Summary =============
[32m INFO[0m 0xbb################################c095c: 11.03% Instruction Covered, 13.16% Branch Covered
[32m INFO[0m 0x93################################c1049: 45.28% Instruction Covered, 44.63% Branch Covered
[32m INFO[0m [Stats #0] run time: 0h-1m-35s, clients: 1, corpus: 70, objectives: 0, executions: 892915, exec/sec: 11.25k
[32m INFO[0m [Stats #0] run time: 0h-1m-36s, clients: 1, corpus: 70, objectives: 0, executions: 904268, exec/sec: 11.25k
[32m INFO[0m [Stats #0] run time: 0h-1m-37s, clients: 1, corpus: 70, objectives: 0, executions: 915397, exec/sec: 11.25k
Timeout