[32m INFO[0m fetching abi from https://api.bscscan.com/api?module=contract&action=getabi&address=0xa0################################3932b&format=json&apikey=6ZUCAR738XJSX6WK3BGN2K8DX4RI9A875M
[32m INFO[0m fetching code from a0c7893713dd4fbe8554185e89599162c9f3932b
Contract loaded: 0xa0################################3932b
[32m INFO[0m 

 ================ EVM Fuzzer Start ===================


[32m INFO[0m Deploying contract: 0xa0################################3932b
[32m INFO[0m Contract 0xa0################################3932b deployed to: 0xa0################################3932b -> balacne is 0
[32m INFO[0m Deployed all contracts

[32m INFO[0m fetching pairs for 0xa0################################3932b
[32m INFO[0m fetching pairs for 0xa0################################3932b
[32m INFO[0m fetching code from 3429880a687140484d59bdb6d4c5dd5832355557
[32m INFO[0m fetching code from bb4cdb9cbd36b01bd1cbaebf2de08d9173bc095c
[32m INFO[0m fetching code from 8ef508aca04b32ff3ba5003177cb18bfa6cd79dd
[32m INFO[0m [Stats #0] run time: 0h-0m-20s, clients: 1, corpus: 0, objectives: 0, executions: 0, exec/sec: 0.000
[32m INFO[0m ============= New Corpus Item =============
[32m INFO[0m Reverted? false 
 Txn:
[Sender] 0x8E################################d79dd
   [1] Router.swapExactETHForTokens{value: 4722.3664 ether}(0, path:(WETH  0xa0################################3932B), address(this), block.timestamp);

[32m INFO[0m ==========================================
[32m INFO[0m [Testcase #0] run time: 0h-0m-20s, clients: 1, corpus: 14, objectives: 0, executions: 1, exec/sec: 0.000
[32m INFO[0m [Stats #0] run time: 0h-0m-20s, clients: 1, corpus: 14, objectives: 0, executions: 1, exec/sec: 0.000
[32m INFO[0m ============= New Corpus Item =============
[32m INFO[0m Reverted? true 
 Txn:
[Sender] 0x8E################################d79dd
   [1] Router.swapExactETHForTokens{value: 4722.3664 ether}(0, path:(WETH  0xa0################################3932B), address(this), block.timestamp);
   [1] Router.swapExactETHForTokens{value: 73.7869 ether}(0, path:(WETH  0xa0################################3932B), address(this), block.timestamp);

[32m INFO[0m ==========================================
[32m INFO[0m [Testcase #0] run time: 0h-0m-20s, clients: 1, corpus: 15, objectives: 0, executions: 2, exec/sec: 0.000
[32m INFO[0m ============= Coverage Summary =============
[32m INFO[0m 0xa0################################3932b: 45.60% Instruction Covered, 34.21% Branch Covered
[32m INFO[0m 0xbb################################c095c: 11.03% Instruction Covered, 13.16% Branch Covered
[32m INFO[0m [Stats #0] run time: 0h-0m-21s, clients: 1, corpus: 15, objectives: 0, executions: 2, exec/sec: 0.000
[32m INFO[0m ============= New Corpus Item =============
[32m INFO[0m Reverted? true 
 Txn:
[Sender] 0x8E################################d79dd
   [1] Router.swapExactETHForTokens{value: 4722.3664 ether}(0, path:(WETH  0xa0################################3932B), address(this), block.timestamp);
[Sender] 0x68################################c9024
   [1] 0xa0################################3932B.approve(0x00################################00000, 2117840945424173712795971505750372844813466700947467618982.4602 ether)
       0x08################################0000000000000000000000000000000000020000000000000000000000000000000000000000000000000000000000000002245524332303a20617070726f766520746f20746865207a65726f2061646472657373000000000000000000000000000000000000000000000000000000000000

[32m INFO[0m ==========================================
[32m INFO[0m [Testcase #0] run time: 0h-0m-21s, clients: 1, corpus: 16, objectives: 0, executions: 33, exec/sec: 0.000
[32m INFO[0m [Stats #0] run time: 0h-0m-21s, clients: 1, corpus: 16, objectives: 0, executions: 33, exec/sec: 0.000
[32m INFO[0m ============= New Corpus Item =============
[32m INFO[0m Reverted? true 
 Txn:
[Sender] 0x8E################################d79dd
   [1] Router.swapExactETHForTokens{value: 4722.3664 ether}(0, path:(WETH  0xa0################################3932B), address(this), block.timestamp);
[Sender] 0x68################################c9024
   [1] 0xa0################################3932B.approve{value: 457.2582 ether}(0x8E################################d79dd, 17421535957636462179768687034772417495884084890473.8869 ether)

[32m INFO[0m ==========================================
[32m INFO[0m [Testcase #0] run time: 0h-0m-21s, clients: 1, corpus: 17, objectives: 0, executions: 37, exec/sec: 0.000
[32m INFO[0m [Stats #0] run time: 0h-0m-21s, clients: 1, corpus: 17, objectives: 0, executions: 37, exec/sec: 0.000
[32m INFO[0m ============= New Corpus Item =============
[32m INFO[0m Reverted? false 
 Txn:
[Sender] 0x8E################################d79dd
   [1] Router.swapExactETHForTokens{value: 4722.3664 ether}(0, path:(WETH  0xa0################################3932B), address(this), block.timestamp);
[Sender] 0x35################################31dDb
   [1] 0xa0################################3932B.approve(0x68################################c9024, 85387853635825902492906834748294065366572340058543142690775.5880 ether)
       0x01

[32m INFO[0m ==========================================
[32m INFO[0m [Testcase #0] run time: 0h-0m-21s, clients: 1, corpus: 18, objectives: 0, executions: 38, exec/sec: 0.000
[32m INFO[0m ============= Coverage Summary =============
[32m INFO[0m 0xbb################################c095c: 11.03% Instruction Covered, 13.16% Branch Covered
[32m INFO[0m 0xa0################################3932b: 46.75% Instruction Covered, 34.87% Branch Covered
[32m INFO[0m [Stats #0] run time: 0h-0m-21s, clients: 1, corpus: 18, objectives: 0, executions: 38, exec/sec: 24.42
[32m INFO[0m ============= New Corpus Item =============
[32m INFO[0m Reverted? true 
 Txn:
[Sender] 0x8E################################d79dd
   [1] Router.swapExactETHForTokens{value: 4722.3664 ether}(0, path:(WETH  0xa0################################3932B), address(this), block.timestamp);
   [1] 0xa0################################3932B.decreaseAllowance(0x8E################################d79dd, 11647444608423251669178633725357804211933162103269108710439.1265 ether)
       0x08################################0000000000000000000000000000000000020000000000000000000000000000000000000000000000000000000000000002545524332303a2064656372656173656420616c6c6f77616e63652062656c6f77207a65726f000000000000000000000000000000000000000000000000000000

[32m INFO[0m ==========================================
[32m INFO[0m [Testcase #0] run time: 0h-0m-21s, clients: 1, corpus: 19, objectives: 0, executions: 65, exec/sec: 41.73
[32m INFO[0m [Stats #0] run time: 0h-0m-21s, clients: 1, corpus: 19, objectives: 0, executions: 65, exec/sec: 41.72
[32m INFO[0m ============= New Corpus Item =============
[32m INFO[0m Reverted? true 
 Txn:
[Sender] 0x8E################################d79dd
   [1] 0xa0################################3932B.decreaseAllowance{value: 872.8566 ether}(0xe1################################c8510, 822752278660603021077484591278675252491367932.8169 ether)

[32m INFO[0m ==========================================
[32m INFO[0m [Testcase #0] run time: 0h-0m-21s, clients: 1, corpus: 20, objectives: 0, executions: 66, exec/sec: 42.34
[32m INFO[0m ============= Coverage Summary =============
[32m INFO[0m 0xa0################################3932b: 48.77% Instruction Covered, 36.51% Branch Covered
[32m INFO[0m 0xbb################################c095c: 11.03% Instruction Covered, 13.16% Branch Covered
[32m INFO[0m [Stats #0] run time: 0h-0m-25s, clients: 1, corpus: 20, objectives: 0, executions: 96, exec/sec: 20.45
[32m INFO[0m [Stats #0] run time: 0h-0m-25s, clients: 1, corpus: 20, objectives: 0, executions: 96, exec/sec: 20.45
[32m INFO[0m ============= New Corpus Item =============
[32m INFO[0m Reverted? true 
 Txn:
[Sender] 0x8E################################d79dd
   [1] Router.swapExactETHForTokens{value: 4722.3664 ether}(0, path:(WETH  0xa0################################3932B), address(this), block.timestamp);
[Sender] 0x68################################c9024
   [1] 0xa0################################3932B.approve(0xa0################################3932B, 115339776388732929035197660848497720713218148808322660448505.8041 ether)
       0x01
[Sender] 0x8E################################d79dd
   [1] 0xa0################################3932B.excludeAccount(0x35################################31dDb)
       0x08################################000000000000000000000000000000000002000000000000000000000000000000000000000000000000000000000000000204f776e61626c653a2063616c6c6572206973206e6f7420746865206f776e6572

[32m INFO[0m ==========================================
[32m INFO[0m [Testcase #0] run time: 0h-0m-25s, clients: 1, corpus: 21, objectives: 0, executions: 97, exec/sec: 20.65
[32m INFO[0m [Stats #0] run time: 0h-0m-25s, clients: 1, corpus: 21, objectives: 0, executions: 97, exec/sec: 20.65
[32m INFO[0m ============= New Corpus Item =============
[32m INFO[0m Reverted? true 
 Txn:
[Sender] 0x8E################################d79dd
   [1] Router.swapExactETHForTokens{value: 4722.3664 ether}(0, path:(WETH  0xa0################################3932B), address(this), block.timestamp);
   [1] 0xa0################################3932B.excludeAccount{value: 12126268741}(0x00################################00000)

[32m INFO[0m ==========================================
[32m INFO[0m [Testcase #0] run time: 0h-0m-25s, clients: 1, corpus: 22, objectives: 0, executions: 99, exec/sec: 21.08
[32m INFO[0m ============= Coverage Summary =============
[32m INFO[0m 0xbb################################c095c: 11.03% Instruction Covered, 13.16% Branch Covered
[32m INFO[0m 0xa0################################3932b: 48.83% Instruction Covered, 36.84% Branch Covered
[32m INFO[0m [Stats #0] run time: 0h-0m-25s, clients: 1, corpus: 22, objectives: 0, executions: 99, exec/sec: 21.05
[32m INFO[0m ============= New Corpus Item =============
[32m INFO[0m Reverted? true 
 Txn:
[Sender] 0x8E################################d79dd
   [1] Router.swapExactETHForTokens{value: 295.1479 ether}(0, path:(WETH  0xa0################################3932B), address(this), block.timestamp);
[Sender] 0x68################################c9024
   [1] 0xa0################################3932B.includeAccount(0x68################################c9024)
       0x08################################000000000000000000000000000000000002000000000000000000000000000000000000000000000000000000000000000204f776e61626c653a2063616c6c6572206973206e6f7420746865206f776e6572

[32m INFO[0m ==========================================
[32m INFO[0m [Testcase #0] run time: 0h-0m-25s, clients: 1, corpus: 23, objectives: 0, executions: 129, exec/sec: 27.42
[32m INFO[0m [Stats #0] run time: 0h-0m-25s, clients: 1, corpus: 23, objectives: 0, executions: 129, exec/sec: 27.42
[32m INFO[0m ============= New Corpus Item =============
[32m INFO[0m Reverted? true 
 Txn:
[Sender] 0x8E################################d79dd
   [1] Router.swapExactETHForTokens{value: 4722.3664 ether}(0, path:(WETH  0xa0################################3932B), address(this), block.timestamp);
[Sender] 0x68################################c9024
   [1] 0xa0################################3932B.includeAccount{value: 7402945688143}(0x8E################################d79dd)

[32m INFO[0m ==========================================
[32m INFO[0m [Testcase #0] run time: 0h-0m-25s, clients: 1, corpus: 24, objectives: 0, executions: 136, exec/sec: 28.90
[32m INFO[0m ============= Coverage Summary =============
[32m INFO[0m 0xa0################################3932b: 48.89% Instruction Covered, 37.17% Branch Covered
[32m INFO[0m 0xbb################################c095c: 11.03% Instruction Covered, 13.16% Branch Covered
[32m INFO[0m [Stats #0] run time: 0h-0m-25s, clients: 1, corpus: 24, objectives: 0, executions: 136, exec/sec: 24.50
[32m INFO[0m ============= New Corpus Item =============
[32m INFO[0m Reverted? false 
 Txn:
[Sender] 0x8E################################d79dd
   [1] Router.swapExactETHForTokens{value: 4722.3664 ether}(0, path:(WETH  0xa0################################3932B), address(this), block.timestamp);
[Sender] 0xe1################################c8510
   [1] 0xa0################################3932B.increaseAllowance(0x35################################31dDb, 4906799308320710000620485315086178677097395061.4311 ether)
       0x01

[32m INFO[0m ==========================================
[32m INFO[0m [Testcase #0] run time: 0h-0m-25s, clients: 1, corpus: 25, objectives: 0, executions: 161, exec/sec: 29.00
[32m INFO[0m [Stats #0] run time: 0h-0m-26s, clients: 1, corpus: 25, objectives: 0, executions: 161, exec/sec: 27.56
[32m INFO[0m ============= New Corpus Item =============
[32m INFO[0m Reverted? true 
 Txn:
[Sender] 0xe1################################c8510
   [1] 0xa0################################3932B.increaseAllowance{value: 18.4829 ether}(0x8E################################d79dd, 44439208456493899936349411258459057067233671742846570944943.3575 ether)

[32m INFO[0m ==========================================
[32m INFO[0m [Testcase #0] run time: 0h-0m-26s, clients: 1, corpus: 26, objectives: 0, executions: 175, exec/sec: 29.94
[32m INFO[0m fetching code from 3429880a687140484d59bdb6d4c5dd5832355557
[32m INFO[0m [Stats #0] run time: 0h-0m-26s, clients: 1, corpus: 26, objectives: 0, executions: 175, exec/sec: 27.10
[32m INFO[0m ============= New Corpus Item =============
[32m INFO[0m Reverted? false 
 Txn:
[Sender] 0x8E################################d79dd
   [1] Router.swapExactETHForTokens{value: 4722.3664 ether}(0, path:(WETH  0xa0################################3932B), address(this), block.timestamp);
[Sender] 0x68################################c9024
   [1] 0xa0################################3932B.approve(0x68################################c9024, 115792089237315784455443267507311618760300657816230226407530.3114 ether)
       0x01
[Sender] 0xe1################################c8510
   [1] 0xa0################################3932B.increaseAllowance(0xe1################################c8510, 46420366044761060855613920212425191963141990223148564987698.1943 ether)
       0x01

[32m INFO[0m ==========================================
[32m INFO[0m [Testcase #0] run time: 0h-0m-26s, clients: 1, corpus: 27, objectives: 0, executions: 186, exec/sec: 28.80
[32m INFO[0m ============= Coverage Summary =============
[32m INFO[0m 0xbb################################c095c: 11.03% Instruction Covered, 13.16% Branch Covered
[32m INFO[0m 0xa0################################3932b: 48.94% Instruction Covered, 37.50% Branch Covered
[32m INFO[0m [Stats #0] run time: 0h-0m-26s, clients: 1, corpus: 27, objectives: 0, executions: 192, exec/sec: 29.69
[32m INFO[0m [Stats #0] run time: 0h-0m-26s, clients: 1, corpus: 27, objectives: 0, executions: 192, exec/sec: 29.69
[32m INFO[0m ============= New Corpus Item =============
[32m INFO[0m Reverted? true 
 Txn:
[Sender] 0x8E################################d79dd
   [1] Router.swapExactETHForTokens{value: 4722.3664 ether}(0, path:(WETH  0xa0################################3932B), address(this), block.timestamp);
[Sender] 0x68################################c9024
   [1] 0xa0################################3932B.reflect(8420)
       0x08################################0000000000000000000000000000000000020000000000000000000000000000000000000000000000000000000000000001e536166654d6174683a207375627472616374696f6e206f766572666c6f770000

[32m INFO[0m ==========================================
[32m INFO[0m [Testcase #0] run time: 0h-0m-26s, clients: 1, corpus: 28, objectives: 0, executions: 193, exec/sec: 29.84
[32m INFO[0m [Stats #0] run time: 0h-0m-26s, clients: 1, corpus: 28, objectives: 0, executions: 193, exec/sec: 29.84
[32m INFO[0m ============= New Corpus Item =============
[32m INFO[0m Reverted? true 
 Txn:
[Sender] 0x8E################################d79dd
   [1] Router.swapExactETHForTokens{value: 4722.3664 ether}(0, path:(WETH  0xa0################################3932B), address(this), block.timestamp);
[Sender] 0x35################################31dDb
   [1] 0xa0################################3932B.approve(0x68################################c9024, 85387853635825902492906834748294065366572340058543142690775.5880 ether)
       0x01
   [1] 0xa0################################3932B.reflect(25108406941546723055343157692830665664409.4217 ether)
       0x08################################00000000000000000000000000000000000200000000000000000000000000000000000000000000000000000000000000021536166654d6174683a206d756c7469706c69636174696f6e206f766572666c6f7700000000000000000000000000000000000000000000000000000000000000

[32m INFO[0m ==========================================
[32m INFO[0m [Testcase #0] run time: 0h-0m-26s, clients: 1, corpus: 29, objectives: 0, executions: 194, exec/sec: 29.99
[32m INFO[0m [Stats #0] run time: 0h-0m-26s, clients: 1, corpus: 29, objectives: 0, executions: 194, exec/sec: 29.98
[32m INFO[0m ============= New Corpus Item =============
[32m INFO[0m Reverted? false 
 Txn:
[Sender] 0x8E################################d79dd
   [1] Router.swapExactETHForTokens{value: 295.1479 ether}(0, path:(WETH  0xa0################################3932B), address(this), block.timestamp);
[Sender] 0x35################################31dDb
   [1] 0xa0################################3932B.reflect(0)

[32m INFO[0m ==========================================
[32m INFO[0m [Testcase #0] run time: 0h-0m-26s, clients: 1, corpus: 30, objectives: 0, executions: 196, exec/sec: 30.29
[32m INFO[0m [Stats #0] run time: 0h-0m-26s, clients: 1, corpus: 30, objectives: 0, executions: 196, exec/sec: 30.27
[32m INFO[0m ============= New Corpus Item =============
[32m INFO[0m Reverted? false 
 Txn:
[Sender] 0x8E################################d79dd
   [1] Router.swapExactETHForTokens{value: 4722.3664 ether}(0, path:(WETH  0xa0################################3932B), address(this), block.timestamp);
[Sender] 0x68################################c9024
   [1] 0xa0################################3932B.approve(0xa0################################3932B, 115339776388732929035197660848497720713218148808322660448505.8041 ether)
       0x01
[Sender] 0x35################################31dDb
   [1] 0xa0################################3932B.reflect(0)

[32m INFO[0m ==========================================
[32m INFO[0m [Testcase #0] run time: 0h-0m-26s, clients: 1, corpus: 31, objectives: 0, executions: 200, exec/sec: 30.88
[32m INFO[0m [Stats #0] run time: 0h-0m-26s, clients: 1, corpus: 31, objectives: 0, executions: 200, exec/sec: 30.86
[32m INFO[0m ============= New Corpus Item =============
[32m INFO[0m Reverted? true 
 Txn:
[Sender] 0x8E################################d79dd
   [1] Router.swapExactETHForTokens{value: 4722.3664 ether}(0, path:(WETH  0xa0################################3932B), address(this), block.timestamp);
[Sender] 0x35################################31dDb
   [1] 0xa0################################3932B.reflect{value: 3383.9808 ether}(6923544899899390399813989786555748432040568807084177.4119 ether)

[32m INFO[0m ==========================================
[32m INFO[0m [Testcase #0] run time: 0h-0m-26s, clients: 1, corpus: 32, objectives: 0, executions: 219, exec/sec: 33.79
[32m INFO[0m ============= Coverage Summary =============
[32m INFO[0m 0xbb################################c095c: 11.03% Instruction Covered, 13.16% Branch Covered
[32m INFO[0m 0xa0################################3932b: 49.75% Instruction Covered, 38.16% Branch Covered
[32m INFO[0m [Stats #0] run time: 0h-0m-26s, clients: 1, corpus: 32, objectives: 0, executions: 219, exec/sec: 33.76
[32m INFO[0m ============= New Corpus Item =============
[32m INFO[0m Reverted? true 
 Txn:
[Sender] 0x8E################################d79dd
   [1] Router.swapExactETHForTokens{value: 4722.3664 ether}(0, path:(WETH  0xa0################################3932B), address(this), block.timestamp);
[Sender] 0x68################################c9024
   [1] 0xa0################################3932B.approve(0xa0################################3932B, 115339776388732929035197660848497720713218148808322660448505.8041 ether)
       0x01
[Sender] 0x8E################################d79dd
   [1] 0xa0################################3932B.renounceOwnership()
       0x08################################000000000000000000000000000000000002000000000000000000000000000000000000000000000000000000000000000204f776e61626c653a2063616c6c6572206973206e6f7420746865206f776e6572

[32m INFO[0m ==========================================
[32m INFO[0m [Testcase #0] run time: 0h-0m-26s, clients: 1, corpus: 33, objectives: 0, executions: 225, exec/sec: 34.68
[32m INFO[0m [Stats #0] run time: 0h-0m-26s, clients: 1, corpus: 33, objectives: 0, executions: 225, exec/sec: 34.68
[32m INFO[0m ============= New Corpus Item =============
[32m INFO[0m Reverted? true 
 Txn:
[Sender] 0x8E################################d79dd
   [1] Router.swapExactETHForTokens{value: 4722.3664 ether}(0, path:(WETH  0xa0################################3932B), address(this), block.timestamp);
[Sender] 0x35################################31dDb
   [1] 0xa0################################3932B.approve(0x68################################c9024, 85387853635825902492906834748294065366572340058543142690775.5880 ether)
       0x01
[Sender] 0x8E################################d79dd
   [1] 0xa0################################3932B.renounceOwnership{value: 1}()

[32m INFO[0m ==========================================
[32m INFO[0m [Testcase #0] run time: 0h-0m-26s, clients: 1, corpus: 34, objectives: 0, executions: 226, exec/sec: 34.83
[32m INFO[0m ============= Coverage Summary =============
[32m INFO[0m 0xbb################################c095c: 11.03% Instruction Covered, 13.16% Branch Covered
[32m INFO[0m 0xa0################################3932b: 49.81% Instruction Covered, 38.49% Branch Covered
[32m INFO[0m [Stats #0] run time: 0h-0m-26s, clients: 1, corpus: 34, objectives: 0, executions: 226, exec/sec: 34.81
[32m INFO[0m ============= New Corpus Item =============
[32m INFO[0m Reverted? true 
 Txn:
[Sender] 0xe1################################c8510
   [1] 0xa0################################3932B.setMaxTxPercent(0)
       0x08################################000000000000000000000000000000000002000000000000000000000000000000000000000000000000000000000000000204f776e61626c653a2063616c6c6572206973206e6f7420746865206f776e6572

[32m INFO[0m ==========================================
[32m INFO[0m [Testcase #0] run time: 0h-0m-26s, clients: 1, corpus: 35, objectives: 0, executions: 257, exec/sec: 39.59
[32m INFO[0m [Stats #0] run time: 0h-0m-26s, clients: 1, corpus: 35, objectives: 0, executions: 257, exec/sec: 39.59
[32m INFO[0m ============= New Corpus Item =============
[32m INFO[0m Reverted? true 
 Txn:
[Sender] 0xe1################################c8510
   [1] 0xa0################################3932B.setMaxTxPercent{value: 4783}(765098993700797485659604096597224594609164151390479688.8799 ether)

[32m INFO[0m ==========================================
[32m INFO[0m [Testcase #0] run time: 0h-0m-26s, clients: 1, corpus: 36, objectives: 0, executions: 258, exec/sec: 39.74
[32m INFO[0m ============= Coverage Summary =============
[32m INFO[0m 0xa0################################3932b: 49.87% Instruction Covered, 38.82% Branch Covered
[32m INFO[0m 0xbb################################c095c: 11.03% Instruction Covered, 13.16% Branch Covered
[32m INFO[0m [Stats #0] run time: 0h-0m-26s, clients: 1, corpus: 36, objectives: 0, executions: 258, exec/sec: 39.72
[32m INFO[0m ============= New Corpus Item =============
[32m INFO[0m Reverted? true 
 Txn:
[Sender] 0xe1################################c8510
   [1] 0xa0################################3932B.transfer(0x00################################00000, 0)
       0x08################################0000000000000000000000000000000000020000000000000000000000000000000000000000000000000000000000000002345524332303a207472616e7366657220746f20746865207a65726f20616464726573730000000000000000000000000000000000000000000000000000000000

[32m INFO[0m ==========================================
[32m INFO[0m [Testcase #0] run time: 0h-0m-26s, clients: 1, corpus: 37, objectives: 0, executions: 289, exec/sec: 44.49
[32m INFO[0m [Stats #0] run time: 0h-0m-26s, clients: 1, corpus: 37, objectives: 0, executions: 289, exec/sec: 44.48
[32m INFO[0m ============= New Corpus Item =============
[32m INFO[0m Reverted? true 
 Txn:
[Sender] 0x8E################################d79dd
   [1] Router.swapExactETHForTokens{value: 590.3678 ether}(0, path:(WETH  0xa0################################3932B), address(this), block.timestamp);
[Sender] 0x35################################31dDb
   [1] 0xa0################################3932B.transfer(0x8E################################d79dd, 105361744274366596221531842812413883166699891543502605706089.7583 ether)
       0x08################################000000000000000000000000000000000002000000000000000000000000000000000000000000000000000000000000000285472616e7366657220616d6f756e74206578636565647320746865206d61785478416d6f756e742e000000000000000000000000000000000000000000000000

[32m INFO[0m ==========================================
[32m INFO[0m [Testcase #0] run time: 0h-0m-26s, clients: 1, corpus: 38, objectives: 0, executions: 290, exec/sec: 44.63
[32m INFO[0m [Stats #0] run time: 0h-0m-26s, clients: 1, corpus: 38, objectives: 0, executions: 290, exec/sec: 44.63
[32m INFO[0m ============= New Corpus Item =============
[32m INFO[0m Reverted? true 
 Txn:
[Sender] 0x8E################################d79dd
   [1] Router.swapExactETHForTokens{value: 4722.3664 ether}(0, path:(WETH  0xa0################################3932B), address(this), block.timestamp);
[Sender] 0xe1################################c8510
   [1] 0xa0################################3932B.transfer{value: 1964.6690 ether}(0x68################################c9024, 9344466924268796781956892946752002942442.2716 ether)

[32m INFO[0m ==========================================
[32m INFO[0m [Testcase #0] run time: 0h-0m-26s, clients: 1, corpus: 39, objectives: 0, executions: 292, exec/sec: 44.94
[32m INFO[0m ============= Coverage Summary =============
[32m INFO[0m 0xa0################################3932b: 50.68% Instruction Covered, 39.47% Branch Covered
[32m INFO[0m 0xbb################################c095c: 11.03% Instruction Covered, 13.16% Branch Covered
[32m INFO[0m [Stats #0] run time: 0h-0m-26s, clients: 1, corpus: 39, objectives: 0, executions: 292, exec/sec: 44.92
[32m INFO[0m ============= New Corpus Item =============
[32m INFO[0m Reverted? true 
 Txn:
[Sender] 0x8E################################d79dd
   [1] Router.swapExactETHForTokens{value: 590.3678 ether}(0, path:(WETH  0xa0################################3932B), address(this), block.timestamp);
   [1] 0xa0################################3932B.approve(0x8E################################d79dd, 97046224218108634222599625087295741753748511296.4551 ether)
       0x01
   [1] 0xa0################################3932B.transferFrom(0x68################################c9024, 0x00################################00000, 0)
       0x08################################0000000000000000000000000000000000020000000000000000000000000000000000000000000000000000000000000002345524332303a207472616e7366657220746f20746865207a65726f20616464726573730000000000000000000000000000000000000000000000000000000000

[32m INFO[0m ==========================================
[32m INFO[0m [Testcase #0] run time: 0h-0m-26s, clients: 1, corpus: 40, objectives: 0, executions: 321, exec/sec: 49.38
[32m INFO[0m [Stats #0] run time: 0h-0m-26s, clients: 1, corpus: 40, objectives: 0, executions: 321, exec/sec: 49.38
[32m INFO[0m ============= New Corpus Item =============
[32m INFO[0m Reverted? true 
 Txn:
[Sender] 0x8E################################d79dd
   [1] Router.swapExactETHForTokens{value: 4722.3664 ether}(0, path:(WETH  0xa0################################3932B), address(this), block.timestamp);
[Sender] 0x35################################31dDb
   [1] 0xa0################################3932B.approve(0x68################################c9024, 85387853635825902492906834748294065366572340058543142690775.5880 ether)
       0x01
[Sender] 0x8E################################d79dd
   [1] 0xa0################################3932B.transferFrom{value: 2436.1086 ether}(0x35################################31dDb, 0x68################################c9024, 12071236355844489538609742226257515504492180033427603695165.4467 ether)

[32m INFO[0m ==========================================
[32m INFO[0m [Testcase #0] run time: 0h-0m-26s, clients: 1, corpus: 41, objectives: 0, executions: 322, exec/sec: 49.52
[32m INFO[0m [Stats #0] run time: 0h-0m-26s, clients: 1, corpus: 41, objectives: 0, executions: 322, exec/sec: 49.52
[32m INFO[0m ============= New Corpus Item =============
[32m INFO[0m Reverted? true 
 Txn:
[Sender] 0x8E################################d79dd
   [1] Router.swapExactETHForTokens{value: 4722.3664 ether}(0, path:(WETH  0xa0################################3932B), address(this), block.timestamp);
[Sender] 0x68################################c9024
   [1] 0xa0################################3932B.approve(0xa0################################3932B, 618615957403698591908394839017624131441015222573.3572 ether)
       0x01
[Sender] 0xe1################################c8510
   [1] 0xa0################################3932B.approve(0xa0################################3932B, 0)
       0x01
[Sender] 0x8E################################d79dd
   [1] 0xa0################################3932B.transferFrom(0x00################################00000, 0x00################################00000, 11997249052168408617728909953770986764325988903923675494935.1629 ether)
       0x08################################0000000000000000000000000000000000020000000000000000000000000000000000000000000000000000000000000002545524332303a207472616e736665722066726f6d20746865207a65726f2061646472657373000000000000000000000000000000000000000000000000000000

[32m INFO[0m ==========================================
[32m INFO[0m [Testcase #0] run time: 0h-0m-26s, clients: 1, corpus: 42, objectives: 0, executions: 323, exec/sec: 49.67
[32m INFO[0m ============= Coverage Summary =============
[32m INFO[0m 0xbb################################c095c: 11.03% Instruction Covered, 13.16% Branch Covered
[32m INFO[0m 0xa0################################3932b: 50.74% Instruction Covered, 39.80% Branch Covered
[32m INFO[0m [Stats #0] run time: 0h-0m-26s, clients: 1, corpus: 42, objectives: 0, executions: 323, exec/sec: 49.65
[32m INFO[0m ============= New Corpus Item =============
[32m INFO[0m Reverted? true 
 Txn:
[Sender] 0xe1################################c8510
   [1] 0xa0################################3932B.transferOwnership(0x35################################31dDb)
       0x08################################000000000000000000000000000000000002000000000000000000000000000000000000000000000000000000000000000204f776e61626c653a2063616c6c6572206973206e6f7420746865206f776e6572

[32m INFO[0m ==========================================
[32m INFO[0m [Testcase #0] run time: 0h-0m-26s, clients: 1, corpus: 43, objectives: 0, executions: 353, exec/sec: 54.25
[32m INFO[0m [Stats #0] run time: 0h-0m-26s, clients: 1, corpus: 43, objectives: 0, executions: 353, exec/sec: 54.25
[32m INFO[0m ============= New Corpus Item =============
[32m INFO[0m Reverted? true 
 Txn:
[Sender] 0x8E################################d79dd
   [1] Router.swapExactETHForTokens{value: 295.1479 ether}(0, path:(WETH  0xa0################################3932B), address(this), block.timestamp);
[Sender] 0xe1################################c8510
   [1] 0xa0################################3932B.transferOwnership{value: 4722.3664 ether}(0x00################################00000)

[32m INFO[0m ==========================================
[32m INFO[0m [Testcase #0] run time: 0h-0m-26s, clients: 1, corpus: 44, objectives: 0, executions: 364, exec/sec: 55.94
[32m INFO[0m ============= Coverage Summary =============
[32m INFO[0m 0xa0################################3932b: 50.79% Instruction Covered, 40.13% Branch Covered
[32m INFO[0m 0xbb################################c095c: 11.03% Instruction Covered, 13.16% Branch Covered
[32m INFO[0m [Stats #0] run time: 0h-0m-26s, clients: 1, corpus: 44, objectives: 0, executions: 364, exec/sec: 55.91
[32m INFO[0m ============= New Corpus Item =============
[32m INFO[0m Reverted? false 
 Txn:
[Sender] 0x8E################################d79dd
   [1] Router.swapExactETHForTokens{value: 4722.3664 ether}(0, path:(WETH  0xa0################################3932B), address(this), block.timestamp);
[Sender] 0x35################################31dDb
   [1] 0xa0################################3932B.approve(0x68################################c9024, 85387853635825902492906834748294065366572340058543142690775.5880 ether)
       0x01
[Sender] 0x68################################c9024
   [1] 0xa0################################3932B.call{value: 0}()

[32m INFO[0m ==========================================
[32m INFO[0m [Testcase #0] run time: 0h-0m-26s, clients: 1, corpus: 45, objectives: 0, executions: 385, exec/sec: 59.13
[32m INFO[0m ============= Coverage Summary =============
[32m INFO[0m 0xa0################################3932b: 50.79% Instruction Covered, 40.13% Branch Covered
[32m INFO[0m 0xbb################################c095c: 11.03% Instruction Covered, 13.16% Branch Covered
[32m INFO[0m [Stats #0] run time: 0h-0m-27s, clients: 1, corpus: 45, objectives: 0, executions: 385, exec/sec: 58.13
[32m INFO[0m ============= New Corpus Item =============
[32m INFO[0m Reverted? false 
 Txn:
[Sender] 0x8E################################d79dd
   [1] Router.swapExactETHForTokens{value: 4722.3664 ether}(0, path:(WETH  0xa0################################3932B), address(this), block.timestamp);
[Sender] 0x68################################c9024
   [1] 0xa0################################3932B.approve(0xe1################################c8510, 2117840945424173712795971505750372844813466700947467618982.4602 ether)
       0x01

[32m INFO[0m ==========================================
[32m INFO[0m [Testcase #0] run time: 0h-0m-27s, clients: 1, corpus: 46, objectives: 0, executions: 488, exec/sec: 73.68
[32m INFO[0m ============= Coverage Summary =============
[32m INFO[0m 0xa0################################3932b: 50.79% Instruction Covered, 40.13% Branch Covered
[32m INFO[0m 0xbb################################c095c: 11.03% Instruction Covered, 13.16% Branch Covered
[32m INFO[0m [Stats #0] run time: 0h-0m-27s, clients: 1, corpus: 46, objectives: 0, executions: 488, exec/sec: 67.29
[32m INFO[0m ============= New Corpus Item =============
[32m INFO[0m Reverted? true 
 Txn:
[Sender] 0xe1################################c8510
   [1] 0xa0################################3932B.transfer(0xe1################################c8510, 536875041)
       0x08################################0000000000000000000000000000000000020000000000000000000000000000000000000000000000000000000000000001e536166654d6174683a207375627472616374696f6e206f766572666c6f770000

[32m INFO[0m ==========================================
[32m INFO[0m [Testcase #0] run time: 0h-0m-27s, clients: 1, corpus: 47, objectives: 0, executions: 1176, exec/sec: 162.1
[32m INFO[0m ============= Coverage Summary =============
[32m INFO[0m 0xa0################################3932b: 50.79% Instruction Covered, 40.46% Branch Covered
[32m INFO[0m 0xbb################################c095c: 11.03% Instruction Covered, 13.16% Branch Covered
[32m INFO[0m [Stats #0] run time: 0h-0m-27s, clients: 1, corpus: 47, objectives: 0, executions: 1176, exec/sec: 160.5
[32m INFO[0m ============= New Corpus Item =============
[32m INFO[0m Reverted? true 
 Txn:
[Sender] 0xe1################################c8510
   [1] 0xa0################################3932B.transfer(0xa0################################3932B, 2215)
       0x08################################0000000000000000000000000000000000020000000000000000000000000000000000000000000000000000000000000001e536166654d6174683a207375627472616374696f6e206f766572666c6f770000

[32m INFO[0m ==========================================
[32m INFO[0m [Testcase #0] run time: 0h-0m-27s, clients: 1, corpus: 60, objectives: 0, executions: 1209, exec/sec: 164.9
[32m INFO[0m ============= Coverage Summary =============
[32m INFO[0m 0xa0################################3932b: 50.89% Instruction Covered, 41.12% Branch Covered
[32m INFO[0m 0xbb################################c095c: 11.03% Instruction Covered, 13.16% Branch Covered
[32m INFO[0m [Stats #0] run time: 0h-0m-27s, clients: 1, corpus: 60, objectives: 0, executions: 1472, exec/sec: 193.8
[32m INFO[0m fetching code from 68dd4f5ac792eaaa5e36f4f4e0474e0625dc9024
[32m INFO[0m fetching code from e1a425f1ac34a8a441566f93c82dd730639c8510
[32m INFO[0m [Stats #0] run time: 0h-0m-28s, clients: 1, corpus: 60, objectives: 0, executions: 1472, exec/sec: 183.7
[32m INFO[0m ============= New Corpus Item =============
[32m INFO[0m Reverted? true 
 Txn:
[Sender] 0x8E################################d79dd
   [1] Router.swapExactETHForTokens{value: 4722.3664 ether}(0, path:(WETH  0xa0################################3932B), address(this), block.timestamp);
[Sender] 0xe1################################c8510
   [1] 0xa0################################3932B.receive()

[32m INFO[0m ==========================================
[32m INFO[0m [Testcase #0] run time: 0h-0m-28s, clients: 1, corpus: 61, objectives: 0, executions: 1855, exec/sec: 231.5
[32m INFO[0m ============= Coverage Summary =============
[32m INFO[0m 0xa0################################3932b: 50.89% Instruction Covered, 41.12% Branch Covered
[32m INFO[0m 0xbb################################c095c: 11.03% Instruction Covered, 13.16% Branch Covered
[32m INFO[0m fetching code from 35c9dfd76bf02107ff4f7128bd69716612d31ddb
[32m INFO[0m [Stats #0] run time: 0h-0m-29s, clients: 1, corpus: 61, objectives: 0, executions: 2813, exec/sec: 324.2
[32m INFO[0m [Stats #0] run time: 0h-0m-29s, clients: 1, corpus: 61, objectives: 0, executions: 2813, exec/sec: 321.8
[32m INFO[0m ============= New Corpus Item =============
[32m INFO[0m Reverted? false 
 Txn:
[Sender] 0x8E################################d79dd
   [1] Router.swapExactETHForTokens{value: 4722.3664 ether}(0, path:(WETH  0xa0################################3932B), address(this), block.timestamp);
[Sender] 0x35################################31dDb
   [1] 0xa0################################3932B.approve(0x68################################c9024, 85387853635825902492906834748294065366572340058543142690775.5880 ether)
       0x01
[Sender] 0xe1################################c8510
   [1] 0xa0################################3932B.decreaseAllowance(0x35################################31dDb, 0)
       0x01

[32m INFO[0m ==========================================
[32m INFO[0m [Testcase #0] run time: 0h-0m-29s, clients: 1, corpus: 62, objectives: 0, executions: 3497, exec/sec: 400.0
[32m INFO[0m ============= Coverage Summary =============
[32m INFO[0m 0xa0################################3932b: 50.89% Instruction Covered, 41.12% Branch Covered
[32m INFO[0m 0xbb################################c095c: 11.03% Instruction Covered, 13.16% Branch Covered
[32m INFO[0m [Stats #0] run time: 0h-0m-30s, clients: 1, corpus: 62, objectives: 0, executions: 6775, exec/sec: 696.7
[32m INFO[0m [Stats #0] run time: 0h-0m-31s, clients: 1, corpus: 62, objectives: 0, executions: 13550, exec/sec: 1.263k
[32m INFO[0m [Stats #0] run time: 0h-0m-31s, clients: 1, corpus: 62, objectives: 0, executions: 13550, exec/sec: 1.234k
[32m INFO[0m ============= New Corpus Item =============
[32m INFO[0m Reverted? false 
 Txn:
[Sender] 0x8E################################d79dd
   [1] Router.swapExactETHForTokens{value: 4722.3664 ether}(0, path:(WETH  0xa0################################3932B), address(this), block.timestamp);
[Sender] 0x35################################31dDb
   [1] 0xa0################################3932B.approve(0x68################################c9024, 85387853635825902492906834748294065366572340058543142690775.5880 ether)
       0x01
[Sender] 0x8E################################d79dd
   [1] 0xa0################################3932B.reflect(387)

[32m INFO[0m ==========================================
[32m INFO[0m [Testcase #0] run time: 0h-0m-31s, clients: 1, corpus: 63, objectives: 0, executions: 15525, exec/sec: 1.414k
[32m INFO[0m ============= Coverage Summary =============
[32m INFO[0m 0xbb################################c095c: 11.03% Instruction Covered, 13.16% Branch Covered
[32m INFO[0m 0xa0################################3932b: 50.89% Instruction Covered, 41.12% Branch Covered
[32m INFO[0m [Stats #0] run time: 0h-0m-31s, clients: 1, corpus: 63, objectives: 0, executions: 15525, exec/sec: 1.386k
[32m INFO[0m ============= New Corpus Item =============
[32m INFO[0m Reverted? false 
 Txn:
[Sender] 0x8E################################d79dd
   [1] Router.swapExactETHForTokens{value: 13}(0, path:(WETH  0xa0################################3932B), address(this), block.timestamp);
[Sender] 0x35################################31dDb
   [1] 0xa0################################3932B.reflect(0)

[32m INFO[0m ==========================================
[32m INFO[0m [Testcase #0] run time: 0h-0m-31s, clients: 1, corpus: 64, objectives: 0, executions: 16834, exec/sec: 1.502k
[32m INFO[0m ============= Coverage Summary =============
[32m INFO[0m 0xa0################################3932b: 50.89% Instruction Covered, 41.12% Branch Covered
[32m INFO[0m 0xbb################################c095c: 11.03% Instruction Covered, 13.16% Branch Covered
[32m INFO[0m [Stats #0] run time: 0h-0m-32s, clients: 1, corpus: 64, objectives: 0, executions: 21952, exec/sec: 1.871k
[32m INFO[0m [Stats #0] run time: 0h-0m-33s, clients: 1, corpus: 64, objectives: 0, executions: 33008, exec/sec: 2.592k
[32m INFO[0m [Stats #0] run time: 0h-0m-34s, clients: 1, corpus: 64, objectives: 0, executions: 42400, exec/sec: 3.086k
[32m INFO[0m [Stats #0] run time: 0h-0m-35s, clients: 1, corpus: 64, objectives: 0, executions: 51029, exec/sec: 3.414k
[32m INFO[0m [Stats #0] run time: 0h-0m-36s, clients: 1, corpus: 64, objectives: 0, executions: 61793, exec/sec: 3.874k
[32m INFO[0m [Stats #0] run time: 0h-0m-37s, clients: 1, corpus: 64, objectives: 0, executions: 67451, exec/sec: 3.888k
[32m INFO[0m [Stats #0] run time: 0h-0m-38s, clients: 1, corpus: 64, objectives: 0, executions: 74643, exec/sec: 4.068k
[32m INFO[0m [Stats #0] run time: 0h-0m-39s, clients: 1, corpus: 64, objectives: 0, executions: 83308, exec/sec: 4.276k
[32m INFO[0m [Stats #0] run time: 0h-0m-40s, clients: 1, corpus: 64, objectives: 0, executions: 94012, exec/sec: 4.588k
[32m INFO[0m [Stats #0] run time: 0h-0m-41s, clients: 1, corpus: 64, objectives: 0, executions: 101775, exec/sec: 4.726k
[32m INFO[0m [Stats #0] run time: 0h-0m-43s, clients: 1, corpus: 64, objectives: 0, executions: 110784, exec/sec: 4.879k
[32m INFO[0m [Stats #0] run time: 0h-0m-44s, clients: 1, corpus: 64, objectives: 0, executions: 121682, exec/sec: 5.133k
[32m INFO[0m [Stats #0] run time: 0h-0m-45s, clients: 1, corpus: 64, objectives: 0, executions: 132768, exec/sec: 5.373k
[32m INFO[0m [Stats #0] run time: 0h-0m-46s, clients: 1, corpus: 64, objectives: 0, executions: 136983, exec/sec: 5.207k
[32m INFO[0m [Stats #0] run time: 0h-0m-47s, clients: 1, corpus: 64, objectives: 0, executions: 147209, exec/sec: 5.335k
[32m INFO[0m [Stats #0] run time: 0h-0m-48s, clients: 1, corpus: 64, objectives: 0, executions: 154338, exec/sec: 5.396k
[32m INFO[0m [Stats #0] run time: 0h-0m-50s, clients: 1, corpus: 64, objectives: 0, executions: 156575, exec/sec: 5.286k
[32m INFO[0m [Stats #0] run time: 0h-0m-51s, clients: 1, corpus: 64, objectives: 0, executions: 167508, exec/sec: 5.470k
[32m INFO[0m [Stats #0] run time: 0h-0m-52s, clients: 1, corpus: 64, objectives: 0, executions: 178401, exec/sec: 5.641k
[32m INFO[0m [Stats #0] run time: 0h-0m-53s, clients: 1, corpus: 64, objectives: 0, executions: 189643, exec/sec: 5.812k
[32m INFO[0m [Stats #0] run time: 0h-0m-54s, clients: 1, corpus: 64, objectives: 0, executions: 200566, exec/sec: 5.964k
[32m INFO[0m [Stats #0] run time: 0h-0m-55s, clients: 1, corpus: 64, objectives: 0, executions: 211589, exec/sec: 6.109k
[32m INFO[0m [Stats #0] run time: 0h-0m-56s, clients: 1, corpus: 64, objectives: 0, executions: 222460, exec/sec: 6.243k
[32m INFO[0m [Stats #0] run time: 0h-0m-57s, clients: 1, corpus: 64, objectives: 0, executions: 233384, exec/sec: 6.370k
[32m INFO[0m [Stats #0] run time: 0h-0m-58s, clients: 1, corpus: 64, objectives: 0, executions: 244313, exec/sec: 6.490k
[32m INFO[0m [Stats #0] run time: 0h-0m-59s, clients: 1, corpus: 64, objectives: 0, executions: 255400, exec/sec: 6.609k
[32m INFO[0m [Stats #0] run time: 0h-1m-0s, clients: 1, corpus: 64, objectives: 0, executions: 266329, exec/sec: 6.717k
[32m INFO[0m [Stats #0] run time: 0h-1m-1s, clients: 1, corpus: 64, objectives: 0, executions: 277543, exec/sec: 6.828k
[32m INFO[0m [Stats #0] run time: 0h-1m-2s, clients: 1, corpus: 64, objectives: 0, executions: 288313, exec/sec: 6.922k
[32m INFO[0m [Stats #0] run time: 0h-1m-3s, clients: 1, corpus: 64, objectives: 0, executions: 299534, exec/sec: 7.022k
[32m INFO[0m [Stats #0] run time: 0h-1m-4s, clients: 1, corpus: 64, objectives: 0, executions: 310560, exec/sec: 7.113k
[32m INFO[0m [Stats #0] run time: 0h-1m-5s, clients: 1, corpus: 64, objectives: 0, executions: 321557, exec/sec: 7.200k
[32m INFO[0m [Stats #0] run time: 0h-1m-6s, clients: 1, corpus: 64, objectives: 0, executions: 332808, exec/sec: 7.288k
[32m INFO[0m [Stats #0] run time: 0h-1m-7s, clients: 1, corpus: 64, objectives: 0, executions: 343643, exec/sec: 7.364k
[32m INFO[0m [Stats #0] run time: 0h-1m-8s, clients: 1, corpus: 64, objectives: 0, executions: 354737, exec/sec: 7.442k
[32m INFO[0m [Stats #0] run time: 0h-1m-9s, clients: 1, corpus: 64, objectives: 0, executions: 365566, exec/sec: 7.511k
[32m INFO[0m [Stats #0] run time: 0h-1m-10s, clients: 1, corpus: 64, objectives: 0, executions: 376555, exec/sec: 7.581k
[32m INFO[0m [Stats #0] run time: 0h-1m-11s, clients: 1, corpus: 64, objectives: 0, executions: 387640, exec/sec: 7.650k
[32m INFO[0m [Stats #0] run time: 0h-1m-12s, clients: 1, corpus: 64, objectives: 0, executions: 398723, exec/sec: 7.715k
[32m INFO[0m [Stats #0] run time: 0h-1m-13s, clients: 1, corpus: 64, objectives: 0, executions: 409559, exec/sec: 7.774k
[32m INFO[0m [Stats #0] run time: 0h-1m-14s, clients: 1, corpus: 64, objectives: 0, executions: 420648, exec/sec: 7.836k
[32m INFO[0m [Stats #0] run time: 0h-1m-15s, clients: 1, corpus: 64, objectives: 0, executions: 431454, exec/sec: 7.889k
[32m INFO[0m [Stats #0] run time: 0h-1m-16s, clients: 1, corpus: 64, objectives: 0, executions: 442663, exec/sec: 7.948k
[32m INFO[0m [Stats #0] run time: 0h-1m-17s, clients: 1, corpus: 64, objectives: 0, executions: 453496, exec/sec: 7.998k
[32m INFO[0m [Stats #0] run time: 0h-1m-18s, clients: 1, corpus: 64, objectives: 0, executions: 464304, exec/sec: 8.047k
[32m INFO[0m [Stats #0] run time: 0h-1m-19s, clients: 1, corpus: 64, objectives: 0, executions: 475388, exec/sec: 8.098k
[32m INFO[0m [Stats #0] run time: 0h-1m-20s, clients: 1, corpus: 64, objectives: 0, executions: 486283, exec/sec: 8.145k
[32m INFO[0m [Stats #0] run time: 0h-1m-21s, clients: 1, corpus: 64, objectives: 0, executions: 497010, exec/sec: 8.186k
[32m INFO[0m [Stats #0] run time: 0h-1m-22s, clients: 1, corpus: 64, objectives: 0, executions: 508130, exec/sec: 8.233k
[32m INFO[0m [Stats #0] run time: 0h-1m-23s, clients: 1, corpus: 64, objectives: 0, executions: 519279, exec/sec: 8.279k
[32m INFO[0m [Stats #0] run time: 0h-1m-24s, clients: 1, corpus: 64, objectives: 0, executions: 530140, exec/sec: 8.319k
[32m INFO[0m [Stats #0] run time: 0h-1m-25s, clients: 1, corpus: 64, objectives: 0, executions: 541445, exec/sec: 8.365k
[32m INFO[0m [Stats #0] run time: 0h-1m-26s, clients: 1, corpus: 64, objectives: 0, executions: 552204, exec/sec: 8.401k
[32m INFO[0m [Stats #0] run time: 0h-1m-27s, clients: 1, corpus: 64, objectives: 0, executions: 563328, exec/sec: 8.441k
[32m INFO[0m [Stats #0] run time: 0h-1m-28s, clients: 1, corpus: 64, objectives: 0, executions: 574164, exec/sec: 8.476k
[32m INFO[0m [Stats #0] run time: 0h-1m-29s, clients: 1, corpus: 64, objectives: 0, executions: 585316, exec/sec: 8.514k
[32m INFO[0m [Stats #0] run time: 0h-1m-30s, clients: 1, corpus: 64, objectives: 0, executions: 596282, exec/sec: 8.549k
[32m INFO[0m [Stats #0] run time: 0h-1m-31s, clients: 1, corpus: 64, objectives: 0, executions: 607277, exec/sec: 8.583k
[32m INFO[0m [Stats #0] run time: 0h-1m-32s, clients: 1, corpus: 64, objectives: 0, executions: 617948, exec/sec: 8.611k
[32m INFO[0m [Stats #0] run time: 0h-1m-33s, clients: 1, corpus: 64, objectives: 0, executions: 628975, exec/sec: 8.645k
[32m INFO[0m [Stats #0] run time: 0h-1m-34s, clients: 1, corpus: 64, objectives: 0, executions: 639615, exec/sec: 8.671k
[32m INFO[0m [Stats #0] run time: 0h-1m-34s, clients: 1, corpus: 64, objectives: 0, executions: 639615, exec/sec: 8.608k
[32m INFO[0m ============= New Corpus Item =============
[32m INFO[0m Reverted? false 
 Txn:
[Sender] 0x8E################################d79dd
   [1] Router.swapExactETHForTokens{value: 1061.6728 ether}(0, path:(WETH  0xa0################################3932B), address(this), block.timestamp);
   [1] 0xa0################################3932B.transfer(0x68################################c9024, 25)
       0x01
[Sender] 0xe1################################c8510
   [1] 0xa0################################3932B.decreaseAllowance(0x35################################31dDb, 0)
       0x01

[32m INFO[0m ==========================================
[32m INFO[0m [Testcase #0] run time: 0h-1m-34s, clients: 1, corpus: 65, objectives: 0, executions: 645643, exec/sec: 8.689k
[32m INFO[0m ============= Coverage Summary =============
[32m INFO[0m 0xa0################################3932b: 50.89% Instruction Covered, 41.12% Branch Covered
[32m INFO[0m 0xbb################################c095c: 11.03% Instruction Covered, 13.16% Branch Covered
[32m INFO[0m [Stats #0] run time: 0h-1m-34s, clients: 1, corpus: 65, objectives: 0, executions: 645643, exec/sec: 8.675k
[32m INFO[0m ============= New Corpus Item =============
[32m INFO[0m Reverted? false 
 Txn:
[Sender] 0x8E################################d79dd
   [1] Router.swapExactETHForTokens{value: 1061.6728 ether}(0, path:(WETH  0xa0################################3932B), address(this), block.timestamp);
   [1] 0xa0################################3932B.transfer(0x68################################c9024, 25)
       0x01
[Sender] 0xe1################################c8510
   [1] 0xa0################################3932B.increaseAllowance(0xe1################################c8510, 46420366044761060855613920212425191963141990223148564987698.1943 ether)
       0x01

[32m INFO[0m ==========================================
[32m INFO[0m [Testcase #0] run time: 0h-1m-34s, clients: 1, corpus: 66, objectives: 0, executions: 646615, exec/sec: 8.688k
[32m INFO[0m ============= Coverage Summary =============
[32m INFO[0m 0xbb################################c095c: 11.03% Instruction Covered, 13.16% Branch Covered
[32m INFO[0m 0xa0################################3932b: 50.89% Instruction Covered, 41.12% Branch Covered
[32m INFO[0m [Stats #0] run time: 0h-1m-35s, clients: 1, corpus: 66, objectives: 0, executions: 649969, exec/sec: 8.693k
[32m INFO[0m [Stats #0] run time: 0h-1m-35s, clients: 1, corpus: 66, objectives: 0, executions: 649969, exec/sec: 8.622k
[32m INFO[0m ============= New Corpus Item =============
[32m INFO[0m Reverted? false 
 Txn:
[Sender] 0x8E################################d79dd
   [1] Router.swapExactETHForTokens{value: 1061.6728 ether}(0, path:(WETH  0xa0################################3932B), address(this), block.timestamp);
   [1] 0xa0################################3932B.transfer(0x68################################c9024, 25)
       0x01
   [1] 0xa0################################3932B.reflect(387)

[32m INFO[0m ==========================================
[32m INFO[0m [Testcase #0] run time: 0h-1m-35s, clients: 1, corpus: 67, objectives: 0, executions: 656195, exec/sec: 8.704k
[32m INFO[0m ============= Coverage Summary =============
[32m INFO[0m 0xbb################################c095c: 11.03% Instruction Covered, 13.16% Branch Covered
[32m INFO[0m 0xa0################################3932b: 50.89% Instruction Covered, 41.12% Branch Covered
[32m INFO[0m [Stats #0] run time: 0h-1m-36s, clients: 1, corpus: 67, objectives: 0, executions: 659492, exec/sec: 8.704k
[32m INFO[0m [Stats #0] run time: 0h-1m-37s, clients: 1, corpus: 67, objectives: 0, executions: 669201, exec/sec: 8.716k
Timeout