[32m INFO[0m fetching abi from https://api.etherscan.io/api?module=contract&action=getabi&address=0x10################################6024e&format=json&apikey=GS896CZ6PQ13S3HGE6FRK1Z9DYCZFWF2RC
[32m INFO[0m fetching code from 10ed43c718714eb63d5aa57b78b54704e256024e
Contract loaded: 0x10################################6024e
[32m INFO[0m fetching abi from https://api.etherscan.io/api?module=contract&action=getabi&address=0xbb################################c095c&format=json&apikey=GS896CZ6PQ13S3HGE6FRK1Z9DYCZFWF2RC
[32m INFO[0m fetching code from bb4cdb9cbd36b01bd1cbaebf2de08d9173bc095c
Contract loaded: 0xbb################################c095c
[32m INFO[0m fetching abi from https://api.etherscan.io/api?module=contract&action=getabi&address=0xbd################################3d5a2&format=json&apikey=GS896CZ6PQ13S3HGE6FRK1Z9DYCZFWF2RC
[32m INFO[0m fetching code from bd266ed809e58de2eec3b185840d7a7e82c3d5a2
Contract loaded: 0xbd################################3d5a2
[32m INFO[0m 

 ================ EVM Fuzzer Start ===================


[32m INFO[0m Deploying contract: 0x10################################6024e
[32m INFO[0m Contract 0x10################################6024e deployed to: 0x10################################6024e -> balacne is 0
[32m INFO[0m Deploying contract: 0xbb################################c095c
[32m INFO[0m Contract 0xbb################################c095c deployed to: 0xbb################################c095c -> balacne is 0
[32m INFO[0m Deploying contract: 0xbd################################3d5a2
[32m INFO[0m Contract 0xbd################################3d5a2 deployed to: 0xbd################################3d5a2 -> balacne is 0
[32m INFO[0m Deployed all contracts

[32m INFO[0m Contract 0xbb################################c095c has no abi
[32m INFO[0m Too many unknown function signature for "0xbb################################c095c", we are going to decompile this contract using EVMole
[32m INFO[0m fetching pairs for 0xbd################################3d5a2
[32m INFO[0m fetching pairs for 0xbd################################3d5a2
[32m INFO[0m fetching code from 9f611f962301d66becd60f9eaecf3a5488326651
[32m INFO[0m fetching code from c02aaa39b223fe8d0a0e5c4f27ead9083c756cc2
[32m INFO[0m [Stats #0] run time: 0h-0m-5s, clients: 1, corpus: 0, objectives: 0, executions: 0, exec/sec: 0.000
[32m INFO[0m ============= New Corpus Item =============
[32m INFO[0m Reverted? false 
 Txn:
[Sender] 0x35################################31dDb
   [1] Router.swapExactETHForTokens{value: 18.4146 ether}(0, path:(WETH  0xbD################################3D5A2), address(this), block.timestamp);

[32m INFO[0m ==========================================
[32m INFO[0m [Testcase #0] run time: 0h-0m-5s, clients: 1, corpus: 13, objectives: 0, executions: 1, exec/sec: 0.000
[32m INFO[0m [Stats #0] run time: 0h-0m-5s, clients: 1, corpus: 13, objectives: 0, executions: 1, exec/sec: 0.000
[32m INFO[0m ============= New Corpus Item =============
[32m INFO[0m Reverted? true 
 Txn:
[Sender] 0x35################################31dDb
   [1] Router.swapExactETHForTokens{value: 4722.3664 ether}(0, path:(WETH  0xbD################################3D5A2), address(this), block.timestamp);
   [1] Router.swapExactETHForTokens{value: 4230743692}(0, path:(WETH  0xbD################################3D5A2), address(this), block.timestamp);

[32m INFO[0m ==========================================
[32m INFO[0m [Testcase #0] run time: 0h-0m-5s, clients: 1, corpus: 14, objectives: 0, executions: 5, exec/sec: 0.000
[32m INFO[0m ============= Coverage Summary =============
[32m INFO[0m 0xc0################################56cc2: 11.03% Instruction Covered, 13.16% Branch Covered
[32m INFO[0m 0xbd################################3d5a2: 38.63% Instruction Covered, 38.71% Branch Covered
[32m INFO[0m [Stats #0] run time: 0h-0m-5s, clients: 1, corpus: 14, objectives: 0, executions: 5, exec/sec: 0.000
[32m INFO[0m ============= New Corpus Item =============
[32m INFO[0m Reverted? true 
 Txn:
[Sender] 0x35################################31dDb
   [1] Router.swapExactETHForTokens{value: 4722.3664 ether}(0, path:(WETH  0xbD################################3D5A2), address(this), block.timestamp);
[Sender] 0x68################################c9024
   [1] 0xbD################################3D5A2.approve(0x00################################00000, 904970002602041650953030948660721267970432139513051913841.4622 ether)
       0x08################################0000000000000000000000000000000000020000000000000000000000000000000000000000000000000000000000000002245524332303a20617070726f766520746f20746865207a65726f2061646472657373000000000000000000000000000000000000000000000000000000000000

[32m INFO[0m ==========================================
[32m INFO[0m [Testcase #0] run time: 0h-0m-5s, clients: 1, corpus: 15, objectives: 0, executions: 33, exec/sec: 0.000
[32m INFO[0m [Stats #0] run time: 0h-0m-5s, clients: 1, corpus: 15, objectives: 0, executions: 33, exec/sec: 0.000
[32m INFO[0m ============= New Corpus Item =============
[32m INFO[0m Reverted? false 
 Txn:
[Sender] 0x35################################31dDb
   [1] Router.swapExactETHForTokens{value: 4722.3664 ether}(0, path:(WETH  0xbD################################3D5A2), address(this), block.timestamp);
[Sender] 0xe1################################c8510
   [1] 0xbD################################3D5A2.approve(0x10################################6024E, 0)
       0x01

[32m INFO[0m ==========================================
[32m INFO[0m [Testcase #0] run time: 0h-0m-5s, clients: 1, corpus: 16, objectives: 0, executions: 34, exec/sec: 0.000
[32m INFO[0m [Stats #0] run time: 0h-0m-5s, clients: 1, corpus: 16, objectives: 0, executions: 34, exec/sec: 0.000
[32m INFO[0m ============= New Corpus Item =============
[32m INFO[0m Reverted? true 
 Txn:
[Sender] 0x35################################31dDb
   [1] Router.swapExactETHForTokens{value: 4722.3664 ether}(0, path:(WETH  0xbD################################3D5A2), address(this), block.timestamp);
   [1] Router.swapExactETHForTokens{value: 3997.9020 ether}(0, path:(WETH  0xbD################################3D5A2), address(this), block.timestamp);
   [1] Router.swapExactETHForTokens{value: 3600.3383 ether}(0, path:(WETH  0xbD################################3D5A2), address(this), block.timestamp);
[Sender] 0xe1################################c8510
   [1] 0xbD################################3D5A2.approve{value: 860.8393 ether}(0x00################################00000, 95444085138762727415814838474603352777111631553.6909 ether)

[32m INFO[0m ==========================================
[32m INFO[0m [Testcase #0] run time: 0h-0m-5s, clients: 1, corpus: 17, objectives: 0, executions: 35, exec/sec: 0.000
[32m INFO[0m [Stats #0] run time: 0h-0m-6s, clients: 1, corpus: 17, objectives: 0, executions: 35, exec/sec: 34.49
[32m INFO[0m ============= New Corpus Item =============
[32m INFO[0m Reverted? false 
 Txn:
[Sender] 0x35################################31dDb
   [1] Router.swapExactETHForTokens{value: 4722.3664 ether}(0, path:(WETH  0xbD################################3D5A2), address(this), block.timestamp);
   [1] Router.swapExactETHForTokens{value: 3997.9020 ether}(0, path:(WETH  0xbD################################3D5A2), address(this), block.timestamp);
[Sender] 0xe1################################c8510
   [1] 0xbD################################3D5A2.approve(0x8E################################d79dd, 1809330570232977660306034271899782687071621802716559936281.4966 ether)
       0x01

[32m INFO[0m ==========================================
[32m INFO[0m [Testcase #0] run time: 0h-0m-6s, clients: 1, corpus: 18, objectives: 0, executions: 47, exec/sec: 46.26
[32m INFO[0m ============= Coverage Summary =============
[32m INFO[0m 0xc0################################56cc2: 11.03% Instruction Covered, 13.16% Branch Covered
[32m INFO[0m 0xbd################################3d5a2: 39.95% Instruction Covered, 39.35% Branch Covered
[32m INFO[0m [Stats #0] run time: 0h-0m-6s, clients: 1, corpus: 18, objectives: 0, executions: 47, exec/sec: 45.44
[32m INFO[0m ============= New Corpus Item =============
[32m INFO[0m Reverted? true 
 Txn:
[Sender] 0x35################################31dDb
   [1] Router.swapExactETHForTokens{value: 4722.3664 ether}(0, path:(WETH  0xbD################################3D5A2), address(this), block.timestamp);
   [1] Router.swapExactETHForTokens{value: 706.3884 ether}(0, path:(WETH  0xbD################################3D5A2), address(this), block.timestamp);
   [1] Router.swapExactETHForTokens{value: 4722.3664 ether}(0, path:(WETH  0xbD################################3D5A2), address(this), block.timestamp);
   [1] 0xbD################################3D5A2.decreaseAllowance(0x00################################00000, 0)
       0x08################################0000000000000000000000000000000000020000000000000000000000000000000000000000000000000000000000000002245524332303a20617070726f766520746f20746865207a65726f2061646472657373000000000000000000000000000000000000000000000000000000000000

[32m INFO[0m ==========================================
[32m INFO[0m [Testcase #0] run time: 0h-0m-6s, clients: 1, corpus: 19, objectives: 0, executions: 65, exec/sec: 62.81
[32m INFO[0m [Stats #0] run time: 0h-0m-6s, clients: 1, corpus: 19, objectives: 0, executions: 65, exec/sec: 53.24
[32m INFO[0m ============= New Corpus Item =============
[32m INFO[0m Reverted? true 
 Txn:
[Sender] 0x35################################31dDb
   [1] Router.swapExactETHForTokens{value: 18.4146 ether}(0, path:(WETH  0xbD################################3D5A2), address(this), block.timestamp);
   [1] Router.swapExactETHForTokens{value: 3294.7354 ether}(0, path:(WETH  0xbD################################3D5A2), address(this), block.timestamp);
   [1] 0xbD################################3D5A2.decreaseAllowance(0x00################################00000, 115792089237316195417293883276224230364096001078840267288787.7946 ether)
       0x08################################0000000000000000000000000000000000020000000000000000000000000000000000000000000000000000000000000002545524332303a2064656372656173656420616c6c6f77616e63652062656c6f77207a65726f000000000000000000000000000000000000000000000000000000

[32m INFO[0m ==========================================
[32m INFO[0m [Testcase #0] run time: 0h-0m-6s, clients: 1, corpus: 20, objectives: 0, executions: 69, exec/sec: 56.46
[32m INFO[0m ============= Coverage Summary =============
[32m INFO[0m 0xbd################################3d5a2: 41.33% Instruction Covered, 40.65% Branch Covered
[32m INFO[0m 0xc0################################56cc2: 11.03% Instruction Covered, 13.16% Branch Covered
[32m INFO[0m [Stats #0] run time: 0h-0m-7s, clients: 1, corpus: 20, objectives: 0, executions: 96, exec/sec: 44.22
[32m INFO[0m [Stats #0] run time: 0h-0m-7s, clients: 1, corpus: 20, objectives: 0, executions: 96, exec/sec: 44.21
[32m INFO[0m ============= New Corpus Item =============
[32m INFO[0m Reverted? true 
 Txn:
[Sender] 0x35################################31dDb
   [1] Router.swapExactETHForTokens{value: 4722.3664 ether}(0, path:(WETH  0xbD################################3D5A2), address(this), block.timestamp);
   [1] 0xbD################################3D5A2.excludeAccount(0x10################################6024E)
       0x08################################000000000000000000000000000000000002000000000000000000000000000000000000000000000000000000000000000204f776e61626c653a2063616c6c6572206973206e6f7420746865206f776e6572

[32m INFO[0m ==========================================
[32m INFO[0m [Testcase #0] run time: 0h-0m-7s, clients: 1, corpus: 21, objectives: 0, executions: 97, exec/sec: 44.66
[32m INFO[0m ============= Coverage Summary =============
[32m INFO[0m 0xbd################################3d5a2: 41.33% Instruction Covered, 40.65% Branch Covered
[32m INFO[0m 0xc0################################56cc2: 11.03% Instruction Covered, 13.16% Branch Covered
[32m INFO[0m [Stats #0] run time: 0h-0m-7s, clients: 1, corpus: 21, objectives: 0, executions: 97, exec/sec: 44.55
[32m INFO[0m ============= New Corpus Item =============
[32m INFO[0m Reverted? true 
 Txn:
[Sender] 0x35################################31dDb
   [1] Router.swapExactETHForTokens{value: 18.4146 ether}(0, path:(WETH  0xbD################################3D5A2), address(this), block.timestamp);
   [1] Router.swapExactETHForTokens{value: 3294.7354 ether}(0, path:(WETH  0xbD################################3D5A2), address(this), block.timestamp);
[Sender] 0xe1################################c8510
   [1] 0xbD################################3D5A2.includeAccount(0x35################################31dDb)
       0x08################################000000000000000000000000000000000002000000000000000000000000000000000000000000000000000000000000000204f776e61626c653a2063616c6c6572206973206e6f7420746865206f776e6572

[32m INFO[0m ==========================================
[32m INFO[0m [Testcase #0] run time: 0h-0m-7s, clients: 1, corpus: 22, objectives: 0, executions: 129, exec/sec: 59.23
[32m INFO[0m ============= Coverage Summary =============
[32m INFO[0m 0xbd################################3d5a2: 41.33% Instruction Covered, 40.65% Branch Covered
[32m INFO[0m 0xc0################################56cc2: 11.03% Instruction Covered, 13.16% Branch Covered
[32m INFO[0m [Stats #0] run time: 0h-0m-7s, clients: 1, corpus: 22, objectives: 0, executions: 129, exec/sec: 59.15
[32m INFO[0m ============= New Corpus Item =============
[32m INFO[0m Reverted? false 
 Txn:
[Sender] 0x35################################31dDb
   [1] Router.swapExactETHForTokens{value: 18.4146 ether}(0, path:(WETH  0xbD################################3D5A2), address(this), block.timestamp);
   [1] Router.swapExactETHForTokens{value: 2300.2418 ether}(0, path:(WETH  0xbD################################3D5A2), address(this), block.timestamp);
   [1] 0xbD################################3D5A2.increaseAllowance(0xbb################################c095c, 31793653603052781618625405508835319163115882219762516808626.8435 ether)
       0x01

[32m INFO[0m ==========================================
[32m INFO[0m [Testcase #0] run time: 0h-0m-7s, clients: 1, corpus: 23, objectives: 0, executions: 161, exec/sec: 73.80
[32m INFO[0m [Stats #0] run time: 0h-0m-8s, clients: 1, corpus: 23, objectives: 0, executions: 161, exec/sec: 51.18
[32m INFO[0m ============= New Corpus Item =============
[32m INFO[0m Reverted? false 
 Txn:
[Sender] 0x35################################31dDb
   [1] Router.swapExactETHForTokens{value: 18.4146 ether}(0, path:(WETH  0xbD################################3D5A2), address(this), block.timestamp);
[Sender] 0x68################################c9024
   [1] 0xbD################################3D5A2.increaseAllowance(0xbb################################c095c, 0)
       0x01

[32m INFO[0m ==========================================
[32m INFO[0m [Testcase #0] run time: 0h-0m-8s, clients: 1, corpus: 24, objectives: 0, executions: 181, exec/sec: 57.52
[32m INFO[0m ============= Coverage Summary =============
[32m INFO[0m 0xbd################################3d5a2: 41.69% Instruction Covered, 40.65% Branch Covered
[32m INFO[0m 0xc0################################56cc2: 11.03% Instruction Covered, 13.16% Branch Covered
[32m INFO[0m [Stats #0] run time: 0h-0m-8s, clients: 1, corpus: 24, objectives: 0, executions: 192, exec/sec: 57.39
[32m INFO[0m [Stats #0] run time: 0h-0m-8s, clients: 1, corpus: 24, objectives: 0, executions: 192, exec/sec: 57.39
[32m INFO[0m ============= New Corpus Item =============
[32m INFO[0m Reverted? true 
 Txn:
[Sender] 0x35################################31dDb
   [1] Router.swapExactETHForTokens{value: 4722.3664 ether}(0, path:(WETH  0xbD################################3D5A2), address(this), block.timestamp);
[Sender] 0x8E################################d79dd
   [1] 0xbD################################3D5A2.reflect(0)
       0x08################################000000000000000000000000000000000002000000000000000000000000000000000000000000000000000000000000000204f776e61626c653a2063616c6c6572206973206e6f7420746865206f776e6572

[32m INFO[0m ==========================================
[32m INFO[0m [Testcase #0] run time: 0h-0m-8s, clients: 1, corpus: 25, objectives: 0, executions: 193, exec/sec: 57.67
[32m INFO[0m ============= Coverage Summary =============
[32m INFO[0m 0xbd################################3d5a2: 41.69% Instruction Covered, 40.65% Branch Covered
[32m INFO[0m 0xc0################################56cc2: 11.03% Instruction Covered, 13.16% Branch Covered
[32m INFO[0m [Stats #0] run time: 0h-0m-8s, clients: 1, corpus: 25, objectives: 0, executions: 193, exec/sec: 57.52
[32m INFO[0m ============= New Corpus Item =============
[32m INFO[0m Reverted? true 
 Txn:
[Sender] 0x35################################31dDb
   [1] Router.swapExactETHForTokens{value: 4722.3664 ether}(0, path:(WETH  0xbD################################3D5A2), address(this), block.timestamp);
   [1] Router.swapExactETHForTokens{value: 3997.9020 ether}(0, path:(WETH  0xbD################################3D5A2), address(this), block.timestamp);
   [1] Router.swapExactETHForTokens{value: 1839.4601 ether}(0, path:(WETH  0xbD################################3D5A2), address(this), block.timestamp);
   [1] Router.swapExactETHForTokens{value: 4703.9197 ether}(0, path:(WETH  0xbD################################3D5A2), address(this), block.timestamp);
   [1] 0xbD################################3D5A2.renounceOwnership()
       0x08################################000000000000000000000000000000000002000000000000000000000000000000000000000000000000000000000000000204f776e61626c653a2063616c6c6572206973206e6f7420746865206f776e6572

[32m INFO[0m ==========================================
[32m INFO[0m [Testcase #0] run time: 0h-0m-8s, clients: 1, corpus: 26, objectives: 0, executions: 225, exec/sec: 67.04
[32m INFO[0m ============= Coverage Summary =============
[32m INFO[0m 0xbd################################3d5a2: 41.69% Instruction Covered, 40.65% Branch Covered
[32m INFO[0m 0xc0################################56cc2: 11.03% Instruction Covered, 13.16% Branch Covered
[32m INFO[0m [Stats #0] run time: 0h-0m-8s, clients: 1, corpus: 26, objectives: 0, executions: 225, exec/sec: 63.32
[32m INFO[0m ============= New Corpus Item =============
[32m INFO[0m Reverted? true 
 Txn:
[Sender] 0x35################################31dDb
   [1] Router.swapExactETHForTokens{value: 18.4146 ether}(0, path:(WETH  0xbD################################3D5A2), address(this), block.timestamp);
   [1] Router.swapExactETHForTokens{value: 3294.7354 ether}(0, path:(WETH  0xbD################################3D5A2), address(this), block.timestamp);
   [1] Router.swapExactETHForTokens{value: 10.0 ether}(0, path:(WETH  0xbD################################3D5A2), address(this), block.timestamp);
[Sender] 0xe1################################c8510
   [1] 0xbD################################3D5A2.approve(0x10################################6024E, 40034987640919133388361231378981188937511509485054547670218.5658 ether)
       0x01
[Sender] 0x68################################c9024
   [1] 0xbD################################3D5A2.transfer(0x10################################6024E, 1766847064829806346999585190987508995571437730951172665.4286 ether)
       0x08################################00000000000000000000000000000000000200000000000000000000000000000000000000000000000000000000000000021536166654d6174683a206d756c7469706c69636174696f6e206f766572666c6f7700000000000000000000000000000000000000000000000000000000000000

[32m INFO[0m ==========================================
[32m INFO[0m [Testcase #0] run time: 0h-0m-8s, clients: 1, corpus: 27, objectives: 0, executions: 257, exec/sec: 72.30
[32m INFO[0m [Stats #0] run time: 0h-0m-8s, clients: 1, corpus: 27, objectives: 0, executions: 257, exec/sec: 72.30
[32m INFO[0m ============= New Corpus Item =============
[32m INFO[0m Reverted? true 
 Txn:
[Sender] 0x35################################31dDb
   [1] Router.swapExactETHForTokens{value: 18.4146 ether}(0, path:(WETH  0xbD################################3D5A2), address(this), block.timestamp);
   [1] Router.swapExactETHForTokens{value: 3294.7354 ether}(0, path:(WETH  0xbD################################3D5A2), address(this), block.timestamp);
[Sender] 0x68################################c9024
   [1] 0xbD################################3D5A2.transfer(0x00################################00000, 0)
       0x08################################0000000000000000000000000000000000020000000000000000000000000000000000000000000000000000000000000002345524332303a207472616e7366657220746f20746865207a65726f20616464726573730000000000000000000000000000000000000000000000000000000000

[32m INFO[0m ==========================================
[32m INFO[0m [Testcase #0] run time: 0h-0m-8s, clients: 1, corpus: 28, objectives: 0, executions: 258, exec/sec: 72.56
[32m INFO[0m ============= Coverage Summary =============
[32m INFO[0m 0xbd################################3d5a2: 42.19% Instruction Covered, 40.97% Branch Covered
[32m INFO[0m 0xc0################################56cc2: 11.03% Instruction Covered, 13.16% Branch Covered
[32m INFO[0m [Stats #0] run time: 0h-0m-8s, clients: 1, corpus: 28, objectives: 0, executions: 258, exec/sec: 72.25
[32m INFO[0m ============= New Corpus Item =============
[32m INFO[0m Reverted? true 
 Txn:
[Sender] 0x35################################31dDb
   [1] Router.swapExactETHForTokens{value: 4722.3664 ether}(0, path:(WETH  0xbD################################3D5A2), address(this), block.timestamp);
   [1] Router.swapExactETHForTokens{value: 706.3884 ether}(0, path:(WETH  0xbD################################3D5A2), address(this), block.timestamp);
[Sender] 0x68################################c9024
   [1] 0xbD################################3D5A2.transferFrom(0x00################################00000, 0x00################################00000, 0)
       0x08################################0000000000000000000000000000000000020000000000000000000000000000000000000000000000000000000000000002545524332303a207472616e736665722066726f6d20746865207a65726f2061646472657373000000000000000000000000000000000000000000000000000000

[32m INFO[0m ==========================================
[32m INFO[0m [Testcase #0] run time: 0h-0m-8s, clients: 1, corpus: 29, objectives: 0, executions: 289, exec/sec: 80.92
[32m INFO[0m ============= Coverage Summary =============
[32m INFO[0m 0xbd################################3d5a2: 42.19% Instruction Covered, 40.97% Branch Covered
[32m INFO[0m 0xc0################################56cc2: 11.03% Instruction Covered, 13.16% Branch Covered
[32m INFO[0m [Stats #0] run time: 0h-0m-9s, clients: 1, corpus: 29, objectives: 0, executions: 289, exec/sec: 72.85
[32m INFO[0m ============= New Corpus Item =============
[32m INFO[0m Reverted? true 
 Txn:
[Sender] 0x35################################31dDb
   [1] Router.swapExactETHForTokens{value: 18.4146 ether}(0, path:(WETH  0xbD################################3D5A2), address(this), block.timestamp);
   [1] Router.swapExactETHForTokens{value: 147.5750 ether}(0, path:(WETH  0xbD################################3D5A2), address(this), block.timestamp);
   [1] 0xbD################################3D5A2.transferOwnership(0x00################################00000)
       0x08################################000000000000000000000000000000000002000000000000000000000000000000000000000000000000000000000000000204f776e61626c653a2063616c6c6572206973206e6f7420746865206f776e6572

[32m INFO[0m ==========================================
[32m INFO[0m [Testcase #0] run time: 0h-0m-9s, clients: 1, corpus: 30, objectives: 0, executions: 322, exec/sec: 81.15
[32m INFO[0m ============= Coverage Summary =============
[32m INFO[0m 0xc0################################56cc2: 11.03% Instruction Covered, 13.16% Branch Covered
[32m INFO[0m 0xbd################################3d5a2: 42.19% Instruction Covered, 40.97% Branch Covered
[32m INFO[0m [Stats #0] run time: 0h-0m-9s, clients: 1, corpus: 30, objectives: 0, executions: 322, exec/sec: 81.03
[32m INFO[0m ============= New Corpus Item =============
[32m INFO[0m Reverted? true 
 Txn:
[Sender] 0x35################################31dDb
   [1] Router.swapExactETHForTokens{value: 4722.3664 ether}(0, path:(WETH  0xbD################################3D5A2), address(this), block.timestamp);
   [1] Router.swapExactETHForTokens{value: 3997.9020 ether}(0, path:(WETH  0xbD################################3D5A2), address(this), block.timestamp);
   [1] Router.swapExactETHForTokens{value: 1839.4601 ether}(0, path:(WETH  0xbD################################3D5A2), address(this), block.timestamp);
   [1] Router.swapExactETHForTokens{value: 1238.5303 ether}(0, path:(WETH  0xbD################################3D5A2), address(this), block.timestamp);
[Sender] 0x8E################################d79dd
   [1] 0xbD################################3D5A2.approve(0x35################################31dDb, 3100085118741679606302463898859978946109702456849819196213.1673 ether)
       0x01
[Sender] 0x68################################c9024
   [1] 0xbD################################3D5A2.transferto(0xe1################################c8510, 115792089237315989729320094874821379889987419659505865999672.1714 ether)
       0x08################################000000000000000000000000000000000002000000000000000000000000000000000000000000000000000000000000000204f776e61626c653a2063616c6c6572206973206e6f7420746865206f776e6572

[32m INFO[0m ==========================================
[32m INFO[0m [Testcase #0] run time: 0h-0m-9s, clients: 1, corpus: 31, objectives: 0, executions: 353, exec/sec: 88.82
[32m INFO[0m ============= Coverage Summary =============
[32m INFO[0m 0xc0################################56cc2: 11.03% Instruction Covered, 13.16% Branch Covered
[32m INFO[0m 0xbd################################3d5a2: 42.19% Instruction Covered, 40.97% Branch Covered
[32m INFO[0m [Stats #0] run time: 0h-0m-9s, clients: 1, corpus: 31, objectives: 0, executions: 353, exec/sec: 88.58
[32m INFO[0m ============= New Corpus Item =============
[32m INFO[0m Reverted? false 
 Txn:
[Sender] 0x35################################31dDb
   [1] Router.swapExactETHForTokens{value: 4722.3664 ether}(0, path:(WETH  0xbD################################3D5A2), address(this), block.timestamp);
   [1] Router.swapExactETHForTokens{value: 3997.9020 ether}(0, path:(WETH  0xbD################################3D5A2), address(this), block.timestamp);
   [1] Router.swapExactETHForTokens{value: 1839.4601 ether}(0, path:(WETH  0xbD################################3D5A2), address(this), block.timestamp);
   [1] Router.swapExactETHForTokens{value: 255102184063096}(0, path:(WETH  0xbD################################3D5A2), address(this), block.timestamp);

[32m INFO[0m ==========================================
[32m INFO[0m [Testcase #0] run time: 0h-0m-9s, clients: 1, corpus: 32, objectives: 0, executions: 393, exec/sec: 98.61
[32m INFO[0m ============= Coverage Summary =============
[32m INFO[0m 0xc0################################56cc2: 11.03% Instruction Covered, 13.16% Branch Covered
[32m INFO[0m 0xbd################################3d5a2: 42.19% Instruction Covered, 40.97% Branch Covered
[32m INFO[0m [Stats #0] run time: 0h-0m-9s, clients: 1, corpus: 32, objectives: 0, executions: 608, exec/sec: 137.0
[32m INFO[0m [Stats #0] run time: 0h-0m-10s, clients: 1, corpus: 32, objectives: 0, executions: 768, exec/sec: 141.0
[32m INFO[0m [Stats #0] run time: 0h-0m-11s, clients: 1, corpus: 32, objectives: 0, executions: 1791, exec/sec: 263.2
[32m INFO[0m [Stats #0] run time: 0h-0m-12s, clients: 1, corpus: 32, objectives: 0, executions: 4603, exec/sec: 589.5
[32m INFO[0m [Stats #0] run time: 0h-0m-13s, clients: 1, corpus: 32, objectives: 0, executions: 4603, exec/sec: 566.5
[32m INFO[0m ============= New Corpus Item =============
[32m INFO[0m Reverted? false 
 Txn:
[Sender] 0x35################################31dDb
   [1] Router.swapExactETHForTokens{value: 4722.3664 ether}(0, path:(WETH  0xbD################################3D5A2), address(this), block.timestamp);
   [1] Router.swapExactETHForTokens{value: 4722.3664 ether}(0, path:(WETH  0xbD################################3D5A2), address(this), block.timestamp);
   [1] 0xbD################################3D5A2.decreaseAllowance(0x8E################################d79dd, 0)
       0x01

[32m INFO[0m ==========================================
[32m INFO[0m [Testcase #0] run time: 0h-0m-13s, clients: 1, corpus: 33, objectives: 0, executions: 5185, exec/sec: 638.0
[32m INFO[0m ============= Coverage Summary =============
[32m INFO[0m 0xbd################################3d5a2: 42.56% Instruction Covered, 40.97% Branch Covered
[32m INFO[0m 0xc0################################56cc2: 11.03% Instruction Covered, 13.16% Branch Covered
[32m INFO[0m [Stats #0] run time: 0h-0m-13s, clients: 1, corpus: 33, objectives: 0, executions: 7413, exec/sec: 839.4
[32m INFO[0m [Stats #0] run time: 0h-0m-14s, clients: 1, corpus: 33, objectives: 0, executions: 12912, exec/sec: 1.313k
[32m INFO[0m [Stats #0] run time: 0h-0m-15s, clients: 1, corpus: 33, objectives: 0, executions: 12912, exec/sec: 1.296k
[32m INFO[0m ============= New Corpus Item =============
[32m INFO[0m Reverted? false 
 Txn:
[Sender] 0x35################################31dDb
   [1] Router.swapExactETHForTokens{value: 4722.3664 ether}(0, path:(WETH  0xbD################################3D5A2), address(this), block.timestamp);
   [1] Router.swapExactETHForTokens{value: 297.3811 ether}(0, path:(WETH  0xbD################################3D5A2), address(this), block.timestamp);
   [1] 0xbD################################3D5A2.transfer(0xbb################################c095c, 6508)
       0x01

[32m INFO[0m ==========================================
[32m INFO[0m [Testcase #0] run time: 0h-0m-15s, clients: 1, corpus: 34, objectives: 0, executions: 13832, exec/sec: 1.388k
[32m INFO[0m ============= Coverage Summary =============
[32m INFO[0m 0xc0################################56cc2: 11.03% Instruction Covered, 13.16% Branch Covered
[32m INFO[0m 0xbd################################3d5a2: 42.56% Instruction Covered, 40.97% Branch Covered
[32m INFO[0m [Stats #0] run time: 0h-0m-15s, clients: 1, corpus: 34, objectives: 0, executions: 13832, exec/sec: 1.371k
[32m INFO[0m ============= New Corpus Item =============
[32m INFO[0m Reverted? false 
 Txn:
[Sender] 0x35################################31dDb
   [1] Router.swapExactETHForTokens{value: 4722.3664 ether}(0, path:(WETH  0xbD################################3D5A2), address(this), block.timestamp);
   [1] Router.swapExactETHForTokens{value: 297.3811 ether}(0, path:(WETH  0xbD################################3D5A2), address(this), block.timestamp);
   [1] 0xbD################################3D5A2.transfer(0xe1################################c8510, 6508)
       0x01

[32m INFO[0m ==========================================
[32m INFO[0m [Testcase #0] run time: 0h-0m-15s, clients: 1, corpus: 35, objectives: 0, executions: 14627, exec/sec: 1.450k
[32m INFO[0m ============= Coverage Summary =============
[32m INFO[0m 0xbd################################3d5a2: 42.56% Instruction Covered, 40.97% Branch Covered
[32m INFO[0m 0xc0################################56cc2: 11.03% Instruction Covered, 13.16% Branch Covered
[32m INFO[0m [Stats #0] run time: 0h-0m-15s, clients: 1, corpus: 35, objectives: 0, executions: 14627, exec/sec: 1.448k
[32m INFO[0m ============= New Corpus Item =============
[32m INFO[0m Reverted? false 
 Txn:
[Sender] 0x35################################31dDb
   [1] Router.swapExactETHForTokens{value: 4722.3664 ether}(0, path:(WETH  0xbD################################3D5A2), address(this), block.timestamp);
   [1] Router.swapExactETHForTokens{value: 297.3811 ether}(0, path:(WETH  0xbD################################3D5A2), address(this), block.timestamp);
   [1] 0xbD################################3D5A2.transfer(0xe1################################c8510, 1)
       0x01

[32m INFO[0m ==========================================
[32m INFO[0m [Testcase #0] run time: 0h-0m-15s, clients: 1, corpus: 36, objectives: 0, executions: 14655, exec/sec: 1.450k
[32m INFO[0m ============= Coverage Summary =============
[32m INFO[0m 0xbd################################3d5a2: 42.56% Instruction Covered, 40.97% Branch Covered
[32m INFO[0m 0xc0################################56cc2: 11.03% Instruction Covered, 13.16% Branch Covered
[32m INFO[0m [Stats #0] run time: 0h-0m-15s, clients: 1, corpus: 36, objectives: 0, executions: 14655, exec/sec: 1.418k
[32m INFO[0m ============= New Corpus Item =============
[32m INFO[0m Reverted? false 
 Txn:
[Sender] 0x35################################31dDb
   [1] Router.swapExactETHForTokens{value: 4722.3664 ether}(0, path:(WETH  0xbD################################3D5A2), address(this), block.timestamp);
   [1] Router.swapExactETHForTokens{value: 297.3811 ether}(0, path:(WETH  0xbD################################3D5A2), address(this), block.timestamp);
   [1] 0xbD################################3D5A2.transfer(0x68################################c9024, 1)
       0x01
   [1] 0xbD################################3D5A2.transfer(0xe1################################c8510, 1)
       0x01

[32m INFO[0m ==========================================
[32m INFO[0m [Testcase #0] run time: 0h-0m-15s, clients: 1, corpus: 37, objectives: 0, executions: 14697, exec/sec: 1.422k
[32m INFO[0m ============= Coverage Summary =============
[32m INFO[0m 0xbd################################3d5a2: 42.56% Instruction Covered, 40.97% Branch Covered
[32m INFO[0m 0xc0################################56cc2: 11.03% Instruction Covered, 13.16% Branch Covered
[32m INFO[0m [Stats #0] run time: 0h-0m-15s, clients: 1, corpus: 37, objectives: 0, executions: 17547, exec/sec: 1.620k
[32m INFO[0m [Stats #0] run time: 0h-0m-16s, clients: 1, corpus: 37, objectives: 0, executions: 23431, exec/sec: 1.978k
[32m INFO[0m [Stats #0] run time: 0h-0m-17s, clients: 1, corpus: 37, objectives: 0, executions: 23431, exec/sec: 1.863k
[32m INFO[0m ============= New Corpus Item =============
[32m INFO[0m Reverted? false 
 Txn:
[Sender] 0x35################################31dDb
   [1] Router.swapExactETHForTokens{value: 4722.3664 ether}(0, path:(WETH  0xbD################################3D5A2), address(this), block.timestamp);
   [1] Router.swapExactETHForTokens{value: 297.3811 ether}(0, path:(WETH  0xbD################################3D5A2), address(this), block.timestamp);
   [1] 0xbD################################3D5A2.transfer(0x68################################c9024, 1)
       0x01
   [1] 0xbD################################3D5A2.transfer(0xe1################################c8510, 6091)
       0x01

[32m INFO[0m ==========================================
[32m INFO[0m [Testcase #0] run time: 0h-0m-17s, clients: 1, corpus: 38, objectives: 0, executions: 27728, exec/sec: 2.205k
[32m INFO[0m ============= Coverage Summary =============
[32m INFO[0m 0xbd################################3d5a2: 42.56% Instruction Covered, 40.97% Branch Covered
[32m INFO[0m 0xc0################################56cc2: 11.03% Instruction Covered, 13.16% Branch Covered
[32m INFO[0m [Stats #0] run time: 0h-0m-17s, clients: 1, corpus: 38, objectives: 0, executions: 29249, exec/sec: 2.277k
[32m INFO[0m [Stats #0] run time: 0h-0m-18s, clients: 1, corpus: 38, objectives: 0, executions: 34969, exec/sec: 2.526k
[32m INFO[0m [Stats #0] run time: 0h-0m-19s, clients: 1, corpus: 38, objectives: 0, executions: 40500, exec/sec: 2.728k
[32m INFO[0m [Stats #0] run time: 0h-0m-20s, clients: 1, corpus: 38, objectives: 0, executions: 45964, exec/sec: 2.898k
[32m INFO[0m [Stats #0] run time: 0h-0m-21s, clients: 1, corpus: 38, objectives: 0, executions: 51621, exec/sec: 3.060k
[32m INFO[0m [Stats #0] run time: 0h-0m-22s, clients: 1, corpus: 38, objectives: 0, executions: 57375, exec/sec: 3.209k
[32m INFO[0m [Stats #0] run time: 0h-0m-23s, clients: 1, corpus: 38, objectives: 0, executions: 62968, exec/sec: 3.333k
[32m INFO[0m [Stats #0] run time: 0h-0m-24s, clients: 1, corpus: 38, objectives: 0, executions: 68851, exec/sec: 3.461k
[32m INFO[0m [Stats #0] run time: 0h-0m-25s, clients: 1, corpus: 38, objectives: 0, executions: 74349, exec/sec: 3.556k
[32m INFO[0m [Stats #0] run time: 0h-0m-26s, clients: 1, corpus: 38, objectives: 0, executions: 79940, exec/sec: 3.648k
[32m INFO[0m [Stats #0] run time: 0h-0m-27s, clients: 1, corpus: 38, objectives: 0, executions: 85564, exec/sec: 3.735k
[32m INFO[0m [Stats #0] run time: 0h-0m-29s, clients: 1, corpus: 38, objectives: 0, executions: 91127, exec/sec: 3.811k
[32m INFO[0m [Stats #0] run time: 0h-0m-30s, clients: 1, corpus: 38, objectives: 0, executions: 96912, exec/sec: 3.889k
[32m INFO[0m [Stats #0] run time: 0h-0m-31s, clients: 1, corpus: 38, objectives: 0, executions: 102600, exec/sec: 3.957k
[32m INFO[0m [Stats #0] run time: 0h-0m-31s, clients: 1, corpus: 38, objectives: 0, executions: 102600, exec/sec: 3.846k
[32m INFO[0m ============= New Corpus Item =============
[32m INFO[0m Reverted? false 
 Txn:
[Sender] 0x35################################31dDb
   [1] Router.swapExactETHForTokens{value: 4722.3664 ether}(0, path:(WETH  0xbD################################3D5A2), address(this), block.timestamp);
   [1] Router.swapExactETHForTokens{value: 297.3811 ether}(0, path:(WETH  0xbD################################3D5A2), address(this), block.timestamp);
   [1] 0xbD################################3D5A2.transfer(0x68################################c9024, 1)
       0x01
   [1] 0xbD################################3D5A2.transfer(0x68################################c9024, 9788)
       0x01
   [1] 0xbD################################3D5A2.transfer(0xe1################################c8510, 6091)
       0x01

[32m INFO[0m ==========================================
[32m INFO[0m [Testcase #0] run time: 0h-0m-31s, clients: 1, corpus: 39, objectives: 0, executions: 106700, exec/sec: 4.000k
[32m INFO[0m ============= Coverage Summary =============
[32m INFO[0m 0xc0################################56cc2: 11.03% Instruction Covered, 13.16% Branch Covered
[32m INFO[0m 0xbd################################3d5a2: 42.56% Instruction Covered, 40.97% Branch Covered
[32m INFO[0m [Stats #0] run time: 0h-0m-32s, clients: 1, corpus: 39, objectives: 0, executions: 108005, exec/sec: 4.010k
[32m INFO[0m [Stats #0] run time: 0h-0m-33s, clients: 1, corpus: 39, objectives: 0, executions: 113566, exec/sec: 4.066k
[32m INFO[0m [Stats #0] run time: 0h-0m-34s, clients: 1, corpus: 39, objectives: 0, executions: 119030, exec/sec: 4.113k
[32m INFO[0m [Stats #0] run time: 0h-0m-35s, clients: 1, corpus: 39, objectives: 0, executions: 124242, exec/sec: 4.148k
[32m INFO[0m [Stats #0] run time: 0h-0m-36s, clients: 1, corpus: 39, objectives: 0, executions: 129963, exec/sec: 4.197k
[32m INFO[0m [Stats #0] run time: 0h-0m-37s, clients: 1, corpus: 39, objectives: 0, executions: 135396, exec/sec: 4.235k
[32m INFO[0m [Stats #0] run time: 0h-0m-38s, clients: 1, corpus: 39, objectives: 0, executions: 140831, exec/sec: 4.271k
[32m INFO[0m [Stats #0] run time: 0h-0m-39s, clients: 1, corpus: 39, objectives: 0, executions: 146139, exec/sec: 4.301k
[32m INFO[0m [Stats #0] run time: 0h-0m-40s, clients: 1, corpus: 39, objectives: 0, executions: 151478, exec/sec: 4.331k
[32m INFO[0m [Stats #0] run time: 0h-0m-41s, clients: 1, corpus: 39, objectives: 0, executions: 156592, exec/sec: 4.352k
[32m INFO[0m [Stats #0] run time: 0h-0m-42s, clients: 1, corpus: 39, objectives: 0, executions: 162126, exec/sec: 4.384k
[32m INFO[0m [Stats #0] run time: 0h-0m-43s, clients: 1, corpus: 39, objectives: 0, executions: 167625, exec/sec: 4.412k
[32m INFO[0m [Stats #0] run time: 0h-0m-44s, clients: 1, corpus: 39, objectives: 0, executions: 172803, exec/sec: 4.431k
[32m INFO[0m [Stats #0] run time: 0h-0m-45s, clients: 1, corpus: 39, objectives: 0, executions: 178303, exec/sec: 4.458k
[32m INFO[0m [Stats #0] run time: 0h-0m-46s, clients: 1, corpus: 39, objectives: 0, executions: 183836, exec/sec: 4.483k
[32m INFO[0m [Stats #0] run time: 0h-0m-47s, clients: 1, corpus: 39, objectives: 0, executions: 189013, exec/sec: 4.499k
[32m INFO[0m [Stats #0] run time: 0h-0m-48s, clients: 1, corpus: 39, objectives: 0, executions: 194442, exec/sec: 4.520k
[32m INFO[0m [Stats #0] run time: 0h-0m-49s, clients: 1, corpus: 39, objectives: 0, executions: 200065, exec/sec: 4.545k
[32m INFO[0m [Stats #0] run time: 0h-0m-50s, clients: 1, corpus: 39, objectives: 0, executions: 205310, exec/sec: 4.560k
[32m INFO[0m [Stats #0] run time: 0h-0m-51s, clients: 1, corpus: 39, objectives: 0, executions: 211001, exec/sec: 4.583k
[32m INFO[0m [Stats #0] run time: 0h-0m-52s, clients: 1, corpus: 39, objectives: 0, executions: 216372, exec/sec: 4.599k
[32m INFO[0m [Stats #0] run time: 0h-0m-53s, clients: 1, corpus: 39, objectives: 0, executions: 221646, exec/sec: 4.613k
[32m INFO[0m [Stats #0] run time: 0h-0m-54s, clients: 1, corpus: 39, objectives: 0, executions: 227336, exec/sec: 4.635k
[32m INFO[0m [Stats #0] run time: 0h-0m-55s, clients: 1, corpus: 39, objectives: 0, executions: 232645, exec/sec: 4.647k
[32m INFO[0m [Stats #0] run time: 0h-0m-56s, clients: 1, corpus: 39, objectives: 0, executions: 238078, exec/sec: 4.661k
[32m INFO[0m [Stats #0] run time: 0h-0m-57s, clients: 1, corpus: 39, objectives: 0, executions: 243672, exec/sec: 4.679k
[32m INFO[0m [Stats #0] run time: 0h-0m-58s, clients: 1, corpus: 39, objectives: 0, executions: 248881, exec/sec: 4.688k
[32m INFO[0m [Stats #0] run time: 0h-0m-59s, clients: 1, corpus: 39, objectives: 0, executions: 254444, exec/sec: 4.703k
[32m INFO[0m [Stats #0] run time: 0h-1m-0s, clients: 1, corpus: 39, objectives: 0, executions: 260009, exec/sec: 4.717k
[32m INFO[0m [Stats #0] run time: 0h-1m-1s, clients: 1, corpus: 39, objectives: 0, executions: 265345, exec/sec: 4.728k
[32m INFO[0m [Stats #0] run time: 0h-1m-2s, clients: 1, corpus: 39, objectives: 0, executions: 270840, exec/sec: 4.742k
[32m INFO[0m [Stats #0] run time: 0h-1m-3s, clients: 1, corpus: 39, objectives: 0, executions: 276275, exec/sec: 4.754k
[32m INFO[0m [Stats #0] run time: 0h-1m-4s, clients: 1, corpus: 39, objectives: 0, executions: 281770, exec/sec: 4.766k
[32m INFO[0m [Stats #0] run time: 0h-1m-5s, clients: 1, corpus: 39, objectives: 0, executions: 287172, exec/sec: 4.776k
[32m INFO[0m [Stats #0] run time: 0h-1m-6s, clients: 1, corpus: 39, objectives: 0, executions: 292477, exec/sec: 4.784k
[32m INFO[0m [Stats #0] run time: 0h-1m-7s, clients: 1, corpus: 39, objectives: 0, executions: 297850, exec/sec: 4.794k
[32m INFO[0m [Stats #0] run time: 0h-1m-8s, clients: 1, corpus: 39, objectives: 0, executions: 303506, exec/sec: 4.807k
[32m INFO[0m [Stats #0] run time: 0h-1m-9s, clients: 1, corpus: 39, objectives: 0, executions: 308750, exec/sec: 4.813k
[32m INFO[0m [Stats #0] run time: 0h-1m-10s, clients: 1, corpus: 39, objectives: 0, executions: 314565, exec/sec: 4.829k
[32m INFO[0m [Stats #0] run time: 0h-1m-11s, clients: 1, corpus: 39, objectives: 0, executions: 319933, exec/sec: 4.836k
[32m INFO[0m [Stats #0] run time: 0h-1m-12s, clients: 1, corpus: 39, objectives: 0, executions: 325947, exec/sec: 4.853k
[32m INFO[0m [Stats #0] run time: 0h-1m-13s, clients: 1, corpus: 39, objectives: 0, executions: 331157, exec/sec: 4.858k
[32m INFO[0m [Stats #0] run time: 0h-1m-14s, clients: 1, corpus: 39, objectives: 0, executions: 336715, exec/sec: 4.868k
[32m INFO[0m [Stats #0] run time: 0h-1m-15s, clients: 1, corpus: 39, objectives: 0, executions: 342282, exec/sec: 4.877k
[32m INFO[0m [Stats #0] run time: 0h-1m-16s, clients: 1, corpus: 39, objectives: 0, executions: 347590, exec/sec: 4.883k
[32m INFO[0m [Stats #0] run time: 0h-1m-17s, clients: 1, corpus: 39, objectives: 0, executions: 353118, exec/sec: 4.891k
[32m INFO[0m [Stats #0] run time: 0h-1m-18s, clients: 1, corpus: 39, objectives: 0, executions: 358519, exec/sec: 4.898k
[32m INFO[0m [Stats #0] run time: 0h-1m-19s, clients: 1, corpus: 39, objectives: 0, executions: 363989, exec/sec: 4.905k
[32m INFO[0m [Stats #0] run time: 0h-1m-20s, clients: 1, corpus: 39, objectives: 0, executions: 369519, exec/sec: 4.913k
[32m INFO[0m [Stats #0] run time: 0h-1m-21s, clients: 1, corpus: 39, objectives: 0, executions: 374763, exec/sec: 4.917k
[32m INFO[0m [Stats #0] run time: 0h-1m-22s, clients: 1, corpus: 39, objectives: 0, executions: 380072, exec/sec: 4.922k
[32m INFO[0m [Stats #0] run time: 0h-1m-23s, clients: 1, corpus: 39, objectives: 0, executions: 385568, exec/sec: 4.929k
[32m INFO[0m [Stats #0] run time: 0h-1m-24s, clients: 1, corpus: 39, objectives: 0, executions: 390940, exec/sec: 4.935k
[32m INFO[0m [Stats #0] run time: 0h-1m-25s, clients: 1, corpus: 39, objectives: 0, executions: 396439, exec/sec: 4.942k
[32m INFO[0m [Stats #0] run time: 0h-1m-26s, clients: 1, corpus: 39, objectives: 0, executions: 402032, exec/sec: 4.949k
[32m INFO[0m [Stats #0] run time: 0h-1m-27s, clients: 1, corpus: 39, objectives: 0, executions: 407274, exec/sec: 4.953k
[32m INFO[0m [Stats #0] run time: 0h-1m-28s, clients: 1, corpus: 39, objectives: 0, executions: 412963, exec/sec: 4.961k
[32m INFO[0m [Stats #0] run time: 0h-1m-29s, clients: 1, corpus: 39, objectives: 0, executions: 418364, exec/sec: 4.965k
[32m INFO[0m [Stats #0] run time: 0h-1m-30s, clients: 1, corpus: 39, objectives: 0, executions: 423832, exec/sec: 4.970k
[32m INFO[0m [Stats #0] run time: 0h-1m-31s, clients: 1, corpus: 39, objectives: 0, executions: 429424, exec/sec: 4.977k
[32m INFO[0m [Stats #0] run time: 0h-1m-32s, clients: 1, corpus: 39, objectives: 0, executions: 434539, exec/sec: 4.979k
[32m INFO[0m [Stats #0] run time: 0h-1m-32s, clients: 1, corpus: 39, objectives: 0, executions: 434539, exec/sec: 4.967k
[32m INFO[0m ============= New Corpus Item =============
[32m INFO[0m Reverted? false 
 Txn:
[Sender] 0x35################################31dDb
   [1] Router.swapExactETHForTokens{value: 4722.3664 ether}(0, path:(WETH  0xbD################################3D5A2), address(this), block.timestamp);
   [1] 0xbD################################3D5A2.transfer(0x68################################c9024, 2076)
       0x01
   [1] 0xbD################################3D5A2.transfer(0x8E################################d79dd, 4790)
       0x01
   [1] 0xbD################################3D5A2.transfer(0xe1################################c8510, 6508)
       0x01

[32m INFO[0m ==========================================
[32m INFO[0m [Testcase #0] run time: 0h-1m-32s, clients: 1, corpus: 40, objectives: 0, executions: 435728, exec/sec: 4.980k
[32m INFO[0m ============= Coverage Summary =============
[32m INFO[0m 0xc0################################56cc2: 11.03% Instruction Covered, 13.16% Branch Covered
[32m INFO[0m 0xbd################################3d5a2: 42.56% Instruction Covered, 40.97% Branch Covered
[32m INFO[0m [Stats #0] run time: 0h-1m-33s, clients: 1, corpus: 40, objectives: 0, executions: 439685, exec/sec: 4.980k
[32m INFO[0m [Stats #0] run time: 0h-1m-34s, clients: 1, corpus: 40, objectives: 0, executions: 444831, exec/sec: 4.981k
[32m INFO[0m [Stats #0] run time: 0h-1m-35s, clients: 1, corpus: 40, objectives: 0, executions: 449946, exec/sec: 4.983k
[32m INFO[0m [Stats #0] run time: 0h-1m-36s, clients: 1, corpus: 40, objectives: 0, executions: 455060, exec/sec: 4.984k
[32m INFO[0m [Stats #0] run time: 0h-1m-37s, clients: 1, corpus: 40, objectives: 0, executions: 460174, exec/sec: 4.985k
[32m INFO[0m [Stats #0] run time: 0h-1m-38s, clients: 1, corpus: 40, objectives: 0, executions: 465353, exec/sec: 4.986k
Timeout